@_fa,prism:url,dc:identifier,eid,dc:title,dc:creator,prism:publicationName,prism:issn,prism:volume,prism:issueIdentifier,prism:pageRange,prism:coverDate,prism:coverDisplayDate,prism:doi,dc:description,citedby-count,prism:aggregationType,subtype,subtypeDescription,author-count.@limit,author-count.@total,author-count.$,source-id,fund-no,openaccess,openaccessFlag,entry_number,freetoread.value.$,freetoreadLabel.value.$
true,https://api.elsevier.com/content/abstract/scopus_id/0026314479,SCOPUS_ID:0026314479,2-s2.0-0026314479,"Pollination by deceit in a neotropical monoecious herb, Begonia involucrata",Agren J.,Biotropica,00063606,23,3,235-241,1991-01-01,1991,10.2307/2388200,"Studied floral display and pollinator behavior in a population of the protandrous perennial Begonia involucrata at Monteverde, Costa Rica. Trigona grandipennis, the most frequent flower visitor in the study population, consistently showed a strong preference for male-phase inflorescences; on average, individual male inflorescences received 3.4-9.6 (median 7.2) times as many visits as female inflorescences. Visits to male flowers lasted about ten times longer than visits to female flowers (mean 29.8 vs 2.6 seconds). Although visits to female flowers were infrequent and brief, fruit set averaged 76% and seed set 57%. Taken together, the striking similarity in male and female flower display, the selective pollinator behavior, and the relatively high levels of fruit and seed set support the hypothesis that the rewardless female flowers of B. involucrata mimic male flowers and are pollinated by deceit. -from Authors",48,Journal,ar,Article,100,2,2,13817,undefined,0,FALSE,41,NA,NA
true,https://api.elsevier.com/content/abstract/scopus_id/0026307884,SCOPUS_ID:0026307884,2-s2.0-0026307884,Natural history of a neotropical gap-inhabiting grasshopper,Braker E.,Biotropica,00063606,23,1,41-50,1991-01-01,1991,10.2307/2388686,"Microtylopteryx hebardi (Orthoptera: Acrididae: Ommatolampinae) was studied at La Selva, Costa Rica. Flightless as an adult, it has low dispersal capabilities, yet inhabits light gaps and other temporary habitats. Numbers of adults, were relatively constant between gaps and during the seven month study period, and all life stages were found year-round. Host plant range included 52 species, but most feeding records and all oviposition records in four related monocotyledonous families. -from Author",9,Journal,ar,Article,100,1,1,13817,undefined,0,FALSE,42,NA,NA
true,https://api.elsevier.com/content/abstract/scopus_id/0026302755,SCOPUS_ID:0026302755,2-s2.0-0026302755,"Behavior and host location cues of Apocephalus paraponerae (Diptera: Phoridae), a parasitoid of the giant tropical ant, Paraponera clavata (Hymenoptera: Formicidae)",Brown B.,Biotropica,00063606,23,2,182-187,1991-01-01,1991,10.2307/2388304,"Apocephalus paraponerae is a parasitoid of injured worker Paraponera clavata. Flies are attracted to prospective hosts, the males to feed and the females to feed and oviposit. Flies were attracted to extracts of crushed workers, the first definitive evidence for an olfactory mode of attraction in parasitic phorid flies. -from Authors",45,Journal,ar,Article,100,2,2,13817,undefined,0,FALSE,43,NA,NA
true,https://api.elsevier.com/content/abstract/scopus_id/0026302711,SCOPUS_ID:0026302711,2-s2.0-0026302711,"Hydrophilous pollination of a dioecious seagrass, Thalassodendron ciliatum (Cymodoceaceae) in Kenya",Cox P.,Biotropica,00063606,23,2,159-165,1991-01-01,1991,10.2307/2388301,Flowering of Thalassodendron ciliatum is coincident with extremely low spring tides. Staminate plants release their flowers underwater immediately before the low tide begins to return. These float to the surface and there they expel the filamentous pollen. The pollen form floating snowflake-like rafts (search vehicles) that collide in the water surface with the female stigmas. Seeds of the developing fruit germinate precociously and seedling development is viviparous. -from Author,11,Journal,ar,Article,100,1,1,13817,undefined,0,FALSE,44,NA,NA
true,https://api.elsevier.com/content/abstract/scopus_id/0026299351,SCOPUS_ID:0026299351,2-s2.0-0026299351,"Olfactory and visual attraction of Erioscelis emarginata (Cyclocephalini, Dynastinae) to the inflorescences of Philodendron selloum (Araceae)",Gottsberger G.,Biotropica,00063606,23,1,23-28,1991-01-01,1991,10.2307/2388684,"Erioscelis emarginata (Coleoptera: Scarabaeidae), the sole pollinator of Philodendron selloum, is guided at dusk to the inflorescences in their female stage by a combination of olfactory and visual stimuli. At close range, visual stimuli are induced by olfactory stimuli and the beetles orient themselves by the light inner side of the spathe. -from Authors",65,Journal,ar,Article,100,2,2,13817,undefined,0,FALSE,45,NA,NA
true,https://api.elsevier.com/content/abstract/scopus_id/0026295888,SCOPUS_ID:0026295888,2-s2.0-0026295888,"A comparison of the efficacy of litter sifting and pitfall traps for sampling leaf litter ants (Hymenoptera, Formicidae) in a tropical wet forest, Costa Rica",Olson D.,Biotropica,00063606,23,2,166-172,1991-01-01,1991,10.2307/2388302,"Litter sifting consistently sampled more ant genera, species, and individual workers than did pitfall traps. Litter sifting samples contained a greater proportion of smaller species and specialist species than did pitfall traps. -from Author",90,Journal,ar,Article,100,1,1,13817,undefined,0,FALSE,46,NA,NA
true,https://api.elsevier.com/content/abstract/scopus_id/0026295667,SCOPUS_ID:0026295667,2-s2.0-0026295667,"Nocturnal perching of scarabaeine dung beetles (Coleoptera, Scarabaeidae) in an Australian tropical rain forest",Howden H.,Biotropica,00063606,23,1,51-57,1991-01-01,1991,10.2307/2388687,"Wongabel, a NE Queensland tropical, wet, evergreen forest, contains 22 species of Scarabaeinae dung beetles; five commonly perched on leaves at night. No clear evidence was found that small species perched closer to the ground than larger species. Perching is one type of foraging strategy. -from Authors",25,Journal,ar,Article,100,3,3,13817,undefined,0,FALSE,47,all,All Open Access
true,https://api.elsevier.com/content/abstract/scopus_id/0026295397,SCOPUS_ID:0026295397,2-s2.0-0026295397,Physical aspects of Hurrican Hugo in Puerto Rico,Scatena F.,Biotropica,00063606,23,4 A,317-323,1991-01-01,1991,10.2307/2388247,"On 18 September 1989 the western part of Hurricane Hugo crossed eastern Puerto Rico and the Luquillo Experimental Forest (LEF). Storm-facing slopes on the northeastern part of the island that were within 15 km of the eye and received greater than 200 mm of rain were most affected by the storm. In the LEF and nearby area, recurrence intervals associated with Hurricane Hugo were 50 yr for wind velocity, 10 to 31 yr for stream discharge, and 5 yr for rainfall intensity. To compare the magnitudes of the six hurricanes to pass over Puerto Rico since 1899, 3 indices were developed. -from Authors",201,Journal,ar,Article,100,2,2,13817,undefined,0,FALSE,48,all,All Open Access
true,https://api.elsevier.com/content/abstract/scopus_id/0026287186,SCOPUS_ID:0026287186,2-s2.0-0026287186,How long do fruit-eating birds stay in the plants where they feed?,Wheelwright N.,Biotropica,00063606,23,1,29-40,1991-01-01,1991,10.2307/2388685,"Data are given on the behavior of resplendent quetzal Pharomachrus mocinno, three-wattled bellbird Procnias tricarunculata, emerald toucanet Aulacorhynchus prasinus and mountain robin Turdus plebejus, which were responsible for >94% of all feeding visits to eight bird-dispersed tree species in the family Lauraceae in the lower montane forests of NW Costa Rica. Despite prominent differences in size, coloration, diet, method of foraging for fruits, and breeding system, the birds spent about the same amount of time per foraging visit (median visit lengths 2.9-4.7 min) and ate about the same number of fruits (1-3) per visit. Differences between sexes within bird species were slight or nonexistent. Single factors such as crypsis, diet or breeding system were ineffective in predicting how long birds spent in fruiting plants. Fruits may not be the ""free lunch' they are often reputed to be. Birds may not be able to meet their energetic demands on a pure diet of the large, lipid-rich fruits of the Lauraceae because gut space is limited and it takes so long to process individual fruits. -from Author",46,Journal,ar,Article,100,1,1,13817,undefined,0,FALSE,49,NA,NA
true,https://api.elsevier.com/content/abstract/scopus_id/0026286490,SCOPUS_ID:0026286490,2-s2.0-0026286490,Antipredator skin secretions of some tropical salamanders (Bolitoglossa) are toxic to snake predators,Brodie E.D.,Biotropica,00063606,23,1,58-62,1991-01-01,1991,10.2307/2388688,"Skin secretions of Bolitoglossa rostrata and B. subpalmata adversely affect Thamnophis spp, which commonly prey on amphibians. The secretion causes the snake to pause during ingestion, paralyzes the mouth, and may render the snake incapable of moving or responding to external stimuli. Snakes often died after attempting to eat the toxic B. rostrata. -Authors",21,Journal,ar,Article,100,3,3,13817,undefined,0,FALSE,50,NA,NA
true,https://api.elsevier.com/content/abstract/scopus_id/0026283917,SCOPUS_ID:0026283917,2-s2.0-0026283917,"Pollination ecology of the two wild bananas, Musa acuminata subsp. halabanensis and M. salaccensis: chiropterophily and ornithophily",Itino T.,Biotropica,00063606,23,2,151-158,1991-01-01,1991,10.2307/2388300,"In West Sumatra, Musa acuminata subsp. halabanensis flowers, on pendant inflorescences, produced jelly-like nectar of 22-25% sugar concentration primarily at night, and were pollinated by the nectarivorous pteropodid bats, Macroglossus sobrinus. The M. salaccensis flowers, on erect inflorescences, produced dilute nectar of 18-21% sugar concentration primarily in the daytime, and were pollinated by the nectarivorous nectariniid birds, Arachnothera longirostris and Aethopyga siparaja. The flowering span of each female flower was 24-40 hr, while that of the male flowers was <12 hr. -from Authors",30,Journal,ar,Article,100,3,3,13817,undefined,0,FALSE,51,NA,NA
true,https://api.elsevier.com/content/abstract/scopus_id/0026282726,SCOPUS_ID:0026282726,2-s2.0-0026282726,"Studies of Ceratosolen galili, a non-pollinating agaonid fig wasp",Compton S.G.,Biotropica,00063606,23,2,188-194,1991-01-01,1991,10.2307/2388305,"Ficus sycomorus is host to Ceratosolen arabicus and C. galili. Studies of C. galili in southern Africa confirm that it does not actively pollinate the figs of F. sycomorus, although some accidental pollination takes place. C. galili larvae did not suffer elevated mortality rates when developing in unpollinated flowers and the only potential ""cost' of not pollinating detected was that adult female C. galili were smaller than those of C. arabicus that developed on the same tree. -from Authors",73,Journal,ar,Article,100,6,6,13817,undefined,0,FALSE,52,NA,NA
true,https://api.elsevier.com/content/abstract/scopus_id/0026278820,SCOPUS_ID:0026278820,2-s2.0-0026278820,Spatial patterns of trees and structuring factors in a Trachypogon savanna of the Orinoco Llanos,San Jose J.J.,Biotropica,00063606,23,2,114-123,1991-01-01,1991,10.2307/2388296,"The vegetation is a closed bush island savanna with coexistent isolated trees and small patches of semideciduous forest. Adult trees were less clumped compared to juveniles. Environmental and biotic differences related to edaphic heterogeneity, life history, and reproductive strategy could account for the clumped pattern. Different spatial patterns emerged for stems in groves. Thus, uniform spatial distribution was evident on the individuals of the fire resistant species (Curatella americana, Byrsonima crassifolia and Bowdichia virgilioides) and a gap filling species (Casearia decandra). Changes in the demographic components between different age groups provide evidence for density-dependent mortality. A hypothesis mainly based on two scales of disturbance (human impact and gap formation) acting synergetically with a large scale factor (substrate patchiness) is put forward to explain the vegetation dynamics. (See also 92L/04897). -from Authors",33,Journal,ar,Article,100,3,3,13817,undefined,0,FALSE,53,NA,NA
true,https://api.elsevier.com/content/abstract/scopus_id/0026278149,SCOPUS_ID:0026278149,2-s2.0-0026278149,Ant species in tropical Australian tree crops and native ecosystems - is there a mosaic?,Majer J.,Biotropica,00063606,23,2,173-181,1991-01-01,1991,10.2307/2388303,"Reports on the distribution of arboreal ants within mango plantations, rain forests, and woodlands in tropical N Australia. Only two genera of arboreal ants, Oecophylla and to a lesser extent Crematogaster, reached high densities on trees. Both genera tend to occupy large blocks of canopy, but in the spaces between their colonies the canopy is either devoid of ants, occupied by arboreal-nesting species of low colony size, or visited by ground-nesting species. -from Authors",41,Journal,ar,Article,100,2,2,13817,undefined,0,FALSE,54,all,All Open Access
true,https://api.elsevier.com/content/abstract/scopus_id/0026277858,SCOPUS_ID:0026277858,2-s2.0-0026277858,"Foraging behavior of the Indian false vampire bat, Megaderma lyra (Chiroptera: Megadermatidae)",Audet D.,Biotropica,00063606,23,1,63-67,1991-01-01,1991,10.2307/2388689,"Bats used individual but nonexclusive areas of c0.1km2 located <0.5-4km from their day roost; 41% of the foraging activity of tagged individuals occurred ≤500m from the roost. They spent the night away from the day roost alternating betwen flights of <1-45 min and perching bouts of <1-274 min. Females flew for up to 174 min nightly and males up to 306 min. Most flights (69.7% for males, 72.5% for females) recorded by telemetry lasted >1 min and 14 of 16 prey captures (85%) observed visually, involved search flights of 10-200m. Prey taken included insects (Orthoptera, Coleoptera), and small vertebrates (Amphibia, Reptilia). -from Authors",44,Journal,ar,Article,100,5,5,13817,undefined,0,FALSE,55,NA,NA
true,https://api.elsevier.com/content/abstract/scopus_id/0026277812,SCOPUS_ID:0026277812,2-s2.0-0026277812,Reproductive biology of the palm Acrocomia aculeata in central Brazil,Scariot A.O.,Biotropica,00063606,23,1,12-22,1991-01-01,1991,10.2307/2388683,"The macauba palm reaches heights of up to 16 m. Flowering occurs between August-December, peaking in October-November. Fruit fall (harvest) is between June-March, peaking in November. Inflorescences are androgynous with marked protogyny. The basic pollination syndrome is by beetles, with wind playing a secondary role. The principal pollinators are Andranthobius sp. (Curculionidae), Mystrops cf mexicana (Nitidulidae) and Cyclocephala forsteri (Scarabaeidae). Cross-pollination between different individuals (xenogamy) accounts for most of the reproductive system, but the species is self-compatible, with geitonogamy accounting for a significant percentage of fruit set. The combination of two pollination strategies (wind and insects) with a flexible reproductive system (cross- and self-pollination) suggests that A. aculeata can be highly successful in the colonization of new areas. -from Authors",101,Journal,ar,Article,100,2,2,13817,undefined,0,FALSE,56,NA,NA
true,https://api.elsevier.com/content/abstract/scopus_id/0026277432,SCOPUS_ID:0026277432,2-s2.0-0026277432,"Geothermally modified waters surface at La Selva biological station, Costa Rica: volcanic processes introduce chemical discontinuities in lowland tropical streams",Pringle C.,Biotropica,00063606,23,4 B,523-529,1991-01-01,1991,10.2307/2388390,"Dilute geothermal springs of the sodium-chloride-bicarbonate type modify the chemistry of receiving streams. Streams receiving geothermal waters are solute-rich and co-occur with solute-poor streams that do not receive geothermal inputs. Geothermal waters contain significantly greater concentrations of Ca, Fe, Mg, Na, Si, Cl, SO4, soluble reactive phosphorus (SRP), and total phosphorus (TP) than waters unmodified by geothermal inputs. Geothermal processes introduce natural chemical discontinuities into stream continua that can affect nutrient limitation of algal growth and potentially primary production. In addition, geothermal upwellings represent a source of variation in soil phosphorus levels that is relatively independent of the composition of parent material in the surficial catchment and may potentially influence plant growth and demography. -from Author",36,Journal,ar,Article,100,1,1,13817,undefined,0,FALSE,57,NA,NA
true,https://api.elsevier.com/content/abstract/scopus_id/0026277276,SCOPUS_ID:0026277276,2-s2.0-0026277276,"Nitrogenase activity by Hapalosiphon flexuosus associated with Sphagnum erythrocalyx mats in the cloud forest on the Volcano La Soufriere, Guadeloupe, French West Indies",Sheridan R.,Biotropica,00063606,23,2,134-140,1991-01-01,1991,10.2307/2388298,Mean rate of C2H4 production in situ by entire plants with the associated cyanobacterium was 19.1 nmol C2H4.gdw-1h-1 (range 0.20-101) with a nitrogenase activity for the uppermost green tips 4.5 times greater than that measured for the basal portions. Highest rates for C2H2 reduction were recorded for plants damaged by high winds and for plants established within vegetation zones recovering from severe damage resulting from the 1976-1977 phreatic eruption of this volcano. The estimated rate of the annual contribution of nitrogen by N-fixation is 4.02 kg N.ha-1.yr-1. -from Author,16,Journal,ar,Article,100,1,1,13817,undefined,0,FALSE,58,NA,NA
true,https://api.elsevier.com/content/abstract/scopus_id/0026273645,SCOPUS_ID:0026273645,2-s2.0-0026273645,"The structure and diversity of rain forests at Bajo Calima, Choco region, western Colombia",Faber-Langendoen D.,Biotropica,00063606,23,1,2-11,1991-01-01,1991,10.2307/2388682,"Biomass levels are low, at 210 tons/ha, and tree canopy heights rarely exceed 30-35 m. Few trees >100 cm dbh were found. Forests at Bajo Calima are among the most species-rich in the world, with >250 tree species ≥10 cm dbh per ha. Palms are numerically abundant in the overstory; Jessenia bataua is most common. Free-climbing lianas are uncommon. Only 11 species had more than eight individuals ≥10 cm dbh per ha. Measures of soil nutrients indicate low fertility and possible Al toxicity. High diversity is correlated with both high rainfall and low nutrient levels. -from Authors",82,Journal,ar,Article,100,2,2,13817,undefined,0,FALSE,59,NA,NA
true,https://api.elsevier.com/content/abstract/scopus_id/0026273359,SCOPUS_ID:0026273359,2-s2.0-0026273359,Control of the distribution of giant rosette species of Puya (Bromeliaceae) in the Ecuadorian paramos,Miller G.A.,Biotropica,00063606,23,2,124-133,1991-01-01,1991,10.2307/2388297,"Puya clava-herculis and Puya hamata are widely distributed giant rosette plants that occupy nonoverlapping ranges (3700-4100m and 3300-3700m, respectively) and each shows a patchy local distribution. Under natural conditions, the lower elevational limits of P. clava-herculis is primarily determined by competition with shrubs. In areas near human habitation, the lower limit of P. clava-herculis and P. hamata is largely determined by constant burning. Above the distribution of P. clava-herculis, bare ground or cushion and mat plants predominate. On bare ground, solifluction, low temperatures, and moisture stress reduce the probability of Puya establishment. In areas dominated by cushion and mat plants, either species of Puya is outcompeted or seedling safe sites are absent. Seedlings of P. clava-herculis showed a stronger than expected association with grass tussocks, indicating the importance of tussock edges as seedling safe sites. -from Authors",21,Journal,ar,Article,100,2,2,13817,undefined,0,FALSE,60,NA,NA
true,https://api.elsevier.com/content/abstract/scopus_id/0026269187,SCOPUS_ID:0026269187,2-s2.0-0026269187,Recovery of the rain forest of southeastern Nicaragua after destruction by Hurricane Joan,Yih K.,Biotropica,00063606,23,2,106-113,1991-01-01,1991,10.2307/2388295,"Hurricane Joan badly damaged the rain forest of SE Nicaragua in October 1988, toppling or snapping off 80% of the trees and completely destroying the canopy over an area of 500 000 ha. An expedition to the area in February 1989 found an unexpected pattern of recovery, with a large majority of damaged trees resprouting. Regeneration is dominated by sprouts and seedlings of primary forest species. Little or no reduction in tree species richness has occurred, although bird and bat populations seem to have decreased considerably. -from Authors",138,Journal,ar,Article,100,4,4,13817,undefined,0,FALSE,61,NA,NA
true,https://api.elsevier.com/content/abstract/scopus_id/0026267502,SCOPUS_ID:0026267502,2-s2.0-0026267502,Nitrogen content and expansion rate of young leaves of rain forest species: implications for herbivory,Kursar T.,Biotropica,00063606,23,2,141-150,1991-01-01,1991,10.2307/2388299,"Low nitrogen content makes leaves less attractive to herbivores, while rapid expansion reduces the time that young leaves are vulnerable to herbivory. Among the 13 study species, N in young leaves (at 5% of full expansion) ranged from 20-71 mg/g DW. Most species had higher N in young compared to mature leaves, but one species showed no change with age. The ratio of N import relative to dry weight import was low (1-4%) and dropped during expansion. The amount of N imported daily into the leaf peaked at 70-75% of full expansion, though species varied in the percent of final N that was imposed prior to full expansion (67-93%). There was a significant positive correlation between N content of young leaves and the rate of leaf expansion. The age-specific patterns of N can best be understood as a trade-off between high palatability to herbivores and escape through rapid expansion. -from Authors",73,Journal,ar,Article,100,2,2,13817,undefined,0,FALSE,62,NA,NA
