@_fa,prism:url,dc:identifier,eid,dc:title,dc:creator,prism:publicationName,prism:issn,prism:volume,prism:issueIdentifier,prism:pageRange,prism:coverDate,prism:coverDisplayDate,prism:doi,dc:description,citedby-count,prism:aggregationType,subtype,subtypeDescription,author-count.@limit,author-count.@total,author-count.$,source-id,fund-no,openaccess,openaccessFlag,entry_number,freetoread.value.$,freetoreadLabel.value.$
true,https://api.elsevier.com/content/abstract/scopus_id/0026365309,SCOPUS_ID:0026365309,2-s2.0-0026365309,"The impact of Hurricane Gilbert on trees, litterfall, and woody debris in a dry tropical forest in the northeastern Yucatan Peninsula",Whigham D.,Biotropica,00063606,23,4 A,434-441,1991-01-01,1991,10.2307/2388263,"All trees in the study area were completely defoliated and most suffered heavy structural damage. Although few trees were killed outright, many died over the next 17 months. Tree recovery was rapid as relative diameter growth for most species for the first year after the hurricane were greater than average diameter growth rates for three of the five prehurricane years. Biomass of litterfall (leaves and wood <10cm diameter) and nutrients generated by the hurricane exceeded the totals produced during any of the five previous years. The hurricane increased the mass and nutrients in coarse woody debris by c50%. Mortality caused by fire was much greater than mortality caused by the hurricane. -from Authors",172,Journal,ar,Article,100,4,4,13817,undefined,0,FALSE,20,NA,NA
true,https://api.elsevier.com/content/abstract/scopus_id/0026364829,SCOPUS_ID:0026364829,2-s2.0-0026364829,Landforms influence patterns of hurricane damage: evidence from Jamaican montane forests,Bellingham P.,Biotropica,00063606,23,4 A,427-433,1991-01-01,1991,10.2307/2388262,"Patterns of damage caused to trees ≥3cm dbh in Jamaican montane rain forests by Hurricane Gilbert were assessed 19-20 mo after the hurricane. Low overall levels of damage occurred compared with studies of hurricane damage elsewhere; stem mortality = 8.1±1.4%; uprooted stems = 5.8±1.3%; broken stems = 8.5±1.2%. Highest levels of damage were found on southern slopes and the ridge crest of the Blue Mountains, as the range protected forests on the northern slopes from the full force of the hurricane. However, mortality and uprooting did not conform to a pattern that could be linked to topography. While hurricanes are fairly frequent events in Jamaica (return period c15yr), their effective return periods to particular areas of forest are likely to be longer because of local differences in exposure. -from Author",94,Journal,ar,Article,100,1,1,13817,undefined,0,FALSE,21,NA,NA
true,https://api.elsevier.com/content/abstract/scopus_id/0026364698,SCOPUS_ID:0026364698,2-s2.0-0026364698,The effect of Hurricane Hugo on six invertebrate species in the Luquillo Experimental Forest of Puerto Rico,Willig M.,Biotropica,00063606,23,4 A,455-461,1991-01-01,1991,10.2307/2388266,"On 18 September 1989 Hurricane Hugo struck Puerto Rico, with the center of the hurricane passing within 10km of the Luquillo Experimental Forest. The densities and spatial distributions of six species of common invertebrates (four snails, Caracolus caracolla, Polydontes acutangula, Nenia tridens and Gaeotis nigrolineata, and two walking sticks, Lamponius portoricensis and Agamemnon iphimedeia) in the tabonuco rain forest were estimated before and after the hurricane. Both species of walking stick and three of the four species of snail exhibited statistically significant reductions in density after the hurricane. Densities of N. tridens, G. nigrolineata and A. iphimedeia were reduced to the point that no specimens were detected in posthurricane surveys. -from Authors",67,Journal,ar,Article,100,2,2,13817,undefined,0,FALSE,22,NA,NA
true,https://api.elsevier.com/content/abstract/scopus_id/0026364697,SCOPUS_ID:0026364697,2-s2.0-0026364697,"Forest structure before and after Hurricane Hugo at three elevations in the Luquillo Mountains, Puerto Rico",Brokaw N.V.L.,Biotropica,00063606,23,4 A,386-392,1991-01-01,1991,10.2307/2388256,"Measured canopy structure before and after the hurricane on 18 September 1989, in ""tabonuco forest' (subtropical wet forest) at 350m elevation, ""colorado forest' (lower montane wet forest) at 750m, and ""cloud forest' (lower montane rain forest) at 1000m. In all plots the chief effect of the hurricane was to reduce significantly the vegetation cover in upper height intervals. Foliage profiles (showing percent vegetation cover in height intervals above ground) changed significantly, average maximum canopy height decreased (by as much as 50%), and amount of low canopy area (vegetation ≤2m high) markedly increased (up to 60-fold) in all three plots. In the colorado forest plot the hurricane caused more damage on ridges than in valleys; the cloud forest plot sustained equal damage on windward and leeward slopes. Forest composition and dynamics could be affected for many years. Local variation in hurricane damage can contribute to forest complexity. -from Authors",160,Journal,ar,Article,100,2,2,13817,undefined,0,FALSE,23,NA,NA
true,https://api.elsevier.com/content/abstract/scopus_id/0026364695,SCOPUS_ID:0026364695,2-s2.0-0026364695,"Effects of Hurricane Hugo on Manilkara bidentata, a primary tree species in the Luquillo Experimental Forest of Puerto Rico",Chengxia You ,Biotropica,00063606,23,4 A,400-406,1991-01-01,1991,10.2307/2388258,"Changes in the population structure and recruitment characteristics of Manilkara bidentata populations were investigated in the Luquillo Experimental Forest, at one month and nine months after Hurricane Hugo. Fatal damage occurred to 4% of the trees at the El Verde site. Severe damage to mature trees disrupted seed production, and 60% of the young seedling populations was destroyed, mainly as a result of burial by litter. For surviving seedlings, the posthurricane growth rate (in height) of old seedlings was 2 cm/mo, 17 times greater than that under prehurricane conditions. The prehurricane population of young seedlings had a large number of individuals and a long transition period (>14 yr); the posthurricane population had fewer individuals and a shorter transition period (<2 yr). Increased growth rates of seedlings were related to increased light at the forest floor. Recruitment rate of the Manilkara population from the seedling size class into the sapling size class was greater than that under prehurricane conditions. -from Authors",29,Journal,ar,Article,100,2,2,13817,undefined,0,FALSE,24,NA,NA
true,https://api.elsevier.com/content/abstract/scopus_id/0026364687,SCOPUS_ID:0026364687,2-s2.0-0026364687,Mass mortality in a mangrove roots fouling community in a hypersaline tropical lagoon,Orihuela B.,Biotropica,00063606,23,4 B,592-601,1991-01-01,1991,10.2307/2388397,"Massive mortality of the fouling community associated with red mangrove Rhizophora mangle roots was observed in February 1989 throughout most of La Restinga, a hypersaline coastal lagoon located in the central part of Margarita Island, Venezuela. Physical disturbances associated with the passage of hurricanes Gilbert and Joan seem to be connected with the observed massive mortality. Apparently, the same factors and those preventing larval transport and settlement (slow water currents and siltation) are responsible for the slow community recovery. -from Authors",20,Journal,ar,Article,100,3,3,13817,undefined,0,FALSE,25,NA,NA
true,https://api.elsevier.com/content/abstract/scopus_id/0026364535,SCOPUS_ID:0026364535,2-s2.0-0026364535,Effects of Hurricane Gilbert on birds in a dry tropical forest in the Yucatan Peninsula,Lynch J.,Biotropica,00063606,23,4 A,488-496,1991-01-01,1991,10.2307/2388271,"On 14 September 1988 Hurricane Gilbert, the strongest tropical storm ever recorded in the Western Hemisphere, passed through an area of tropical forest in Quintana Roo, Mexico. The hurricane defoliated the forest, and created a nearly impenetrable tangle of fallen branches and vines at ground level. Point counts and mist-netting conducted 5-6 mo after the storm revealed an influx of field- and shrub-associated bird species. Most previously common insectivores and feeding generalists were present in February-March 1989, but many had declined significantly in abundance. Resident frugivores and nectarivores were especially scarce after the hurricane. Wildfires that swept through NE Quintana Roo in the summer of 1989 had a greater effect on birds than did the storm itself. By late winter 1990 the bird community within unburned forest was clearly converging toward its prehurricane composition. In contrast, the bird community in burned forest resembled that associated with recently abandoned agricultural fields and pastures. As a group, overwintering nearctic migrants appeared to be more resilient than year-round residents to the effects of both the hurricane and the associated fires. -Author",57,Journal,ar,Article,100,1,1,13817,undefined,0,FALSE,26,NA,NA
true,https://api.elsevier.com/content/abstract/scopus_id/0026363465,SCOPUS_ID:0026363465,2-s2.0-0026363465,Responses of ground-foraging ant communities to three experimental fire regimes in a savanna forest of tropical Australia,Andersen A.,Biotropica,00063606,23,4 B,575-585,1991-01-01,1991,10.2307/2388395,"Ants were sampled using pitfall traps in two replicate 1 ha plots of each of three experimental fire treatments (annually burned, biennially burned, and unburned for over 14 yr) in a eucalypt-dominated savanna in Kakadu National Park. The ant fauna was extremely diverse, with 81 specis from 24 genera. Species were classified into functional groups based on habitat requirements and competitive interactions, with the most important groups being dominant species of Iridomyrmex (11 species, 14-63% total ants in traps); generalized myrmicines (mostly species of Monomorium and Pheidole; total of 22 species, 11-61% total ants in traps); hot climate specialists (species of Melophorus, Monomorium (""Chelaner') and Meranoplus; 14 species, 1-16% total ants in traps); cryptic species (many genera; 13 species, 2-26% total ants in traps;) and opportunists (mostly species of Rhytidoponera and Tetramorium; 11 species, 3-12% total ants in traps). Ant communities in the annually burned plots were characterized by relatively high numbers of dominant Iridomyrmex, hot climate specialists and opportunistic Rhytidoponera aurata, and low numbers of generalized myrimicines and cryptic species. The reverse was true for unburned plots. Many species were common under one fire regime, but were rarely or never recorded under the other, differences attributed to structural changes in the habitat caused by fire, and in particular to the levels of litter accumulation and insolation on the ground. These changes influenced ants directly, but also had important indirect effects through their influence on the abundance of dominant Iridomyrmex, and therefore on competitive interactions. -from Author",202,Journal,ar,Article,100,1,1,13817,undefined,0,FALSE,27,NA,NA
true,https://api.elsevier.com/content/abstract/scopus_id/0026363464,SCOPUS_ID:0026363464,2-s2.0-0026363464,"Differential seedling responses to litter after Hurricane Hugo in the Luquillo Experimental Forest, Puerto Rico",Guzman-Grajales S.M.,Biotropica,00063606,23,4 A,407-413,1991-01-01,1991,10.2307/2388259,"Total seedling densities (for both newly emerged and established seedlings) were highest in litter removal treatment, suggesting that litter is a major constraint to recruitment of seedlings. However, species differed in their responses to the three treatments: species characteristic of early succession (Chionanthus domingensis and Cecropia schreberiana) were densest in the litter removal treatment, while densities of species characteristic of late succession either did not increase (Sloanea berteriana) or declined (Dacryodes excelsa) in litter removal treatment. Height growth was lowest and mortality generally highest for seedlings in the litter removal treatment. Variability in species responses to litter after the hurricane may lead to changes in the species composition of the forest. -from Authors",90,Journal,ar,Article,100,2,2,13817,undefined,0,FALSE,28,NA,NA
true,https://api.elsevier.com/content/abstract/scopus_id/0026363461,SCOPUS_ID:0026363461,2-s2.0-0026363461,Changes in light availability following Hurricane Hugo in a subtropical montane forest in Puerto Rico,Fernandez D.,Biotropica,00063606,23,4 A,393-399,1991-01-01,1991,10.2307/2388257,"Changes in light availability in the understory of a subtropical wet forest (Luquillo Experimental Forest, Puerto Rico) were monitored after the passage of Hurricane Hugo on 18 September 1989. During the 14 mo after the passage of the hurricane photosythetic photon flux density (PPFD), showed a highly skewed distribution with most values <200 μmol m-2 s-1. Maximum spatial heterogeneity was observed in July 1990 because of the shading of some sensors by the growing pioneer vegetation. Median values of total daily PPFD for ten months after the hurricane ranged from 7.7-10.8 mol m-2 d-1, similar to values previously observed for large (>400 m2) treefall gaps. Median total daily PPFD fell to 0.8 mol m-2 d-1 in November 1990 because of almost complete coverage of the transect by a canopy of Cecropia schreberiana. Through March 1990 patches of high and low light separated by distances of 10-12 m were detected. By July 1990 the patchiness was replaced by a pattern that showed no autocorrelation at distances ≥1m. -from Authors",89,Journal,ar,Article,100,2,2,13817,undefined,0,FALSE,29,NA,NA
true,https://api.elsevier.com/content/abstract/scopus_id/0026351058,SCOPUS_ID:0026351058,2-s2.0-0026351058,The effect of understorey palms and cyclanths on the growth and survival of Inga seedlings,Denslow J.,Biotropica,00063606,23,3,225-234,1991-01-01,1991,10.2307/2388199,"Seedlings of Inga fagifolia and I. pezizifera were planted into the understorey of a Costa Rican rain forest. Proximity of palms or cyclanths significantly affected growth and survival of both species, but most of this effect could be attributed to loss of stem length due to herbivore or pathogen damage rather than to differences in growth rates. -from Authors",85,Journal,ar,Article,100,3,3,13817,undefined,0,FALSE,30,NA,NA
true,https://api.elsevier.com/content/abstract/scopus_id/0026350298,SCOPUS_ID:0026350298,2-s2.0-0026350298,Microclimatic conditions in nests of the Cuban iguana (Cyclura nubila),Christian K.A.,Biotropica,00063606,23,3,287-293,1991-01-01,1991,10.2307/2388206,"In SW Puerto Rico nest temperatures were similar among nests and over a 24 hr cycle with temperatures around 31-32°C. There was more variability in soil water potential among the nests, as they dried at different rates after a soaking rain near the beginning of incubation. -from Authors",14,Journal,ar,Article,100,2,2,13817,undefined,0,FALSE,31,NA,NA
true,https://api.elsevier.com/content/abstract/scopus_id/0026350292,SCOPUS_ID:0026350292,2-s2.0-0026350292,Phenology of lianas and anemochorous trees in a Mexican tropical rain forest,Ibarra-Manriquez G.,Biotropica,00063606,23,3,242-254,1991-01-01,1991,10.2307/2388201,"Of a total of 273 tree and 91 liana species for a tropical rain forest at SE Veracruz, 68 species (18.7%) are wind dispersed. The anemochorous syndrome is represented better in lianas (42.9% of the species), while trees are predominantly zoochorous (80.9%). Data in relation to the phenology and frequency of diaspore type for 59 anemochorous species trees and lianas are presented. At the community level, winged diaspores predominate (45 species, 76.3%); nonwinged species are much less common. For both life forms flowering is highly correlated with the late dry season. Fruiting has two peaks, the first one late in the dry, hot season (""secas'), and the second one in the late wet season, when precipitation is high and temperature is low (""nortes'). The period of fruiting in trees and lianas is clearly separated in time. Dispersal by trees is concentrated in ""secas', while dispersal by lianas is more frequent during ""nortes'. Plumed diaspores were more abundant during ""secas' independent of life form. Species with winged diaspores had a bimodal distribution, one during ""secas' and the other one during ""nortes', the latter was due primarily to fruiting lianas. -from English summary",36,Journal,ar,Article,100,3,3,13817,undefined,0,FALSE,32,NA,NA
true,https://api.elsevier.com/content/abstract/scopus_id/0026340286,SCOPUS_ID:0026340286,2-s2.0-0026340286,"More aggressive ant species (Hymenoptera: Formicidae) provide better protection for soft scales and mealybugs (Homoptera: Coccidae, Pseudococcidae)",Buckley R.,Biotropica,00063606,23,3,282-286,1991-01-01,1991,10.2307/2388205,"For 11 sets of interacting species near Madang, Papua New Guinea, coccoids attended by relatively inoffensive ants were more heavily parasitized than those attended by more aggressive ants. This was due to active protection of the coccoids from both predation and parasitization. -from Authors",122,Journal,ar,Article,100,2,2,13817,undefined,0,FALSE,33,NA,NA
true,https://api.elsevier.com/content/abstract/scopus_id/0026340232,SCOPUS_ID:0026340232,2-s2.0-0026340232,Survival by sprouting following fire in tropical forests of the eastern Amazon,Kauffman J.,Biotropica,00063606,23,3,219-224,1991-01-01,1991,10.2307/2388198,"Following fire, crown mortality ranged from 64-97%. Eight months after fire, 36-69% of all trees present on the sites at the time of burning were dead. Out of 124 species measured (500 total individuals), 46% had the capacity to sprout from subterranean tissues and 27% sprouted from epicormic tissues; 41% of the sampled species lacked any capacity to sprout vegetatively. Survival of the 14 most common species encountered ranged from 15-83%. Survival also varied among sites, primarily attributed to differences in fire severity. Fire severity and plant mortality were greatest in selectively logged forests that were intentionally burned for pasture conversion (>65% mortality). One ecological advantage of sprouting over establishment from seeds is rapid regrowth and a greater capacity for exploitation of limited resources in tropical forests. Mean sprout height was 0.8-1.6 m for 8-month old sprouts and 4.2 m for 20-month old sprouts. -from Author",125,Journal,ar,Article,100,1,1,13817,undefined,0,FALSE,34,NA,NA
true,https://api.elsevier.com/content/abstract/scopus_id/0026339745,SCOPUS_ID:0026339745,2-s2.0-0026339745,Seed predation of Cariniana micrantha (Lecythidaceae) by brown capuchin monkeys in central Amazonia,Peres C.,Biotropica,00063606,23,3,262-270,1991-01-01,1991,10.2307/2388203,"Reports on a tight plant-animal interaction between Cebus apella and the emergent Cariniana micrantha. The very hard and thick pericarps of this species are morphological adaptations to protect their fatty and protein-rich seeds from predispersal predators, but brown capuchins are behaviorally adept at overcoming the seed protection mechanisms. Some 69.5% of the entire anemochorous, winged-seeded crop was destroyed because of direct predation. Another 30.1% of the seed crop also became inviable: its single dispersal opportunity was disrupted because seeds remained trapped inside indehisced fruits which had been discarded to the ground by the monkeys. -from Author",57,Journal,ar,Article,100,1,1,13817,undefined,0,FALSE,35,NA,NA
true,https://api.elsevier.com/content/abstract/scopus_id/0026334591,SCOPUS_ID:0026334591,2-s2.0-0026334591,Aboveground adventitious roots and stemflow chemistry of Ceratopetalum virchowii in an Australian montane tropical rain forest,Herwitz S.,Biotropica,00063606,23,3,210-218,1991-01-01,1991,10.2307/2388197,"Aboveground adventitious roots emerging from the stems and branches of Ceratopetalum virchowii do not require epiphyte mats to stimulate their growth. The adventitious roots grow in dense clumps on fully exposed aboveground woody surfaces of this species on Mount-Bellenden Ker, NE Queensland, where mean annual rainfall exceeds 6000 mm. While the soil is nutrient-poor, the nutrient content of the rainwater draining from the stems of C. virchowii is unusually high compared to the stemflow of other neighboring canopy tree species. C. virchowii is particularly prone to the leaching of Ca2+, Mg2+, K+, and Na+. The aboveground adventitious roots, therefore, may serve the adaptive function of nutrient recovery before its nutrient-rich stemflow reaches the ground and becomes available to other plants. Growth of the aboveground adventitious roots is probably influenced by the high nutrient content of its stemflow and branchflow drainage, and by the moist condition of its woody surfaces which remain wetted for relatively long periods after rainfalls. -from Author",25,Journal,ar,Article,100,1,1,13817,undefined,0,FALSE,36,NA,NA
true,https://api.elsevier.com/content/abstract/scopus_id/0026333769,SCOPUS_ID:0026333769,2-s2.0-0026333769,Population characteristics of the introduced brown tree snake (Boiga irregularis) on Guam,Savidge J.,Biotropica,00063606,23,3,294-300,1991-01-01,1991,10.2307/2388207,"Size class distributions reflected prey availability. Larges snakes (>150 cm) were rare in forest habitat, where their preferred food (birds and mammals) were scarce or nonexistent, yet were commonly found in urban locations that supported a variety of vertebrate prey. Males reached larger body size than females in both urban and nonurban habitats. The sex ratio was about equal in the smaller size classes (<120 cm), but became increasingly male-biased with increasing snout-vent length. Snakes colonizing a previously snake-free area were significantly larger than individuals present in an area that had been colonized at least a decade earlier. Snakes densities in N Guam were 1.6 times greater than those in S Guam. A conservative density estimate of 16 snakes/ha was obtained by grid trapping in an area where birds had been essentially eliminated by snakes. -from Author",23,Journal,ar,Article,100,1,1,13817,undefined,0,FALSE,37,NA,NA
true,https://api.elsevier.com/content/abstract/scopus_id/0026324889,SCOPUS_ID:0026324889,2-s2.0-0026324889,Strategies of seed dispersal and seed predation in Amazonian ungulates,Bodmer R.,Biotropica,00063606,23,3,255-261,1991-01-01,1991,10.2307/2388202,"Fruit constitutes 81% of the diet of red brocket deer Mazama americana, 87% of grey brocket deer M. gouazoubira, 59% of collared peccary Tayassu tajacu, 66% of white-lipped peccary T. pecari and 33% of lowland tapir Tapirus terrestris. These Amazonian ungulates often disperse seeds over short distances by spitting them out during mastication. The lowland tapir is the only ungulate that frequently disperses intact seeds through the digestive tract. Brocket deer destroy most of the seeds they consume by digesting them with rumen microbes, while peccaries crack seeds using their resistant teeth, strong jaw muscles, and thick skull bones. Defensive strategies of seeds include strength, chemical toxins, mast fruiting, fibrous lignin, and size variation. Brocket deer and peccaries have pregastric fermentation that may detoxify some secondary compounds of seeds. Small seeds occasionally pass intact through brocket deer and peccary guts, but strong palm seeds that avert many mammalian predators are often destroyed by ungulates. The fibrous lignin that protects seeds of Jessenia bataua (Palmae) appears to be effective against ungulates which may explain its abundance in the study area. -from Author",168,Journal,ar,Article,100,1,1,13817,undefined,0,FALSE,38,NA,NA
true,https://api.elsevier.com/content/abstract/scopus_id/0026324888,SCOPUS_ID:0026324888,2-s2.0-0026324888,"The spatial distribution of herbivory, mines and galls within an Australian rain forest tree",Basset Y.,Biotropica,00063606,23,3,271-281,1991-01-01,1991,10.2307/2388204,"Argyrodendron actinophyllum (Sterculiaceae) was studied in a subtropical rain forest in the Mount Glorious State Forest. Apparent leaf damage amounted to 11% of leaf area removed, was significantly higher in sun than in shade leaves, was not significantly higher in the upper crown (>25 m) than in the lower crown (15-25 m), and did not differ significantly amoung compass orientations. Leaf biomass removed by herbivores was significantly higher in the upper crown and in sun samples. Overall leaf damage, including leaflets entirely eaten and leaf-mining, ranged from 11-19%, but actual leaf consumption was mainly restricted to young leaves, and amounted to 16%; this was more dependent on the location of isolated, abundant, and sunny patches of young foliage than on local differences in foliar nutrient characteristics, such as total N and water content. Lepidopteran biomass and numbers were correlated with leaf damage in the samples. Leaf-mining, averaging 31 mines per m2 of leaf area, was significantly higher in the lower canopy. Gall densities approached three galls per m2 of leaf area. Galled leaves were significantly larger and less heavily grazed. -from Author",46,Journal,ar,Article,100,1,1,13817,undefined,0,FALSE,39,NA,NA
true,https://api.elsevier.com/content/abstract/scopus_id/0026324695,SCOPUS_ID:0026324695,2-s2.0-0026324695,"Intercolonial interactions and nestmate discrimination in the giant tropical ant, Paraponera clavata",Breed M.,Biotropica,00063606,23,3,301-306,1991-01-01,1991,10.2307/2388208,"At La Selva, Costa Rica, workers near colony entrances express discrimination of nestmates from non-nestmates by attacking the latter. Foragers engage in scramble competition with non-nestmates for large ephemeral food resources; agonism may occur secondarily in this context. Nests are significantly overdispersed, but discrete territorial boundaries are apparently not defended. -from Authors",8,Journal,ar,Article,100,4,4,13817,undefined,0,FALSE,40,NA,NA
