@_fa,prism:url,dc:identifier,eid,dc:title,dc:creator,prism:publicationName,prism:issn,prism:volume,prism:issueIdentifier,prism:pageRange,prism:coverDate,prism:coverDisplayDate,prism:doi,dc:description,citedby-count,prism:aggregationType,subtype,subtypeDescription,author-count.@limit,author-count.@total,author-count.$,authkeywords,source-id,fund-no,openaccess,openaccessFlag,entry_number,freetoread.value.$,freetoreadLabel.value.$,fund-sponsor
true,https://api.elsevier.com/content/abstract/scopus_id/0001029770,SCOPUS_ID:0001029770,2-s2.0-0001029770,Mangrove isotopic (δ<sup>15</sup>N and δ<sup>13</sup>C) fractionation across a nitrogen vs. phosphorus limitation gradient,McKee K.L.,Ecology,00129658,83,4,1065-1075,2002-04-01,1 April 2002,10.2307/3071914,"Mangrove islands in Belize are characterized by a unique switching from nitrogen (N) to phosphorus (P) limitation to tree growth from shoreline to interior. Fertilization has previously shown that Rhizophora mangle (red mangrove) fringe trees (5-6 m tall) growing along the shoreline are N limited; dwarf trees (≤1.5 m tall) in the forest interior are P limited; and transition trees (2-4 m tall) are co-limited by both N and P. Growth patterns paralleled a landward decrease in soil flushing by tides and an increase in bioavailable N, but P availability remained consistently low across the gradient. Stable isotopic composition was measured in R. mangle leaves to aid in explaining this nutrient switching pattern and growth variation. Along control transects, leaf δ15N decreased from +0.10‰ (fringe) to -5.38‰ (dwarf). The δ15N of N-fertilized trees also varied spatially, but the values were consistently more negative (by ∼3‰) compared to control trees. Spatial variation in δ15N values disappeared when the trees were fertilized with P, and values averaged +0.12‰, similar to that in control fringe trees. Neither variation in source inputs nor microbial fractionation could fully account for the observed patterns in δ15N. The results instead suggest that the lower δ15N values in transition and dwarf control trees were due to plant fractionation as a consequence of slower growth and lower N demand. P fertilization increased N demand and decreased fractionation. Although leaf δ13C was unaffected by fertilization, values increased from fringe (-28.6‰) to transition (-27.9‰) to dwarf (-26.4‰) zones, indicating spatial variation in environmental stresses affecting stomatal conductance or carboxylation. The results thus suggest an interaction of external supply, internal demand, and plant ability to acquire nutrients under different hydro-edaphic conditions that vary across this tree-height gradient. The findings not only aid in understanding mangrove discrimination of nitrogen and carbon isotopes, but also have implications for identifying nutrient loading and other stress conditions in coastal systems dominated by mangroves.",208,Journal,ar,Article,100,4,4,"Carbon isotope discrimination | Height forms | Mangrove, red | Nitrogen isotope discrimination | Nutrient limitation | Rhizophora mangle | Stress tolerance",20308,undefined,0,FALSE,235,NA,NA,NA
true,https://api.elsevier.com/content/abstract/scopus_id/0000592106,SCOPUS_ID:0000592106,2-s2.0-0000592106,"Journal quality, effect size, and publication bias in meta-analysis",Murtaugh P.,Ecology,00129658,83,4,1162-1166,2002-04-01,1 April 2002,10.1890/0012-9658(2002)083[1162:JQESAP]2.0.CO;2,"A simple, empirical method of detecting evidence of publication bias in meta-analyses is proposed, based on the relationship between the strength of the results in published studies and the quality of the journals in which they appear. In an illustration of its use, the method is applied to published meta-analyses of terrestrial plant competition, predation in streams, woody plant growth under elevated CO2, and marine nutrient enrichment experiments. Statistically significant associations of effect strength and journal quality were found in two of the four meta-analyses.",74,Journal,ar,Article,100,1,1,Journal impact factor | Log response ratio | Meta-analysis | Publication bias | Research synthesis,20308,undefined,0,FALSE,236,NA,NA,NA
true,https://api.elsevier.com/content/abstract/scopus_id/0000418828,SCOPUS_ID:0000418828,2-s2.0-0000418828,Spatially limited pollen exchange and a long-range synchronization of trees,Satake A.,Ecology,00129658,83,4,993-1005,2002-04-01,1 April 2002,10.1890/0012-9658(2002)083[0993:SLPEAA]2.0.CO;2,"Many trees in mature forests show intermittent reproduction. Intensive flowering and seed production occur only once in several years, often synchronized over a long distance. In a previous paper, we showed that the limitation of fruit production by the outcross pollen availability can bring about synchronized reproduction of trees in a constant environment, assuming that pollen availability depends on the mean flowering intensity of the trees. However, pollen exchange normally occurs within a distance much shorter than the extent of the whole forest. We studied a coupled map lattice, in which each tree engages in the chaotic dynamics of energy reserve level, but different trees are coupled by pollen exchange with neighbors. We first derived a relation between two statistics of spatial covariance (dynamic spatial covariance and snapshot spatial covariance). A strong synchronization of tree reproduction can develop over the whole forest that may be orders of magnitude larger than the distance of direct pollen exchange between trees. The fluctuation is close to a cycle with a period of two years. The model of local coupling always generates non-uniform spatial patterns, but the enhanced spatial covariance caused by the spatial heterogeneity is restricted to a short range, only a few times larger than the spatial range of direct interaction. When pollen exchange occurs beyond the nearest neighbors, the local spatial pattern becomes proportionally larger, but the condition for synchronization of the whole forest and its magnitude are the same as for the case with the nearest neighbor pollen exchange. When a fraction of the seeds are sired by globally dispersed pollen and the rest are sired by local pollen, long-range synchronization can occur for a wide-parameter region, and trees may engage in a fluctuation with a masting interval longer than two years. We discuss alternative explanations for the long-range synchronization of beech forests.",84,Journal,ar,Article,100,2,2,"Beech forest | Coupled map lattice | Dynamic spatial covariance | Japan | Masting | Pollen coupling of trees | Synchronization, long-range",20308,undefined,0,FALSE,237,NA,NA,NA
true,https://api.elsevier.com/content/abstract/scopus_id/0000301671,SCOPUS_ID:0000301671,2-s2.0-0000301671,The temporal scale of foraging decisions in bison,Fortin D.,Ecology,00129658,83,4,970-982,2002-04-01,1 April 2002,10.1890/0012-9658(2002)083[0970:TTSOFD]2.0.CO;2,"Assessing the temporal scale under which gain is maximized is critical for the understanding of diet choice by animals. Classical foraging theory assumes that animals maximize long-term rates. Few studies have considered several temporal scales concurrently, however, weakening tests of rate-maximizing models. We used contingency models based on maximization of short-term vs. long-term energy intake by bison (Bison bison). Model predictions were tested against field observations conducted during six periods of 1998: two periods in the winter, one in the spring, and three in the summer. During most of the year, foraging characteristics and plant attributes suggested that intake rate of bison should be limited by ingestion time over short periods of time, and by digestive constraints over long periods of time. Diet predictions varied across temporal scales for four of the six sampling periods. Selecting Agropyron spp., rather than Carex atherodes, during these periods would result in an increase of daily energy intake by as much as 15 565 kJ (i.e., 7.4% of daily gains) but would necessitate a longer daily foraging time. We observed, instead, that bison preferred C. atherodes to Agropyron spp., suggesting that patterns of diet selection by bison were more consistent with maximization of short-term than of long-term energy intake. We thus provide some evidence that, contrary to established principles of classic optimality models, the foraging decisions of bison reduce potential long-term gains by maximizing short-term gains.",101,Journal,ar,Article,100,3,3,Agropyron spp. | Bison | Bison bison | Carex atherodes | Contingency model | Digestive constraints | Energy maximization | Foraging decision | Intake rate | Large grazers | Optimal diet | Temporal scales,20308,undefined,0,FALSE,238,NA,NA,NA
true,https://api.elsevier.com/content/abstract/scopus_id/0000220956,SCOPUS_ID:0000220956,2-s2.0-0000220956,Forest canopy and the performance of larval amphibians,Skelly D.,Ecology,00129658,83,4,983-992,2002-04-01,1 April 2002,10.1890/0012-9658(2002)083[0983:FCATPO]2.0.CO;2,"Freshwater ponds inhabited by larval amphibians can become encroached by forest vegetation. Surveys reveal that gradients formed by canopy cover can act as a selective sieve for the distribution of amphibian larvae among ponds. In eastern North America, many species, including spring peepers (Pseudacris crucifer), are usually absent from ponds where forest canopies have closed over the pond basin. Relatively fewer species, including wood frogs (Rana sylvatica), are commonly present in both closed and open canopy ponds. Long-term observations reveal that canopy development is associated with extinction of spring peeper populations and persistence of wood frog populations. We evaluated performance of spring peeper and wood frog larvae in a set of experiments designed to assess three predictions: (1) that conditions in closed canopy ponds (e.g., lower temperature) are associated with depressed growth rates, (2) that the impact of canopy cover will be more severe on an open canopy specialist vs. a canopy generalist species, and (3) that abiotic differences between closed and open canopy ponds may provide a sufficient explanation for performance patterns. In support of the first prediction, a field transplant experiment showed that both species grew slower in closed vs. open canopy ponds. We found some support for the second prediction during two separate experiments. During the field experiment, the impact of canopy on spring peeper growth was similar to the effect on wood frogs. However, in a common garden experiment (in which physical conditions tended to coverge), spring peepers raised on substrates and water from closed canopy ponds grew substantially slower than conspecifics in the presence of water and substrate from open canopy ponds. By contrast, wood frogs grew faster in the closed canopy treatment. Finally, while recognizing that abiotic variation appears to play an important role in performance across the canopy gradient, we rejected the third hypothesis. We found that a biotic manipulation (food addition) partially mitigated depressed growth rates in closed canopy ponds. This result suggests that biotic factors (e.g., variation in abundance and composition of periphyton) also contribute to performance differences across the canopy gradient.",206,Journal,ar,Article,100,3,3,"Amphibian | Canopy | Forest cover | Freshwater ponds | Growth rate | Periphyton | Pseudacris crucifer | Rana sylvatica | Tadpoles | Temperature | Yale-Myers Forest, Connecticut",20308,undefined,0,FALSE,239,NA,NA,NA
true,https://api.elsevier.com/content/abstract/scopus_id/0038814879,SCOPUS_ID:0038814879,2-s2.0-0038814879,"Drought cycles and landscape responses to past aridity on prairies of the northern Great Plains, USA",Clark J.S.,Ecology,00129658,83,3,595-601,2002-03-01,1 March 2002,10.1890/0012-9658(2002)083[0595:DCALRT]2.0.CO;2,"Widespread drought is among the most likely and devastating consequences of future global change. Assessment of drought impacts forecast by atmospheric models requires an understanding of natural drought variability, especially under conditions more arid than today. Using high-resolution lake-sediment records from the northern Great Plains, we show pronounced 100- to 130-yr drought cycles during the arid middle Holocene (8000 calendar yr BP). During drought phases, grass productivity declined, erosion and forbs increased, and fuel limitation reduced fire importance. Intervening humid decades saw grass production rise, with stabilization of soils and renewed fire as fuels became abundant. Although both C3 and C4 grasses declined during droughts, a lasting shift to C3 dominance occurred during a single drought ∼8200 calendar yr BP. During the more humid Late Holocene (2800 calendar yr BP), climate was less variable and without evident drought cyclicity. Consequently, drought severity during past, and possibly future, arid phases cannot be anticipated from the attenuated climate variability evident during contemporary humid phases. Our study demonstrates that agriculturally important grassland ecosystems respond sensitively to drought variability, uncertainty in which has profound implications for the future of these ecosystems.",131,Journal,ar,Article,100,6,6,C  grassland 4 | Climate change | Diatoms | Fire | Holocene | Limnology | Pollen analysis | δ C 13,20308,undefined,0,FALSE,240,NA,NA,NA
true,https://api.elsevier.com/content/abstract/scopus_id/0038477122,SCOPUS_ID:0038477122,2-s2.0-0038477122,Effects of food supplementation and habitat selection on timing of Lesser Kestrel breeding,Aparicio J.M.,Ecology,00129658,83,3,873-877,2002-03-01,1 March 2002,10.1890/0012-9658(2002)083[0873:EOFSAH]2.0.CO;2,"Numerous experimental studies providing extra food have concluded that food availability at the beginning of the breeding season constrains the start of egg-laying for female birds (Food Supply Hypothesis) because supplemented females usually lay earlier than nonsupplemented ones. This conclusion has recently been questioned because food addition studies may be confounded by ordered habitat selection. Ordered habitat selection occurs when territories or nests provided with extra food are chosen by individuals of higher quality that may be able to initiate breeding early, regardless of food supply (Habitat Selection Hypothesis). To test these two hypotheses, we performed an experiment using the Lesser Kestrel (Falco naumanni). To reveal effects of ordered habitat selection, extra food was provided to half of the nests in two colonies in which the other nests remained unsupplemented (mixed colonies). We provided extra food to all nests in two colonies (all-fed colonies) and to no nests in three colonies (all-unfed colonies). In these colonies, ordered habitat selection could not occur because all nests received equal treatment. In mixed colonies, fed pairs laid earlier than unfed ones. In contrast to the prediction of the Habitat Selection Hypothesis, there was no significant difference in mean laying date between unfed pairs of mixed colonies and pairs in all-unfed colonies, or between fed pairs of mixed colonies and pairs in all-fed colonies. Moreover, laying date was significantly earlier in all-fed than in all-unfed colonies. Therefore, the results support the Food Supply Hypothesis and refute the Habitat Selection Hypothesis.",46,Journal,ar,Article,100,2,2,Egg laying | Falco naumanni | Food limitation | Food supply | Habitat selection | Laying date | Lesser Kestrel | Spain | Supplementary food | Timing of breeding,20308,undefined,0,FALSE,241,NA,NA,NA
true,https://api.elsevier.com/content/abstract/scopus_id/0038477119,SCOPUS_ID:0038477119,2-s2.0-0038477119,Interactions among aliens: Apparent replacement of one exotic species by another,Lohrer A.M.,Ecology,00129658,83,3,719-732,2002-03-01,1 March 2002,10.1890/0012-9658(2002)083[0719:IAAARO]2.0.CO;2,"Although many studies have documented the impact of invasive species on indigenous flora and fauna, few have rigorously examined interactions among invaders and the potential for one exotic species to replace another. European green crabs (Carcinus maenas), once common in rocky intertidal habitats of southern New England, have recently declined in abundance coincident with the invasion of the Asian shore crab (Hemigrapsus sanguineus). Over a four-year period in the late 1990s we documented a significant (40-90%) decline in green crab abundance and a sharp (10-fold) increase in H, sanguineus at three sites in southern New England. Small, newly recruited green crabs had a significant risk of predation when paired with larger H. sanguineus in the laboratory, and recruitment of 0-yr C. maenas was reduced by H. sanguineus as well as by larger conspecifics in field-deployed cages (via predation and cannibalism, respectively). In contrast, recruitment of 0-yr H. sanguineus was not affected by larger individuals of either crab species during the same experiments. The differential susceptibility of C. maenas and H. sanguineus recruits to predation and cannibalism likely contributed to the observed decrease in C. maenas abundance and the almost exponential increase in H. sanguineus abundance during the period of study. While the Asian shore crab is primarily restricted to rocky intertidal habitats, C. maenas is found intertidally, subtidally, and in a range of substrate types in New England. Thus, the apparent replacement of C. maenas by H. sanguineus in rocky intertidal habitats of southern New England may not ameliorate the economic and ecological impacts attributed to green crab populations in other habitats of this region. For example, field experiments indicate that predation pressure on a native bivalve species (Mytilus edulis) has not necessarily decreased with the declines of C. maenas. While H. sanguineus has weaker per capita effects than C. maenas, its densities greatly exceed those of C. maenas at present and its population-level effects are likely comparable to the past effects of C. maenas. The Carcinus-Hemigrapsus interactions documented here are relevant in other parts of the world where green crabs and grapsid crabs interact, particularly on the west coast of North America where C. maenas has recently invaded and co-occurs with two native Hemigrapsus species.",128,Journal,ar,Article,100,2,2,Brachyuran crabs | Carcinus maenas | Hemigrapsus sanguineus | Interactions between | Invasion ecology | Invasive species | Marine biological invasions | Non-indigenous species | Post-settlement predation | Rocky intertidal zone,20308,undefined,0,FALSE,242,NA,NA,NA
true,https://api.elsevier.com/content/abstract/scopus_id/0038343637,SCOPUS_ID:0038343637,2-s2.0-0038343637,"Environmental variation in seed number, size, and dispersal of a fleshy-fruited plant",Parciak W.,Ecology,00129658,83,3,780-793,2002-03-01,1 March 2002,10.1890/0012-9658(2002)083[0780:EVISNS]2.0.CO;2,"Plant reproductive strategies may evolve from fitness trade-offs between seed dispersal and seedling establishment. Small crops of large seeds generally are not dispersed as far as large crops of small seeds, bur large seeds contain more reserves for seedling establishment. However, selection pressures imposed on these traits may vary among environments. This study examined the extent and consequences of environmental variation in the seed dispersal strategy of a fleshy-fruited plant, the common chokecherry (Prunus virginiana). From 1996 to 1998, P. virginiana fruit crop and seed traits were measured for plants sampled in moist riparian or dry slope habitats in western Montana. The consequences of variation in P. virginiana location, seed size, and seed number for seed dispersal were estimated from 1996 to 1999 by collecting seeds in seed traps. In all years, P. virginiana produced larger crops of smaller seeds, in riparian than in slope habitats. Reproductive biomass was lower for plants on moisture-limited slopes than for similarly sized plants in riparian habitats. However, P. virginiana on slopes increased seed size rather than seed number in a year with relatively high levels of precipitation, suggesting that large offspring size may play a more important role than seed number in this environment. Environmental variation in P. virginiana reproductive traits may contribute to differences in seed dispersal patterns. Frugivores removed greater numbers of seeds from plants with large fruit crops and preferentially consumed relatively small seeds within sites (particularly in slope habitats). In riparian habitats, seed deposition by frugivores was greater away from rather than under P. virginiana canopies. In contrast, seed deposition on slopes was greatest under canopies. Thus, the production of many small seeds may be an adaptive response to increase seed dispersal in the riparian environment, where dispersal may be more important than seed size for successful offspring recruitment.",74,Journal,ar,Article,100,1,1,Common chokecherry | Environmental variation | Fruit removal | Plant reproductive strategies | Prunus virginiana | Seed dispersal | Seed size vs. number,20308,undefined,0,FALSE,243,NA,NA,NA
true,https://api.elsevier.com/content/abstract/scopus_id/0038225708,SCOPUS_ID:0038225708,2-s2.0-0038225708,Protandry: The relationship between emergence time and male fitness in the pitcher-plant mosquito,Holzapfel C.,Ecology,00129658,83,3,607-611,2002-03-01,1 March 2002,10.1890/0012-9658(2002)083[0607:PTRBET]2.0.CO;2,"Protandry is the emergence or arrival into a seasonal population of males before females and is widespread among both plants and animals. Conceptually, protandry should be subject to stabilizing selection because early emerging males risk death before mating and late-emerging males miss opportunities to mate. However, for any given male, the optimal emergence rime may depend upon the mean and distribution of emergence of other males in the population. Using lifetime offspring sired as our criterion of reproductive success, we found that, in laboratory populations of the pitcher-plant mosquito, Wyeomyia smithii, there is, indeed, stabilizing selection acting on the optimal time for male emergence, and that the specific optimum does depend upon emergence time of other males in the population. In addition, male cohorts achieved greater reproductive success when their emergence was spread over several days rather than occurring in a single day. However, reproductive success did not differ between normal and superdispersed emergence distributions, suggesting that, under more variable, natural conditions, the specific pattern of male emergence may be far less important than variation in emergence time, per se.",23,Journal,ar,Article,100,2,2,Emergence time and male fitness | Evolutionary stable strategy (ESS) | Invasions | Life-history evolution | Male fitness | Mosquitoes | Reproductive success | Seasonality | Sexual selection | Wyeomyia smithii,20308,undefined,0,FALSE,244,NA,NA,NA
true,https://api.elsevier.com/content/abstract/scopus_id/0038138162,SCOPUS_ID:0038138162,2-s2.0-0038138162,Succession in old pastures of central Amazonia: Role of soil fertility and plant litter,Ganade G.,Ecology,00129658,83,3,743-754,2002-03-01,1 March 2002,10.1890/0012-9658(2002)083[0743:SIOPOC]2.0.CO;2,"The effects of neighbor vegetation during succession were studied in old-field and rain forest sites of central Amazonia. We investigated how plant litter and the availability of soil nutrients (P and K) influenced interactions between neighbor vegetation and colonizing species. We monitored the establishment and growth of seedlings of four tree species, sown in old-field and forest plots in which vegetation, plant litter, and soil P and K were experimentally manipulated. In the old field, removal of vegetation significantly decreased seedling establishment of Oenocarpus bataua, Socrathea exorrhiza, and Aspidosperma discolor (suggesting facilitation in these late successional species) but had no effect on Inga edulis (a mid successional species). In contrast, neighboring vegetation inhibited the growth of all sown species: removal significantly increased biomass. In the forest site, removal of forest vegetation had no effect on establishment but significantly increased seedling mass, suggesting inhibition. Plant litter removal significantly decreased seedling establishment of all species in the old field, and of S. exorrhiza and I. edulis in the forest, suggesting positive effects. A significant interaction between plant litter and vegetation removal for O. bataua and S. exorrhiza in the old field showed that litter may also contribute to facilitation. Seedling mass of the three late-successional species was consistently not enhanced by P and K addition. In I. edulis, however, mass increased 2.5 times after P and K addition when vegetation was removed but did not vary in intact old-field vegetation. Seedling establishment in the old field was significantly higher in S. exorrhiza and A. discolor compared to the forest, while plant biomass in S. exorrhiza, A. discolor, and I. edulis was significantly higher. Neither plant litter nor P and K addition could account for these differences. We conclude that facilitation and competition may operate during the early stages of forest succession in Amazonia, that plant litter contributes to the facilitation process, and that soil P and K do not influence the inhibition process, suggesting that light competition may be important. As succession proceeds, the effects of neighbor vegetation switch from positive to negative.",49,Journal,ar,Article,100,2,2,Amazonia | Aspidosperma discolor | Competition and facilitation | Inga edulis | Oenocarpus bataua | Old-field succession | Plant litter | Root | Seedling establishment | Shoot allocation | Socratea exorrhiza | Soil fertility | Succession | Tropical rain forest,20308,undefined,0,FALSE,245,NA,NA,NA
