@_fa,prism:url,dc:identifier,eid,dc:title,dc:creator,prism:publicationName,prism:issn,prism:volume,prism:issueIdentifier,prism:pageRange,prism:coverDate,prism:coverDisplayDate,prism:doi,dc:description,citedby-count,prism:aggregationType,subtype,subtypeDescription,author-count.@limit,author-count.@total,author-count.$,source-id,fund-no,openaccess,openaccessFlag,entry_number,freetoread.value.$,freetoreadLabel.value.$
true,https://api.elsevier.com/content/abstract/scopus_id/0026273777,SCOPUS_ID:0026273777,2-s2.0-0026273777,The influence of larval supply and settlement on the population structure of barnacles,Minchinton T.,Ecology,00129658,72,5,1867-1879,1991-01-01,1991,10.2307/1940984,"The abundance and distribution of settlers, recruits, and adults of Semibalanus balanoides were monitored at adjacent, but physically and biologically different sites (A and B) on a rocky intertidal shore in Nova Scotia following a rare occurrence of ice scouring. There was a strong concordance between cyprid availability and settler density over the main settlement period among intertidal heights, where each was inversely related to intertidal height. Differences in cyprid availability with intertidal height were related to immersion time as the larvae, in general, were uniformly distributed at the water-substratum interface. Settlement rate was strongly correlated with cyprid availability in the low intertidal zone at site A, where most settlement occurred. In all zones at both sites, recruit density at the end of the main settlement period was a positive function of settler density over this period: 79% of the variation in recruit density was explained by settler density over the main settlement period. Adult density and total settler density also tended to be strongly related: 86% (mid zone at site A) and 73% (high zone at site B) of variation in adult density was explained by total settler density, except where postrecruitment mortality was high. Local hydrodynamics, which influences supply and distribution of planktonic larvae, may dictate the distribution of settlers and, ultimately, adults. -from Authors",186,Journal,ar,Article,100,2,2,20308,undefined,0,FALSE,78,NA,NA
true,https://api.elsevier.com/content/abstract/scopus_id/0026273540,SCOPUS_ID:0026273540,2-s2.0-0026273540,Population stability of a tropical lizard,Andrews R.,Ecology,00129658,72,4,1204-1217,1991-01-01,1991,10.2307/1941094,"Populations of Anolis limifrons were censused for 19 yr at the Lutz site on Barro Colorado Island (BCI) and for 4 yr at 20 other sites in C Panama. Census data provided estimates of population density at the end of the wet season (December) and indices of per-capita food intake and annual recruitment. Year-to-year changes in density of as much as 5- to 8-fold were observed at Lutz and of 2- to 3-fold were observed at other sites. Changes in population density at 11 BCI sites were synchronous over 1983-1986, while population density fluctuated independently at non-BCI sites. Populations of A. limifrons exhibited significantly greater generation-to-generation variability than populatioans of West Indian Anolis and of lizards in temperate-zone habitats. An index of per-capita food intake was negatively related to density both for temporal comparisons at Lutz and for spatial comparisons among sites. The relative number of young individuals at the end of the wet season was negatively related to population density and positively related to an estimate of food intake. Recruitment was depressed when density was high and enhanced when food was relatively abundant. Despite the potential for density-dependent regulation, A. limifrons populations are highly unstable, presumably because of random perturbations of the environment. Rainfall is implicated causally. Population attributes that contribute to instability are rapid population turnover and a middle-level trophic position in a complex food web. -from Author",43,Journal,ar,Article,100,1,1,20308,undefined,0,FALSE,79,all,All Open Access
true,https://api.elsevier.com/content/abstract/scopus_id/0026273539,SCOPUS_ID:0026273539,2-s2.0-0026273539,An experimental test of mate defence in an iguanid lizard (Sceloporus graciosus),Deslippe R.,Ecology,00129658,72,4,1218-1224,1991-01-01,1991,10.2307/1941095,"Resident male sagebrush lizard in W Colorado did not abandon their territories following removal of adult females, nor did they expand the size of their territories. Males were not defending juvenile females because most male territories did not include juvenile females. Sagebrush lizards are long lived, and territory defense probably ensures several mating opportunities. Loss of a mate in one season may be less important than the long-term benefits of territory maintenance and repeated reproduction. -from Authors",13,Journal,ar,Article,100,2,2,20308,undefined,0,FALSE,80,NA,NA
true,https://api.elsevier.com/content/abstract/scopus_id/0026272791,SCOPUS_ID:0026272791,2-s2.0-0026272791,Nitrogen content of food plants and vulnerability of Pieris rapae to natural enemies,Loader C.,Ecology,00129658,72,5,1586-1590,1991-01-01,1991,10.2307/1940958,"Tested the assumption that reduction in leaf quality reduces the survivorship of herbivores indirectly by increasing their exposure to natural enemies. Caterpillars of Pieris rapae were placed on collard plants that had been manipulated to have leaves either rich or poor in N. On low-N plants caterpillars both developed more slowly and devoted more of their time to feeding than on high-nitrogen plants. When exposed to large (>2mm) predators and parasites in a natural setting, survivorship of caterpillars on low-N collards was reduced greatly compared to caterpillars protected from predators and parasites. Survivorship of caterpillars on high-N plants was reduced significantly less dramatically when exposed to predators and parasites. Small (<1-2mm) pupal parasites that were able to reach the caterpillars through the mesh of the predator exclusion cages emerged more frequently from individuals reared on high-nitrogen plants. -Authors",128,Journal,ar,Article,100,2,2,20308,undefined,0,FALSE,81,NA,NA
true,https://api.elsevier.com/content/abstract/scopus_id/0026272620,SCOPUS_ID:0026272620,2-s2.0-0026272620,"Behavior, heterogeneity, and the dynamics of interacting species",Chesson P.,Ecology,00129658,72,4,1187-1195,1991-01-01,1991,10.2307/1941092,"In various settings the authors show how behavior can be a response to heterogeneity, introducing nonlinear density dependence and qualitatively altering population dynamics. Also, even simple behaviors can cause nonadditivity, which is an interaction between environmental and density-dependent processes. It has a critical effect on the coexistence of competing species. To understand these various joint effects of behavior and heterogeneity on population dynamics, the general effects of behavior on dynamics are discussed. The authors then consider examples of the various ways in which heterogeneity affects dynamics, and for each example consider the interaction of behavior with heterogeneity. -from Authors",57,Journal,ar,Article,100,2,2,20308,undefined,0,FALSE,82,NA,NA
true,https://api.elsevier.com/content/abstract/scopus_id/0026271148,SCOPUS_ID:0026271148,2-s2.0-0026271148,Group membership facilitates feeding of the herbivorous sea slug Placida dendritica,Trowbridge C.,Ecology,00129658,72,6,2193-2203,1991-01-01,1991,10.2307/1941570,"Placida dendritica (Gastropoda: Opisthobranchia: Ascoglossa) formed feeding groups on the coenocytic green algae Codium setchellii and C. fragile, but not on the related green alga Bryopsis corticulans. Members of Placida congregations composed of similar-sized individuals grew significantly faster than single individuals. In mixed-sized congregations, however, trophic benefits were not shared equally among all members. Small slugs always benefited from the presence of conspecifics, small or large; large slugs, however, benefited only if conspecifics were comparable in size. Small Placida tended to reduce the growth rate of large conspecifics. A slug's feeding not only stimulated other group members to feed but also modified algal condition, enhancing feeding and growth of conspecifics. -from Author",21,Journal,ar,Article,100,1,1,20308,undefined,0,FALSE,83,NA,NA
true,https://api.elsevier.com/content/abstract/scopus_id/0026270557,SCOPUS_ID:0026270557,2-s2.0-0026270557,Fire intensity effects on germination of shrubs and herbs in southern California chaparral,Moreno J.,Ecology,00129658,72,6,1993-2004,1991-01-01,1991,10.2307/1941554,"Investigated the effects of fire intensity and combustion products on shrub and herbaceous seedling emergence in mixed chaparral dominated by a facultative seeder, Adenostoma fasciculatum, and by an obligate seeder, Ceanothus greggii. Adenostoma was very sensitive to increasing fire intensity, with decreasing seedling production as fire intensity increased. Ceanothus germination was either stimulated by, or very resistant to, increasing fire intensity; increasing fire intensity also promoted earlier germination. Among the abundant herbs, fire annuals like Phacelia brachyloba were more resistant to increasing fire intensity than opportunistic annuals like Cryptantha muricata. Seedling production of one opportunistic annual, Lotus strigosus, was, however, stimulated by all levels of increased fire intensity. In most cases, ash and char did not affect field germination. -from Authors",123,Journal,ar,Article,100,2,2,20308,undefined,0,FALSE,84,NA,NA
true,https://api.elsevier.com/content/abstract/scopus_id/0026270554,SCOPUS_ID:0026270554,2-s2.0-0026270554,Competition among plants sharing hummingbird pollinators: laboratory experiments on a mechanism,Feinsinger P.,Ecology,00129658,72,6,1946-1952,1991-01-01,1991,10.2307/1941549,"At Monteverde, Costa Rica, Besleria triflora (Gesneriaceae), Palicourea lasiorrachis and Cephaelis elata (both Rubiaceae) share hummingbirds (Lampornis calolaema) as pollinators. Intervention of Cephaelis flowers strongly reduced pollen transfer among Palicourea flowers. Increasing the number of donor Palicourea flowers significantly increased the absolute amount of pollen transferred but did not overcome the negative effect of Cephaelis. Pollen transfer among Besleria flowers also declined with the intervention of Cephaelis flowers; the decline was less strongly significant than for Palicourea, perhaps because pollen loads on stigmas of some female Besleria flowers can contain self pollen left over from their male phase. Despite its demonstrability in the laboratory, however, competition among individual plants varies in its ability to explain density dependence in pollination among plant populations in the field. Studying the role of particular interactions in community structure must involve examinations of mechanisms at the level of individuals, processes at the population level, and patterns of coexistence rather than just one level of this hierarchy. (See also 92L/05913). -from Authors",51,Journal,ar,Article,100,2,2,20308,undefined,0,FALSE,85,NA,NA
true,https://api.elsevier.com/content/abstract/scopus_id/0026269630,SCOPUS_ID:0026269630,2-s2.0-0026269630,Mechanisms of benthic algal succession in lotic environments,McCormick P.,Ecology,00129658,72,5,1835-1848,1991-01-01,1991,10.2307/1940982,"In a productive third-order stream in Kentucky, observations in different current environments during two consecutive winters were used to classify dominant species as early or late successional based on changes in relative abundance through time on newly exposed substrates. Assemblages of the same age but differing in the relative abundance of early- and late-successional species were developed in streamside channels recreating both current environments to measure growth parameters of dominant species and to test for interspecific interactions. Of the five dominant species of algae in the winter assemblages, three species were consistently classified as early successional (decreased in relative abundance with increasing assemblage age), two species as late successional. Early-successional species differed in their growth form and strategy for initially dominating the substrate, having high densities in the water column, high probabilities of attaching, or fast early reproductive rates. Late-successional species exhibited a more extended growth form and had the highest per capita reproductive rates during later growth. Late-successional species reduced the reproductive rate of early species as succession proceeded in both current environments but were not themselves inhibited by biovolume increases. -from Authors",121,Journal,ar,Article,100,2,2,20308,undefined,0,FALSE,86,NA,NA
true,https://api.elsevier.com/content/abstract/scopus_id/0026269360,SCOPUS_ID:0026269360,2-s2.0-0026269360,Optimal foraging strategy of the sheet-web spider Lepthyphantes flavipes under perturbation,Leclerc J.,Ecology,00129658,72,4,1267-1272,1991-01-01,1991,10.2307/1941100,"Field work concerning Lepthyphantes flavipes (Linyphiidae), found on the upper surface of a deciduous forest litter indicates that a physical perturbation like falling leaves has a major effect on spider movement. The proposed optimal foraging model using stochastic dynamic programming includes perturbation movement as opposed to foraging movement between web sites, with variable prey availability in space and time. The 2 possible strategies (fixed-site or mobile strategy) are constrained by different energy costs and predation risks. Decision is based on prey availability of an occupied web site and on internal fat reserves. A fixed-site strategy is optimal in good web sites and in poor web sites when spiders have high fat reserves. A mobile strategy is optimal in poor web sites at low reserves. An optimal mobile strategy is much less profitable than an optimal fixed-site strategy, but the latter is interrupted by perturbation. -from Author",19,Journal,ar,Article,100,1,1,20308,undefined,0,FALSE,87,NA,NA
true,https://api.elsevier.com/content/abstract/scopus_id/0026269113,SCOPUS_ID:0026269113,2-s2.0-0026269113,Measuring realized niche spaces: climatic response of chaparral and coastal sage scrub,Westman W.,Ecology,00129658,72,5,1678-1684,1991-01-01,1991,10.2307/1940967,"Direct gradient analysis utilizes measures of abundance of the species at sites spanning the climatic range of the species' occurrence. Geographic distribution analysis quantifies the proportion of the species' total areal occurrence that is found within each climatic zone. A geographic information system is used to digitize species distribution maps and climatic isoline maps, and to compute areas of coincidence. The methods are compared on eight species of Californian coastal sage scrub. The position of species maxima along climatic gradients coincided for 75% of the 24 cases in which climatic response from the two methods was compared, suggesting that the quicker and less expensive geographic distribution analysis method may have value in generating first approximations to climatic response functions. The geographic distribution analysis method is also used to characterize the realized climatic niche space for an additional eight species of Californian hard chaparral. Most species' response surfaces from data throughout the species' range were approximately bell shaped along climatic axes, providing some confirmation of theoretical expectation. -from Author",53,Journal,ar,Article,100,1,1,20308,undefined,0,FALSE,88,NA,NA
true,https://api.elsevier.com/content/abstract/scopus_id/0026268582,SCOPUS_ID:0026268582,2-s2.0-0026268582,Effects of avian predation on grasshopper populations in North Dakota grasslands,Fowler A.,Ecology,00129658,72,5,1775-1781,1991-01-01,1991,10.2307/1940976,Results support the hypothesis that avian predation reduces insect populations at low and moderate densities. -from Authors,44,Journal,ar,Article,100,4,4,20308,undefined,0,FALSE,89,NA,NA
true,https://api.elsevier.com/content/abstract/scopus_id/0026268339,SCOPUS_ID:0026268339,2-s2.0-0026268339,The effects of a successional habitat mosaic on a small mammal community,Foster J.,Ecology,00129658,72,4,1358-1373,1991-01-01,1991,10.2307/1941108,"Effects of patch size on animal densities and persistence rates in an old field in Kansas varied among animal species. The largest species, Sigmodon hispidus, was never found on the smallest patches, but densities of Reithrodontomys megalotis, Microtus ochrogaster, and Peromyscus maniculatus were often highest on the smallest patches. Animal density variations were often significantly explained by patch size using multiple regression analyses, but other, unmeasured, variables may have influenced results. Persistence rates of the three species were often highest on the largest patches. Animals visited small patches more often than large patches without staying, and used large patches to create territories. Small and medium patches may have been used as archipelagos of preferred habitat interspersed with less desirable habitat -from Authors",84,Journal,ar,Article,100,2,2,20308,undefined,0,FALSE,90,NA,NA
true,https://api.elsevier.com/content/abstract/scopus_id/0026268321,SCOPUS_ID:0026268321,2-s2.0-0026268321,Weather and reproductive variation in shrubsteppe sparrows: a hierarchical analysis,Rotenberry J.,Ecology,00129658,72,4,1325-1335,1991-01-01,1991,10.2307/1941105,"During a 5-yr period the authors monitored clutch sizes, brood sizes, and fledging success in sage Amphispiza belli and Brewer's Spizella breweri sparrows in shrubsteppe habitat in C Oregon. During the study, the Pacific Northwest experienced precipitation extremes, with the driest bioyear (October-April) in 65 yr of records (1976-1977) followed by one of the wettest. Within each breeding season daily temperature and precipitation fluctuated widely and in most cases unpredictably over a scale of a few days. Both species achieved significantly greater final reproductive success (number of fledglings produced) in wetter, presumably more biologically productive years. In Brewer's sparrows this was achieved through higher clutch sizes in wetter years, whereas sage sparrows had higher hatching rates. For sage sparrows, within-year weather variables accounted for a significant amount of variation in reproductive parameters beyond that statistically explained by bioyear precipitation alone, but in Brewer's sparrows addition of within-year weather variables was not significant, and thus this species appeared buffered from the effects of short-term variation in abiotic conditions. Clutch-size variation in Brewer's sparrows may represent adaptive flexibility, the ability to assess potentially favorable environmental conditions and adjust reproductive investment accordingly. In sage sparrows the association between bioyear precipitation and final reproductive success seemed most likely to be a proximate consequence of resource availability at the time of oogenesis, and to be further modified by the effects of weather that each nest experienced. -from Authors",90,Journal,ar,Article,100,2,2,20308,undefined,0,FALSE,91,NA,NA
true,https://api.elsevier.com/content/abstract/scopus_id/0026267629,SCOPUS_ID:0026267629,2-s2.0-0026267629,Opportunities for using the EOS imaging spectrometers and synthetic aperture radar in ecological models,Ustin S.,Ecology,00129658,72,6,1934-1945,1991-01-01,1991,NA,"Starting in 1997, the Earth Observing System (EOS) will offer the first opportunity to obtain frequent (daily to 16-d repeat) remote observations in microwave, optical, and thermal bands over most of the Earth's surface. These data can be used to infer biophysical and geophysical attributes of the surface of the Earth using algorithms that convert sensor units (e.g., reflectance, phase, and backscatter) into physical units (e.g., absorbed photosynthetically active radiation (APAR), evapotranspiration, soil moisture, biomass) that are needed to drive ecosystem and climate models. -from Authors",62,Journal,ar,Article,100,6,6,20308,undefined,0,FALSE,92,NA,NA
true,https://api.elsevier.com/content/abstract/scopus_id/0026267457,SCOPUS_ID:0026267457,2-s2.0-0026267457,Patch dynamics of a phytophagous mite population: effect of number of subpopulations,Walde S.,Ecology,00129658,72,5,1591-1598,1991-01-01,1991,10.2307/1940959,"Using the phytophagous European red mite Panonychus ulmi and its predator, the phytoseiid mite Typhlodromus pyri, an orchard was established where apple trees were arranged in groups of one, four or 16. The pests reached highest densities and were most persistent on trees in the largest groups. Results are explained in terms of an interaction between prey immigration/emigration and predation. -from Author",17,Journal,ar,Article,100,1,1,20308,undefined,0,FALSE,93,NA,NA
true,https://api.elsevier.com/content/abstract/scopus_id/0026266817,SCOPUS_ID:0026266817,2-s2.0-0026266817,A comparative demographic analysis of clonal reproduction in a temperate soft coral,McFadden C.,Ecology,00129658,72,5,1849-1866,1991-01-01,1991,10.2307/1940983,"Four populations of Alcyonium sp. were monitored photographically for two years to record colony growth, mortality, fission, sexual reproduction, and larval recruitment. Despite high turnover, population densities remained reasonably constant. The 24-52% mortality was matched approximately by recruitment of daughter colonies produced by fission. Sexual reproduction was infrequent, and no larval recruitment was observed. The frequency of both fission and sexual reproduction increased with increasing colony size; mortality decreased with increasing size. Projected growth rates (=relative fitness, λ) of the four populations ranged from 0.66-1.15. Sexual reproduction contributes <1% of the value of λ, while >40% of λ is accounted for by transitions between the upper size classes in the population, either by fission or growth. Selection for increased λ will increase fission at the expense of sexual reproduction in this species. -from Author",64,Journal,ar,Article,100,1,1,20308,undefined,0,FALSE,94,NA,NA
true,https://api.elsevier.com/content/abstract/scopus_id/0026097022,SCOPUS_ID:0026097022,2-s2.0-0026097022,Fungal mediation of a plant-herbivore interaction in an early successional plant community,Bowers M.,Ecology,00129658,72,3,1032-1037,1991-01-01,1991,10.2307/1940603,"Examined whether herbivory by mammals affected the structure and dynamics of an old-field plant community in Virginia. Early in the 3rd yr of the study purple clover Trifolium pratense, a dominant member of the plant community, occurred at higher densities where herbivores were excluded relative to control plots. Following a 1-mo time lag, Trifolium became infected by the rust-forming fungal pathogen Uromyces trifolii; incidence of infection was higher in exclosures relative to control plots where herbivores were present. Early-to-late season changes in the abundance of Trifolium were related to the degree of fungal infection and not herbivore presence/absence. Data from the following year (when the fungus and Trifolium were rare) showed clover abundance to be higher in control plots than in exclosures, ie the negative influence of the fungus not only persisted through time, but more strongly affected host plant abundance in a 2-mo period than did herbivory that occurred in both years. While the direct effect of herbivory on food plants is negative, by keeping plant abundance below that at which fungal infections become epidemic, the net effect of herbivores on some forage plants may be positive. -from Authors",18,Journal,ar,Article,100,2,2,20308,undefined,0,FALSE,95,NA,NA
true,https://api.elsevier.com/content/abstract/scopus_id/0026096687,SCOPUS_ID:0026096687,2-s2.0-0026096687,Interactions between the salamander Siren intermedia and the keystone predator Notophthalmus viridescens,Fauth J.E.,Ecology,00129658,72,3,827-838,1991-01-01,1991,10.2307/1940585,"In a community where broken-striped newt Notophthalmus viridescens dorsalis acts as a keystone predator on larval anurans, the authors independently manipulated the initial density of adult Notophthalmus (2 or 4) and the presence or absence of one adult Siren intermedia. At low newt density Siren had no effect on survival, but at high newt density competition reduced the survival and growth rates of Notophthalmus. Density of Notophthalmus and presence of Siren interacted to determine the fecundity of Notophthalmus. At low newt density Siren reduced Notophthalmus reproductive success by preying on larvae. At high newt density Siren indirectly enhanced reproductive success by reducing survival of adults, thus releasing larvae from intraspecific competition and cannibalism. Notophthalmus density had no effect on adult Siren survival or growth but other evidence indicates that competition with Notophthalmus reduces growth rates of Siren. Notophthalmus acted as a keystone predator on the assemblage of spring-breeding anurans; it increased the number of metamorphs of the weak competitor Pseudacris crucifer by releasing them from interspecific competition. Siren preyed on tadpoles in a nonselective manner. -from Authors",69,Journal,ar,Article,100,2,2,20308,undefined,0,FALSE,96,NA,NA
