@_fa,prism:url,dc:identifier,eid,dc:title,dc:creator,prism:publicationName,prism:issn,prism:volume,prism:issueIdentifier,prism:pageRange,prism:coverDate,prism:coverDisplayDate,prism:doi,dc:description,citedby-count,prism:aggregationType,subtype,subtypeDescription,author-count.@limit,author-count.@total,author-count.$,source-id,fund-no,openaccess,openaccessFlag,entry_number,freetoread.value.$,freetoreadLabel.value.$
true,https://api.elsevier.com/content/abstract/scopus_id/0026046726,SCOPUS_ID:0026046726,2-s2.0-0026046726,Estimates of movement and site fidelity using mark-resight data of wintering Canada geese,Hestbeck J.,Ecology,00129658,72,2,523-533,1991-01-01,1991,10.2307/2937193,"Mark-resight data from 28 849 Branta canadensis banded in the mid-Atlantic (New York, Pennsylvania, New Jersey), Chesapeake (Delaware, Maryland, Virginia), and Carolinas (North and South Carolina) were used to estimate movement and site fidelity. A model that incorporated ""tradition' or memory of previous wintering regions fit the data better than one that assumes that a first-order Markov chain described movement among regions. Considerable levels of movement occurred among regions of the Atlantic flyway. The annual probability of remaining in the same region for 2 successive winters, used as a measure of site fidelity, was 0.710 ± 0.016 (estimated mean ± SE), 0.889 ± 0.006, and 0.562 ± 0.025, for the mid-Atlantic, Chesapeake, and Carolinas, respectively. The estimated probability of moving to the Chesapeake from the mid-Atlantic or from the Carolinas was 3 × and 25 × as high, respectively, as the probability of moving in the opposite directions. Changes in estimated probabilities of moving between years corresponded to changes in winter harshness. In warm years, geese moved north and in cold years, they moved south. Geese had a high probability of moving to and remaining in the Chesapeake. Considerable numbers of geese from the Carolinas appeared to be wintering in more northerly locations (""short-stopped) in subsequent winters. -from Authors",386,Journal,ar,Article,100,3,3,20308,undefined,0,FALSE,133,NA,NA
true,https://api.elsevier.com/content/abstract/scopus_id/0026021618,SCOPUS_ID:0026021618,2-s2.0-0026021618,Survival and reproductive effort in banner-tailed kangaroo rats,Waser P.M.,Ecology,00129658,72,3,771-777,1991-01-01,1991,10.2307/1940579,"Nine years of demographic data for 2 unmanipulated populations Dipodomys spectabilis, in Arizona provide measures of survival, fecundity, age structure, and density. These data are used to search for costs of reproduction in survival and future fecundity, and to examine the interaction effects among reproductive effort, age, sex, and density on survival and future fecundity. None of the analyses reveals a significant negative effect of reproductive effort on survival or future fecundity. This result may be seen as evidence that reproduction has no measureable costs in fitness for bannertails, but bannertails may adjust their reproductive effort to individual circumstances so as to minimize costs. -from Authors",35,Journal,ar,Article,100,2,2,20308,undefined,0,FALSE,134,NA,NA
true,https://api.elsevier.com/content/abstract/scopus_id/0026021605,SCOPUS_ID:0026021605,2-s2.0-0026021605,Seasonal variation in pollination dynamics of sexually dimorphic Sidalcea oregana ssp. spicata (Malvaceae),Ashman T.,Ecology,00129658,72,3,993-1003,1991-01-01,1991,10.2307/1940599,"Hermaphrodite Sidalcea oregana ssp. spicata produced flowers with significantly larger petals but maintained fewer open flowers per infloresecence than females. Flowers of hermaphrodites produced 50% more nectar sugar in the 24 h after anthesis than the flowers of females. Nectar sugar production was also significantly and positively correlated with petal length. Pollinator visitation rates were influenced more by differences in petal length than by differences in flower number per inflorescence. Consequently, hermaphrodites experienced higher visitation rates on a per-flower basis. Female flowers tended to receive pollen at a lower rate than hermaphrodites, but remained in the receptive female-phase longer than hermaphrodites. On average, length of the period of flower receptivity declined as pollen deposition rate increased. These opposing processes resulted in the sex morphs receiving equivalent levels of pollination. Seasonal varation in the rate of pollen reception was more strongly influenced by the efficiency of the available pollinator pool than by rates of visitation. Dramatic seasonal shifts in the composition of the pollinator assemblage and pollen availability were correlated with increased pollination intensity as the season progressed. Not only were more pollen grains received, but they arrived in a shorter period of time and the number of potential pollen donors (hermaphrodites) increased. Pollen competition in both sex morphs may be more intense late in the season. -from Authors",138,Journal,ar,Article,100,2,2,20308,undefined,0,FALSE,135,NA,NA
true,https://api.elsevier.com/content/abstract/scopus_id/0026020430,SCOPUS_ID:0026020430,2-s2.0-0026020430,Plant characteristics over a century of primary succession on islands: Lake Hjalmaren,Rydin H.,Ecology,00129658,72,3,1089-1101,1991-01-01,1991,10.2307/1940608,"Between 1882-1886 the water level of Lake Hjalmaren, Sweden was lowered 130 cm. From 30 newly-emerging islands we have complete lists of vascular plant species with notes on their abundance from 1886, 1892, 1903-1904, 1927-1928, and 1984-1985. The 112 most important species were grouped as pioneers, early-, mid-, or late-successional. Several species (stayers) remained common once they had entered the succession. Eight of the 13 pioneers were annuals (therophytes), all of which were predominantly autogamous. After the pioneer stage there was no continuous change in these attributes. Seeds in pioneers were not smaller than in early- or midsuccessional species; seed size did not differ between annuals and perennials. Water dispersal was very important, and therefore dispersal success put no constraint on seed size. Species with the heaviest seeds arrived late; notably they were bird dispersed. Only among wind-dispersed trees and shrubs was there a gradual increase in seed mass over succession. The Ellenberg light indicator value showed a slight decrease over time, as did a variable measuring preference for open habitats. Physiology may be more important than life history for species replacements after the pioneer stage. -from Authors",68,Journal,ar,Article,100,2,2,20308,undefined,0,FALSE,136,NA,NA
true,https://api.elsevier.com/content/abstract/scopus_id/0026018407,SCOPUS_ID:0026018407,2-s2.0-0026018407,Ecological similarity of shrub-desert avifaunas of Australia and North America,Wiens J.,Ecology,00129658,72,2,479-495,1991-01-01,1991,10.2307/2937189,"Quantified features of community structure and of breeding biology, behavior, and life history of bird species occupying several sites in semi-arid shrub deserts in the Great Basin of North America and the interior of Australia. Study sites on both continents were statistically indistinguishable in most measures of vegetation structure. Breeding-bird assemblages contained the same number of species per unit area, but densities of individuals in Australia averaged half those in North America. A cluster analysis based on a multivariate similarity matrix derived from 14 ecological and life-history characteristics of the species revealed little close matching of Australian species with a North American counterpart, although 2 such pairings suggest possible ecological convergence. The Australian species were characterized by longer breeding periods with more breeding attempts, greater social aggregation during breeding and feeding activities, greater use of domed nests, and sedentariness or nomadism rather than seasonal migration. The avifaunas did not differ in mean clutch sizes, incidence of polygyny, nesting height, territory size, or general dietary patterns. That differences between the species and communities are more striking than the similarities may be related to climatic differences. Although long-term mean precipitation in the 2 regions does not differ, the monthly and yearly variance in Australia is substantially greater. Droughts may be prolonged and widespread, and this factor, together with soil-nutrient limitations, may result in generally lower and more erratic primary and secondary production in the Australian deserts. -from Author",48,Journal,ar,Article,100,1,1,20308,undefined,0,FALSE,137,NA,NA
true,https://api.elsevier.com/content/abstract/scopus_id/0026018360,SCOPUS_ID:0026018360,2-s2.0-0026018360,Effect of algal epiphytes on the mussel Mytilus californianus,Dittman D.,Ecology,00129658,72,1,286-296,1991-01-01,1991,10.2307/1938922,"The effects of facultative epiphytes on a bivalve host were studied on an islet near Santa Catalina Island, California. The primary cover in the mid-intertidal zone was a mosaic of red algal turf (Corallina officinalis, Gigartina canaliculata, Gelidium coulteri) and clumps of the mussel Mytilus californianus. In certain circumstances the algae attached to and overgrew the mussels. Spiny lobsters Panulirus interruptus and oystercatchers Haematopus bachmani preyed on intertidal mussels. Overgrowth significantly reduced survivorship. Presence of algae did not protect the mussels from predators. Overgrown mussels also had significantly lower rates of growth and reproduction than naturally clear mussels of similar size and location. Removal of epiphytes caused significant increases in mussel growth and reproduction. -from Authors",43,Journal,ar,Article,100,2,2,20308,undefined,0,FALSE,138,NA,NA
true,https://api.elsevier.com/content/abstract/scopus_id/0026015814,SCOPUS_ID:0026015814,2-s2.0-0026015814,Effects of geothermal groundwater on nutrient dynamics of a lowland Costa Rican stream,Pringle C.,Ecology,00129658,72,3,951-965,1991-01-01,1991,10.2307/1940596,"Spatial and temporal variability of surface and groundwater nutrient chemistry was contrasted between two tributaries of the Salto River, which drain from lava flows in the foothills of Barva Volcano. Some riparian zones along the Salto are saturated by subsurface inflows of phosphorus-rich, geothermal groundwater of the sodium-chloride-bicarbonate type. The heterogeneous patterns of solute-rich groundwater inflows results in dramatic differences in soluble reactive phosphorus (SRP) concentration between stream waters. In situ nutrient bioassays of algal periphyton growth indicated that both nitrate and SRP were at growth-saturating levels of the Salto while, in the Pantano, algal growth was phosphorus limited. The Pantano had a high retention capacity for phosphorus as measured through a whole-stream tracer injection experiment. -from Authors",59,Journal,ar,Article,100,2,2,20308,undefined,0,FALSE,139,NA,NA
true,https://api.elsevier.com/content/abstract/scopus_id/0026010719,SCOPUS_ID:0026010719,2-s2.0-0026010719,Virus spread and vector dynamics in genetically diverse plant populations,Power A.,Ecology,00129658,72,1,232-241,1991-01-01,1991,10.2307/1938917,"Using the aphid-transmitted barley yellow dwarf virus, the author examined the influence of genetic diversity in oats Avena sativa on the spread of the virus and on the population dynamics and movement behavior of aphid vectors of the virus. Only at relatively high aphid abundance were the densities of aphid vectors influenced by plant genetic diversity. In 1 year out of 3, densities of oat-bird cherry aphid Rhopalosiphum padi were significantly lower in the genetically diverse stand than in the genetically homogeneous stands. In no year were densities of the English grain aphid Sitobion avenae influenced by the host-plant population. Incidence of the virus was nevertheless consistently lower in the genetically diverse oat populations. Disease reduction in the diverse populations appears to depend upon changes in aphid movement behavior that affect the efficiency of virus transmission. S. avenae movement rates were significantly higher and plant tenure times significantly lower in genetically diverse oat populations. Because the barley yellow dwarf virus requires several hours of aphid feeding for effective transmission, these reduced tenure times and increased travel time among plants led to a reduction of virus transmission. -from Author",82,Journal,ar,Article,100,1,1,20308,undefined,0,FALSE,140,NA,NA
true,https://api.elsevier.com/content/abstract/scopus_id/0026007284,SCOPUS_ID:0026007284,2-s2.0-0026007284,Effects of soil moisture on shrub seedling survival in a semi-arid grassland,Harrington G.,Ecology,00129658,72,3,1138-1149,1991-01-01,1991,10.2307/1940611,"In semi-arid grasslands in Australia Dodonaea attenuata is a common, invasive shrub of perennial grasslands on sandy soils; cohorts of D. attenuata establish infrequently in vigorous grasslands and more frequently where the perennial grass has been damaged by overgrazing. Without summer irrigation all the seedlings in the natural grassland died. Seedling survival was inversely related to the amount of herbaceous growth on the other treatments. Summer irrigation maintained D. attenuata seedlings and produced a large biomass of perennial grass, which left the seedlings susceptible to grass fires. A water-balance model was run for the experimental site for the 97 yr of climatic records. The soil-moisture patterns associated with the establishment of 3 known cohorts of D. attenuata were identified. Only 6 widespread D. attenuata establishment events have occurred in 97 yr. In intact grasslands D. attenuata rarely establishes densely, and when it does so it is susceptible for grass fires. Modern management has increased establishment frequency by increasing the availability of summer soil moisture by overgrazing the grasslands and has suppressed grass fires. This has changed open grassland to dense shrubland. -from Author",154,Journal,ar,Article,100,1,1,20308,undefined,0,FALSE,141,NA,NA
true,https://api.elsevier.com/content/abstract/scopus_id/0026005422,SCOPUS_ID:0026005422,2-s2.0-0026005422,Costs of reproduction in a willow: experimental responses vs. natural variation,Fox J.F.,Ecology,00129658,72,3,1013-1023,1991-01-01,1991,10.2307/1940601,"Reports on the interaction between reproduction and subsequent reproductive and vegetative growth in female plants of a dioecious, early successional, tall shrub, feltleaf willow Salix alaxensis. Natural pheotypic variation suggested a trade-off between reproduction and growth, but a direct test by experiment revealed only a trade-off between current and future reproduction. The increased commitment to flowering that occurred after experimental reduction of current reproductive investment may be evidence for a cost of reproduction. -from Authors",67,Journal,ar,Article,100,2,2,20308,undefined,0,FALSE,142,NA,NA
true,https://api.elsevier.com/content/abstract/scopus_id/0026005413,SCOPUS_ID:0026005413,2-s2.0-0026005413,Discrimination between exploitative and interference competition between Cladocera and Keratella cochlearis,Macisaac H.,Ecology,00129658,72,3,924-937,1991-01-01,1991,10.2307/1940594,"Large cladocerans can suppress rotifers through both mechanical interference competition (IC) and exploitative competition (EC) for shared food resources. The author assessed the relative extent by which small- and large-bodied cladocerans suppressed the rotifer Keratella cochlearis. The small-bodied cladoceran Ceriodaphnia dubia suppressed Keratella exclusively through EC, while a slightly larger species (Daphnia ambigua) and subadults (Daphnia pulex) of two much larger-bodied cladocerans suppressed Keratella primarily through IC. Suppression by EC occurred in all treatments only after food was depleted below the concentration necessary to support maximal rotifer population growth, while suppression by IC occurred at both high and low food concentrations. IC should favor invulnerable rotifer speices, many of which are large-bodied, while EC should favor rotifer species with low food requirements, which tend to be small-bodied. -from Authors",78,Journal,ar,Article,100,2,2,20308,undefined,0,FALSE,143,NA,NA
true,https://api.elsevier.com/content/abstract/scopus_id/0026005412,SCOPUS_ID:0026005412,2-s2.0-0026005412,Regulation of planktonic microbial communities by nutrients and herbivores,Pace M.,Ecology,00129658,72,3,904-914,1991-01-01,1991,10.2307/1940592,"In single-factor experiments in Peter and Paul lakes, Michigan, large Daphnia were added to enclosures; these were compared to enclosures without Daphnia. Bacterial abundance and the incorporation of methyl-thymidine into DNA by bacteria were similar in treatments with and without Daphnia. Ciliates were significantly reduced while heterotrophic flagellates were only marginally reduced by Daphnia additions in the Peter Lake experiments. Protozoans were not affected by Daphnia additions in the Paul Lake experiment. Factorial experiments compared the relative significance of large daphnids and nutrients as regulators of bacteria and protozoa. Treatments included controls, Daphnia additions, nutrient (N+P) additions, and a combined Daphnia-nutrient treatment. Bacteria responded to nutrient additions but not to Daphnia. Protozoa were strongly affected by Daphnia and to a lesser extent by nutrients. Experiments suggest that the trophic cascade is truncated at the level of protozoans. -from Authors",139,Journal,ar,Article,100,2,2,20308,undefined,0,FALSE,144,NA,NA
true,https://api.elsevier.com/content/abstract/scopus_id/0026003547,SCOPUS_ID:0026003547,2-s2.0-0026003547,Effects of maternal nutrient pulse on reproduction of two colonizing Plantago species,Miao S.,Ecology,00129658,72,2,586-596,1991-01-01,1991,10.2307/2937198,"For Plantago major and P. rugelii, the effects of maternal nutrient pulses were related to the environments of both parents and progeny. When grown without competition, progeny from parent P. major plants maintained at the low background nutrient level and given a nutrient pulse had a higher spike biomass and a higher proportional allocation to spikes than did progeny from parents that did not receive a nutrient pulse. The progeny of parents that were maintained at the high nutrient level showed no response to a nutrient pulse. In P. rugelii the effect of maternal nutrient pulses on the total and leaf biomass of the progeny was related to both maternal background nutrient levels and nutrient pulse treatments to the progeny. For both species, the timing of maternal nutrient pulse had no significant effect on the characters studied. In competition, for P. major, the progeny from parents given a nutrient pulse during fruit maturation consistently produced a greater amount of spike biomass relative to their neighbouring plants from parents that did not receive nutrient pulses, but for the progeny from parents given a nutrient pulse during the vegetative and flowering stages, their competitive ability relative to their neighbors depended on both the timing of maternal pulse and the progeny pulse treatment. For P. rugelii, the performance (leaf biomass) of the 2 neighboring progeny depended on maternal background nutrient levels. -from Authors",48,Journal,ar,Article,100,3,3,20308,undefined,0,FALSE,145,NA,NA
true,https://api.elsevier.com/content/abstract/scopus_id/0026003521,SCOPUS_ID:0026003521,2-s2.0-0026003521,Diet choice in the herring gull: constraints imposed by reproductive and ecological factors,Pierotti R.,Ecology,00129658,72,1,319-328,1991-01-01,1991,10.2307/1938925,"During pre-laying and incubation periods in Newfoundland, 75-80% of Larus argentatus specialized on either intertidal organisms, human refuse, or other seabirds, while only 20-25% had generalized diets. Foraging tactics associated with each of the three diets were related to time budgets and ecological constraints, ie levels of predation or intraspecific competition in specific habitats. Intertidal specialists laid eggs earlier, produced larger and heavier clutches, and had higher rates of hatching than generalists and other specialists. Despite differences in performance related to laying and hatching, there were no significant differences in fledging rates, either between years or among diets. These results suggest that 1) choice of nesting habitat may constrain diet choice, 2) diet choice may have major effects on breeding performance, and 3) energy may not be the proper currency for examining diet choice in carnivores subject to a variety of constraints. -from Authors",168,Journal,ar,Article,100,2,2,20308,undefined,0,FALSE,146,NA,NA
true,https://api.elsevier.com/content/abstract/scopus_id/0026003511,SCOPUS_ID:0026003511,2-s2.0-0026003511,"Interactions among the effects of herbivory, competition, and resource limitation on chaparral herbs",Swank S.,Ecology,00129658,72,1,104-115,1991-01-01,1991,10.2307/1938906,"Assessed the individual and combined effects of trenching to reduce root competition, caging to reduce herbivory, nutrient addition and water addition on herb germination, survival and growth in chaparral dominated by chamise Adenostoma fasciculatum. Strong interactions occurred among treatments. Herb establishment was limited by herbivory and root competition with shrubs for limited nutrients and/or water. Survival was enhanced by trenching, caging and water. Growth was enhanced by nutrient addition, but the magnitude of this nutrient effect became appreciable only within trenched, caged plots. -from Authors",44,Journal,ar,Article,100,2,2,20308,undefined,0,FALSE,147,NA,NA
true,https://api.elsevier.com/content/abstract/scopus_id/0026002274,SCOPUS_ID:0026002274,2-s2.0-0026002274,Nitrogen sharing among ramets increases clonal growth in Fragaria chiloensis,Alpert P.,Ecology,00129658,72,1,69-80,1991-01-01,1991,10.2307/1938903,"Experiments suggested that: 1) transport of N among ramets can increase growth in beach strawberry, but to a limited extent; 2) transport of N through a stolon may be either acropetal or basipetal but tends to promote the growth of younger ramets; 3) higher soil N availability alters plant archictecture by increasing allocation to leaves and to new stolons and ramets; and 4) physiological integration among ramets modifies clonal architecture because N acquired by roots promotes growth of both a rooted ramet and its new ramets, whereas N acquired from another ramet promotes the growth of new ramets almost exclusively. -from Author",148,Journal,ar,Article,100,1,1,20308,undefined,0,FALSE,148,NA,NA
true,https://api.elsevier.com/content/abstract/scopus_id/0026002272,SCOPUS_ID:0026002272,2-s2.0-0026002272,"Subalpine tree growth, climate, and increasing CO<inf>2</inf>: an assessment of recent growth trends",Graumlich L.,Ecology,00129658,72,1,1-11,1991-01-01,1991,10.2307/1938895,"Recent trends of increasing ring widths in subalpine conifers may be due to the fertilizing effects of increased atmospheric CO2. Five tree-ring series from foxtail pine Pinus balfouriana, lodgepole pine P. murrayana and western juniper Juniperus occidentalis collected in the Sierra Nevada, California, were analyzed to determine if the temporal and spatial patterns of recent growth were consistent with the hypothesized CO2-induced growth enhancement. For 3 of the 5 sites, 20th-century growth variation can be adequately modeled as a function of climatic variation. For the remaining 2 sites, trends in the residuals from the growth/climate models indicate systematic underestimation of growth during the past decade that could be interpreted as either CO2 fertilization or as a response to extreme climatic events during the mid 1970s. At all sites, current growth levels have been equalled or exceeded during some preindustrial periods. Taken together, results do not indicate that CO2-induced growth enhancement is occurring among subalpine conifers in the Sierra Nevada. Results offer no support for the hypothesized CO2 fertilization effect but do provide insights into the response of subalpine conifers to climatic variation. Although maximum growth rates occur under conditions of high winter precipitation and warm summers for all 3 species, substantial species-to-species variation occurs in the response to these variables. -from Author",170,Journal,ar,Article,100,1,1,20308,undefined,0,FALSE,149,NA,NA
true,https://api.elsevier.com/content/abstract/scopus_id/0026001820,SCOPUS_ID:0026001820,2-s2.0-0026001820,Fish community structure in dry-season stream pools,Capone T.,Ecology,00129658,72,3,983-992,1991-01-01,1991,10.2307/1940598,"Fish assemblage patterns were examined in 40 dry-season pools in a hydrologically variable river drainage in NE Texas. Cluster analyses of the relative abundance of fish species detected 3 fish assemblages dominated by: mosquitofish Gambusia affinis, black bullhead Ictalurus melas, and green sunfish Lepomis cyanellus-golden shiner Notemigonus crysoleucas-mosquitofish. Factor analysis reduced environmental variables to six factors representing pool depth, pool persistence, channel size, canopy cover, pool substrate, and pH, by which assemblages could be discriminated. The discriminating variables varied along a gradient, and fish assemblages varied similarly. -from Authors",120,Journal,ar,Article,100,2,2,20308,undefined,0,FALSE,150,NA,NA
