@_fa,prism:url,dc:identifier,eid,dc:title,dc:creator,prism:publicationName,prism:issn,prism:volume,prism:issueIdentifier,prism:pageRange,prism:coverDate,prism:coverDisplayDate,prism:doi,dc:description,citedby-count,prism:aggregationType,subtype,subtypeDescription,author-count.@limit,author-count.@total,author-count.$,source-id,fund-no,openaccess,openaccessFlag,entry_number,freetoread.value.$,freetoreadLabel.value.$
true,https://api.elsevier.com/content/abstract/scopus_id/0020450056,SCOPUS_ID:0020450056,2-s2.0-0020450056,Robust analysis of aggregation error.,Gardner R.,Ecology,00129658,63,6,1771-1779,1982-01-01,1982,10.2307/1940119,"Theoretical studies indicating the dangers of dealing with the dynamics of aggregated systems have focused on mathematical models so results have been of marginal interest to the field ecologist. Practical criteria are here developed which can be applied when the underlying model is unknown or of little immediate interest. The approach is to examine 40 alternative models and to state conclusions that are valid, no matter what the underlying dynamics of the system. No error is introduced when 2 components with identical turnover times are aggregated. For certain problems, the components can be aggregated with <10% error, even if the turnover rates differ by a factor of 3. Criteria can be stated even more practically in terms of the ratio between the standing crops of the components. When measurement errors are considered explicitly, the criteria depend upon the accuracy with which aggregated and disaggregated measures can be estimated.-from Authors",82,Journal,ar,Article,100,3,3,20308,undefined,0,FALSE,39,NA,NA
true,https://api.elsevier.com/content/abstract/scopus_id/0020450042,SCOPUS_ID:0020450042,2-s2.0-0020450042,"The responses of plankton communities in experimental ponds to atrazine, the most heavily used pesticide in the United States.",Denoyelles F.,Ecology,00129658,63,5,1285-1293,1982-01-01,1982,10.2307/1938856,"Ponds received single additions of atrazine at 20 and 500 mu g/L, and were compared to control ponds for 136 d. Atrazine is an inhibitor of photosynthesis, and both concentrations depressed phytoplankton growth in the ponds within a few days. This was followed by successional changes leading to establishment of species of phytoplankton more resistant to inhibition by atrazine. Laboratory studies verified effects on other species at concentrations of atrazine as low as 1-5 mu g/L. At the atrazine concentration of 500 mu g/L, there was a delayed appearance but eventually a greater biomass and persistence of resistant species. The grazing zooplankton influenced these differences and were in turn affected by them. Natural interactions such as competition and predation among the species of the communities greatly affected their responses to the chemical. The importance of atrazine as an environmental pollutant is suggested by these responses to concentrations of 1-5 mu g/L, which are common downstream in many agricultural watersheds, 20 mu g/L, which is the high level found in these waters, and 500 mu g/L, which is the high level found in waters directly adjacent to treated fields.-from Authors",225,Journal,ar,Article,100,3,3,20308,undefined,0,FALSE,40,all,All Open Access
true,https://api.elsevier.com/content/abstract/scopus_id/0020447958,SCOPUS_ID:0020447958,2-s2.0-0020447958,Nitrogen and lignin control of hardwood leaf litter decomposition dynamics.,Melillo J.,Ecology,00129658,63,3,621-626,1982-01-01,1982,10.2307/1936780,"As studied at the Hubbard Brook Experimental Forest, rate constants (k) for annual leaf mass loss ranged from -0.08 to - 0.47. The rate constants had a negative linear correlation with the ratio of initial lignin concentration to initial N concentration. Decomposition dynamics of the litter materials were described by inverse linear relationships between the percentage of original mass remaining and the N concentration in the residual material. Initial lignin concentration was highly correlated with the slope of the inverse linear relationship for each of the litter types. -from Authors",1964,Journal,ar,Article,100,3,3,20308,undefined,0,FALSE,41,NA,NA
true,https://api.elsevier.com/content/abstract/scopus_id/0020447561,SCOPUS_ID:0020447561,2-s2.0-0020447561,Mycorrhizal role in net primary production and nutrient cycling in Abies amabilis ecosystems in western Washington.,Vogt K.A.,Ecology,00129658,63,2,370-380,1982-01-01,1982,10.2307/1938955,"The potential contribution of mycorrhizal fungi to total ecosystem biomass and turnover and nutrient distribution and turnover was examined in a 23-yr-old and a 180-yr-old Pacific silver fir stand. While mycorrhizal fungi contributed roughly 1% to total ecosystem biomass in both stands, the percentage of net primary production (NPP) in the mycorrhizal fungal component was 14% in the younger stand and 15% in the mature stand. Mycorrhizal fungi plus conifer fine roots contributed 45% of NPP in the young stand and 75% in the mature stand. Sclerotia production (2700 kg ha-1 yr-1) contributed the largest proportion of total mycorrhizal fungal production in both stands followed by mycorrhizal sheath production (350 kg ha-1 yr-1 and 430 kg ha-1 yr-1 in the young and mature stands, respectively). Potentially, 27 kg ha-1 yr-1 of N is cycled through sporocarps in the young stand and 41 kg ha-1 yr-1 in the mature stand. Annually, fine roots (including mycorrhizae) cycle at least 60, 10, 20, 30 and 10 kg ha-1 yr-1 of N, P, K, Ca and Mg, respectively, are cycled through fine roots in the mature stand. -Authors",179,Journal,ar,Article,100,4,4,20308,undefined,0,FALSE,42,NA,NA
true,https://api.elsevier.com/content/abstract/scopus_id/0020438381,SCOPUS_ID:0020438381,2-s2.0-0020438381,How aphids choose leaves: the roles of phenolics in host selection by a galling aphid.,Zucker W.V.,Ecology,00129658,63,4,972-981,1982-01-01,1982,10.2307/1937237,"Pemphigus betae does not induce galls at random on leaves of its host plant, Populus angustifolia. Probability of stem mother success in forming a gall, body mass of stem mother and progeny, number of progeny, development rate of progeny to maturity, and numbers of embryos in mature progeny are all correlated positively with leaf size at maturity. Leaf size at maturity is predictable from leaf position in the shoot at bud burst. The major secondary compounds of the host plant are known phenol glycosides. A strong inverse correlation has been established between the concentration of total phenols and suitability of a tree, leaf, or leaf section for galling at the time of bud burst, when the colonizing stem mothers are at the peak at their activity. Expanding leaves within the same shoot have different phenol concentrations; the potentially largest leaves have lower phenol levels. Leaves containing one or more incipient galls have lower phenol levels than leaves without galls. Phenol concentrations in leaves are not uniform; the existence of phenol gradients in leaves is demonstrated.-from Author",89,Journal,ar,Article,100,1,1,20308,undefined,0,FALSE,43,NA,NA
true,https://api.elsevier.com/content/abstract/scopus_id/0020435925,SCOPUS_ID:0020435925,2-s2.0-0020435925,Statistical inference for MacArthur-Levins niche overlap.,Maurer B.,Ecology,00129658,63,6,1712-1719,1982-01-01,1982,10.2307/1940113,"Methods of statistical inference are presented for an overlap measure suggested first by MacArthur and Levins (1967). A general form is derived for normal distributions and for exponential densities. Confidence intervals may be robust for normal densities with one variance no more than 2 times larger than the other. Maximum-likelihood estimators of overlap when densities are not normal may be obtained, but confidence intervals are not currently available. The methods for normal densities may be extended for multivariate normal densities, using discriminant analysis and principal-components analysis.-from Author",24,Journal,ar,Article,100,1,1,20308,undefined,0,FALSE,44,NA,NA
true,https://api.elsevier.com/content/abstract/scopus_id/0020431423,SCOPUS_ID:0020431423,2-s2.0-0020431423,"Regulation of fruit and seed production in an annual legume, Cassia fasciculata.",Lee T.D.,Ecology,00129658,63,5,1363-1373,1982-01-01,1982,10.2307/1938864,"Cassia fasciculata (Leguminosae) is a hermaphroditic herb of prairies, open woods and waste places in the eastern USA. Removal of competitors and addition of water to plants showed that resource levels prior to fruit filling influence plant size which, in turn, is positively related to the number of fruit matured. Manual addition of pollen to flowers in the field did not increase number of fruit matured, suggesting that fruit production was not pollinator limited. Removal of rapidly growing fruit resulted in growth and maturation of fruit that normally would not have matured; resources thus limited fruit production. In 4 populations studied, 24-70% of initiated fruit matured, 12-40% aborted or died, 3-31% were still developing at the time of plant death, and 6-12% were lost to predators. In fruit that matured, between 23% and 73% of initiated seeds reached maturity, 22-43% were aborted, and 0-49% were lost to seed predators. Seed production was thus limited by resources and seed predators. It is hypothesized that overinitiation of fruit is here an adaptive response to: 1) variation in fruit quality coupled with the ability of the plant to selectively mature high-quality fruit, or 2) unpredictability of resource levels and survival during fruit filling. The data support these hypotheses. -from Authors",131,Journal,ar,Article,100,2,2,20308,undefined,0,FALSE,45,NA,NA
true,https://api.elsevier.com/content/abstract/scopus_id/0020431385,SCOPUS_ID:0020431385,2-s2.0-0020431385,Influence of stream temperature and seston on the growth and production of over-wintering larval black flies ( Diptera: Simuliidae).,Merritt R.,Ecology,00129658,63,5,1322-1331,1982-01-01,1982,10.2307/1938860,"Prosimulium mixtum, P. fuscum and Stegopterna mutata were studied in a southcentral Michigan first-order stream. Production estimates (dry mass m-2 of artificial substrate, with 95% confidence interval) for 2 cohorts of P. mixtum/fuscum were 696 + or - 95 and 1939 + or - 339 mg m-2 yr-1. On artificial substrates, mean standing stock biomasses for the cohorts were 110 and 507 mg/m2, and the cohort P/B ratios were 6.32 and 3.83, respectively. Seston concentrations (AFDM) during winter and early spring were highly dependent on stream discharge and ranged from 0.81-8.33 mg/L, with a mean of 3.73 mg/L. Particles <45 mu m comprised >92% of the total organic seston, and larvae ingested particles in the 0.45-45 mu m size class almost exclusively, with 85% of the particles in larval guts <10 mu m in diameter. Over 81% of P. mixtum/fuscum annual production occurred during the last 2 larval stadia and was attributed to increases in stream temperature and seston organic content during late winter and early spring.- from Authors",43,Journal,ar,Article,100,3,3,20308,undefined,0,FALSE,46,NA,NA
true,https://api.elsevier.com/content/abstract/scopus_id/0020431197,SCOPUS_ID:0020431197,2-s2.0-0020431197,Competition among Cladocera.,Smith D.,Ecology,00129658,63,4,1004-1015,1982-01-01,1982,10.2307/1937240,"For Daphnia pulex, Moina affinis and Ceriodaphnia sp. in a small pond, competitive effects were nonlinear functions of cladoceran density, and both intra- and interspecific competition were important determinants of the dynamics of the pond populations. The degree of competition was probably dependent on resource levels and the age of competitors. The major pond predator, Chaoborus, was able to control prey populations only when the densities of prey and phytoplankton were low.-from Authors",49,Journal,ar,Article,100,2,2,20308,undefined,0,FALSE,47,NA,NA
true,https://api.elsevier.com/content/abstract/scopus_id/0020428855,SCOPUS_ID:0020428855,2-s2.0-0020428855,Structure and species composition of desert heteromyid rodent species assemblages: effects of a simple habitat manipulation.,Thompson S.D.,Ecology,00129658,63,5,1313-1321,1982-01-01,1982,10.2307/1938859,"A reduction in the distance between desert shrubs can produce a marked change in the structure and composition of a desert rodent species assemblage. After placement of small cardboard shelters in open areas between shrubs the dominant heteromyid rodent, Dipodomys merriami, declined in abundance and an intermediate-size species, Perognathus fallax, became established. Reduction in interplant distance also produced successful invasion by 2 species of generalist cricetine rodents belonging to the genus Peromyscus. Reduction of distances between safe foraging sites, which may decrease the risk of predation, increases the number of strategies of spatial utilization available to desert rodents.-from Author",52,Journal,ar,Article,100,1,1,20308,undefined,0,FALSE,48,NA,NA
true,https://api.elsevier.com/content/abstract/scopus_id/0020428804,SCOPUS_ID:0020428804,2-s2.0-0020428804,A model for fruiting display: seed dispersal by birds for mulberry trees.,Stapanian M.,Ecology,00129658,63,5,1432-1443,1982-01-01,1982,10.2307/1938870,"The effectiveness of fruiting displays of mulberry trees (Morus) for seed dispersal by birds was studied in eastern Kansas. Alternative models were developed in which the number of fruits eaten by birds and the number of seeds dispersed from a tree were hypothesized to be functions of the number of fruits on a tree, reward energy in an individual fruit, and total reward energy on the tree. The models predict an increase in seeds dispersed with an increase in fruiting display, with each of the models predicting a different behavioral response to increases in fruiting display. When empirical data were analyzed on a weekly basis, the null hypothesis was rejected and total reward energy on the tree explained the number of fruits eaten by birds and the number of seeds dispersed better than did number of fruits on a tree or reward energy per fruit. The latter 2 variables are components of the first, more significant, variable. In successive weeks smaller displays resulted in the same number of seeds being dispersed. Decreasing availability of insect food is probably at least partially responsible for this increase in fruiting display efficiency. Mulberry trees are monoecious with highly variable sex ratios; results predict selection for reproduction at an early age in Morus and equal fitness for all sex ratios.-from Author",19,Journal,ar,Article,100,1,1,20308,undefined,0,FALSE,49,NA,NA
true,https://api.elsevier.com/content/abstract/scopus_id/0020428666,SCOPUS_ID:0020428666,2-s2.0-0020428666,"Drought-induced changes in avian community structure along a montane sere ( Utah, Idaho).",Smith K.G.,Ecology,00129658,63,4,952-961,1982-01-01,1982,10.2307/1937235,"Avian community structure was studied along a meadow-aspen-fir-spruce subalpine sere in northern Utah and southern Idaho. During 1977 one of the worst droughts of this century occurred in the western United States. Number of breeding species declined most markedly during drought in aspen. Breeding communities on the forested plots during drought were least similar to predrought communities; pre- and postdrought communities were consistently most similar. Densities of singing males declined more markedly on all plots during drought than did number of species, and remained below predrought levels in 1978. Changes were also noted in avian trophic structure during drought: insectivores generally declined in number, nectivorous hummingbirds completely disappeared, and the number of granivorous cardueline finch species increased. These changes can be related to changes in food resources. During drought, insect species composition and densities changed, flower phenology was 5 wk early, and one of the best coniferous cone crops in 30 yr occurred in northern Utah. Direct effects of lack of water were observed, and many bird species probably experienced water stress. Although difficult to document, indirect effects of drought on food resources are suggested for insectivores, nectivores, and possibly carnivores. Drought can represent an 'ecological crunch' to, and affect the structure, of temperate avian communities. Avian communities in deciduous vegetation may be more greatly affected by drought than those in coniferous vegetation. -from Author",32,Journal,ar,Article,100,1,1,20308,undefined,0,FALSE,50,NA,NA
true,https://api.elsevier.com/content/abstract/scopus_id/0020428433,SCOPUS_ID:0020428433,2-s2.0-0020428433,The adaptive significance of calanoid copepod pigmentation: a comparative and experimental analysis.,Byron E.,Ecology,00129658,63,6,1871-1886,1982-01-01,1982,10.2307/1940127,"Pigments are adaptive to calanoid copepods because they facilitate a metabolic increase and provide photoprotection when the animals are illuminated. Pigments are rarely found in the zooplankton, however, because zooplankton are continuously exposed to predation by visually selective predators. In cold environments with short growing seasons, as at high elevations, the advantages of pigmentation at least partially outweigh the costs in terms of selective predation, thus shifting the balance in favor of pigmentation.-from Author",72,Journal,ar,Article,100,1,1,20308,undefined,0,FALSE,51,NA,NA
true,https://api.elsevier.com/content/abstract/scopus_id/0020428432,SCOPUS_ID:0020428432,2-s2.0-0020428432,"Body size, energy reserves, and competitive ability in three species of Cladocera.",Goulden C.,Ecology,00129658,63,6,1780-1789,1982-01-01,1982,10.2307/1940120,"Demographic traits of all species were affected by low levels, but the smaller species suffered higher death rates. Daphnia magna matured and reproduced well in the lowest food level studied; growth rate of the population was 0.143 d-1. Survivorship for D. galeata cohorts was poor at the lowest food level but many animals did mature and reproduce; population growth rate was 0.082 d-1. Few Bosmina longirostris individuals matured and reproduced and all were dead by the 3rd adult instar; the population growth rate was -0.136 d-1. In competition experiments, D. magna was the numerical dominant in high-food cultures with D. galeata, and D. galeata in cultures with Bosmina. However, Bosmina coexisted with D. galeata, and in medium-food competition experiments became the numerical dominant after the first oscillation cycle of the daphnid population. Bosmina possibly coexists with Daphnia because Bosmina adults can survive the oscillation cycles of the Daphnia populations, and when food is abundant, after the decline of the Daphnia, the increase in resources enables Bosmina to increase its population size temporarily.-from Authors",124,Journal,ar,Article,100,3,3,20308,undefined,0,FALSE,52,NA,NA
true,https://api.elsevier.com/content/abstract/scopus_id/0020428165,SCOPUS_ID:0020428165,2-s2.0-0020428165,The statistical analysis of population growth rates calculated from schedules of survivorship and fecundity.,Lenski R.,Ecology,00129658,63,3,655-662,1982-01-01,1982,10.2307/1936785,"Defines an ideal population such that it is completely described by the probabilities governing age-specific survival and reproduction, and defines the lifetime contribution of an individual to population growth in a manner analogous to Fisher's (1930) reproductive value. The mean of these individual contributions is equal to the finite rate of increase for the population. The properties of sample cohorts drawn from an ideal population are then studied. Estimates of population growth rates based on sample cohorts are shown to be biased. The magnitude of the bias decreases as the number of individuals used to construct the sample schedules of survivorship and fecundity is increased. This relationship conflicts with the statistical desirability of maximizing the number of estimates of the population growth rate. Bias can be reduced by pooling individual schedules to calculate a single estimate of the growth rate of the population within which individual contributions are defined. When cohort size is small, a modified jackknifing procedure is recommended for further reducing bias. To demonstrate the application of these methods, a 95% confidence interval for a rate of increase based on a sample cohort of aphids is obtained. -from Authors",67,Journal,ar,Article,100,2,2,20308,undefined,0,FALSE,53,NA,NA
true,https://api.elsevier.com/content/abstract/scopus_id/0020428074,SCOPUS_ID:0020428074,2-s2.0-0020428074,Age-sex differences in the diets of wintering Rocky Mountain bighorn sheep.,Shank C.,Ecology,00129658,63,3,627-633,1982-01-01,1982,10.2307/1936781,"In Banff National Park, rams remained primarily on the north end of the study area while ewes, lambs and yearlings occupied primarily the south end. The southern part of the range was characterized by relatively more Bromus, Carex, Koeleria, Poa, Oxytropis and Juniperus and less Festuca, Fragaria, Hedysarum, Arctostaphylos and Rosa than the northern portion. The southern part was typified by less soil, more xeric conditions, lower plant biomass and apparently overgrazed conditions. Ewes, lambs and yearlings had diets more similar to each other than to that of adult rams. Class effects in multivariate statistical analysis were significant; the major univariate differences were that non-rams ate more Carex and less Festuca than did rams. This class effect was wholly attributable to the fact that rams and non-rams segregate onto separate portions of the range which contain different availabilities of forage plants. It is unlikely that the spatial separation arose from diet preferences but rather from some unrelated factor. -from Author",55,Journal,ar,Article,100,1,1,20308,undefined,0,FALSE,54,NA,NA
true,https://api.elsevier.com/content/abstract/scopus_id/0020427628,SCOPUS_ID:0020427628,2-s2.0-0020427628,An experimental analysis of social spacing in Tamias striatus.,Mares M.,Ecology,00129658,63,2,267-273,1982-01-01,1982,10.2307/1938940,"When food levels were increased within an area, mean home range size decreased and population density increased through recruitment from neighboring habitats. When population density was held constant and food supplies were experimentally increased, there was a significant reduction in mean home range sizes when compared to control. When food supplies were undisturbed, but population density was greatly reduced, there was no change in the mean home range size over that determined at higher densities. In eastern chipmunks, food supply is thus a primary determinant of mean home range size, whereas population density (at least at the levels examined) has no effect on movement patterns. -from Authors",62,Journal,ar,Article,100,1,1,20308,undefined,0,FALSE,55,NA,NA
true,https://api.elsevier.com/content/abstract/scopus_id/0020427532,SCOPUS_ID:0020427532,2-s2.0-0020427532,"The effect of soil fauna on litter mass loss and nutrient loss dynamics in arctic tundra at Barrow, Alaska.",Douce G.,Ecology,00129658,63,2,523-537,1982-01-01,1982,10.2307/1938968,Generally greater dry mass loss and less nutrient loss occurred from the litter in the control than in a corresponding defaunated plot. Nutrient loss was greater in plots subjected to natural periodic flooding than in plots never flooded. Loge regression lines of percent mass loss vs. days are reported for each plot on a calendar year and a nonfrozen season basis. -from Authors,17,Journal,ar,Article,100,2,2,20308,undefined,0,FALSE,56,NA,NA
true,https://api.elsevier.com/content/abstract/scopus_id/0020427513,SCOPUS_ID:0020427513,2-s2.0-0020427513,Experimental evaluation of predator-prey relationships in a patchy environment: consequences for habitat use patterns in minnows.,Fraser D.,Ecology,00129658,63,2,307-313,1982-01-01,1982,10.2307/1938947,"Used Semotilus atromaculatus and Rhinichthys atratulus. Predators were adult S. atromaculatus; juveniles of both species were used as prey. Prey of both species actively avoid locations that contain predators, but structural complexity and time of day each have a mediating effect on response of prey fish to presence of predators. This study shows how prey respond behaviorally to the presence of predators in habitat patches. They are most likely to enter those patches during daylight or when structure is present. -from Authors",102,Journal,ar,Article,100,2,2,20308,undefined,0,FALSE,57,NA,NA
