@_fa,prism:url,dc:identifier,eid,dc:title,dc:creator,prism:publicationName,prism:issn,prism:volume,prism:issueIdentifier,prism:pageRange,prism:coverDate,prism:coverDisplayDate,prism:doi,dc:description,citedby-count,prism:aggregationType,subtype,subtypeDescription,author-count.@limit,author-count.@total,author-count.$,authkeywords,source-id,fund-no,openaccess,openaccessFlag,entry_number,freetoread.value.$,freetoreadLabel.value.$,fund-sponsor
true,https://api.elsevier.com/content/abstract/scopus_id/0037550279,SCOPUS_ID:0037550279,2-s2.0-0037550279,Variable impact of diverse insect herbivores on dimorphic Datura wrightii,Hare J.,Ecology,00129658,83,10,2711-2720,2002-10-01,1 October 2002,10.1890/0012-9658(2002)083[2711:VIODIH]2.0.CO;2,"Traits that confer plant resistance to some herbivore species but increase plant susceptibility to other herbivore species are said to carry an ""ecological cost"" of herbivore resistance. The native perennial, Datura wrightii, is dimorphic for leaf trichome type, and the production of glandular trichomes carries a potential ecological cost over the production of nonglandular trichomes. Glandular trichomes provide resistance to at least six herbivore species, but they also confer susceptibility to Tupiocoris notatus, an abundant mirid bug with special adaptations to glandular trichomes. We estimated herbivore-specific damage to plants of each trichome type and measured plant seed production, a component of fitness, in a common garden over three years. Plant seed production increased with the size and persistence of leaf canopies and occasionally declined with increasing damage caused by some of the defoliating insects. Plant seed production was never reduced by T. notatus damage, however. Even though the ecological cost of glandular trichome production was not apparent in D. wrightii, the trait still was not beneficial. The fitness of plants with glandular trichomes never exceeded that of plants with nonglandular trichomes despite variation in both the composition of the herbivore community and the total level of damage inflicted by herbivores over three years of study. The persistence of the allele coding for glandular trichomes cannot be explained solely on the basis of the herbivore resistance that those trichomes provide.",57,Journal,ar,Article,100,2,2,Datura wrightii | Ecological cost | Herbivore community | Plant defense | Plant fitness | Trichomes | Tupiocoris notatus | Water availability,20308,undefined,0,FALSE,75,all,All Open Access,NA
true,https://api.elsevier.com/content/abstract/scopus_id/0013298414,SCOPUS_ID:0013298414,2-s2.0-0013298414,Competition for shelter space causes density-dependent predation mortality in damselfishes,Holbrook S.,Ecology,00129658,83,10,2855-2868,2002-10-01,1 October 2002,10.1890/0012-9658(2002)083[2855:CFSSCD]2.0.CO;2,"The long-standing interest in density dependence in demographic rates of organisms stems from its influence in bounding population fluctuations and in shaping spatial patterns of abundance. Despite growing evidence that early mortality of marine reef fishes can be density dependent and can involve predation, the underlying biological mechanisms have not as yet been fully explored in any system. Here we examine the causes of density-dependent juvenile mortality for two tropical damselfishes, Dascyllus flavicaudus and D. trimaculatus. These species shelter in branching corals or anemones, and they feed on plankton above their microhabitats during the day. Field experiments confirmed that density-dependent juvenile mortality of both Dascyllus species arose from predation and that most of the density-dependent loss could be attributed to small-bodied, resident piscivores (e.g., sandperch, squirrelfish) rather than larger, transient species (e.g., jacks). Over the diel cycle, mortality was strongly density dependent during the dark when damselfish were sheltering but not during daylight when fish were actively foraging. Infrared video recordings revealed the species of predators responsible for most losses and indicated that most predatory events occurred from late twilight to early night, when damselfishes were in shelters and not feeding. Individuals were most at risk when located near or just outside the perimeter of a shelter. The proportion of a cohort in the riskiest areas of a microhabitat increased with density. The cause of the increased fraction of individuals at risk with increasing density was intraspecific interactions among sheltering fish jostling for space in the safest regions; this resulted in the displacement of less aggressive individuals to riskier locations. Thus, density-dependent mortality in both damselfishes arose from interference competition for refuge space from crepuscular and nocturnal predators.",302,Journal,ar,Article,100,2,2,Competition | Coral reefs | Damselfish | Dascyllus | Density dependence | Interference | Population dynamics | Predation | Refuge | Regulation,20308,undefined,0,FALSE,76,NA,NA,NA
true,https://api.elsevier.com/content/abstract/scopus_id/0012810375,SCOPUS_ID:0012810375,2-s2.0-0012810375,How plants benefit from providing food to predators even when it is also edible to herbivores,Van Rijn P.,Ecology,00129658,83,10,2664-2679,2002-10-01,1 October 2002,10.1890/0012-9658(2002)083[2664:HPBFPF]2.0.CO;2,"It is well established that plants provide alternative foods to predators of herbivorous arthropods. This provision may facilitate protection against herbivory. However, plants often cannot prevent other organisms from utilizing these foods as well. There are many examples of herbivorous arthropods that can feed on plant-provided foods such as extrafloral nectar and pollen. The question therefore arises whether individual plants still gain protection when not only the predators, but also the herbivores, can feed on these foods. We investigated this question using a mathematical model and experiments that assessed the impact of supplementary pollen on the dynamics of predatory mites (Iphiseius degenerans (Berlese)) and herbivorous thrips (Frankliniella occidentalis (Pergande)), two arthropods capable of using pollen for reproduction. Replicated greenhouse experiments showed that addition of pollen every two weeks to one young mature leaf of a male-sterile cucumber plant increased predator population growth and greatly reduced herbivore numbers. A stage-structured predator-prey-pollen model with experimentally established parameters gave reasonably accurate predictions of population trends observed in the greenhouse experiments with and without pollen. Model analysis yielded three important results. First, herbivore (prey) equilibria always settled to lower values in the presence of pollen. Second, mean herbivore numbers during the transient phase following predator release were not always lower under pollen supply, depending on the initial numbers of predators and prey. Third, limiting the plant area covered with pollen led to a decrease in mean herbivore numbers, provided that the predators aggregated in (and thereby ""monopolized"") pollen patches. The latter result may explain why plants provide alternative foods at specific sites.",191,Journal,ar,Article,100,3,3,Apparent competition | Frankliniella occidentalis | Indirect plant defense | Intraguild predation | Iphiseius degenerans | Omnivory | Plant-predator mutualism | Pollen | Predator-prey interaction | Spatial distribution | Supplementary food | Tri-trophic interactions.,20308,undefined,0,FALSE,77,NA,NA,NA
true,https://api.elsevier.com/content/abstract/scopus_id/0012789171,SCOPUS_ID:0012789171,2-s2.0-0012789171,Similar relationships between pelagic primary and bacterial production in clearwater and humic lakes,Karlsson J.,Ecology,00129658,83,10,2902-2910,2002-10-01,1 October 2002,10.1890/0012-9658(2002)083[2902:SRBPPA]2.0.CO;2,"We examined the relationship between planktonic primary production (PP). and bacterial production (BP) in 16 subarctic lakes along an altitude gradient extending from colored coniferous forest lakes to clearwater high alpine lakes. We tested the hypothesis that there was a shift from low to high PP:BP ratios along this gradient. The clearwater alpine lakes had low PP:BP ratios, generally well below 1.0, while the highest ratios were found in the forest lakes. In contradiction to our hypothesis, the pelagic systems of the clearwater lakes were thus dominated by bacterial energy mobilization from external carbon sources. In this respect the alpine lakes were similar to highly humic lakes. We suggest that the relationship between C, N, and P plays a critical role in determining the PP:BP ratio, and that the N:P ratio in particular can be critical for development of PP or BP dominance in the pelagic systems of unproductive lakes.",85,Journal,ar,Article,100,3,3,Bacterioplankton production | Dissolved organic carbon (DOC) | Lakes | Nutrients | Phytoplankton production | Subarctic Sweden,20308,undefined,0,FALSE,78,NA,NA,NA
true,https://api.elsevier.com/content/abstract/scopus_id/0012775617,SCOPUS_ID:0012775617,2-s2.0-0012775617,Measuring individual-level resource specialization,Bolnick D.I.,Ecology,00129658,83,10,2936-2941,2002-10-01,1 October 2002,10.1890/0012-9658(2002)083[2936:MILRS]2.0.CO;2,"Many apparently generalized species are in fact composed of individual specialists that use a small subset of the population's resource distribution. Niche variation is usually established by testing the null hypothesis that individuals draw from a common resource distribution. This approach encourages a publication bias in which negative results are rarely reported, and obscures variation in the degree of individual specialization, limiting our ability to carry out comparative studies of the causes or consequences of niche variation. To facilitate studies of the degree of individual specialization, this paper outlines four quantitative indices of intrapopulation variation in resource use. Traditionally, such variation has been measured by partitioning the population's total niche width into within- and between-individual, sex, or phenotype components. We suggest two alternative measures that quantify the mean resource overlap between an individual and its population, and we discuss the advantages and disadvantages of all four measures. The utility of all indices depends on the quality of the empirical data. If resources are measured in a coarse-grained manner, individuals may falsely appear generalized. Alternatively, specialization may be overestimated by cross-sectional sampling schemes where diet variation can reflect a patchy environment. Isotope ratios, parasites, or diet-morphology correlations can complement cross-sectional data to establish temporal consistency of individual specialization.",437,Journal,ar,Article,100,5,5,Adaptive variation | Diet analysis | Gut contents | Individual specialization | Niche variation | Proportional similarity | Resource partitioning,20308,undefined,0,FALSE,79,all,All Open Access,NA
true,https://api.elsevier.com/content/abstract/scopus_id/0012673759,SCOPUS_ID:0012673759,2-s2.0-0012673759,The influence of substrate on vegetation history and ecosystem development,Ewing H.A.,Ecology,00129658,83,10,2766-2781,2002-10-01,1 October 2002,10.1890/0012-9658(2002)083[2766:TIOSOV]2.0.CO;2,"Comparison of vegetation, soil, and climatic history at two sites differing in soil texture and thus soil water-holding capacity reveals long-term differences in terrestrial ecosystem development. Vegetation history reconstructed using pollen analysis and modern surface samples reveals that the site on till has hosted species with higher moisture requirements than those at the outwash site since the early Holocene. The outwash site had incomplete forest cover for much of the Holocene in contrast to the till site, which likely had a closed-canopy forest for most of its history. Comparison of vegetation and soil records reveals a correspondence between the timing of changes in vegetation and soil at both sites for most of the Holocene and provides evidence for greater weathering rates under coniferous than deciduous forest or savanna. Soil and vegetation changes are synchronous within, but not across, sites 13 000-3000 yr BP, suggesting that local interactions between soil and vegetation may have been important in determining the timing of ecosystem change. In contrast, there was synchronous change in soil and vegetation across sites ∼3000 yr BP, when hemlock became established at the till site and weathering intensified at both sites. This synchrony suggests a regional driver of ecosystem change, most likely the climatic change to higher moisture availability that occurred in the late Holocene. Thus, both climate and interactions between soil and vegetation have influenced the timing of ecosystem change, and the relative importance of their influence has varied over time.",26,Journal,ar,Article,100,1,1,Climatic change | Ecosystem development | Holocene | Michigan | Paleoecology | Soil development | Soil water-holding capacity | Vegetation history | Wisconsin,20308,undefined,0,FALSE,80,NA,NA,NA
true,https://api.elsevier.com/content/abstract/scopus_id/0003326551,SCOPUS_ID:0003326551,2-s2.0-0003326551,Some like it hot: Effects of forest clearing on nest temperatures of montane reptiles,Shine R.,Ecology,00129658,83,10,2808-2815,2002-10-01,1 October 2002,10.1890/0012-9658(2002)083[2808:SLIHEO]2.0.CO;2,"Global climate change may affect the upper elevational limits of distribution of montane organisms, especially if those limits are set directly by temperature. Oviparous (egg-laying) reptiles are constrained in this way because of their nesting requirements. In many areas, deforestation has already subjected these animals to small-scale ""climate change."" Clearing for power lines (hydrocuts) increases solar radiation to potential nest sites, and hence enables these animals to penetrate higher into montane areas than would otherwise be possible. Such small-scale anthropogenic ""warming"" may offer a useful model system to explore consequences of broader climate change on the distribution and biology of montane organisms. We quantified thermal effects of a hydrocut in montane eucalypt forest in the Brindabella Range of southeastern Australia. The reduced canopy cover, increased duration of sunlight exposure, and higher levels of incident radiation in cleared areas substantially modified thermal regimes in potential nest sites. Orientation and exposure were the most important determinants of nest temperature and predicted the distribution of natural nests. Such cleared corridors (for roads, power lines, ski runs, etc.) may not only extend the upper elevational limit for oviparous reptiles, but may also modify the genetic structure and demography of populations.",57,Journal,ar,Article,100,3,3,"Australia, southeastern | Bassiana duperreyi | Climate change, global | Forest clearing affects nest-site temperature | Geographic distribution | Montane organisms, elevational distribution limits | Nesting requirements of egg-laying reptiles | Oviparity",20308,undefined,0,FALSE,81,NA,NA,NA
true,https://api.elsevier.com/content/abstract/scopus_id/0038814760,SCOPUS_ID:0038814760,2-s2.0-0038814760,Combined effect of foliar and mycorrhizal endophytes on an insect herbivore,Vicari M.,Ecology,00129658,83,9,2452-2464,2002-09-01,1 September 2002,10.1890/0012-9658(2002)083[2452:CEOFAM]2.0.CO;2,"Many foliar endophytic fungi deter herbivores from feeding on their host plants, but a previous study has suggested that their deterrent effect may be reduced in the presence of arbuscular mycorrhizae. In our study, factorial experiments determined the effects of infection of perennial ryegrass, Lolium perenne, by the foliar endophyte Neotyphodium lolii [present (+E) or absent (-E)] and the mycorrhizal fungus Glomus mosseae [present (+M) or absent (-M)] on larvae of the noctuid moth Phlogophora meticulosa. When host plants received adequate phosphorus (P), mycorrhizae and the foliar endophyte decreased the survivorship of larvae between their second and fifth instar in an additive manner. Sixth-instar larvae feeding on -M-E plants attained greater mass than those feeding on plants with one or both symbionts. There was an M X E interaction with the total amount of grass consumed per larva. The foliar endophyte increased relative consumption rate and reduced efficiency of conversion of ingested food of larvae, while the mycorrhizal fungus had no effect on insect nutritional indices. Larvae preferred -E over +E leaf blades regardless of mycorrhizal infection status. They showed no preference with respect to plant mycorrhizal status. When foraging among mixed stands of intact plants, larvae inflicted more damage on -E than on +E plants. Mycorrhizae reduced feeding damage, but only in -E plants and to a lesser extent than the foliar endophyte. The relative difference between +E and -E plants, in terms of grazing damage, was decreased but not eliminated by mycorrhizae. When P was limiting to plant growth, mycorrhizae still decreased the survivorship of larvae between their second and fifth instar, independently of the foliar endophyte. They accelerated larval development slightly. The foliar endophyte increased the survivorship of fifth-instar larvae, independently of mycorrhizae. We concluded that both foliar endophytes and mycorrhizae affected larval growth and survivorship. Some effects were additive, while others were nonadditive and depended to some extent on host P nutrition. Our findings suggest that the beneficial effect of the foliar endophyte on the host plant, in terms of insect resistance, was reduced but not eliminated by mycorrhizae.",76,Journal,ar,Article,100,3,3,"Antixenosis | Arbusular mycorrhizae | Endomycorrhizae | Glomus mosseae | Herbivore defense hypothesis | Interaction, multitrophic | Lolium perenne | Mutualism | Mycophyllas and mycorrhizae, effect on herbivores | Neotyphodium lolii | Phlogophora meticulosa | Phytophagy",20308,undefined,0,FALSE,82,NA,NA,NA
true,https://api.elsevier.com/content/abstract/scopus_id/0038814758,SCOPUS_ID:0038814758,2-s2.0-0038814758,Does human scent bias seed removal studies?,Duncan R.,Ecology,00129658,83,9,2630-2636,2002-09-01,1 September 2002,10.1890/0012-9658(2002)083[2630:DHSBSR]2.0.CO;2,"Field estimates of seed removal rates are often determined by monitoring the survival of seeds placed at stations. Such experiments may unintentionally provide seed predators with unnatural olfactory cues. We compared the removal of seeds that had direct contact with human skin (scented) vs. seeds that had no contact with human skin (unscented). At three Florida sites in 1997-1998, four to five species were tested by placing five conspecific seeds at each station; 40-50 stations per species, per treatment, per site were monitored for 30 d. Seed removal was greater for scented than unscented seeds, but most differences were significant only with all species and sites pooled. At two Illinois sites and one Florida site in 1999-2000, one seed of one of two species was placed at each of 400 stations and monitored for 30 d. Scented seeds were removed significantly faster than unscented seeds at Illinois sites (14% scented vs. 5% unscented removed after one day), but not at the Florida site. The effect of scent on removal was pronounced during the first week, then disappeared. Fortunately, these results suggest scent biases are weak and short-lived, and most studies are unaffected. Studies that may be affected are those of short duration.",40,Journal,ar,Article,100,4,4,"Experimental bias | Granivore | Olfactory cues | Seed predation, seed removal",20308,undefined,0,FALSE,83,NA,NA,NA
true,https://api.elsevier.com/content/abstract/scopus_id/0038814757,SCOPUS_ID:0038814757,2-s2.0-0038814757,The role of seed dispersers in the population dynamics of the columnar cactus Neobuxbaumia tetetzo,Godínez-Alvarez H.,Ecology,00129658,83,9,2617-2629,2002-09-01,1 September 2002,10.1890/0012-9658(2002)083[2617:TROSDI]2.0.CO;2,"We examined the effect of frugivorous bats and birds on the population dynamics of the giant columnar cactus Neobuxbaumia tetetzo in the Tehuacán Valley, Mexico. Because successful seedling establishment occurs only beneath the canopies of shrubs and trees, we hypothesized that seed dispersal is a key process in the maintenance of its populations. We determined the dispersal effectiveness of different frugivores, considering the quantity and quality components of seed dispersal. We also evaluated the potential effects of each frugivore species on the finite rate of increase of N. tetetzo populations by modifying the fecundity values of a Lefkovitch matrix model. The bat Leptonycteris curasoae had the highest effectiveness whereas the bird Carpodacus mexicanus had the lowest. The estimated finite rates of increase calculated to evaluate the effects of frugivores on the population dynamics of the cactus differ marginally from unity, except when the effect of the bat L. curasoae was analyzed. Our results suggest that the bat Leptonycteris curasoae could be considered the legitimate dispersal agent of N. tetetzo, dispersing seeds directly to safe sites, and thus representing a key species in the ecology of this columnar cactus.",88,Journal,ar,Article,100,3,3,Arid tropical scrub | Bats | Birds | Frugivory | Leptonycteris curasoae | Matrix models | Mexico | Safe sites | Seed dispersal | Seed germination | Seedling establishment | Tehuacán Valley,20308,undefined,0,FALSE,84,NA,NA,NA
true,https://api.elsevier.com/content/abstract/scopus_id/0038545212,SCOPUS_ID:0038545212,2-s2.0-0038545212,Demographic and population responses of Cape May Warblers wintering in multiple habitats,Latta S.,Ecology,00129658,83,9,2502-2515,2002-09-01,1 September 2002,10.1890/0012-9658(2002)083[2502:DAPROC]2.0.CO;2,"Wintering Cape May Warblers (Dendroica tigrina) were studied in three habitats along an altitudinal gradient in the Dominican Republic. Results of this study are some of the first to link both population responses and individual condition of nonbreeding birds to prevailing ecological conditions across divergent habitats. Our data suggest that Cape May Warblers are habitat generalists and generally unspecialized resource opportunists, but that differences in food resources result in competitive interactions, sex and age class segregation, and differences in site fidelity and physiological condition among habitats. Diet of the Cape May Warbler varied between habitats: in desert, Cape Mays were primarily insectivores; in dry forest, they foraged primarily on homopteran honeydew; in pine forest, they were principally frugivores. Abundance of warblers as measured by mist-net captures was highest in pine forest sites. Males were more common than females in pine habitat, whereas there was a female-biased sex ratio in other sites. Adult birds were more common in the desert and the pine forest, but there was a bias toward immature birds in dry forest habitat. Overwinter site persistence was 76% in pine, but only 28% and 33% in dry forest and desert, respectively. Annual return rate averaged 57% and did not vary significantly among habitats. Adjusted body mass of site-persistent birds was highest in pine and dry forest and lowest in desert. Pectoral muscle mass scores increased in the pine forest throughout the Sampling period, whereas muscle mass scores decreased in the desert. These data suggest that, among the habitats sampled, pine was preferred. It is likely that stability and predictability of resources, particularly fruiting Trema trees and nectar sources, attracted dominant Cape May Warblers to pine forests and kept them as site-persistent individuals in good body condition. In contrast, dry forest may have been suboptimal, unless an individual was able to hold and defend a tree with honeydew-producing homopteran scale insects. Desert thorn scrub was seemingly suboptimal because resources were consistently scarce, and conditions became increasingly difficult during the late-winter dry period.",97,Journal,ar,Article,100,2,2,Altitude gradients | Cape May Warbler | Demography | Dendroica tigrina | Diet | Foraging behavior | Habitat generalist | Hispaniola | Resource opportunist | Site dependence | Site fidelity | Wintering behavior,20308,undefined,0,FALSE,85,NA,NA,NA
