@_fa,prism:url,dc:identifier,eid,dc:title,dc:creator,prism:publicationName,prism:issn,prism:volume,prism:issueIdentifier,prism:pageRange,prism:coverDate,prism:coverDisplayDate,prism:doi,dc:description,citedby-count,prism:aggregationType,subtype,subtypeDescription,author-count.@limit,author-count.@total,author-count.$,source-id,fund-no,openaccess,openaccessFlag,entry_number,freetoread.value.$,freetoreadLabel.value.$
true,https://api.elsevier.com/content/abstract/scopus_id/0020383238,SCOPUS_ID:0020383238,2-s2.0-0020383238,Habitat and seasonality as niche axes in an odonate community.,Crowley P.,Ecology,00129658,63,4,1064-1077,1982-01-01,1982,10.2307/1937245,"Focuses on the coexistence of the dominant larval populations among 46 odonate species found in Bays Mountain Park, Sullivan County, Tennessee, using an index to estimate niche specialization (breadth-1) and overlap on habitat and seasonal axes, both separately and simultaneously (two dimensional analysis). This enables evaluation of 2 possible mechanisms of coexistence: resource partitioning (differing time-averaged patterns of resource utilization among competitors) and ecological shift (nonevolutionary change in resource utilization in response to competition). Three results support the resource-partitioning mechanism: 1) Competition coefficients, obtained by dividing niche overlap values by the appropriate niche specialization values, are all less than one; this indicates that each population should inhibit its own access to a limited food supply more than it inhibits the access of the other populations. 2) The two-dimensional competition coefficients are slightly smaller on average than the product of single-axis means, suggesting two-dimensional complementary. 3) There are about the same number of consistent 3-yr trends in specialization and overlap as would be expected by change, suggesting a relatively persistent arrangement of odonate niches in niche space. The ecological shift mechanism may nevertheless be operating within or between those populations that do exhibit consistent 3-yr trends in specialization or overlap. The 6 populations that comprise the detritus-submersed macrophyte guild account for most of the larval biomass. The dominant population within the guild (and the community as a whole) is the semivoltine anisopteran Tetragoneuria cynosura. A particularly intense interaction is between the abundant zygopterans Enallagma traviatum and E. signatum; unusually high specializations and overlap were observed for the rush-dwelling zygopterans Ischnura verticalis and I. posita.-from Authors",53,Journal,ar,Article,100,2,2,20308,undefined,0,FALSE,111,NA,NA
true,https://api.elsevier.com/content/abstract/scopus_id/0020383087,SCOPUS_ID:0020383087,2-s2.0-0020383087,Exclusion experiments and the competitive release of insects feeding on collards.,Kareiva P.,Ecology,00129658,63,3,696-704,1982-01-01,1982,10.2307/1936790,"Interspecific competition among crucifer herbivores was tested by exclusion experiments. Two (of 21 potential) instances of competitive release were observed: Phyllotreta striolata (Coleoptera: Chrysomelidae) upon the exclusion of P. cruciferae, and P. cruciferae upon the exclusion of cabbage worms (Pieris rapae larvae; Lepidoptera: Pieridae) Significant releases of flea beetles occurred only at the densest of 3 collard plantings. Phyllotreta foraging movements may mediate competition in collard-flea beetle associations, restricting competitive release phenomena to dense planting where beetles have more opportunity to be discriminating in their choice of food plant, because they have more opportunity to move among plants. -from Author",17,Journal,ar,Article,100,1,1,20308,undefined,0,FALSE,112,NA,NA
true,https://api.elsevier.com/content/abstract/scopus_id/0020382653,SCOPUS_ID:0020382653,2-s2.0-0020382653,Competition and the role of habitat selection in Gerbillus allenbyi and Meriones tristrami: a removal experiment.,Abramsky Z.,Ecology,00129658,63,5,1242-1247,1982-01-01,1982,10.2307/1938850,"In northern Israel, 2 seed-eating gerbilline rodents exhibit exclusive distributions. Gerbillus allenbyi is the only species inhabiting coastal sand dunes between Tel Aviv and Mt. Carmel. Meriones tristrami is found in the same coastal region, but is restricted to non-sandy habitats. However, in the coastal area north of Mt. Carmel where G. allenbyi does not occur, M. tristrami inhabits dunes. This type of distribution is usually interpreted to result from competition. A perturbation experiment conducted in the narrow transition strip between soil and sand in an area where the above species are sympatric revealed no ongoing competition between the species. Strong interspecific competition in the past may have resulted in genetically determined habitat selection in the present.-Authors",22,Journal,ar,Article,100,2,2,20308,undefined,0,FALSE,113,NA,NA
true,https://api.elsevier.com/content/abstract/scopus_id/0020382632,SCOPUS_ID:0020382632,2-s2.0-0020382632,Garter snake diets in a fluctuating environment: a seven-year study.,Kephart D.G.,Ecology,00129658,63,5,1232-1126,1982-01-01,1982,10.2307/1938848,"Diets of the terrestrial garter snake Thamnophis elegans and the common garter snake T. sirtalis were studied at a lake in northern California. The snakes were opportunistic feeders; their diets varied dramatically from year to year, parallel with the abundance of prey. Snakes foraged more successfully, judging from the incidence of stomachs containing prey, in years when metamorphic toads Bufo boreas were available.-from Authors",61,Journal,ar,Article,100,2,2,20308,undefined,0,FALSE,114,NA,NA
true,https://api.elsevier.com/content/abstract/scopus_id/0020382627,SCOPUS_ID:0020382627,2-s2.0-0020382627,On the tradeoff between the mean and the variance in foraging: effect of spatial distribution and color preference.,Real L.,Ecology,00129658,63,6,1617-1623,1982-01-01,1982,10.2307/1940101,"An enclosed colony of bumblebees Bombus pennsylvanicus was restricted to foraging on 2 artificial flower types. The means and variances were adjusted in 2 flower types in order to detect risk sensitivity. Both the mean and the variance contributed to the bees' foraging decisions. An indifference curve represents combinations of mean and variance in nectar reward for which bees showed no preference. In 3 of 4 experiments there was a positive tradeoff between the mean and the variance, ie. a relatively more variable flower type could be compensated for by increasing its expected reward. The quantitative nature of the tradeoff is sensitive to ecological parameters (eg. spatial distribution of flowers) and independent behavioral parameters (eg. intrinsic color preference).-Authors",88,Journal,ar,Article,100,3,3,20308,undefined,0,FALSE,115,NA,NA
true,https://api.elsevier.com/content/abstract/scopus_id/0020382392,SCOPUS_ID:0020382392,2-s2.0-0020382392,Genecology of eastern redbud ( Cercis canadensis).,Donselman H.,Ecology,00129658,63,4,962-971,1982-01-01,1982,10.2307/1937236,"Plants of eastern redbud from throughout the natural range show considerable morphological variation. Characteristics usually associated with xeric conditions, such as increased pubescence; thicker and smaller leaves, and efficient stomatal geometry, are correlated with evapotranspirational trends over the natural range, reaching extremes in western populations. Photoperiodic growth response, time of initiation of dormancy, rate and extent of acclimation, and chilling requirements of dormant buds also vary over the natural range. Plants of southern origin continue to grow under shorter photoperiods than northern plants, and are slower to enter dormancy under short days. Plants of northern origin acclimate more rapidly than southern plants. Degree of acclimation in a fixed time is correlated with climatic parameters as well as latitude and, in the case of first-stage acclimation, longitude as well as latitude. Chilling requirements for breaking bud dormancy increased with latitude, with Florida plants showing no dormancy or chilling requirements.-from Authors",20,Journal,ar,Article,100,2,2,20308,undefined,0,FALSE,116,NA,NA
true,https://api.elsevier.com/content/abstract/scopus_id/0020381681,SCOPUS_ID:0020381681,2-s2.0-0020381681,Estimating survivorship when the subjects are visited periodically.,Bart J.,Ecology,00129658,63,4,1078-1090,1982-01-01,1982,10.2307/1937246,Statistical methods for estimating and comparing constant survival rates are developed for sampling designs in which survival of a subject is checked at irregular intervals. -from Authors,157,Journal,ar,Article,100,2,2,20308,undefined,0,FALSE,117,NA,NA
true,https://api.elsevier.com/content/abstract/scopus_id/0020379014,SCOPUS_ID:0020379014,2-s2.0-0020379014,Dynamics of understory biomass in Sitka spruce- western hemlock forests of southeast Alaska.,Alaback P.,Ecology,00129658,63,6,1932-1948,1982-01-01,1982,10.2307/1940131,"Understory vegetation undergoes successional stages during the 1st 300 yr after logging or fire disturbance in the coastal Picea sitchensis-Tsuga heterophylla forests of SE Alaska. Residual shrubs and tree seedlings increase their growth within 5 yr after overstory removal. Understory biomass peaks at 5 Mg.ha-1.yr-1 approx 15-25 yr after logging. Shrubs and herbs are virtually eliminated (<0.1 Mg/ha) from the understory after forest canopies close at stand ages of 25-35 yr. Bryophytes and ferns dominate understory biomass during the following century. An understory of deciduous shrubs and herbs is reestablished after 140-160 yr. Thereafter, biomass of the shrubs, herbs, and ferns continues to increase, while bryophyte biomass and tree productivity decline. In forests <100 yr, the decline in understory development immediately after canopy closure is significantly associated with tree basal area and percentage of tree canopy cover. In old-growth forests, understory biomass is correlated with mean tree diameter, age and volume. Understory development over the chronosequence responds primarily to changes induced in the light environment by developments in the forest canopy. Maintenance of the most productive forests in the aggradation stages of development (0-100 yr) through forest management will minimize the development of a productive vascular understory and thus deprive herbivores of forage during 70-80% of the forest rotation.-from Author",237,Journal,ar,Article,100,1,1,20308,undefined,0,FALSE,118,NA,NA
true,https://api.elsevier.com/content/abstract/scopus_id/0020379013,SCOPUS_ID:0020379013,2-s2.0-0020379013,The role of fine roots in the organic matter and nitrogen budgets of two forested ecosystems.,McClaugherty C.,Ecology,00129658,63,5,1481-1490,1982-01-01,1982,10.2307/1938874,"Studied a 53 yr-old red pine Pinus resinosa plantation and an adjacent 80 yr-old mixed hardwood stand in north-central Massachusetts. Dry matter of live fine roots was higher in the hardwoods (mean 6.1 Mg/ha; annual range 3.6-8.6 Mg/ha) than in the plantation (mean 5.1 Mg/ha; annual range 2.5-7.8 Mg/ha). Dead root mass was similar in the hardwoods (mean 4.4 Mg/ha) and plantation (mean 4.0 Mg/ha). Nitrogen standing crop of live roots in the hardwoods was higher than in the plantation (mean 65 kg/ha and 42 kg/ha, respectively). Net fine root production estimates ranged from 4.1-11.4 Mg.ha-1.yr-1 in the hardwoods and from 3.2- 10.9 Mg.ha-1.yr-1 in the plantation, depending on assumptions. Estimates of total N requirement for this production ranged from 73-184 kg.ha-1.yr-1 in the hardwoods and from 44-122 kg.ha-1.yr-1 in the plantation. Decomposition, measured as mass loss from buried cloth bags, was approx 20% in 0.4 mm mesh bags and as high as 47% in 3 mm mesh bags after 1-yr. The lowest estimates of production are probably more accurate. -from Authors",443,Journal,ar,Article,100,3,3,20308,undefined,0,FALSE,119,NA,NA
true,https://api.elsevier.com/content/abstract/scopus_id/0020378844,SCOPUS_ID:0020378844,2-s2.0-0020378844,Behavioral response of a sit-and-wait predator to spatial variation in foraging gain.,Olive C.,Ecology,00129658,63,4,912-920,1982-01-01,1982,10.2307/1937231,"The orb-weaving spiders Argiope trifasciata and Araneus trifolium were tested for specific behavioral responses to spatial variation in the net rate of energy return. In laboratory feeding experiments, no changes in attack time, capture success, or web design were caused by increased experience with particular prey types. Field experiments in enclosures of old-field vegetation were conducted with Argiope. Spiders were free to move between 4 contiguous quadrats which differed only in the ration fed to spiders. Length of stay at a site was positively correlated but probability of moving and distance moved were negatively correlated with ration level. Spiders moved more often than predicted by random expectation when current rations were less than previous rations. These responses produced an aggregation of spiders in quadrats with high ration levels over 11-d. This increase in search intensity with increasing return rate is qualitatively similar to that observed in searching predators in previous studies.-Author",95,Journal,ar,Article,100,1,1,20308,undefined,0,FALSE,120,NA,NA
true,https://api.elsevier.com/content/abstract/scopus_id/0020378749,SCOPUS_ID:0020378749,2-s2.0-0020378749,Intertidal zonation of barnacles: the influence of planktonic zonation of larvae on vertical distribution of adults.,Grosberg R.,Ecology,00129658,63,4,894-899,1982-01-01,1982,10.2307/1937228,"Examines the role of larval behavior in molding the zonation of the acorn barnacles Balanus glandula and B. crenatus. The vertical distribution of adults is a reflection of the vertical zonation of cyprids in the plankton and settlement patterns of spat. Although postsettlement mortality and substratum selection occur, presettlement behavior can strongly influence vertical zonation of sessile organisms.-from Author",192,Journal,ar,Article,100,1,1,20308,undefined,0,FALSE,121,NA,NA
true,https://api.elsevier.com/content/abstract/scopus_id/0020378612,SCOPUS_ID:0020378612,2-s2.0-0020378612,The selective importance of heat stress in gull nest location.,Salzman A.G.,Ecology,00129658,63,3,742-751,1982-01-01,1982,10.2307/1936795,"A brief but intense heat wave on 9 June 1979 caused catastrophic Larus occidentalis chick mortality in a population of western gulls on Santa Barbara Island, California. The area of high chick heat stress mortality was characterized by higher ground and air temperatures and lower wind velocities than the area of low mortality. Taxidermic thin metal chick models had a higher integrated thermal load, or operative environmental temperature, in the area of previous high mortality. Persistent nesting by gulls in areas of high potential chick mortality cannot be explained by habitat shortage or by the competitive inferiority of those birds. Enhanced access to food resources may explain the persistence of one area, but not of several others. Analysis of long-term weather records showed that heat waves during the breeding season are rare. The present nesting distribution of gulls on the island has probably evolved in response to a long period of highly equable climatic conditions. -from Author",43,Journal,ar,Article,100,1,1,20308,undefined,0,FALSE,122,NA,NA
true,https://api.elsevier.com/content/abstract/scopus_id/0020378067,SCOPUS_ID:0020378067,2-s2.0-0020378067,Organic matter production and distribution in slash pine ( Pinus elliottii) plantations.,Gholz H.,Ecology,00129658,63,6,1827-1839,1982-01-01,1982,10.2307/1940124,"Maximum leaf area of slash pine occurred at 5 yr. Aboveground net primary production (NPP) continued to increase to a maximum at 26 yr, then declined. After 5 yr stem biomass production composed a constant 50% of NPP. The forest floor increased at a constant rate through 34 yr, although total detritus (forest floor plus soil organic matter) was relatively constant at c.160 Mg/ha. Live vegetation mass was less than detritus mass until c.25 yr, the current harvest rotation length. Total system organic matter showed no indication of a decline after site preparation, and was still increasing at 34 yr (340 Mg/ha). During site preparation c.30 Mg/ha organic matter were lost through burning and decomposition. This loss was small enough to be completely offset by increases in live vegetation and forest floor over c.3 yr following site preparation, which may be important in limiting losses of nutrients from these sites after a disturbance.-from Authors",151,Journal,ar,Article,100,2,2,20308,undefined,0,FALSE,123,NA,NA
true,https://api.elsevier.com/content/abstract/scopus_id/0020378057,SCOPUS_ID:0020378057,2-s2.0-0020378057,Habitat stuctural complexity and the interaction between bluegills and their prey ( Lepomis macrochirus).,Crowder L.,Ecology,00129658,63,6,1802-1813,1982-01-01,1982,10.2307/1940122,"Lepomis macrochirus restricted to ponds in vegetation density grew better and consumed more prey at intermediate macrophyte density than fish held at either low or high macrophyte densities. Fish at low macrophyte density had narrower diets than expected due to high initial prey availability relative to prey available at intermediate and high macrophyte density. Fish at high macrophyte density ate fewer, but larger, prey and thus had a narrower diet than expected. Fish predation reduced total prey biomass as well as mean prey size and altered the prey community structure by removing large active invertebrate predators and herbivores with subsequent release of smaller invertebrate predators and herbivores. These changes in prey community structure were also mediated by habitat structure. Habitat structure-food density interactions may be added to temperature and presence of predators as variables that influence the use of resources by fish.-Authors",981,Journal,ar,Article,100,2,2,20308,undefined,0,FALSE,124,NA,NA
true,https://api.elsevier.com/content/abstract/scopus_id/0020377786,SCOPUS_ID:0020377786,2-s2.0-0020377786,Statistical significance of species clusters in association analysis.,Strauss R.E.,Ecology,00129658,63,3,634-639,1982-01-01,1982,10.2307/1936782,"For present/absence occurrence data, an approximate test of significance may be performed by generating random occurrence matrices within the constraints of a randomization model which treats as marginal constants both the observed number of occurrences of each species and the observed number of species present at each locality. Null (random) distributions of node values of dendrograms, derived from the randomly generated occurrence matrices, are used to assign approximate critical test values. These values may be applied directly to the dendrogram derived from the observed distribution data to determine which of the observed spcies clusters may be considered statistically significant. -from Author",54,Journal,ar,Article,100,1,1,20308,undefined,0,FALSE,125,NA,NA
true,https://api.elsevier.com/content/abstract/scopus_id/0020377284,SCOPUS_ID:0020377284,2-s2.0-0020377284,Increased reproductive success at high densities and predator satiation for periodical cicadas ( Magicicada septendecim).,Karban R.,Ecology,00129658,63,2,321-328,1982-01-01,1982,10.2307/1938949,"The reproductive success of Magicicada septendecim, measured as the number of offspring produced per adult, increases as adult density increases. The inverse density-dependent pattern at the adult stage occurred over the entire range of adult densities encountered. This result could have been caused by 1) predator satiation, 2) increased fecundity at higher densities, 3) more efficient mating at higher densities, and 4) movement of adults from sites of low initial densities to sites of high densities. If predator satiation accounts for the inverse density-dependent mortality, then each cicada's risk of capture will decrease as cicada density increases. Data suggest that this prediction is true; predation did not increase as cicada density increased so that the probability of escaping predation is greater at high-density sites. Total cicada predation was independent of cicada density but dependent on the density of predators.-from Author",98,Journal,ar,Article,100,1,1,20308,undefined,0,FALSE,126,NA,NA
true,https://api.elsevier.com/content/abstract/scopus_id/0020376679,SCOPUS_ID:0020376679,2-s2.0-0020376679,Stable population structure and reproductive values for populations with complex life cycles.,Caswell H.,Ecology,00129658,63,5,1223-1231,1982-01-01,1982,10.2307/1938847,"Classical demographic theory was developed to describe age-classified populations, in which knowledge of an individual's age accurately specifies its demographic state. In many species (eg. plants, insects, fish) individuals of the same age may be in very different states; classical theory is inappropriate for such populations. General formulae are presented for the stable stage distribution (the analogue of the stable age distribution of classical demography) and the stage-specific reproductive value distribution for populations with arbitrarily complex life histories. The results are obtained by use of the z-transforms of a simple graphical representation of the life cycle. They yield literal formulae, which can be used to draw qualitative conclusions about the general properties of the life history. They also provide quantitative results if numerical values for the parameters are available. Since the selective pressures on life history traits can be expressed simply in terms of the stable stage distribution and reproductive value, these results render complex life cycles amenable to evolutionary analysis. The reproductive value formulae can sometimes be used to calculate optimal schedules of stage-specific reproductive effort. -Author",59,Journal,ar,Article,100,1,1,20308,undefined,0,FALSE,127,NA,NA
true,https://api.elsevier.com/content/abstract/scopus_id/0020376373,SCOPUS_ID:0020376373,2-s2.0-0020376373,Thermal ecology of neotropical lungless salamanders (Amphibia: Plethodontidae): environmental temperatures and behavioral responses.,Feder M.E.,Ecology,00129658,63,6,1665-1674,1982-01-01,1982,10.2307/1940108,"Seven species of neotropical plethodontid salamanders exhibited distinct thermal preferences. The mean substrate temperature selected in the gradient (preferred body temperature, PBT) was affected by acclimation temperature and feeding in some species, and was negatively correlated with the elevation at which each species was collected. Regulation of the PBT was imprecise and only partially compensated for changes in environmental temperatures. Even though tropical plethodontids are capable of thermoregulation, they may be unable to thermoregulate in the field because of limited thermal diversity in their microhabitats. Temperatures within typical salamander microhabitats such as bromeliads (Tillandsia sp.) and banana plants (Musa sp.) ranged only 2o and 3.7oC, respectively. Diverse temperatures were available nearby in each case, but would have evolved exposure to direct light or dehydrating conditions. Water relations may limit thermoregulation in salamanders because hydric requirements restrict salamanders to moist microhabitats, which may have limited thermal diversity. However, in atypical field situations in which moist thermal gradients are available, some terrestrial salamanders (eg. Thorius narisovalis) are capable of regulating their body temperatures.-Author",43,Journal,ar,Article,100,1,1,20308,undefined,0,FALSE,128,NA,NA
true,https://api.elsevier.com/content/abstract/scopus_id/0020376326,SCOPUS_ID:0020376326,2-s2.0-0020376326,Population dynamics and standing biomass of the freshwater sponge Spongilla lacustris.,Frost T.,Ecology,00129658,63,5,1203-1210,1982-01-01,1982,10.2307/1938844,"In a sphagnum bog-pond in central New Hampshire, Spongilla lacustris exhibits a high growth rate and reaches a large standing biomass (ash-free dry biomass 1.7 g/m2) by the end of its growing season in October. The sponge overwinters as gemmules, and the conversions between these dormant forms and active sponge tissue in the spring and fall are very conservative in terms of biomass. With the high growth rate and efficiency of these transfers, 10 mg of gemmulated sponge (AFDM) in the spring could eventually produce 18 g upon resting stage formation in the fall. S. lacustris does not require a hard substratum. The greatest part of this population grows as upright branches from the pond bottom or attached to aquatic macrophytes. In winter, the gemmulated sponges, including those attached to macrophytes, collapse into the bottom sediments. There is a high mortality during this period, resulting from the accumulation of sediments over the gemmulated sponges, which prevents their successful hatching. Sponges derived from sexually produced larvae would be particularly unlikely to survive the winter. Asexual growth processes are thus of primary quantitative importance in this system and must be considered in evaluating reproductive effort.-Authors",45,Journal,ar,Article,100,3,3,20308,undefined,0,FALSE,129,NA,NA
