@_fa,prism:url,dc:identifier,eid,dc:title,dc:creator,prism:publicationName,prism:issn,prism:volume,prism:issueIdentifier,prism:pageRange,prism:coverDate,prism:coverDisplayDate,prism:doi,dc:description,citedby-count,prism:aggregationType,subtype,subtypeDescription,author-count.@limit,author-count.@total,author-count.$,authkeywords,source-id,fund-no,openaccess,openaccessFlag,entry_number,freetoread.value.$,freetoreadLabel.value.$,fund-sponsor
true,https://api.elsevier.com/content/abstract/scopus_id/0012338347,SCOPUS_ID:0012338347,2-s2.0-0012338347,Nonlinear self-thinning in a stream-resident population of brown trout (Salmo trutta),Rincón P.A.,Ecology,00129658,83,7,1808-1816,2002-07-01,1 July 2002,10.1890/0012-9658(2002)083[1808:NSTIAS]2.0.CO;2,"Self-thinning, the reduction in abundance of a cohort of growing organisms due to competition for limiting resources, has been observed in mobile animals, including many stream-dwelling salmonid fishes. Identifying self-thinning and hypothesizing its causal mechanisms rely on inspection of the slope of the relationship between log body mass and log density. We have examined such relationships for 42 brown trout cohorts (11 yr classes at four sites) sampled bimonthly throughout their complete life span. Trajectories displayed two distinct phases whose transition occurred at a body mass of 30-40 g (14-15 cm). Split lines provided a significantly better fit than straight lines in 32 of 42 cases and explained an average of 81.3% of the variation in trout abundance. The slopes of the first phase typically were not significantly different from zero and were shallower than predictions from either energetic or territorial allometry, whereas those of the second phase were steeper. This pattern strongly suggested that resource availability for brown trout was size-dependent in our study sites. Cohorts did not appear to be self-thinning initially, but resources (presumably pool habitat) seemed to become progressively more limiting as trout grew to lengths exceeding 14-15 cm. Thus, larger size may allow mobile animals to exploit previously inaccessible resources but also may render previously used resources unavailable. Therefore, the relationship between per capita resource availability and body size is likely to depend on local conditions and may not be directly predictable only from scaling the needed amount of food or space with body size.",59,Journal,ar,Article,100,2,2,Allometry | Arroyo Chaballos | Brown trout | Density dependence | Drift feeding | Northwest Spain | Population dynamics | Resource use | Salmo trutta | Stream salmonids,20308,undefined,0,FALSE,150,NA,NA,NA
true,https://api.elsevier.com/content/abstract/scopus_id/0012255290,SCOPUS_ID:0012255290,2-s2.0-0012255290,Coyote predation and habitat segregation of white-tailed deer and mule deer,Lingle S.,Ecology,00129658,83,7,2037-2048,2002-07-01,1 July 2002,10.1890/0012-9658(2002)083[2037:CPAHSO]2.0.CO;2,"Predation has been proposed as a major factor maintaining segregation among species of ungulates, but predator-prey interactions have not been observed to test this idea directly. Here, observations of coyote (Canis latrans) packs hunting deer are used to show that mule deer (Odocoileus hemionus), which typically stand high on slopes and on rugged terrain increased both their risk of being encountered and attacked by coyotes by standing low rather than high on slopes. The risk incurred at certain heights was not fixed: a mule deer's risk of being approached by coyotes was also affected by the height of other mule deer groups present during the same hunt. White-tailed deer (O. virginianus), which typically use gentle terrain, were not similarly disadvantaged by remaining low on slopes or on flat terrain. When confronted by coyotes, mule deer moved to and up slopes, whereas white-tails moved down and away from slopes. Species differences in behavior were independent of starting position and were observed for animals in mixed-species groups. Unlike their response to coyotes, feeding preferences or competition did not lead mule deer to use rugged habitats: mule deer moved down and left slopes to feed, bringing them closer to white-tails. These results suggest that coyote predation contributes to the habitat segregation of white-tails and mule deer (1) by selective predation against mule deer but not white-tails in gentle habitats and (2) by eliciting differing antipredator behavior that increases their segregation. Unlike prey involved in other examples of predator-mediated resource partitioning, white-tails and mule deer are similar in size and morphology. Contrasting antipredator strategies, specifically, their ability to avoid predation using flight or confrontation, are likely to explain why the species differ in their behavior and in their risk on gentle terrain.",72,Journal,ar,Article,100,1,1,Antipredator behavior | Canis latrans | Conservation | Coyotes | Deer | Habitat segregation | Odocoileus | Predator-mediated resource partitioning | Reproductive isolation | Rugged terrain,20308,undefined,0,FALSE,151,NA,NA,NA
true,https://api.elsevier.com/content/abstract/scopus_id/0012243512,SCOPUS_ID:0012243512,2-s2.0-0012243512,Dispersal distance of mammals is proportional to home range size,Bowman J.,Ecology,00129658,83,7,2049-2055,2002-07-01,1 July 2002,10.1890/0012-9658(2002)083[2049:DDOMIP]2.0.CO;2,"We tested the prediction that home range area and dispersal distance in mammals are related when considered independently of body size. Regression of log-transformed data demonstrated that more variance in maximum dispersal distance could be explained by home range area (74%) than could be explained by body size (50%). The relationship between maximum dispersal distance and home range size was isometric (slope = 1) when the square root of home range area (i.e., linear dimension of home range) was used. Thus, maximum dispersal distance was related to home range size by a single constant of 40. A linear relationship remained between these two variables after the effects of body size were removed (F = 31.6, df = 1, 32, P = 3.2 × 10-6 R2 = 0.50). A similar isometric relationship with home range size was found for median dispersal distance (related by a multiple of 7). This isometric relationship between dispersal distance and home range size was tested using a second data source: maximum movements made by mammals after translocation, which also was linearly related to home range area (F = 94.5, df = 1, 23, P = 1.3 × 10-9, R2 = 0.81). The slope and intercept of this relationship were not different from those of the relationship between maximum dispersal distance and home range area. We suggest that the vagility of mammals affected both home range size and dispersal distance (or movement after translocation) independently of body size, such that these movements could be predicted by home range area better than by body size alone. The resulting isometric relationship between dispersal distance and home range size has potential as a useful scaling rule for ecological practitioners.",266,Journal,ar,Article,100,3,3,Allometric | Dispersal distance | Home range | Homing | Isometric | Mammal | Relocation | Scale | Scaling | Simulation model | Translocation | Vagility,20308,undefined,0,FALSE,152,NA,NA,NA
true,https://api.elsevier.com/content/abstract/scopus_id/0010882504,SCOPUS_ID:0010882504,2-s2.0-0010882504,"Light, nutrients, and P:C ratios in algae: Grazer performance related to food quality and quantity",Hessen D.,Ecology,00129658,83,7,1886-1898,2002-07-01,1 July 2002,10.1890/0012-9658(2002)083[1886:LNAPCR]2.0.CO;2,"Continuous cultures of the green algae Selenastrum capricornutum were grown at different concentrations of total phosphorus (1-50 μmol P/L) and different light levels (10-200 μmol quanta·m-2·s-1). Growth yields in terms of C, N, and P were positively correlated to total P level. Total biomasses in terms of C and N, but not P, were also positively correlated to light level. The cell quotas of C were positively correlated with light, whereas cell quotas of P were negatively correlated with light. The resulting elemental ratios gave a quite consistent pattern, where high light caused significant reductions in both N:C and P:C ratios, as well as strong reductions in chlorophyll to carbon ratios. The increase in P:C ratio with increasing total P and decreasing light can be interpreted as an adaptive response to self-shading. In that case, our results indicate that light adaptation not only involves a cost in terms of increased chlorophyll synthesis, but also in terms of increased P demands. This provides new insight not only into the physiological regulation of C and P uptake in algae, but it could also explain deviations from the Redfield ratio. The growth of juvenile Daphnia magna fed S. capricornutum from the different light and phosphorus treatments was studied in a series of short-term assays (7 d) covering a gradient of food concentrations. The response of Daphnia growth rate along this quantity (0.5-5.0 mg C/L) and quality (0.5-12 μg atomic P-[mg atomic C]-1) gradient gave a close fit to a double hyperbola model. Changes in elemental ratios of the algae were reflected in the growth rate of Daphnia, such that up to 40% reduction in its growth rate could be attributed to increased C:P ratios. This study demonstrates that the physiological responses of phototrophs in terms of chlorophyll content and elemental composition depend strongly on ambient light and nutrient regimes. It also confirms that these patterns can yield contrasting responses on herbivore growth responses along the food quantity and quality axes.",204,Journal,ar,Article,100,3,3,Daphnia | Food quality | Grazer | Green algae (Selenastrum capricornutum) | Light | Nutrients | Photosynthesis,20308,undefined,0,FALSE,153,NA,NA,NA
true,https://api.elsevier.com/content/abstract/scopus_id/0006470472,SCOPUS_ID:0006470472,2-s2.0-0006470472,Interactions between herbivorous fishes and limiting nutrients in a tropical stream ecosystem,Flecker A.,Ecology,00129658,83,7,1831-1844,2002-07-01,1 July 2002,10.1890/0012-9658(2002)083[1831:IBHFAL]2.0.CO;2,"Ecologists have long been interested in understanding the strengths of consumer and resource limitation in influencing communities. Here we ask three questions concerning the relative importance of nutrients and grazing fishes to primary producers of a tropical Andean stream: (1) Are stream algae nutrient limited? (2) Are top-down and bottom-up forces of dual importance in limiting primary producers? (3) Do grazing fishes modulate the degree of resource limitation We obtained several lines of evidence suggesting that Andean stream algae are nitrogen limited. Addition of nitrogen in flow-through channels resulted in major increases in algal standing crop, whereas there were no measurable effects of phosphorus enrichment. Interestingly, the N2-fixing cyanobacteria Anabaena was one of the taxa that responded most dramatically to the addition of nitrogen. Moreover, nutrient uptake rates were significantly higher for inorganic nitrogen (NO3-N and NH4-N) compared to phosphorus (PO4-P). Nutrients and the presence of grazing fishes were manipulated simultaneously in a series of experiments by using nutrient-diffusing substrates in fish exclusions vs. open cages accessible to the natural fish assemblage. We observed strong effects of both nitrogen addition and consumers on algal standing crop, although consumer limitation was found to be of considerably greater magnitude than resource limitation in influencing algal biomass and composition. Finally, the degree of resource limitation varied as a consequence of grazing fishes. Experiments examining nutrient limitation in the presence and absence of fishes showed that the response to nitrogen enrichment was significantly greater on substrates accessible to natural fish assemblages compared to substrates where grazing fishes were excluded. These experiments demonstrate simultaneous and interactive effects of top-down and bottom-up factors in limiting primary producers of tropical Andean streams. Whereas other studies have shown that consumers affect nutrient supply in ecosystems, our findings Suggest that consumers can play an important role in influencing nutrient demand.",116,Journal,ar,Article,100,8,8,Algae | Andes | Community structure | Cyanobacteria | Food webs | Grazing fishes | Herbivory | Nitrogen limitation | Nutrient uptake | Stream | Top-down and bottom-up effects | Tropics,20308,undefined,0,FALSE,154,NA,NA,NA
true,https://api.elsevier.com/content/abstract/scopus_id/0005899203,SCOPUS_ID:0005899203,2-s2.0-0005899203,"Lizard home ranges revisited: Effects of sex, body size, diet habitat, and phylogeny",Perry G.,Ecology,00129658,83,7,1870-1885,2002-07-01,1 July 2002,10.1890/0012-9658(2002)083[1870:LHRREO]2.0.CO;2,"The area traversed by an animal during food gathering, mating, and other routine activities is termed the home range (HR), and its size is believed to reflect behavioral and physiological requirements (e.g., access to mates and food). We evaluated both biological and methodological factors that may affect estimated HR sizes of lizards. We compiled a database of nearly 500 published sex x population data sets. These yielded usable data for 108 populations from 60 species, all with both sexes represented. Initial analyses indicated pervasive sex differences, so sexes were analyzed separately with both conventional and phylogenetically based statistical methods. First, we conducted conventional analyses of covariance, which treat each data point as statistically independent. Second, we repeated these analyses while comparing members of two major clades represented in our database, Iguania and Autarchoglossa. Third, we repeated the analyses after designating smaller clades, nested within major clades. Fourth, we performed a fully phylogenetic analysis via independent contrasts and a composite phylogeny assembled from published studies. All analyses showed highly significant effects of both biological (body size, diet, habitat type) and most methodological (calculation method and minimum number of sightings per individual, but not study duration) factors and covariates tested. The conventional analysis comparing Iguania and Autarchoglossa en toto indicated a significant difference, as has been suggested in the literature. The analysis with nested minor clades, however, revealed differences among these but not between the two major clades. The analysis with phylogenetically independent contrasts indicated no statistically significant differences either among minor clades or between major clades. We also used our database to compare the scaling of HR area to body mass, using recently published allometric equations for field metabolic rates of lizards. The similarity of allometric slopes suggests that, interspecifically, HR size scales directly with energetic requirements. Intraspecifically, however, we found that males in both Autarchoglossa and Iguania consistently had larger HRs than did females. This difference, presumably related to the need to maximize access to females, may impose a ""cost of reproduction"" on males.",188,Journal,ar,Article,100,2,2,Allometry | Autarchoglossa | Body size | Diet | Energetics | Habitat | Home range | Iguania | Lizards | Methodology | Phylogeny | Sex,20308,undefined,0,FALSE,155,NA,NA,NA
true,https://api.elsevier.com/content/abstract/scopus_id/0003337955,SCOPUS_ID:0003337955,2-s2.0-0003337955,Ecological-niche factor analysis: How to compute habitat-suitability maps without absence data?,Hirzel A.H.,Ecology,00129658,83,7,2027-2036,2002-07-01,1 July 2002,10.1890/0012-9658(2002)083[2027:ENFAHT]2.0.CO;2,"We propose a multivariate approach to the study of geographic species distribution which does not require absence data. Building on Hutchinson's concept of the ecological niche, this factor analysis compares, in the multidimensional space of ecological variables, the distribution of the localities where the focal species was observed to a reference set describing the whole study area. The first factor extracted maximizes the marginality of the focal species, defined as the ecological distance between the species optimum and the mean habitat within the reference area. The other factors maximize the specialization of this focal species, defined as the ratio of the ecological variance in mean habitat to that observed for the focal species. Eigenvectors and eigenvalues are readily interpreted and can be used to build habitat-suitability maps. This approach is recommended in situations where absence data are not available (many data banks), unreliable (most cryptic or rare species), or meaningless (invaders). We provide an illustration and validation of the method for the alpine ibex, a species reintroduced in Switzerland which presumably has not yet recolonized its entire range.",1075,Journal,ar,Article,100,4,4,Capra ibex | Ecological niche | GIS | Habitat suitability | Marginality | Multivariate analysis | Presence-absence data | Specialization | Species distribution | Switzerland,20308,undefined,0,FALSE,156,all,All Open Access,NA
true,https://api.elsevier.com/content/abstract/scopus_id/0001703131,SCOPUS_ID:0001703131,2-s2.0-0001703131,Shade-induced plasticity and its ecological significance in wild populations of Arabidopsis thaliana,Callahan H.,Ecology,00129658,83,7,1965-1980,2002-07-01,1 July 2002,10.1890/0012-9658(2002)083[1965:SIPAIE]2.0.CO;2,"In laboratory studies of Arabidopsis thaliana, plants shaded by neighboring vegetation (or subject to treatments mimicking shade) flower at a younger developmental stage, and sometimes earlier in time. We examined whether this shade avoidance response varies among and within natural populations of A. thaliana, and whether it corresponds to variable selection regimes at shaded and unshaded field sites, by conducting a two-year reciprocal transplant study and a parallel greenhouse study that manipulated the presence and timing of shade. In the field, shading had limited or inconsistent impacts on survivorship across several phases of the growing season. The date of bolting was earlier at the shadier site compared to the less shady site, but in the greenhouse there was no significant shade-induced plasticity for this trait. In both studies, we detected directional selection gradients favoring earlier bolting in shade, but gradients favoring earlier bolting were as strong in nonshaded conditions. The number of rosette leaves at bolting (i.e., the developmental stage of flowering) was significantly reduced by shade in both studies. However, there was either no directional selection on this trait, or selection to flower with more rather than fewer leaves. Despite the contrast in habitats, there was limited differentiation between populations for survivorship, reproductive fitness, size-related or flowering time traits, and no differentiation for trait plasticities. Some traits were variable among families within populations. A trade-off between age and developmental stage may limit the response to selection for flowering time, possibly explaining limited local adaptation. The adaptive significance of shade-induced flowering time plasticity remains equivocal. Future studies of the plasticity of flowering time in A. thaliana should investigate the effects of shading regimes together with other environmental variables on size- and timing-related traits.",116,Journal,ar,Article,100,2,2,"Age and size at reproduction | Agricultural Experiment Station, Tennessee | Arabidopsis thaliana | Flowering time | Life history evolution | Light spectral quality | Phenotypic plasticity | Phenotypic selection | Phytochrome | Shade avoidance",20308,undefined,0,FALSE,157,NA,NA,NA
true,https://api.elsevier.com/content/abstract/scopus_id/0001427932,SCOPUS_ID:0001427932,2-s2.0-0001427932,Linking life history strategies and ontogeny in crustacean zooplankton: Implications for homeostasis,Villar-Argaiz M.,Ecology,00129658,83,7,1899-1914,2002-07-01,1 July 2002,10.1890/0012-9658(2002)083[1899:LLHSAO]2.0.CO;2,"Work to date has established that consumers are constrained in their chemical content variability. Such a constraint generates many different kinds of ecological relationships ranging from aspects of animal mineral nutrition to factors affecting consumer-driven nutrient recycling. Although previous studies have shown variation in zooplankton nutrient content within and between taxa, most stoichiometric studies assume that consumers are homeostatic in their elemental composition. In this paper, this assumption is reexamined as we describe the variability in the elemental content of the calanoid copepod Mixodiaptomus laciniatus Lilljeborg throughout its ontogeny (interstage variability) and for its specific developmental stages (intrastage variability). Mean copepod carbon content as dry mass increased significantly during ontogeny from 36.3% in nauplii to 51.5% in immature copepodites and 55.8% in adults. Mean phosphorus content decreased from 0.98% in nauplii to 0.87% in immature copepodites and 0.51% in adults. The copepod molar C:N:P ratio was 99:3:1 for nauplii, 165:13:1 for immature copepodites, and 234:25:1 for adults. These ontogenetic variations in stoichiometry within a single copepod species are comparable to the previously described range between taxa. Stoichiometric and physiological approaches are used as complementary tools to explain the two-part life history strategy of this copepod. First, the nauplii and early copepodite stages (CI-CIV) with high carbon demands adopt a growth strategy during which carbon sources are mainly allocated to increases in body size. The susceptibility of these copepodite stages to carbon limitation is reflected in the decline in the carbon content for a given stage (e.g., from 66% to 38% C in CII) and in the 40-fold decrease in neutral-to-polar lipid ratio toward the end of the ice-free season, suggesting a mobilization of food reserves toward growth. In contrast, copepodite stage CV and adults with less carbon demands for growth followed a survival-reproductive strategy, where the invariability in carbon content as dry mass (near 60%) and in neutral-to-polar lipid ratio through time indicates no accumulation of storage lipids, but instead an allocation of resources toward maintenance or reproduction. The basic assumption of predictions of stoichiometric models that elemental composition remains constant with time are not supported by changes in the intrastage carbon and nitrogen contents of Mixodiaptomus laciniatus. Thus, we suggest that the idea of strict homeostasis may be replaced with the concept of rheostasis, which allows the homeostatic regulatory mechanisms of an organism to adjust to a changing environment over time.",73,Journal,ar,Article,100,3,3,Carbon | Homeostasis | Life history strategies | Lipid ratio | Nitrogen | Ontogeny | Phosphorus | Rheostasis | Stoichiometry | Zooplankton,20308,undefined,0,FALSE,158,NA,NA,NA
true,https://api.elsevier.com/content/abstract/scopus_id/0000445547,SCOPUS_ID:0000445547,2-s2.0-0000445547,"The many faces of predation: How induction, selection, and thinning combine to alter prey phenotypes",Relyea R.,Ecology,00129658,83,7,1953-1964,2002-07-01,1 July 2002,10.1890/0012-9658(2002)083[1953:TMFOPH]2.0.CO;2,"Populations in nature face a number of factors that can alter their traits and subsequent performance. Predation is one factor that can have widespread effects on the mean trait value in a prey population because predators can impact prey traits through a number of processes. Predators can directly induce prey phenotypes through visual and chemical cues, predators can indirectly alter prey phenotypes by thinning the prey population (thereby reducing competition), and predators can cause selection on prey phenotypes through nonrandom killing. Ecologists are beginning to understand each of these three processes in isolation, but these processes act on prey phenotypes simultaneously, and we lack information on the relative importance of these processes in determining the final phenotype of prey. I used a system of gray treefrog tadpoles (Hyla versicolor) and dragonfly predators (Anax longipes) to determine the separate and combined impacts of induction, thinning, and selection on the behavior, morphology, and growth of tadpoles reared in aquatic mesocosms. Using combinations of hand thinning, cues emitted from caged predators, and lethal predators, I demonstrated that the impact of lethal predators on growth was mediated primarily through thinning, the impact on morphology was primarily through induction, and the impact on behavior was affected similarly through thinning and induction. Surprisingly, while we know from numerous studies that the dragonflies kill tadpoles nonrandomly, selection did not have a significant impact on the final phenotypes of the tadpoles. This work appears to be the first study that identifies the relative magnitudes of the three predatory processes on a suite of prey phenotypes. The three processes can have opposing or supporting effects, the relative magnitudes of which likely differ among systems, illustrating why we often observe contradictory results when we examine the impact of lethal predators on prey phenotypes. Thus, it is important that we identify the mechanisms underlying the outcomes of predation, rather than simply observing the outcomes and then inferring which processes are responsible.",80,Journal,ar,Article,100,1,1,Anax longipes | Antipredator traits | Hyla versicolor | Phenotype | Phenotypic plasticity | Predation,20308,undefined,0,FALSE,159,NA,NA,NA
