@_fa,prism:url,dc:identifier,eid,dc:title,dc:creator,prism:publicationName,prism:issn,prism:volume,prism:issueIdentifier,prism:pageRange,prism:coverDate,prism:coverDisplayDate,prism:doi,dc:description,citedby-count,prism:aggregationType,subtype,subtypeDescription,author-count.@limit,author-count.@total,author-count.$,source-id,fund-no,openaccess,openaccessFlag,entry_number,freetoread.value.$,freetoreadLabel.value.$
true,https://api.elsevier.com/content/abstract/scopus_id/0026292608,SCOPUS_ID:0026292608,2-s2.0-0026292608,Ecological interactions among predators in experimental stream communities,Resetarits W.J.,Ecology,00129658,72,5,1782-1793,1991-01-01,1991,10.2307/1940977,"Examined the ecological interactions among four species of co-occurring predators, adult brook trout Salvelinus fontinalis (98-122 mm standard length), larval Gyrinophilus porphyriticus (36-58 mm snout-vent length), larval Eurycea bislineata (13-21 mm SVL), and Cambarus bartonii (6-17 mm carapace length) in an experiment that began in mid-June and ran for 3 mo. Brook trout affected both survival and growth of the larger salamander species, Gyrinophilus, and Salvelinus and Gyrinophilus affected the growth of the smaller salamander Eurycea and the crayfish Cambarus. Presence of Gyrinophilus had no effect on relative condition or fecundity of Salvelinus. Large predators caused Cambarus and Eurycea to alter their activity levels and habitat, but Gyrinophilus made no adjustments to the presence of Salvelinus. Gyrinophilus is vulnerable to predation/aggression from brook trout, but Eurycea and Cambarus can behaviorally avoid predation by both large predators at a significant cost to growth. Interactions among predators in headwater streams directly and indirectly influence population dyanmics of the interacting species by affecting survival, growth, behavior, and habitat use. -from Author",79,Journal,ar,Article,100,1,1,20308,undefined,0,FALSE,40,NA,NA
true,https://api.elsevier.com/content/abstract/scopus_id/0026291226,SCOPUS_ID:0026291226,2-s2.0-0026291226,Seed entrapment in alpine ecosystems: effects of soil particle size and diaspore morphology,Chambers J.,Ecology,00129658,72,5,1668-1677,1991-01-01,1991,10.2307/1940966,"In a disturbed alpine ecosystem on the Beartooth Plateau, Montana, diaspores of species with varying morphology were sown over soils of five different particle sizes and later collected from three depths. Regardless of diaspore morphology, the total number of diaspores trapped increased with increasing particle size until a threshold soil particle size was reached above which no more diaspores were trapped. At small particle sizes (0.5-1.0 and 1.0-2.0 mm) small diaspores and diaspores with adhesive seed coats were trapped, but most large diaspores moved horizontally across the surface and were not trapped. Most diaspores trapped were at the 0-1cm depth at small particle sizes. At large particle sizes (2.0-4.0, 4.0-8.0, and 8.0-16.0 mm) high numbers of large diaspores were trapped, and more diaspores moved vertically through the soil column. In small particle size soils small diaspores reached greater depths than large diaspores. Diaspores with adhesive seed coats responded more like large diaspores in terms of vertical movement. Diaspore length and eccentricity (length/width) were highly correlated with entrapment at small particle sizes and appeared to have the greatest effect on horizontal movement. -from Authors",162,Journal,ar,Article,100,3,3,20308,undefined,0,FALSE,41,NA,NA
true,https://api.elsevier.com/content/abstract/scopus_id/0026291223,SCOPUS_ID:0026291223,2-s2.0-0026291223,Nonlethal effects of a predator on competitive interactions between two anuran larvae,Werner E.,Ecology,00129658,72,5,1709-1720,1991-01-01,1991,10.2307/1940970,"Examined the nonlethal effects of an odonate larva (Anax junius), on competitive interactions between bullfrog Rana catesbeiana and green frog R. clamitans. In the absence of the predator, the two species were similar in competitive abilities and grew at virtually identical rates. In the presence of caged A. junius, however, the bullfrog grew to be larger and the green frog much smaller. Both species reacted to the presence of A. junius by reducing activity and altering space use. The reductions in activity in the presence of the predator affected the two species differently, which in turn changed competitive interactions. -from Author",185,Journal,ar,Article,100,1,1,20308,undefined,0,FALSE,42,NA,NA
true,https://api.elsevier.com/content/abstract/scopus_id/0026290943,SCOPUS_ID:0026290943,2-s2.0-0026290943,"Relative abundance of littoral zone fishes: biotic interactions, abiotic factors, and postglacial colonization",Hinch S.,Ecology,00129658,72,4,1314-1324,1991-01-01,1991,10.2307/1941104,"Mutlivariate ordination techniques were used to establish relationships among the abundances of the most frequently occurring littoral zone fishes (fishes that occurred in >60% of the lakes) in 25 central Ontario lakes. Some 70% of the variation in abundances was described by the first two axes from a correspondence anlaysis. Abundances of white sucker Catostomus commersoni and rock bass Ambloplites rupestris, and abundances of brown bullhead Ictalurus nebulosus and smallmouth bass Micropterus dolomieui were negatively related. However, abundances of these species pairs were not related where the species occurred in sympatry, suggesting that species presence/absence strongly influenced these patterns of abundance. Most of the variation in species abundance and distribution was attributed to physical factors associated with species colonization processes, eg differences in postglacial colonization rates may have caused negative associations between white sucker and rock bass. An independent 45-lake data set was used to confirm these zoogeographic patterns. Predation by northern pike Esox lucius may be partly responsible for variation in abundance and distribution of white sucker. Habitat differences between lakes provided the best explanation for the variation in abundance of smallmouth bass and brown bullhead. -from Authors",45,Journal,ar,Article,100,3,3,20308,undefined,0,FALSE,43,NA,NA
true,https://api.elsevier.com/content/abstract/scopus_id/0026289703,SCOPUS_ID:0026289703,2-s2.0-0026289703,"Learning, memory, and foraging efficiency in two species of desert seed-harvester ants",Johnson R.A.,Ecology,00129658,72,4,1408-1419,1991-01-01,1991,10.2307/1941112,"Individuals of Messor pergandei and Pogonomyrmex rugosus learned a suite of behaviors that enhanced foraging efficiency on a novel seed species under natural conditions. Handling time per seed and return time (travel time to and from the nest and time inside the nest) decreased for both species. Individuals of the larger P. rugosus increased efficiency by increasing the number of seeds harvested per trip. As a result, the percentage of individuals that carried >1 seed per trip increased over time. M. pergandei decreased the number of seeds handled before harvesting one, and still harvested heavier than average seeds because they handled but did not harvest lightweight seeds. M. pergandei also varied the number of seeds handled before harvesting one, such that the fewest number of seeds was handled at low natural seed densities. Overall, foraging efficiency of M. pergandei and P. rugosus individuals, measured as seed mass harvested per unit time, increased 1.9- and 3.85-fold, respectively, within one observation period, even excluding the effect of harvesting heavier than average seeds. Memory was an important component of foraging efficiency for both species, as all foraging efficiency indices fell much more slowly than they rose. Tactile-associated behaviors, such as handling time per seed and number of seeds handled, were lost quickly compared to olfactory-associated behaviors such as seed recognition and acceptance. -from Author",62,Journal,ar,Article,100,1,1,20308,undefined,0,FALSE,44,NA,NA
true,https://api.elsevier.com/content/abstract/scopus_id/0026289698,SCOPUS_ID:0026289698,2-s2.0-0026289698,Facilitation and interference of Quercus douglasii on understory productivity in central California,Callaway R.,Ecology,00129658,72,4,1484-1499,1991-01-01,1991,10.2307/1941122,"In some studies, understory grassland productivity was <25% of open grassland productivity, whereas in other studies understory productivity exceeded 200% of that of surrounding grassland. Grassland productivity is likely to be facilitated by nutrient inputs via litterfall and throughfall under all trees, but trees with low understory grassland productivities had substantially higher amounts of fine roots in the upper 50cm of soil and much lower predawn xylem pressure potentials than trees with high understory productivities and presumably deeper root systems. Root exclosures reduced the negative effects of these trees on the dominant understory grass species. The negative effects of the tree roots may partially result from allelopathic oak root exudates. Thus, shallow fine tree roots may inhibit understory productivity, and variations in Q. douglasii root morphology may explain the intertree variations in facilitating/interfering effects on understory species. -from Authors",266,Journal,ar,Article,100,3,3,20308,undefined,0,FALSE,45,NA,NA
true,https://api.elsevier.com/content/abstract/scopus_id/0026288245,SCOPUS_ID:0026288245,2-s2.0-0026288245,"Soil, nitrogen, phosphorus, and organic matter processing by earthworms in tallgrass prairie",James S.,Ecology,00129658,72,6,2101-2109,1991-01-01,1991,10.2307/1941562,"Estimated cast production and rates of nutrient processing by the native genus Diplocardia and by exotic Lumbricidae on two soil types at Konza Prairie Research Natural Area, Kansas. Earthworms were Diplocardia longiseta, D. kansensis, D. rugosa, D. singularis, D. smithii, D. verrucosa and the European species Aporrectodea caliginosa and Octolasion cyaneum. Estimated total cast production and nutrient processing by Diplocardia spp. exceeded that of exotics in both soil types, in spite of higher populations of Lumbricidae in one soil. Total annual soil consumption by all earthworms was 4-10% of the A-horizon, depending on soil type. Organic matter equivalent to 10% of total soil organic matter in the top 15 cm or to 100-300% of plant annual belowground production appears to pass through the earthworms each year. Mineral N processed was 10-12% of annual plant N uptake, comparable to half of the input from precipitation, while the P processed was equivalent to 50% of annual uptake. Introduction of Lumbricidae had a negative effect on soil turnover and nutrient mineralization due to the lower throughput of Lumbricidae and their relative intolerance of summer soil temperature. -from Author",86,Journal,ar,Article,100,1,1,20308,undefined,0,FALSE,46,NA,NA
true,https://api.elsevier.com/content/abstract/scopus_id/0026288038,SCOPUS_ID:0026288038,2-s2.0-0026288038,The effect of ontogeny on interspecific interactions in larval amphibians,Sredl M.J.,Ecology,00129658,72,6,2232-2239,1991-01-01,1991,10.2307/1941573,"Assessed the relative importance of predator density, prey density and time of prey introduction on interactions between larval salamanders Ambystoma tigrinum and their anuran prey Pseudacris triseriata, and examined how these interactions affected mass at metamorphosis, length of larval period, growth rate, and survival. Microhabitat differences in primary productivity, sources of predation other than salamanders, and abiotic factors were important determinants of community structure. High levels of salamander predation negatively affected tadpole survival, but affected no other response variable. Tadpoles in the early predator introduction treatment had longer larval periods and lower survival rates than those in the late treatment. Intaractions of factors, including time of introduction, were common. -from Authors",24,Journal,ar,Article,100,2,2,20308,undefined,0,FALSE,47,NA,NA
true,https://api.elsevier.com/content/abstract/scopus_id/0026287352,SCOPUS_ID:0026287352,2-s2.0-0026287352,Worldwide limitation of finch densities by food and other factors,Schluter D.,Ecology,00129658,72,5,1763-1774,1991-01-01,1991,10.2307/1940975,"Nonbreeding finch densities (biomass) were compared with seed abundance in arid and semiarid sites in Kenya, the USA, Brazil, and Argentina, using data from the finches of the Galapagos Islands as an approximate measure of the food-imposed upper limit to finch density because food there is short, emigration is restricted, and predation is reduced. Half the variation in finch densities could be explained by standing seed abundance, strongly suggesting that finches on mainlands are food limited. Densities on different continents were roughly similar when seed supplies were the same, despite the different phylogenetic origins of finches present. Nevertheless, average densities on mainlands were only a quarter the densities found on the Galapagos. Low mainland densities possibly result from competition with other granivores, eg rodents and ants, but mainland finches restrict their foraging to areas of relative safety, where seed densitites may be lower than elsewhere, hinting that predation may also reduce densities. -from Authors",41,Journal,ar,Article,100,2,2,20308,undefined,0,FALSE,48,NA,NA
true,https://api.elsevier.com/content/abstract/scopus_id/0026287350,SCOPUS_ID:0026287350,2-s2.0-0026287350,"Influence of plant allelochemicals on the tobacco hornworm and its parasitoid, Cotesia congregata",Barbosa P.,Ecology,00129658,72,5,1567-1575,1991-01-01,1991,10.2307/1940956,"Evaluated the development rate, size and survival of Cotesia congregata when reared from Manduca sexta fed on diets containing either nicotine, rutin or hordenine. Results were compared to the effects of the same three chemicals on unparasitized M. sexta. In general, the effects of these allelochemicals on thoe parasitoid paralleled those on the unparasitized hornworm. The one major exception was that concentrations of nicotine that had little or no effect on the hornworm caused significant mortality of parasitoids. -from Authors",168,Journal,ar,Article,100,3,3,20308,undefined,0,FALSE,49,NA,NA
true,https://api.elsevier.com/content/abstract/scopus_id/0026287325,SCOPUS_ID:0026287325,2-s2.0-0026287325,Foraging on cyanobacteria by copepods: responses to chemical defenses and resource abundance,Demott W.,Ecology,00129658,72,5,1820-1834,1991-01-01,1991,10.2307/1940981,"Diaptomus birgei exhibited behaviors ranging from strong preferences for some taxa of cyanobacteria to almost complete rejection of other taxa when allowed to feed in low-concentration mixtures of a high-quality green alga, Chlamydomonas reinhardi, and each of 16 taxa of cyanobacteria. Results demonstrate the overriding importance of chemical factors. Copepods exhibited very high clearance rates for some filaments and colonies but rejected morphologically similar strains shown to contain potentially toxic compounds. Responses to resource abundance exhibited three patterns, each consistent with the assumptions and predictions of an optimal diet model. 1) Selectivity for high-ranking cyanobacteria declined in high-concentration mixtures with Chlamydomonas relative to selectivity in low-concentration mixtures. 2) A test of the effects of time without food showed that hunger, rather than food concentration per se, was responsible for these shifts in selectively. 3) Each toxic strain was consistently ingested at very low rates, even when offered as the sole food resource. -from Authors",230,Journal,ar,Article,100,2,2,20308,undefined,0,FALSE,50,NA,NA
true,https://api.elsevier.com/content/abstract/scopus_id/0026287127,SCOPUS_ID:0026287127,2-s2.0-0026287127,Life history and the relationship between food availability and foraging effort,Abrams P.,Ecology,00129658,72,4,1242-1252,1991-01-01,1991,10.2307/1941098,"Simple theoretical models are used to explore the effect of changed food density on optimal foraging effort when a forager faces a trade-off between energy (nutrient) gain and risk of mortality. Models of simple iteroparous and semelparous life histories show that the optimal effort or amount of risk may increase or decrease with increasing food density. Increases are more likely for iteroparous than for semelparous life histories, and are more likely when the increase in food availability is of short duration. The possibility of starvation makes it more likely that foraging effort will decrease with increasing food density. Organisms whose foraging goal is to minimize mortality are especially unlikely to increase effort in response to increased food availability. If there is a cost associated with the amount of food ingested, effort is more likely to decrease with increasing food. -from Author",170,Journal,ar,Article,100,1,1,20308,undefined,0,FALSE,51,NA,NA
true,https://api.elsevier.com/content/abstract/scopus_id/0026286672,SCOPUS_ID:0026286672,2-s2.0-0026286672,Models of multiple dispersers from the nest: predictions and inference,Tonkyn D.,Ecology,00129658,72,5,1721-1730,1991-01-01,1991,10.2307/1940971,"Extends an analytic model, which predicts the probability that an individual will locate an available site within any given distance, under two limiting search strategies, to consider the distances traveled by multiple dispersers from a site. Competitive exclusion by early dispersers can further increase the variation in dispersal distances. This incorporates the effects of competition with siblings, but not with dispersers from other natal sites. -from Authors",20,Journal,ar,Article,100,2,2,20308,undefined,0,FALSE,52,NA,NA
true,https://api.elsevier.com/content/abstract/scopus_id/0026286343,SCOPUS_ID:0026286343,2-s2.0-0026286343,Salmon breeding behavior and life history evolution in changing environments,Gross M.,Ecology,00129658,72,4,1180-1186,1991-01-01,1991,10.2307/1941091,"Male salmon have two life-history tactics: maturing precociously at a small body size, or delaying maturity until a larger body size is reached. Conditional strategies permit rapid responses as alternative life-history and behavioral tactics are expressed. Many human activities in the ocean and salmon breeding environment can be expected to elicit long-term evolutionary changes in the proportion of male coho salmon Oncorhynchus kisutch maturing as jacks. Other activities in freshwater rearing environments will have short-term effects. In some cases, male salmon populations once characterized by fighting hooknose males may instead become characterized by smaller precocious jacks. It is also possible that ocean-caught salmon will someday be females only. -from Author",178,Journal,ar,Article,100,1,1,20308,undefined,0,FALSE,53,NA,NA
true,https://api.elsevier.com/content/abstract/scopus_id/0026283984,SCOPUS_ID:0026283984,2-s2.0-0026283984,Do tropical bird-pollinated plants exhibit density-dependent interactions? Field experiments,Feinsinger P.,Ecology,00129658,72,6,1953-1963,1991-01-01,1991,10.2307/1941550,"In a tropical cloud forest at Monteverde, Costa Rica, three understory shrub species overlap greatly in flowering seasons and share hummingbird pollinators (Lampornis calolaema). The authors controlled floral composition in the neighborhoods surrounding 12 focal plants of self-compatible Besleria triflora (Gesneriaceae) and of self-incompatible Palicourea lasiorrachis (Rubiaceae), producing prescribed mixtures of flowers of the focal plants' conspecifics and of Cephaelis elata (Rubiaceae). Heterospecific enrichment, decreased both pollination levels and seed output in Palicourea, and seed output in Besleria. In general, altering the floral neighborhood affected Palicourea more strongly than Besleria. Intensity of density dependence, at least in terms of female reproductive success, varies among plant species sharing pollinators. Seed outputs in self-incompatible plants such as Palicourea may closely reflect flower densities of neighbors, but interspecific effects on fertilization in self-compatible plants such as Besleria may be density vague. (See also 92L/05912). -from Authors",144,Journal,ar,Article,100,3,3,20308,undefined,0,FALSE,54,NA,NA
true,https://api.elsevier.com/content/abstract/scopus_id/0026283851,SCOPUS_ID:0026283851,2-s2.0-0026283851,Toward a method for measuring instantaneous fungal growth rates in field samples,Newell S.Y.,Ecology,00129658,72,5,1547-1559,1991-01-01,1991,10.2307/1940954,"Devised a technique for estimating instantaneous growth rates for ergosterol-containing fungi in field material, and preliminarily applied the technique to estimation of fungal productivities and throughputs in two types of standing-dead grass (one saltwater, one freshwater). This method is based on measuring rates of radiolabeled acetate incorporation into ergosterol. -from Authors",127,Journal,ar,Article,100,2,2,20308,undefined,0,FALSE,55,NA,NA
true,https://api.elsevier.com/content/abstract/scopus_id/0026283839,SCOPUS_ID:0026283839,2-s2.0-0026283839,Phosphorus availability in acid organic soils of the lower North Carolina Coastal Plain,Walbridge M.,Ecology,00129658,72,6,2083-2100,1991-01-01,1991,10.2307/1941561,"The natural gradient from short pocosin to bay forest was found to represent a gradient of increasing P availability, as indicated by increases in: (1) total P in surface (0-15 cm) soils, from 19.6 to 118.3 kg/ha; (2) seasonal and annual PO43- supply to in situ anion-exchange resins; and (3) P concentrations in native plant foliage. Increases in P availability were accompanied by a significant decline in the N:P ratios of both plant leaves and surface soils. A decline in the ratio of microbial:total P in surface soils, from 56.3 to 37.4%, and an increase in the ratio of net:gross P mineralization (estimated by isotope dilution), suggested that as P availability increased, microbial control decreased. Landscape-level processes may have contributed to the observed variations in vegetation and P availability along this natural gradient. -from Author",129,Journal,ar,Article,100,1,1,20308,undefined,0,FALSE,56,NA,NA
true,https://api.elsevier.com/content/abstract/scopus_id/0026283614,SCOPUS_ID:0026283614,2-s2.0-0026283614,Walking the tight rope: arboreal sprint performance among Sceloporus occidentalis lizard populations,Sinervo B.,Ecology,00129658,72,4,1225-1233,1991-01-01,1991,10.2307/1941096,"Documents variation in the degree of arboreality among four populations of western fence lizard and investigates how this variation relates to locomotor performance capability in an arboreal context. Specialization for maximizing sprinting performance on arboreal surfaces of a particular diameter entails a performance trade-off that is reflected in both speed and ""surefootedness'. Lizards with relatively longer limbs sprinted faster. Among-population differences in arboreal sprint performance are probably genetically based. -from Authors",139,Journal,ar,Article,100,2,2,20308,undefined,0,FALSE,57,NA,NA
true,https://api.elsevier.com/content/abstract/scopus_id/0026283591,SCOPUS_ID:0026283591,2-s2.0-0026283591,Deactivation of plant defense: correspondence between insect behavior and secretory canal architecture,Dussourd D.,Ecology,00129658,72,4,1383-1396,1991-01-01,1991,10.2307/1941110,"Vein-cutting insects occur on plants with arboresecent canals (resin canals in Anacardiaceae and nonarticulated laticifers in Apocynaceae, Asclepiadaceae, and Moraceae). By severing the secretory canals in leaf veins, insects prevent the flow of secretion to distal branches of the canals. Trenching insects are found on plants with net-like canal systems (anastomosing articulated laticifers in Asteraceae and Caricaceae, and exuding phloem in Cucurbitaceae). To eliminate secretion outflow from these plants, the insects must transect all strands of the network by cutting a trench. The secretory canals of the Convolvulaceae (nonanastomosing articulated laticifers) differ from the preceding categories in being restricted primarily to the major leaf veins. The behavour of herbivores on this family is also distinct: all feed between the major veins without prior vein cutting or trenching. -from Authors",128,Journal,ar,Article,100,2,2,20308,undefined,0,FALSE,58,NA,NA
true,https://api.elsevier.com/content/abstract/scopus_id/0026282654,SCOPUS_ID:0026282654,2-s2.0-0026282654,Relative impact of interactions within and between trophic levels during an insect outbreak,Auerbach M.,Ecology,00129658,72,5,1599-1608,1991-01-01,1991,10.2307/1940960,"The aspen blotch miner Phyllonorycter salicifoliella has occurred at epidemic densities on its quaking aspen Populus tremuloides host trees for at least 10 yr in Itasca State Park, Minnesota. During the 1986 through 1988 growing seasons, most mortality occurred during larval development and was caused by interference, parasitism, and unknown causes. Interference means that one larva kills another when mines coalesce during the first three instars. Egg mortality, predation, and death from premature leaf abscission were generally low, except in 1988 when a severe drought caused significant early leaf fall. Larval interference was the only consistently density-dependent cause of death. Although interference was spatially density dependent, it appears incapable of regulating P. salicifoliella population size. Instead, P. salicifoliella densities approached population ceilings delimited each year by availability of young leaves during oviposition. Cessation of the outbreak is unlikely until stochastic meteorological events increase overwintering mortality and/or severely disrupt synchrony between oviposition flights and availability of young foliage. -from Author",28,Journal,ar,Article,100,1,1,20308,undefined,0,FALSE,59,NA,NA
