@_fa,prism:url,dc:identifier,eid,dc:title,dc:creator,prism:publicationName,prism:issn,prism:volume,prism:issueIdentifier,prism:pageRange,prism:coverDate,prism:coverDisplayDate,prism:doi,dc:description,citedby-count,prism:aggregationType,subtype,subtypeDescription,author-count.@limit,author-count.@total,author-count.$,source-id,fund-no,openaccess,openaccessFlag,entry_number,freetoread.value.$,freetoreadLabel.value.$
true,https://api.elsevier.com/content/abstract/scopus_id/0026313217,SCOPUS_ID:0026313217,2-s2.0-0026313217,Fire and grazing in the tallgrass prairie: contingent effects on nitrogen budgets,Hobbs N.,Ecology,00129658,72,4,1374-1382,1991-01-01,1991,10.2307/1941109,"Combustion losses of N from ungrazed plots (1.8 g.m-2.yr-1) burned in the spring were double those from similarly burned, grazed plots (0.9 g.m-2.yr-1). These losses represented about half of the preburn, aboveground stocks of N. The magnitude of N loss was proportional to the standing crop biomass available for combustion. Fire temperatures and energy release were reduced by grazing. In the absence of burning, mowing (simulating heavy grazing) increased the likelihood that a patch would be regrazed and caused persistent reductions in the residual biomass remaining in a patch at the end of the growing season. Mowing did not influence patch utilization or residual biomass when pastures were burned. Thus, the effects of fire on grassland N budgets were modified by grazing, and the effects of grazing on the patch structure of grasslands were modified by fire. -from Authors",198,Journal,ar,Article,100,4,4,20308,undefined,0,FALSE,1,NA,NA
true,https://api.elsevier.com/content/abstract/scopus_id/0026312810,SCOPUS_ID:0026312810,2-s2.0-0026312810,Factors affecting gerbil foraging behavior and rates of owl predation,Kotler B.P.,Ecology,00129658,72,6,2249-2260,1991-01-01,1991,10.2307/1941575,"Experimented on how illumination, habitat structure, and three different species of owls affected the foraging behavior of Gerbillus allenbyi and G. pyramidum, which coexist on sand dune habitats in the Negev Desert, Israel. In response to the presence of owls or to increased illumination, gerbils foraged less, shifted foraging activity to the bush microhabitat, and quit patches at a higher giving-up density of resources. In accord with moonlight avoidance, both gerbil species suffered higher predation rates under illumination. G. pyramidum distinguished among owl species, as indicated by changes in patch use and habitat selection. Gerbils foraged less in the open than in the bush microhabitat, foraged less when there was no cover present, and foraged less in the bush microhabitat when patches were encumbered by entangling branches. In accord with avoidance of open areas, both gerbil species suffered higher rates of predation when shrub cover was 0% than when shrub cover was 10%. With 0% cover, G. allenbyi suffered higher predation rates than G. pyramidum, but with 10% cover, rates of owl predation did not differ between gerbil species. Relative to G. allenbyi, G. pyramidum predominates on open sand dunes and biases its behavior toward the open microhabitat. -from Authors",411,Journal,ar,Article,100,3,3,20308,undefined,0,FALSE,2,NA,NA
true,https://api.elsevier.com/content/abstract/scopus_id/0026312663,SCOPUS_ID:0026312663,2-s2.0-0026312663,Indirect effects of citrus cultivars on life history parameters of a parasitic wasp,Hare J.,Ecology,00129658,72,5,1576-1585,1991-01-01,1991,10.2307/1940957,"Determined sex ratio, initial egg complement, and size of adult Aphytis melinus, an ectoparasitoid of California red scale Aonidiella auranti. Wasps from scales reared on leaves of lemons Citrus limon produced nearly twice the proportion of female progeny as did wasps from scales reared on leaves of grapefruit Citrus paradisi, orange Citrus sinensis or mandarin Citrus unshiu. Female wasps from lemon-reared scales had highest initial egg complement, followed by wasps reared from grapefruit, mandarin, and orange. The quality of scales for the production of fecund female wasp progeny also varied seasonally over all cultivars pooled. Scales reached largest size when reared in the cooler autumn temperatures and were more than twice as suitable for the production of fecund, female A. melinus as scales reared in early summer or midsummer. -from Authors",35,Journal,ar,Article,100,2,2,20308,undefined,0,FALSE,3,NA,NA
true,https://api.elsevier.com/content/abstract/scopus_id/0026312357,SCOPUS_ID:0026312357,2-s2.0-0026312357,"Life history and demography of the common mud turtle Kinosternon subrubrum in South Carolina, USA",Frazer N.,Ecology,00129658,72,6,2218-2231,1991-01-01,1991,10.2307/1941572,"For Kinosternon subrubrum in a fluctuating aquatic habitat data collected over 20 yr on survivorship and fecundity (clutch size, per capita clutch frequency) were assessed and compared to statistics for slider turtle Trachemys scripta in the same body of water and for yellow mud turtle K. flavescens in Nebraska. The annual survival rate for adult female Kinosternon (87.6%) is significantly higher than that of adult female Trachemys (77.4%). Male Kinosternon exhibit an annual survival rate (89.0%) significantly higher than that of male Trachemys (83.4%). The mean annual proportion of female Kinosternon that are reproductively active (50.7%) also is significantly higher than that of Trachemys (37.2%). Survival rate from the time eggs are laid by Kinosternon until hatchlings enter the aquatic environment (26.1%) is significantly higher than that for Trachemys (10.5%). Comparisons of findings with those for K. flavescens indicate that these geographically separate populations of congeneric species also differ substantially in age at maturity, mean generation time, and the mean proportion of females that are reproductively active in any given year. Differences were also apparent in mean clutch frequencies and adult survival rates. -from Authors",61,Journal,ar,Article,100,3,3,20308,undefined,0,FALSE,4,NA,NA
true,https://api.elsevier.com/content/abstract/scopus_id/0026312343,SCOPUS_ID:0026312343,2-s2.0-0026312343,Complex predator-prey interactions within an estuarine benthic community,Posey M.,Ecology,00129658,72,6,2155-2169,1991-01-01,1991,10.2307/1941567,"Examined the direct effects of predation by an omnivorous grass shrimp, Palaemonetes pugio, and the indirect effects for prey species of interactions between this shrimp and other predators in the benthic community of Chesapeake Bay. Grass shrimp predation reduced the densities of a variety of benthic fauna, but the effects varied seasonally and with prey size. Interactions between grass shrimp and other predators took two forms: reduction of an infaunal predator by shrimp predation and predation on grass shrimp by fish. Both types of interactions had a mixed effect on lower trophic levels, with enhancement of certain benthic prey and no effect on other species. Interactions between grass shrimp and their fish predators resulted in changes in shrimp distribution independent of changes in shrimp abundance, creating spatial refugia for shrimp prey. The dynamics of indirect interactions in this community are strongly affected by the omnivorous nature of the major predators. -from Authors",123,Journal,ar,Article,100,2,2,20308,undefined,0,FALSE,5,NA,NA
true,https://api.elsevier.com/content/abstract/scopus_id/0026312216,SCOPUS_ID:0026312216,2-s2.0-0026312216,Persistence of maternal nutrient effects in Plantago major: the third generation,Miao S.,Ecology,00129658,72,5,1634-1642,1991-01-01,1991,10.2307/1940963,"Maternal treatments were plants that 1) had received nutrient pulses in both the first and second generations, 2) had received a nutrient pulse only in the first generation, 3) had received a nutrient pulse only in the second generation, and 4) did not receive a nutrient pulse in either generation. Maternal environmental factors can affect plant phenotypic characters for at least three generations. The expression and the extent of these maternal effects varied with the resource condition experienced by the progeny, the intensity of competitive interactions, and life history stage. -from Authors",93,Journal,ar,Article,100,3,3,20308,undefined,0,FALSE,6,NA,NA
true,https://api.elsevier.com/content/abstract/scopus_id/0026311922,SCOPUS_ID:0026311922,2-s2.0-0026311922,Herbivory and tree stand composition: moose patch use in winter,Danell K.,Ecology,00129658,72,4,1350-1357,1991-01-01,1991,10.2307/1941107,Field experiments in winter used free-ranging Alces alces having access to artificial stands of trees. In these stands Scots pine Pinus sylvestris was mixed with either aspen Populus tremula or alder Alnus incana. Food selection appears to occur primarily at the tree level within stands. The level of decision might also be important for the performance of the plant species exploited. -from Authors,106,Journal,ar,Article,100,3,3,20308,undefined,0,FALSE,7,NA,NA
true,https://api.elsevier.com/content/abstract/scopus_id/0026311767,SCOPUS_ID:0026311767,2-s2.0-0026311767,Variation and change in behavioral ecology,Gordon D.,Ecology,00129658,72,4,1196-1203,1991-01-01,1991,10.2307/1941093,"Argues for the importance of time in the behavioral ecology of changing environments, ie how behavior changes in response to the time scale of environmental change, distinguishing between change, which occurs over time, and variation, which is measured instantaneously. After providing some definitions, to clarify what is meant here by time-dependent behavioral responses, variation, and change, the author uses some examples of the behavior of seed-eating ants to illustrate the ecological importance of time-dependent behavioral change. She then reviews how current work on behavior in changing environments treats questions of variation and change, arguing that this work emphasizes instantaneous variation rather than temporal change. Finally, considers how models of phenotypic response to changing environments, derived from other fields of evolutionary ecology, have explicitly considered temporal factors, and how these models might be extended to behavioral ecology. -from Author",15,Journal,ar,Article,100,1,1,20308,undefined,0,FALSE,8,NA,NA
true,https://api.elsevier.com/content/abstract/scopus_id/0026311682,SCOPUS_ID:0026311682,2-s2.0-0026311682,Resilience of lotic ecosystems to a light-elimination disturbance,Steinman A.D.,Ecology,00129658,72,4,1299-1313,1991-01-01,1991,10.2307/1941103,"Resilience of eight laboratory stream ecosystems was evaluated following a 92-d light elimination disturbance. Results are consistent with the theory that resilience is positively associated with the rate of nutrient input to a nutrient-limited system, but are inconsistent with the idea that resilience is positively associated with the addition of a herbivore trophic level to the system. Grazing intensity (density), as well as behavioural (vagility) and life history characteristics may need to be considered. -from Authors",37,Journal,ar,Article,100,5,5,20308,undefined,0,FALSE,9,NA,NA
true,https://api.elsevier.com/content/abstract/scopus_id/0026310210,SCOPUS_ID:0026310210,2-s2.0-0026310210,Conditions for a species to gain advantage from the presence of competitors,Stone L.,Ecology,00129658,72,6,1964-1972,1991-01-01,1991,10.2307/1941551,"Determined species interactions within the framework of the community to which they belong, using an ""inverse' method which evaluates all the effects that one species experiences from another, both direct and indirect. This method was used to study the classical ""competition community', where each species is considered (in the ""isolated pair' approach) to suffer from the presence of every other. The model takes account of the fluctuations in interaction coefficients that one must expect in the real world, both from one species pair to another, and as the effect of ambient environmental variations. The ""inverse' method finds that generally a high proportion (20-40%) of the interactions must be beneficial, or ""advantageous' when not lifted out of the community context in which they actually occur. The contrary case, called here ""hypercompetitive', in which each species suffers from every other species, can occur only if the environment is nearly constant, and the species closely akin to each other, with both of these conditions holding and persisting to a degree that must be considered implausible. -from Authors",92,Journal,ar,Article,100,2,2,20308,undefined,0,FALSE,10,NA,NA
true,https://api.elsevier.com/content/abstract/scopus_id/0026309783,SCOPUS_ID:0026309783,2-s2.0-0026309783,Source-sink carbon relations in two Panicum coloratum ecotypes in response to herbivory,Dyer M.,Ecology,00129658,72,4,1472-1483,1991-01-01,1991,10.2307/1941120,"Population samples of an African C4 grass, Panicum coloratum, were collected from two locations in the Serengeti grasslands varying in grazing intensity, one a high-grazing location (GA=grazing-adapted), the other a low-grazing location (NGA=nongrazing-adapted). Plants were subjected to light grazing pressure by a generalist-feeding North American grasshopper, Melanoplus sanguinipes. Pregrazing net C-fixation rates, translocation rates, and C-storage pools were identical for the two ecotypes. After grazing, overall C-fixation rates were 39% higher for GA plants, and remained higher than NGA rates throughout the experiment. Removal of <10% of initial green-leaf biomass by grazing at each grazing period produced major differences in carbon flux between the samples. Throughout the experiment GA plants produced and stored more C in leaves, stored less C in stem sinks, had higher phloem activity, and translocated more of the labile C to roots where it was stored in higher quantities. This suggests that storage of labile C reserves in sinks or pools readily accessible to the plant, which allows rapid mobilization after grazing, is an important element of adaptation to grazing. More storage of labile reserves in stems, characteristic of the NGA plants, may be advantageous in ungrazed habitats where there is vertical growth due to canopy closure and competition for light, but such storage makes those reserves accessible to grazers. -from Authors",90,Journal,ar,Article,100,1,1,20308,undefined,0,FALSE,11,NA,NA
true,https://api.elsevier.com/content/abstract/scopus_id/0026309780,SCOPUS_ID:0026309780,2-s2.0-0026309780,An invader alters germination and growth of a native dominant tree in Hawai'i,Walker L.,Ecology,00129658,72,4,1449-1455,1991-01-01,1991,10.2307/1941117,"Myrica faya, an introduced N-fixing tree, is rapidly invading volcanically disturbed forests in Hawaii Volcanoes National Park on Hawai'i. The authors investigated the direct effects of Myrica on the establishment and growth of the native Metrosideros polymorpha in a forest that is recovering from burial under a 10-200 cm deep layer of volcanic cinder. Number of Metrosideros seedlings found under Metrosideros trees, in the open, and under Myrica trees was 0.12/m2, 0.01/m1 and zero, respectively. Myrica litter inhibited Metrosideros germination in field experiments; germination occurred only when Myrica litter was removed. In open sites, addition of N-rich Myrica soils increased dry mass accumulation of transplanted Metrosideros seedlings. Shade from Myrica canopies increased survivorship and height growth but not dry mass accumulation of Metrosideros seedlings. Isolated Metrosideros trees increased diameter growth in response to N fertilizer but not in response to the presence of adjacent Myrica trees. Myrica basal diameter and height growth were consistently greater than that of Metrosideros in all size classes. Although Myrica does not readily invade closed, late-successional Metrosideros forests, on young, volcanically disturbed soils it is rapidly establishing dense, monospecific stands under which Metrosideros does not regenerate. -from Authors",145,Journal,ar,Article,100,2,2,20308,undefined,0,FALSE,12,NA,NA
true,https://api.elsevier.com/content/abstract/scopus_id/0026308137,SCOPUS_ID:0026308137,2-s2.0-0026308137,The influence of island and mainland lakeshore landscapes on boreal forest fire regimes,Bergeron Y.,Ecology,00129658,72,6,1980-1992,1991-01-01,1991,10.2307/1941553,"The fire history for the islands of Lake Duparquet, NW Quebec, was reconstructed and compared to that of the surrounding lakeshore. Dated fire scars revealed 82 fire years, with the earliest dated to 1593. Islands experienced more fire years (56) than the lakeshore (37), and fire years were uncorrelated. Most (72%) of the lakeshore stands were initiated by a few large fires (eight), whereas fire size on islands was variable, ranging from <10% to 100% of the total surface of the island. Fire occurrence and fire frequency decreased concurrently on the islands and the lakeshore starting c120 yr ago. The lakeshore fire cycle was 63 yr before 1870 and 99 yr since 1870, whereas the fire cycle on the islands was slightly longer (74 yr and 112 yr) during the same intervals. The long-term decrease in fire frequency of both the lakeshore and the islands was possibly driven by climatic change. Fire frequency was generally similar for all surficial deposits and fuel types on the lakeshore, whereas fires were more abundant in pine woodland growing on bedrock on the islands. Lakeshore fires were generally of lethal intensity, whereas both a long cycle of lethal fires and a shorter cycle of non-lethal fires were observed on 50% of the islands. The morphology and location of islands with both types of fires suggest that a higher frequency of lightning strikes resulted in a regime characterized by more frequent fires and fires of variable intensity. The specific fire regime observed in the island landscape may be the cause of the abundance of pines, whose presence may contribute, in turn, to the continuation of this regime of less intense and more frequent fires. It is suggested that fire regime in the boreal forest is controlled by long-term climate change at the regional scale, and by a strong interaction with landscape at the local scale. -from Author",243,Journal,ar,Article,100,1,1,20308,undefined,0,FALSE,13,NA,NA
true,https://api.elsevier.com/content/abstract/scopus_id/0026307783,SCOPUS_ID:0026307783,2-s2.0-0026307783,Translating foraging movements in heterogeneous environments into the spatial distribution of foragers,Turchin P.,Ecology,00129658,72,4,1253-1266,1991-01-01,1991,10.2307/1941099,"Uses data on movement tracks of Euphydryas anicia females to calculate butterfly residence indices in host-plant patches vs. nonhost environment. The predicted distribution of butterflies among host and nonhost areas differed by only 16% from the actual distribution, as documented by an independent data set. The model was also applied to data from 3 studies on insect movement and spatial distribution. -from Author",274,Journal,ar,Article,100,1,1,20308,undefined,0,FALSE,14,NA,NA
true,https://api.elsevier.com/content/abstract/scopus_id/0026306736,SCOPUS_ID:0026306736,2-s2.0-0026306736,Capture success and diet of cottid fishes: the role of predator morphology and attack kinematics,Norton S.F.,Ecology,00129658,72,5,1807-1819,1991-01-01,1991,10.2307/1940980,"Small-mouthed cottid species had significantly lower attack success on shrimp (20-41% vs. 45-56%) than did large-mouthed cottids. Both groups had similar high success rates in attacks on crabs on a sand surface: 93-100% for small-mouthed species and 85-95% for large-mouthed species. Most small-mouthed cottids used attack kinematics more typical of suction feeding (eg, shorter predator-prey distances and slower attack velocities) than did ram feeders. One small-mouthed species, Jordania zonope, used attack kinematics similar to those used by large-mouthed cottids in attacks on shrimp, and had higher capture success than other small-mouthed species, but had significantly lower capture success than large-mouthed species. All predators showed some ability to modify their attack kinematics when attacking prey with different escape tactics, but cottids showed little intraspecific variation in attack kinematics. -from Author",136,Journal,ar,Article,100,1,1,20308,undefined,0,FALSE,15,NA,NA
true,https://api.elsevier.com/content/abstract/scopus_id/0026306450,SCOPUS_ID:0026306450,2-s2.0-0026306450,Effects of cannibalism and alternative prey on population dynamics of Saduria entomon (Isopoda),Leonardsson K.,Ecology,00129658,72,4,1273-1285,1991-01-01,1991,10.2307/1941101,"In laboratory experiments the vulnerability to cannibalism was high for small individuals. The vulnerable phase lasted c9 mo in the deep zone, and 3 mo in the shallow zone. Large S. entomon individuals caught small conspecifics more efficiently than they caught the alternative prey Pontoporeia affinis (Amphipoda), and Neomysis integer (Mysidacea). Both relative and absolute densities affected the number of small conspecifics eaten. The preference for conspecifics increased with decreasing density of P. affinis. In a behavioral experiment a small but significant proportion of the small S. entomon specimens actively sensed and avoided aggregations of large conspecifics. Only a small amount of S. entomon, however, were found in the guts of large conspecifics from samples from the Gulf of Bothnia. Pontoporeia affinis was the dominant prey. Conditions for cannibalism differ between shallow and deep zones, favoring higher rates of cannibalism in the deep zone. Cannibalism has the potential to cause substantial mortality in S. entomon in the deep zone also when inflated mortality rates were accounted for. -from Author",90,Journal,ar,Article,100,1,1,20308,undefined,0,FALSE,16,NA,NA
true,https://api.elsevier.com/content/abstract/scopus_id/0026305343,SCOPUS_ID:0026305343,2-s2.0-0026305343,Moose browsing on Scots pine along a gradient of plant productivity,Danell K.,Ecology,00129658,72,5,1624-1633,1991-01-01,1991,10.2307/1940962,"Consumption of Pinus sylvestris twig biomass by Alces alces was highest on pines from the most productive habitat and lowest on those from the moderately productive habitat with an overstory of mature pines. Consumption was intermediate on pines from the least productive habitat and from the moderately productive habitat without an overstory. Pines from the highly productive habitat had greater N, P and K content and more readily degradable dry matter than did pines from the less productive habitats. Even though they provided a lower quality food for moose, pines in the less productive habitats generally suffered most from moose browsing. The slender twigs and the slow growth rate of these pines allow the moose to browse the main part of the needle-bearing twigs, following simulated winter browsing in living pines, pine mortality was greater in the less productive habitats. These findings largely explain why pines growing in habitats of low and medium productivity suffer more than pines in highly productive habitats, where the possibility for growth is better. Severe damage to stands growing on poor soils most probably arises where moose density is high and where moose have already harvested most of the available twigs from pines growing in the more productive habitats. The moose are then forced to utilize the suboptimal food resources available in less productive habitats. -from Authors",76,Journal,ar,Article,100,4,4,20308,undefined,0,FALSE,17,NA,NA
true,https://api.elsevier.com/content/abstract/scopus_id/0026304749,SCOPUS_ID:0026304749,2-s2.0-0026304749,The impact of a stream-dwelling harpacticoid copepod upon detritally associated bacteria,Perlmutter D.,Ecology,00129658,72,6,2170-2180,1991-01-01,1991,10.2307/1941568,"Natural densities of common stream-dwelling Attheyella spp reduced the density and biomass and increased the area-specific and cell-specific production of detritally associated bacteria. Bacterial density was reduced by as much as 58% and rod-shaped bacteria were reduced as much as 27%. Attheyella selectively removed larger rod-shaped bacteria. With copepods present, bacterial biomass was reduced as much as 45%. -from Authors",80,Journal,ar,Article,100,2,2,20308,undefined,0,FALSE,18,NA,NA
true,https://api.elsevier.com/content/abstract/scopus_id/0026304173,SCOPUS_ID:0026304173,2-s2.0-0026304173,"Crown asymmetry, treefalls, and repeat disturbance of broad-leaved forest gaps",Young T.,Ecology,00129658,72,4,1464-1471,1991-01-01,1991,10.2307/1941119,"Gap-edge trees were significantly more likely to fall into pre-existing gaps than in other directions in a moist tropical forest on Barro Colorado Island, Panama. Trees not at gap edges were more likely to fall away from near neighbors than toward them. Gross asymmetries of tree crowns were the rule rather than the exception for all trees. The crowns of most gap-edge trees were strongly asymmetrical into their adjoining gaps, and trees not at gap edges were strongly asymmetrical away from near neighbors. Trees had a strong and significant tendency to fall on these heavy sides. Such treefalls, and related limbfalls, can result in redisturbance of gaps and a retardation of gap regeneration. An analysis of 5 yr of canopy height data from a mapped 50-ha plot revealed that sites within larger gaps were significantly more likely to be redisturbed by secondary treefalls than were sites in the smallest gaps or nongap quadrats. -from Authors",156,Journal,ar,Article,100,2,2,20308,undefined,0,FALSE,19,NA,NA
