@_fa,prism:url,dc:identifier,eid,dc:title,dc:creator,prism:publicationName,prism:issn,prism:volume,prism:issueIdentifier,prism:pageRange,prism:coverDate,prism:coverDisplayDate,prism:doi,dc:description,citedby-count,prism:aggregationType,subtype,subtypeDescription,author-count.@limit,author-count.@total,author-count.$,source-id,fund-no,openaccess,openaccessFlag,entry_number,freetoread.value.$,freetoreadLabel.value.$
true,https://api.elsevier.com/content/abstract/scopus_id/0020470738,SCOPUS_ID:0020470738,2-s2.0-0020470738,"Effects of latitude, season, elevation, and microhabitat on field body temperatures of neotropical and temperate zone salamanders.",Feder M.E.,Ecology,00129658,63,6,1657-1664,1982-01-01,1982,10.2307/1940107,"Behavioral thermoregulation in the field is uncommon among the vast majority of tropical and temperate salamander species. Body temperatures of tropical salamanders closely parallel seasonal and altitudinal changes in the thermal environment. Body temperatures of salamanders show a complex relationship with latitude. Temperate zone species experience lower minimum temperatures than neotropical salamanders, but there are no consistent latitudinal trends in maximum body temperatures. Tropical plethodontids and ambystomatids show similar rates of decline in mean body temperature with increasing elevation, but ambystomatid temperatures are significantly warmer than plethodontid temperatures at the same elevation. Variation in body temperature is greater seasonally for temperate than tropical salamanders. At a given time or locality, however, variation in field body temperature among members of a population is similar for tropical and temperate salamanders. Interspecific thermal differences are not evident in sympatric species of tropical salamanders, and therefore may not serve as a means of niche segregation in tropical salamander communities.- from Authors thermoregulation plethodontids ambystomatids",52,Journal,ar,Article,100,2,2,20308,undefined,0,FALSE,1,NA,NA
true,https://api.elsevier.com/content/abstract/scopus_id/0020470054,SCOPUS_ID:0020470054,2-s2.0-0020470054,Competition within and between hatching cohorts of a treehole mosquito.,Livdahl T.,Ecology,00129658,63,6,1751-1760,1982-01-01,1982,10.2307/1940117,"Aedes triseriatus were reared under different conditions of larval density, concentration of natural treehole fluid, and in the presence or absence of a late-hatching cohort of larvae. Density and fluid concentration produced similar and independent significant competitive effects on each measure of cohort success, including female mass, development time, and survival to the adult stage, as well as on a composite index of performance. The sensitivity of first-cohort development time to high density and dilute fluid was reduced by the presence of the second cohort, and first-cohort survivorship responses to fluid concentration and density suggest an enhanced performance in dilute medium and intermediate density due to the addition of the second cohort. The second cohort experienced total mortality in the presence of high first-cohort density, dilute medium, or the incidental oviposition of another treehole mosquito, Anopheles barberi, and never matched the success of the first cohort.-from Author",82,Journal,ar,Article,100,1,1,20308,undefined,0,FALSE,2,NA,NA
true,https://api.elsevier.com/content/abstract/scopus_id/0020469890,SCOPUS_ID:0020469890,2-s2.0-0020469890,Niches of adult and juvenile deer mice ( Peromyscus maniculatus) in seral stages of coniferous forest.,Van Horne B.,Ecology,00129658,63,4,992-1003,1982-01-01,1982,10.2307/1937239,"In seral stages of coastal coniferous forest in SE Alaska, adult deer mice consumed a higher proportion of hard-bodied arthropods than did juveniles. Juveniles consumed a lower proportion of soft-bodied arthropods in high-density populations than in low-density populations. Adult high-density habitat had more cover than juvenile high-density habitat and was more favorable, as evidenced by a greater overwinter survival of both juveniles and adults. Intraspecfic competition appeared to be responsible for niche displacement of juvenile deer mice along food and habitat dimensions. -from Author",82,Journal,ar,Article,100,1,1,20308,undefined,0,FALSE,3,NA,NA
true,https://api.elsevier.com/content/abstract/scopus_id/0020468939,SCOPUS_ID:0020468939,2-s2.0-0020468939,"Local geographic distributions of bumblebees, near Crested Butte, Colorado: competition and community structure.",Pyke G.,Ecology,00129658,63,2,555-573,1982-01-01,1982,10.2307/1938970,"Seven of 12 species of bumblebees accounted for 97% of all bumblebees observed. These 7 species form 4 groups in terms of both their proboscis lengths and the corolla lengths of the plants they preferentially visit. Long-, medium-, and short-tongued groups were most often observed foraging at flowers with long, medium, and short corollas, respectively. Proboscis lengths tended to be very similar within each group but quite dissimilar between groups. The 4th group consisted of a single short-tongued species which has well- developed mandibles which enable it to rob nectar from many plants with long corollas. It also feeds legitimately on short-corolla flowers. When the data on bumblebees and plant distributions are combined with data on flower preferences, a pattern consistent with a competition hypothesis emerges. Within each proboscis-length group, bumblebee species tend to replace one another altitudinally in a manner consistent with the hypothesis.-from Author",126,Journal,ar,Article,100,1,1,20308,undefined,0,FALSE,4,NA,NA
true,https://api.elsevier.com/content/abstract/scopus_id/0020468085,SCOPUS_ID:0020468085,2-s2.0-0020468085,Role of body temperature in the seasonality of daily activity in tenebrionid beetles of eastern Washington.,Kenagy G.J.,Ecology,00129658,63,5,1491-1503,1982-01-01,1982,10.2307/1938875,"Eight species of tenebrionid were studied in the arid Artemisia steppe of eastern Washington. Some 97% of the body temperatures (Tb) obtained between April and October ranged between 10- 30oC (mean = 20o). Environmental temperature was strongly seasonal, and in order for beetles to be active within the same 10o-30o range of Tb at all seasons, their activity patterns were not coupled to the same phase of the daily light-dark cycle at all seasons. Rather, beetles were strongly day-active in early spring and fall, mostly active during twilight and at night in the midst of summer, and active bimodally (morning and evening) in between these seasons. Tb's predicted with a biophysical model correlate significantly with actually measured Tb's and can be used to predict satisfactorily the times of day when beetles are active. The tenebrionid beetles studied have a range of Tb's during activity 10o-15o lower than that of many other terrestrial insects, including other insects in the same habitat and other species of tenebrionids found in more extreme desert environments. Tenebrionids in the eastern Washington steppe may have evolved a low range of active Tb's as part of a strategy by which the season of activity is expanded into earlier and later times of year, when both quantity and quality of food may be greater.-from Authors",27,Journal,ar,Article,100,2,2,20308,undefined,0,FALSE,5,NA,NA
true,https://api.elsevier.com/content/abstract/scopus_id/0020468048,SCOPUS_ID:0020468048,2-s2.0-0020468048,Pollination of Luehea ( Tiliaceae) in Costa Rican deciduous forest.,Haber W.,Ecology,00129658,63,6,1740-1750,1982-01-01,1982,10.2307/1940116,"The 3 species of Luehea studied all produce hermaphroditic flowers exhibiting nocturnal anthesis, anther dehiscence, nectar secretion, and fragrances consistent with adaptation for nocturnal moth pollination. Luehea candida, flowering during the wet season, has self-incompatible flowers pollinated primarily by sphingid moths. Generalist diurnal visitors, including stingless bees, flies and butterflies, were also common flower visitors, but they were ineffective pollinators. Luehea candida rejects pollen from nearby conspecifics as a means of limiting inbreeding resulting from pollination by poor outcrossers such as stingless bees. The principal pollinators of L. seemannii, which flowers during the dry season, were the same types of diurnal visitors that contributed nothing to pollination success of L. candida. Nocturnal moths were low in abundance during the dry season and pollinated few flowers. Individuals of the deciduous forest population of L. seemannii ranged from partially to fully self-compatible, though an evergreen forest population was self-incompatible. The partial breakdown of incompatibility, diurnal pollinators, and nectar analysis of L. seemannii suggest an ongoing evolutionary shift to diurnal pollination resulting from the scarcity of nocturnal pollinators and selection by diurnal insects, especially stingless bees, in the deciduous forest.-from Authors",44,Journal,ar,Article,100,2,2,20308,undefined,0,FALSE,6,NA,NA
true,https://api.elsevier.com/content/abstract/scopus_id/0020468047,SCOPUS_ID:0020468047,2-s2.0-0020468047,Ontogeny of water snake foraging ecology.,Mushinsky H.,Ecology,00129658,63,6,1624-1629,1982-01-01,1982,10.2307/1940102,"Ontogenetic changes in prey consumption are most striking in Nerodia erythrogaster and N. fasciata. Prey of these 2 species changes from fish to frogs as the snakes exceed a snout-vent length of 50 cm. Nerodia rhombifera and N. cyclopion primarily eat fish throughout their life. However, with maturity and increased body size both species change portions of their diets. Nerodia rhombifera preys upon larger fish which occupy deeper, open-water habitats, when the snakes exceed 80 cm. Nerodia cyclopion eats a larger proportion of centrarchid fish as its body size increases. Small prey are found in the stomachs of most size-classes of all 4 snake species. All 4 species eat larger prey as they mature. However, the largest individuals are females, and in 2 of the 4 species the large females eat a different array of prey than smaller conspecific males. The size sexual dimorphism does not reduce the overlap in the diets of the 2 species that eat anurans as adults.-from Authors",143,Journal,ar,Article,100,3,3,20308,undefined,0,FALSE,7,NA,NA
true,https://api.elsevier.com/content/abstract/scopus_id/0020466528,SCOPUS_ID:0020466528,2-s2.0-0020466528,"Ecological consequences of song matching: breeding success and intraspecific song mimicry in indigo buntings ( Passerina cyanea, Michigan).",Payne R.B.,Ecology,00129658,63,2,401-411,1982-01-01,1982,10.2307/1938958,"Adult male Passerina cyanea studied in southern Michigan, had higher success than 1st-yr males. First-year males that matched the song of an adult on a neighboring territory had significantly greater mating success, nesting success, and fledging success than did nonmatching 1st-yr males. First-year males with blue plumage did better than 1st-yr males with browner plumage. The advantage in birds that mimic was restricted to birds that copy an adult and remain on a territory near the song model, and was most pronounced in the mimics that resembled the song model in plumage as well as in song. The increased success of song mimics apparently resulted from matching the adult neighbor's song and not simply from a behavioral maturation of song learning.-from Author",129,Journal,ar,Article,100,1,1,20308,undefined,0,FALSE,8,NA,NA
true,https://api.elsevier.com/content/abstract/scopus_id/0020463488,SCOPUS_ID:0020463488,2-s2.0-0020463488,Overlap summary indices and the detection of community structure.,Thomson J.,Ecology,00129658,63,2,274-277,1982-01-01,1982,10.2307/1938941,"It is often desirable to compare the amount or intensity of overlaps in different communities. The most commonly used index for such comparisons, mean pairwise overlap, is often unsuitable. Alternate approaches are suggested.-from Authors",9,Journal,ar,Article,100,2,2,20308,undefined,0,FALSE,9,NA,NA
true,https://api.elsevier.com/content/abstract/scopus_id/0020462775,SCOPUS_ID:0020462775,2-s2.0-0020462775,"Algal dynamics and trophic interactions in the recent history of Frains Lake, Michigan.",Carney H.,Ecology,00129658,63,6,1814-1826,1982-01-01,1982,10.2307/1940123,"Analysis of a 10-m sediment core taken from the center of Frains Lake, Michigan, reveals distinct changes in diatom and chrysophycean cyst assemblages following European settlement c.1830 AD. The presettlement planktonic diatom flora was dominated by Cyclotella species. Postsettlement flora was dominated first by eurytopic taxa, including Melosira granulata, Fragilaria construens, and F. crotonensis, then by a complex of small Stephanodiscus species, particularly S. hantzschii. Shifts in the algal assemblage and other resources have influenced zooplankton community structure.-from Author",33,Journal,ar,Article,100,1,1,20308,undefined,0,FALSE,10,NA,NA
true,https://api.elsevier.com/content/abstract/scopus_id/0020462770,SCOPUS_ID:0020462770,2-s2.0-0020462770,Microhabitat utilization and foraging behavior of bipedal and quadrupedal heteromyid rodents.,Thompson S.D.,Ecology,00129658,63,5,1303-1312,1982-01-01,1982,10.2307/1938858,"Quantified foraging behavior in Dipodomys deserti, D. merriami and Perognathus longimembris in two Mojave Desert communities. D. merriami and P. longimembris do not partition shrub and open microhabitats, and all 3 species concentrate their foraging efforts (>75%) near or beneath the canopies of desert shrubs. P. longimembris avoids open areas and utilizes shrubs in a relatively coarse-grained fashion. D. merriami and D. deserti frequently traverse open areas at high speeds and hence utilize shrubs in a relatively fine-grained manner. Beneath shrubs, D. merriami and D. deserti are more active and discrete in their foraging than is P. longimembris; both Dipodomys search for large clumps of seeds, while P. longimembris forages slowly and continuously, taking individual seeds from scattered dispersions. The distinctive morphology of Dipodomys is interpreted as an adaptation that allows fine-grained use of desert shrubs in the face of high predation risk during intershrub transits. Differences in heteromyid body sizes may also reflect 2 foraging strategies: small size reduces energy demands, and thus lowers the need to move between shrubs and reduces the need for predator avoidance; larger size permits year-round activity (avoidance of torpor), reduces susceptibility to starvation, increases the range of thermal tolerance, and generally increases abilities to cope with variations in environmental parameters.- from Author",80,Journal,ar,Article,100,1,1,20308,undefined,0,FALSE,11,NA,NA
true,https://api.elsevier.com/content/abstract/scopus_id/0020462345,SCOPUS_ID:0020462345,2-s2.0-0020462345,Habitat selection and its effect on reproductive output in the herring gull in Newfoundland.,Pierotti R.,Ecology,00129658,63,3,854-868,1982-01-01,1982,10.2307/1936804,"Larus argentatus nesting in 3 different habitats (designated puffin, rocky, and meadow) were compared with regard to several reproductive parameters. More pairs nested in rocky habitat, fewer pairs in puffin habitat, than expected from a random distribution. In 1977, a year of low food availability, pairs in rocky habitat laid and hatched eggs earlier than in the other habitats. In 1978, when food was more abundant, gulls in rocky habitat laid heavier eggs. In both 1977 and 1978, chicks from rocky habitat grew at the fastest rate and were heavier than chicks in the other habitats. Female gulls in rocky habitat were capable of producing significantly more eggs than their counterparts in meadow and puffin habitats. Despite the better condition of gulls in rocky habitat, however, herring gull pairs in puffin habitat fledged as many chicks per nest as pairs in rocky habitat in 1977 and 1978. Gulls in meadow habitat fledged the fewest chicks per nest. Within habitats, chick survival was strongly correlated with early laying dates and high rates of growth, but there was also a large residual effect which was probably due to differences in the habitats. These differences are probably due to crowding and socially induced mortality in rocky habitat, and to the presence of predatory great black-backed gulls L. marinus in meadow habitat. Increasing density in a preferred habitat can create a situation whereby fitness may actually be greater in a less-preferred habitat.-from Author",77,Journal,ar,Article,100,1,1,20308,undefined,0,FALSE,12,all,All Open Access
true,https://api.elsevier.com/content/abstract/scopus_id/0020461665,SCOPUS_ID:0020461665,2-s2.0-0020461665,"The population biology of Chamaelirium luteum, a dioecious member of the lily family: two-sex population projections and stable population structure.",Meagher T.,Ecology,00129658,63,6,1701-1711,1982-01-01,1982,10.2307/1940112,"A 2-sex size-specific population projection model is developed for this long-lived dioecious plant. Differences between sex classes (male, female, juvenile) in size-specific survivorship and size transitions are taken into account, as well as particular differences between males and females in age at first reproduction, flowering schedules and reproductive output per individual. The populations studied are near a stable structure and should show only modest changes in population size from year to year. -from Author",34,Journal,ar,Article,100,1,1,20308,undefined,0,FALSE,13,NA,NA
true,https://api.elsevier.com/content/abstract/scopus_id/0020461658,SCOPUS_ID:0020461658,2-s2.0-0020461658,Patterns of disturbance in some old-growth mesic forests of eastern North America.,Runkle J.,Ecology,00129658,63,5,1533-1546,1982-01-01,1982,10.2307/1938878,"Canopy openings covered 9.5% of total land area. New gaps were formed at an average rate of 1% of total land area per year; old gap area closed at a similar rate primarily by sapling height growth. With increased gap size, vegetation within gaps increased in woody species diversity, total basal area and total number of stems. Stems also showed accelerated growth into larger size classes. As gaps aged, stems grew into larger size classes and basal area increased. Some species survived and became established in fairly small gaps (50-100 m2) Although in large gaps (up to 2009 m2), these species usually increased in total number of stems and basal area, they declined in importance relative to species which rarely survived in small gaps but grew rapidly in large gaps. The disturbance regimes in the forests studied favored tolerant species but allowed opportunists to persist at low densities.-from Author",693,Journal,ar,Article,100,1,1,20308,undefined,0,FALSE,14,NA,NA
true,https://api.elsevier.com/content/abstract/scopus_id/0020461638,SCOPUS_ID:0020461638,2-s2.0-0020461638,Mat-water phosphorus exchange in an acid bog lake ( Sphagnum).,Hooper F.F.,Ecology,00129658,63,5,1411-1421,1982-01-01,1982,10.2307/1938868,"In early spring, with low water temperatures, P moves along isotherms from the Sphagnum mat directly to the hypolimnion and bypasses the thermocline. In late spring movement is to the epilimnion and thermocline. Maximum P concentrations in the mat were above a compacted zone at the 2-m depth. This maximum coincided with an open-water P maximum at 2 m, which indicated that there were frequent inputs of mat P to this stratum. The direction of net P movement was largely controlled by the water balance of the system. During periods of high precipitation, low temperatures and low evapotranspiration, found in early spring, net P movement was toward the lake. During midsummer high evapotranspiration of the mat vegetation increased the storage capacity of the mat. This reduced P flow towards the lake so that net flow was often toward the mat.-from Authors",9,Journal,ar,Article,100,2,2,20308,undefined,0,FALSE,15,NA,NA
true,https://api.elsevier.com/content/abstract/scopus_id/0020461635,SCOPUS_ID:0020461635,2-s2.0-0020461635,The application of a new method for the determination of particle deposition onto a lake.,Banks H.,Ecology,00129658,63,5,1254-1258,1982-01-01,1982,10.2307/1938852,"For any material liberated from a watershed and deposited by air onto a lake, there is likely to be a relationship between distance from shore and quantity of particle deposition. A new method of estimating total particle deposition onto a lake surface was developed. The method is based on the distance vs. quantity relationship, and uses planimetry to integrate lake surface areas at various distances from shore. The method was applied to Tsuga canadensis and Pinus spp. pollen deposition onto a small lake on the Canadian Shield.-from Authors",0,Journal,ar,Article,100,2,2,20308,undefined,0,FALSE,16,NA,NA
true,https://api.elsevier.com/content/abstract/scopus_id/0020461629,SCOPUS_ID:0020461629,2-s2.0-0020461629,"Abalones, shells, and sea otters: dynamics of prey populations in central California.",Hines A.,Ecology,00129658,63,5,1547-1560,1982-01-01,1982,10.2307/1938879,"Densities, sizes, and species composition of abalones, Haliotis rufescens, H. walallensis and H. kamtschatkana, remained stable from 1972-1981 within a sea otter Enhydra lutris habitat. Almost all censused abalones were in crevices, with densities averaging 1.8 animals/10 m2. Live abalones and empty abalone shells resulting primarily from predation by sea otters averaged 7.5 and 9 cm in length, respectively. Out of the range of sea otters, live abalones were over twice as large and were numerous outside crevices (when protected from human predation). Sea otters selected abalones larger than were proportionately available in crevices, and they broke many large shells with stone tools. An average of 55 freshly produced empty abalone shells, equivalent to approx 20% of the crevice population of live abalones, were found each month over a 12-mo period. The high production rates of abalones must result from high rates of juvenile recruitment and growth, and are indicative of a highly dynamic population, with a turnover time of 1-3 yr.-from Authors",63,Journal,ar,Article,100,2,2,20308,undefined,0,FALSE,17,NA,NA
true,https://api.elsevier.com/content/abstract/scopus_id/0020459149,SCOPUS_ID:0020459149,2-s2.0-0020459149,Fire and mammalian secondary succession in an Australian coastal heath.,Fox B.,Ecology,00129658,63,5,1332-1341,1982-01-01,1982,10.2307/1938861,"A species-rich small-mammal community on 7 ha of diverse coastal heath in Myall Lakes National Park, New South Wales, was studied for 7 mo before the area burned in a wildfire (August 1974) and has subsequently been monitored for 5 yr. Species regularly trapped were the dasyurids Antechinus stuartii and Sminthopsis murina, the peramelid Isoodon macrourus, and the native murids Pseudomys novaehollandiae and P. gracilicaudatus, together with the introduced Mus musculus. Pseudomys species, M. musculus and S. murina reached greater abundance on early seral stages, while the abundance there of both Rattus fuscipes and R. lutreolus was much reduced. Species reach peak abundance in an orderly replacement sequence exhibiting a mammalian secondary succession. A habitat accommodation model is proposed with species entering the succession and reaching peak abundance as externally controlled changes in the vegetation fulfil the habitat requirements of each species. Species leave the succession or are greatly reduced in abundance when these local physical conditions move out of the optimal range for the species. Regeneration time may represent a resource axis subdivided by community members in this secondary succession.-from Author",257,Journal,ar,Article,100,1,1,20308,undefined,0,FALSE,18,NA,NA
true,https://api.elsevier.com/content/abstract/scopus_id/0020459107,SCOPUS_ID:0020459107,2-s2.0-0020459107,A neighborhood model of annual-plant interference.,Weiner J.,Ecology,00129658,63,5,1237-1241,1982-01-01,1982,10.2307/1938849,"A model is constructed in which seed production by individual annual plants within a population is a function of the number and species of individuals within each of several concentric neighborhoods. The effect of increasing competition is to reduce seed production in a hyperbolic fashion, and the contribution of each individual to this effect is in inverse proportion to the square of its distance from the test individual. A simple monospecific version of this model was tested on populations of 2 annual knotweeds. A least-squares fit accounted for >80% of variation in seed production. This model provides an alternative to density in describing plant populations. A monospecific aggregated version can be seen as an extension of the inverse-yield law.-from Author",158,Journal,ar,Article,100,1,1,20308,undefined,0,FALSE,19,NA,NA
true,https://api.elsevier.com/content/abstract/scopus_id/0020459103,SCOPUS_ID:0020459103,2-s2.0-0020459103,A critique of the analytical methods used in examining decomposition data obtained from litter bags.,Wieder R.K.,Ecology,00129658,63,6,1636-1642,1982-01-01,1982,10.2307/1940104,"Analysis of variance is useful if the intent is to compare treatment means, but does not directly test hypotheses regarding decomposition rates. If the intent is to determine rate constants, then fitting mathematical models to data is the more appropriate analysis. Single and double exponential models best describe the loss of mass over time with an element of biological realism.-from Authors",702,Journal,ar,Article,100,2,2,20308,undefined,0,FALSE,20,all,All Open Access
