@_fa,prism:url,dc:identifier,eid,dc:title,dc:creator,prism:publicationName,prism:issn,prism:volume,prism:issueIdentifier,prism:pageRange,prism:coverDate,prism:coverDisplayDate,prism:doi,dc:description,citedby-count,prism:aggregationType,subtype,subtypeDescription,author-count.@limit,author-count.@total,author-count.$,source-id,fund-no,openaccess,openaccessFlag,entry_number,freetoread.value.$,freetoreadLabel.value.$
true,https://api.elsevier.com/content/abstract/scopus_id/0024221357,SCOPUS_ID:0024221357,2-s2.0-0024221357,Constraints on reproductive investment: a comparison between aquatic and terrestrial snakes,Shine R.,Evolution,00143820,42,1,17-27,1988-01-01,1988,10.1111/j.1558-5646.1988.tb04104.x,"Biomechanical models suggest that reproductive investment in aquatic snakes may be constrained by the important locomotory role of the posterior part of the body during swimming: carying eggs or offspring in this region would more seriously impair locomotory efficiency in swimming than in terrestrial lateral undulation. If this constraint is important, aquatic snakes would be expected to have lower clutch masses relative to body mass than terrestrial species and to carry the clutch in a more anterior position. Comparisons between aquatic and terrestrial snakes of several families confirm predictions. Phylogenetic analysis suggests that his pattern of reduced reproductive investment has evolved independently in each of the 4 ophidian lineages that contain marine species (acrochordids, homalopsine colubrids, laticaudid sea snakes, and hydrophiid sea snakes). Although if thus seems likely that these patterns represent adaptations to aquatic versus terrestrial life, the nature of the selective forces involved remains speculative. The hypothesis based on locomotory impairment of gravid females has better empirical support than any alternative hypothesis, as it successfully predicts modifications in the position of the clutch within the female's body, as well as overall reduced reproductive investment. -from Author",75,Journal,ar,Article,100,1,1,22104,undefined,1,TRUE,21,all,All Open Access
true,https://api.elsevier.com/content/abstract/scopus_id/0024219380,SCOPUS_ID:0024219380,2-s2.0-0024219380,Evolution of higher feeding rate in Drosophila due to density- dependent natural selection,Joshi A.,Evolution,00143820,42,5,1090-1093,1988-01-01,1988,10.1111/j.1558-5646.1988.tb02527.x,"Reports on differences in rates of sclerite retraction in larvae of r and K-selected D. melanogaster populations, which could be a significant component of the earlier recorded differences in larval ability to compete for limiting food resources. -from Authors",80,Journal,ar,Article,100,2,2,22104,undefined,1,TRUE,22,all,All Open Access
true,https://api.elsevier.com/content/abstract/scopus_id/0024218926,SCOPUS_ID:0024218926,2-s2.0-0024218926,Genetic variation and juvenile survival in red deer,Pemberton J.M.,Evolution,00143820,42,5,921-934,1988-01-01,1988,10.1111/j.1558-5646.1988.tb02511.x,"Survival of Cervus elaphus calves to 2 yr of age was examined in relation to electrophoretic variation in a population on the Scottish island of Rhum. All 3 polymorphic loci examined, Mpi, Idh-2 and Trf, are significantly associated with juvenile survival. -from Authors",58,Journal,ar,Article,100,5,5,22104,undefined,1,TRUE,23,all,All Open Access
true,https://api.elsevier.com/content/abstract/scopus_id/0024218507,SCOPUS_ID:0024218507,2-s2.0-0024218507,Estimating the form of natural selection on a quantitative trait,Schluter D.,Evolution,00143820,42,5,849-861,1988-01-01,1988,10.1111/j.1558-5646.1988.tb02507.x,"The fitness function f related fitness of individuals to the quantitative trait under natural selection. The function is useful in predicting fitness differences among individuals and in revealing whether an optimum is present within the range of phenotypes in the population. It may also be thought of as describing the ecological environment in terms of the trait. Quadratic regression will approximate the fitness function from data, but the method does not reliably indicate features of f such as the presence of modes (stabilizing selection) or dips (disruptive selection). An alternative procedure which requires no a priori model for the function, provides a nonparametric estimate of f, and it can be used to suggest an appropriate parametric model. -from Author",552,Journal,ar,Article,100,1,1,22104,undefined,1,TRUE,24,all,All Open Access
true,https://api.elsevier.com/content/abstract/scopus_id/0024218454,SCOPUS_ID:0024218454,2-s2.0-0024218454,Unisexual/bisexual breeding complexes in Poeciliidae: why do males copulate with unisexual females?,Kawecki T.J.,Evolution,00143820,42,5,1018-1023,1988-01-01,1988,10.1111/j.1558-5646.1988.tb02520.x,"Unisexual poeciliid fishes live as sexual parasites in breeding complexes with related bisexual species. Males of the host species copulate with unisexual females as well as with conspecifics, thus maintaining the unisexuals. Copulation with a unisexual offers no selective benefit for a male. A model is proposed that provides an explanation in terms of evolutionary ecology for why males copulate with unisexuals. It assumes that, before copulation, a male attempts to identify a female as conspecific or not but that the correctness of the identification depends on the length of time spent on the identification process. Some cost is involved in the passage of time, so an optimal time spent on identification must exist. Because subordinate males risk being driven away by dominant males, the optimal time is longer for males at the top of the dominance hierarchy than for males at the bottom. Such an optimal strategy gives a male the greatest possible average net benefit from a mating attempt, given his social status; this is a ""best of a bad job' strategy. -Author",20,Journal,ar,Article,100,1,1,22104,undefined,1,TRUE,25,all,All Open Access
true,https://api.elsevier.com/content/abstract/scopus_id/0024200414,SCOPUS_ID:0024200414,2-s2.0-0024200414,Alpha-chain hemoglobin polymorphisms are correlated with altitude in the deer mouse Peromyscus maniculatus,Synder L.R.G.,Evolution,00143820,42,4,689-697,1988-01-01,1988,10.1111/j.1558-5646.1988.tb02487.x,"In deer mouse populations in W USA, alpha-globin haplotype frequency, beta-globin haplotype frequency, and base-line blood oxygen affinity (measured after acclimation to low altitude) show strong correlations with native altitude. Correlations improve when an average regional altitude is substituted for the local altitude at collection sites. This substitution roughly compensates for the effects of gene exchange between populations in areas of highly variable topography. -from Authors",42,Journal,ar,Article,100,3,3,22104,undefined,1,TRUE,26,all,All Open Access
true,https://api.elsevier.com/content/abstract/scopus_id/0024200399,SCOPUS_ID:0024200399,2-s2.0-0024200399,"Field measurements of natural and sexual selection in the fungus beetle, Bolitotherus cornutus",Conner J.,Evolution,00143820,42,4,736-749,1988-01-01,1988,10.1111/j.1558-5646.1988.tb02492.x,"Lifetime fitness of a group of males of this tenebrionid way partitioned into: lifespan, attendance at the mating area, number of females courted, number of copulations attempted, and number of females inseminated. Three phenotypic characters were measured (elytral length, horn length, and weight). There were strong positive correlations among the 3 characters, but only horn length was under significant direct selection. This selection was for longer horns and was due mainly to differences in lifespan and access to females. -from Author",92,Journal,ar,Article,100,1,1,22104,undefined,1,TRUE,27,all,All Open Access
true,https://api.elsevier.com/content/abstract/scopus_id/0024198760,SCOPUS_ID:0024198760,2-s2.0-0024198760,Sturm und Drang and the evolutionary synthesis,Futuyma D.J.,Evolution,00143820,42,2,217-226,1988-01-01,1988,10.1111/j.1558-5646.1988.tb04126.x,"Develops the theses that many of the criticisms of evolutionary theory are unwarranted and that, although evolutionary biology suffers from some serious schisms, these nevertheless present exciting challenges to the development of this field. -from Author",18,Journal,ar,Article,100,1,1,22104,undefined,1,TRUE,28,all,All Open Access
true,https://api.elsevier.com/content/abstract/scopus_id/0024198487,SCOPUS_ID:0024198487,2-s2.0-0024198487,Spatial genetic structure in a population of Psychotria nervosa. I. Distribution of genotypes,Dewey S.E.,Evolution,00143820,42,4,834-838,1988-01-01,1988,10.1111/j.1558-5646.1988.tb02504.x,Analyzes the spatial distribution of alleles at 2 polymorphic enzyme loci in a natural population of the distylous Psychotria nervosa (Rubiaceae) in S Florida. -from Authors,87,Journal,ar,Article,100,2,2,22104,undefined,0,FALSE,29,NA,NA
true,https://api.elsevier.com/content/abstract/scopus_id/0024198472,SCOPUS_ID:0024198472,2-s2.0-0024198472,The effects of the mating system on progeny performance in Hyla crucifer (Anura: Hylidae),Woodward B.D.,Evolution,00143820,42,4,784-794,1988-01-01,1988,10.1111/j.1558-5646.1988.tb02496.x,"Males from the upper half of the body-size distribution sired offspring with 6% higher growth rates than those of offspring sired by males from the lower half of the body-size distribution. Offspring sired by males that obtained mates in nature had 3% higher growth rates than their half-siblings sired by males that did not mate in nature. Genetic variation for larval-period duration and size at metamorphosis was detected, but neither mating status nor body size of sire could be used to predict values of these traits in the progeny. Although all 3 larval traits can affect fitness, there was no evidence that the offspring of some sires would always outperform the offspring of others in all 3 traits. The predictable associations between adult male size and larval growth rate means that the H. crucifer mating system would have a directional effect on larval growth rate if male body size influences the outcome of male-male competition or female choice. -from Authors",25,Journal,ar,Article,100,3,3,22104,undefined,1,TRUE,30,all,All Open Access
true,https://api.elsevier.com/content/abstract/scopus_id/0024198251,SCOPUS_ID:0024198251,2-s2.0-0024198251,The cost of heavy-metal tolerance: an example,Wilson J.B.,Evolution,00143820,42,2,408-413,1988-01-01,1988,10.1111/j.1558-5646.1988.tb04146.x,"In populations of Agrostis capillaris seedlings are very rare, and the wide distribution of clones suggests that much of its reproduction is vegetative. When reproduction is vegetative, selection acts to maximize relative growth rate (RGR). On heavy-metal contaminated soils, tolerant genotypes have a higher RGR than do nontolerant genotypes; in fact, the latter quickly die. The question is whether tolerance imposes a cost involving lower RGR and, hence, selective disadvantage on more favorable soils. This question is addressed by estimating tolerance and RGR in near-optimum conditions, for a range of A. capillaris genotypes, mostly from mid-Wales. -from Author",85,Journal,ar,Article,100,1,1,22104,undefined,1,TRUE,31,all,All Open Access
true,https://api.elsevier.com/content/abstract/scopus_id/0024197642,SCOPUS_ID:0024197642,2-s2.0-0024197642,Heritability and selection on clutch size in Darwin's medium ground finches (Geospiza fortis),Gibbs H.L.,Evolution,00143820,42,4,750-762,1988-01-01,1988,10.1111/j.1558-5646.1988.tb02493.x,"Quantitative-genetic analyses were carried out on Isla Daphne Major using the 1st clutch laid by a female in a given year. Repeatability of clutch size was small (≤8%) and nonsignificant in all cases. Sib-sib analyses and parent-offspring regressions gave no evidence of a significant additive genetic component to clutch-size variation. Slopes of mother-daughter's clutch size. There was a small positive relationship between female age and clutch size but no effect of male or female body size or of large-scale differences in habitat quality on clutch size. Selection on clutch size was generally directional and positive: in almost all years in which successful breeding occurred, large clutches tended to fledge more chicks and produce more young surviving to the following year, possibly because there was no trade-off between clutch size and the weights of individual chicks at fledging. Thus, sustained directional selection for large clutch size may have reduced additive genetic variation in clutch size to low levels in this population. The size of a female's clutch may be primarily determined by unidentified proximate environmental factors which vary from year to year, rather than by any long-term optimization of clutch size with respect to adult survival. -from Author",24,Journal,ar,Article,100,1,1,22104,undefined,1,TRUE,32,all,All Open Access
true,https://api.elsevier.com/content/abstract/scopus_id/0024197474,SCOPUS_ID:0024197474,2-s2.0-0024197474,Queen number in colonies of social Hymenoptera as a kin-selected adaptation,Nonacs P.,Evolution,00143820,42,3,566-580,1988-01-01,1988,10.1111/j.1558-5646.1988.tb04161.x,"Examines factors that favor multiple egg-laying queens (polygyny) in eusocial Hymenoptera colonies. There is a theoretical conflict of interest between founding queens and their daughter workers over how many and which individuals should be the extra reproductives. Both castes should prefer their full sisters. Therefore, primary polygyny (multiple related foundresses) may favor queens while secondary polygyny (related queens added to mature colonies) may favor workers. Polygyny, itself, was favored by high colony survivorship and low probability of queens contributing eggs to successive broods. Polygyne colonies, however, did not need to produce more offspring per brood to be selectively favored; they could be half as productive per brood as monogyne ones and still have higher lifetime fitness under some conditions. For reproductive data from 8 ant species with both monogyne and polygyne colonies, the model generates results that are consistent with a kin-selection explanation of polygyny in all of them. It is proposed that queen number is an ecologically flexible trait that is influenced by a broad set of factors but is not necessarily linked to specific habitat types. Neither polygyny nor monogyny may be reliably considered as the primitive or ancestral Hymenopteran social system. The optimal queen number within a species may evolutionarily increase or decrease, depending on the direction of environmental change. -from Author",112,Journal,ar,Article,100,1,1,22104,undefined,0,FALSE,33,NA,NA
true,https://api.elsevier.com/content/abstract/scopus_id/0024195637,SCOPUS_ID:0024195637,2-s2.0-0024195637,Mixed mating systems in Hawaiian Bidens (Asteraceae),Sun M.,Evolution,00143820,42,3,516-527,1988-01-01,1988,10.1111/j.1558-5646.1988.tb04157.x,"Protandry and male sterility promote outcrossing, while self-compatibility and geitonogamy contribute to inbreeding. The combination of these floral mechanisms results in a mixed mating system in all species studied. Outcrossing rates of 15 populations of the 11 species ranged from 0.43-0.88, averaging 0.65. Apparent selfing rates of females ranged from 0-0.25 in 7 gynodioecious populations, suggesting that there is variation in the level of biparental inbreeding among populations. Presence of females increased the level of outcrossing by an average of 9% in gynodioecious populations. Efficiency of gynodioecy as an outcrossing mechanism largely depends on the current outcrossing rate of hermaphrodites, frequency of females, and extent of genetic substructuring in populations. On average, autogamy contributed 4%, geitonogamy contributed 24%, and consanguineous mating contributed 15% to the realized selfing rate (43%) in the hermaphrodites of these species. -from Authors",53,Journal,ar,Article,100,2,2,22104,undefined,0,FALSE,34,NA,NA
true,https://api.elsevier.com/content/abstract/scopus_id/0024195552,SCOPUS_ID:0024195552,2-s2.0-0024195552,"The consequences of brood size for breeding blue tits. III. Measuring the cost of reproduction: survival, future fecundity, and differential dispersal",Nur N.,Evolution,00143820,42,2,351-362,1988-01-01,1988,10.1111/j.1558-5646.1988.tb04138.x,"A population of Parus caeruleus breeding in Wytham Wood, England, was manipulated over 3 yr. Pairs were randomly assigned 3, 6, 9, 12, or 15 nestlings; nestlings were exchanged soon after hatching. Survival of adult females declined significantly with increasing brood size in 2 out of 3 yr; there was significant year-to-year variation in the relationship of recapture rate to brood size. Mean female recapture rates (averaged over 3 yr) declined in a linear fashion. There was no significant linear or curvilinear relationship between male-recapture rate and brood size in any of the three years nor was there a significant linear or curvilinear relationship for averaged data. Nevertheless, recapture proportions for males differed significantly with respect to brood size. There was no relationship between brood size and dispersal distance within the study area for either sex, except that females given broods of 3 were significantly more likely to move >300 m than were those given broods of 6-15 young. Both males and females showed evidence of a cost with respect to future fecundity: as brood size increased, number of surviving offspring produced in the following year decreased from 1.5-1.6 (for adults that had reared 3-6 young) to 0.4 (for those that had reared 15 young). Number of eggs laid and number of young hatched in year n + 1 did not differ significantly with respect to brood size in year n; rather, differences in future fecundity reflected differences in the survival prospects of young reared in year n + 1. -from Author",88,Journal,ar,Article,100,1,1,22104,undefined,1,TRUE,35,all,All Open Access
true,https://api.elsevier.com/content/abstract/scopus_id/0024192385,SCOPUS_ID:0024192385,2-s2.0-0024192385,"Quantitative genetics, development, and physiological adaptation in host strains of fall armyworm",Pashley D.P.,Evolution,00143820,42,1,93-102,1988-01-01,1988,10.1111/j.1558-5646.1988.tb04110.x,"Two genetically differentiated host strains of Spodoptera frugiperda were reared on their own and each other's host plants. Larval host had a greater impact on development in the rice strain than in the corn strain, indicating that physiology could have facilitated specialization in one strain but not the other. Consequently, behavioral mechanisms are also likely to be important in the maintenance of host specificity. Comparison between strains indicated significant differences in the rate at which larvae gained weight. Because this character had consistently high heritabilities, genetic differentiation in development is indicated. Genotypic performance on one host was apparently not indicative of performance on the other. Each strain exhibited genetic variation that would facilitate host-associated divergence and adaptation if coupled with a mechanism that reduced gene flow between hosts. Significant genetic correlations between several characters were detected when strains were reared on their natural hosts but not when they were reared on nonnatural hosts: feeding on novel hosts caused developmental uncoupling of characters. Release from genetic constraints could provide a mechanism for physiological adjustments to newly occupied habitats. -from Author",110,Journal,ar,Article,100,1,1,22104,undefined,1,TRUE,36,all,All Open Access
true,https://api.elsevier.com/content/abstract/scopus_id/0024190208,SCOPUS_ID:0024190208,2-s2.0-0024190208,Gene flow in ground beetles (Coleoptera: Carabidae) of differing habitat preference and flight-wing development,Liebherr J.K.,Evolution,00143820,42,1,129-137,1988-01-01,1988,10.1111/j.1558-5646.1988.tb04113.x,"Estimates of gene flow vary 100-fold among 5 carabid species, ranging from the winged lowland subtropical Agonum elongatulum to the flightless montane temperate Platynus angustatus. Genetic heterogeneity is positively correlated with average elevation of collection sites. Lower levels of gene flow associated with greater genetic subdivision may occur in upland areas because of habitat fragmentation (due to topographic diversity) and habitat persistence (leading to a lower extinction rate for populations). In at least one species, the distribution of stable infraspecific polymorphisms indicates that the high estimate of present-day gene flow is likely to be due to historical gene flow. -from Author",51,Journal,ar,Article,100,1,1,22104,undefined,1,TRUE,37,all,All Open Access
true,https://api.elsevier.com/content/abstract/scopus_id/0024189786,SCOPUS_ID:0024189786,2-s2.0-0024189786,A genetic and behavioral analysis of mate choice and song neighborhoods in indigo buntings,Payne R.B.,Evolution,00143820,42,5,935-947,1988-01-01,1988,10.1111/j.1558-5646.1988.tb02512.x,"Neighboring male Passerina cyanea share songs in S Michigan. Mate choice was independent of the genetic and morphometric similarity of female and male, and these measures were independent of each other. Bunting songs may provide no information to a female about genetic quality of males. -from Authors",20,Journal,ar,Article,100,2,2,22104,undefined,1,TRUE,38,all,All Open Access
true,https://api.elsevier.com/content/abstract/scopus_id/0024189035,SCOPUS_ID:0024189035,2-s2.0-0024189035,"Parasite load, body size, and age of wild-caught male field crickets (Orthoptera: Gryllidae): effects on sexual selection",Zuk M.,Evolution,00143820,42,5,969-976,1988-01-01,1988,10.1111/j.1558-5646.1988.tb02515.x,Comparison of male Gryllus veletis and G. pennsylvanicus collected either by themselves or with one or more females showed that the paired males were significantly older and significantly less parasitized by gregarines (protozoan gut parasites) than were solitary males. Females are preferentially attracted to older males. The ability of less parasitized males to produce more spermatophores under laboratory conditions may also be important in the field. -from Author,105,Journal,ar,Article,100,1,1,22104,undefined,1,TRUE,39,all,All Open Access
true,https://api.elsevier.com/content/abstract/scopus_id/0024188844,SCOPUS_ID:0024188844,2-s2.0-0024188844,Sexual dimorphism in body size: a model and a test,Arak A.,Evolution,00143820,42,4,820-825,1988-01-01,1988,10.1111/j.1558-5646.1988.tb02501.x,"Presents a simple model that, in principle, can be used to predict the degree of sexual dimorphism in a given species. Two episodes of selection acting directly on body size during an animal's lifetime are considered: natural selection and reproductive selection. A general hypothesis is derived concerning the expected relationship between sexual dimorphism and reproductive selection pressures acting on body size in males and females. This hypothesis is tested using comparative data on sexual dimorphism in anurans. -from Author",128,Journal,ar,Article,100,1,1,22104,undefined,0,FALSE,40,NA,NA
true,https://api.elsevier.com/content/abstract/scopus_id/0024188359,SCOPUS_ID:0024188359,2-s2.0-0024188359,Sex-ratio selection in a bivoltine thrips. I. Conditional sex-ratio manipulation and fitness variation,Crespi B.J.,Evolution,00143820,42,6,1199-1211,1988-01-01,1988,10.1111/j.1558-5646.1988.tb04180.x,"Females of Elaphrothrips tuberculatus (Thysanoptera) produce broods of either all males (by viviparity) or all females (by oviparity). Female parents tend to be viviparous (produce males) if their offspring will become relatively large adults, and males gain more in fitness from large size than do females, but in spring, when breeding is synchronous, 1) oviparous and viviparous females do not differ in body size, 2) females tend to viviparous where the fungus upon which they feed is relatively dense and where their offspring will become relatively large adults, and 3) fungus density is highly correlated with male and female offspring size. In summer, when breeding is relatively asynchronous, 1) viviparous females are much larger than oviparous females early (but not late) in the season, 2) large viviparous females begin breeding earlier than smaller ones, 3) offspring developing earlier in the season become larger adults, and 4) a higher proportion of females are viviparous earlier than later. Data suggest that females avoid production of males (the sex with higher variance in expected fitness) when the size of their offspring is relatively uncertain. -from Author",20,Journal,ar,Article,100,1,1,22104,undefined,1,TRUE,41,all,All Open Access
