@_fa,prism:url,dc:identifier,eid,dc:title,dc:creator,prism:publicationName,prism:issn,prism:volume,prism:issueIdentifier,prism:pageRange,prism:coverDate,prism:coverDisplayDate,prism:doi,dc:description,citedby-count,prism:aggregationType,subtype,subtypeDescription,author-count.@limit,author-count.@total,author-count.$,source-id,fund-no,openaccess,openaccessFlag,entry_number,freetoread.value.$,freetoreadLabel.value.$
true,https://api.elsevier.com/content/abstract/scopus_id/0024264357,SCOPUS_ID:0024264357,2-s2.0-0024264357,Heritability of oviposition preference and its relationship to offspring performance within a single insect population,Singer M.C.,Evolution,00143820,42,5,977-985,1988-01-01,1988,10.1111/j.1558-5646.1988.tb02516.x,"Within a population of Euphydryas editha (Lepidoptera: Nymphalidae) that oviposits predominantly on 2 host species, heritable variation in postalighting oviposition preference was found. Oviposition preference of adult females was correlated with offspring performance (growth). There was a significant tendency for offspring to perform better on the host species that their female parent preferred. -from Authors",185,Journal,ar,Article,100,3,3,22104,undefined,0,FALSE,1,NA,NA
true,https://api.elsevier.com/content/abstract/scopus_id/0024259023,SCOPUS_ID:0024259023,2-s2.0-0024259023,Adaptive plasticity in development of Scaphiopus couchii tadpoles in desert ponds,Newman R.A.,Evolution,00143820,42,4,774-783,1988-01-01,1988,10.1111/j.1558-5646.1988.tb02495.x,"Couch's spadefoot toads breed in ephemeral desert ponds that are highly variable in duration. Rapid development is expected to be advantageous in short-duration ponds, but slower development, allowing more time for growth, may be advantageous in ponds of longer duration. There was no evidence for genetic variation in plasticity of development; all sibships exhibited faster development and decreased larval period in ponds of short duration. Plasticity in development appears to be adaptive, as size at metamorphosis was correlated with duration of larval period. The slowest developing sibship, however, suffered higher mortality compared to other sibships in short duration ponds. Sibships did not differ in growth or size at metamorphosis in short-duration ponds, but the slowest developing sibship metamorphosed at the largest size in long duration ponds, resulting in a significant genotype × environment interaction for size at metamorphosis. Thus, there appears to be genetic variation for plasticity in growth, and a genetically determined trade-off between fitness in short-duration ponds (via rapid development) and fitness in long duration ponds (via large size at metamorphosis). This may explain the existence of both phenotypic plasticity and genetic variation in development. -from Author",201,Journal,ar,Article,100,1,1,22104,undefined,1,TRUE,2,all,All Open Access
true,https://api.elsevier.com/content/abstract/scopus_id/0024257376,SCOPUS_ID:0024257376,2-s2.0-0024257376,Sexual allocation strategy in wind-pollinated plants,Burd M.,Evolution,00143820,42,2,403-407,1988-01-01,1988,10.1111/j.1558-5646.1988.tb04145.x,"Proposes that allocation patterns found in anemophilous species can be understood in the context of current theory if the relation between male fitness and male investment is not linear but, rather, follows a pattern of saturation or diminishing marginal returns. In particular, the rate of saturation should be determined largely by the height of a plant because, other factors being equal, pollen-flight distances (and thus access to mates) are dependent on the height of the pollen-emitting source. A diminutive plant with a restricted pollen shadow might be able to fertilize most or all of the few available ovules even at low levels of pollen production. Allocation to additional polliniferous flowers would not alter the dispersal range or ovule pool and so would merely increase the local mating competition (LMC) among sib pollen. In contrast, a taller individual should experience reduced LMC and have a less saturating male-fitness curve, due to wider dispsersal of its pollen. Thus, contrary to the traditional expectation of greater female effort in larger plants, larger wind-pollinated plants should have relatively greater male investment. Data on the tropical monoecious grass, teosinte (Zea spp.) support this hypothesis. -from Authors",79,Journal,ar,Article,100,2,2,22104,undefined,0,FALSE,3,NA,NA
true,https://api.elsevier.com/content/abstract/scopus_id/0024256618,SCOPUS_ID:0024256618,2-s2.0-0024256618,Extinction and recolonization: their effects on the genetic differentiation of local populations,Wade M.J.,Evolution,00143820,42,5,995-1005,1988-01-01,1988,10.1111/j.1558-5646.1988.tb02518.x,"Investigates the genetic effects of extinction and recolonization for a species whose population structure consists of an array of local demes with some migration among them. In particular, the conditions are considered under which extinction and recolonization might enhance or diminish gene flow and increase or decrease the rate of genetic differentiation relative to the static case with no extinctions, explicitly taking into account the age-structure that is established within the array of populations by the extinction and colonization process. Two different models of the colonization process are also considered; the so-called ""migrant pool' and ""propagule pool' models. Theoretical studies indicate that the genetic effects of extinction and colonization depend upon the relative magnitudes of K, the number of individuals founding new colonies, and 2Nm, twice the number of migrants moving into extant populations. These genetic effects are insensitive to the extinction rate. In order to assess the genetic effects of the population dynamics, one must first answer an important empirical question that is essentially ecological: is colonization a behavior distinct from migration? -from Authors",506,Journal,ar,Article,100,2,2,22104,undefined,1,TRUE,4,all,All Open Access
true,https://api.elsevier.com/content/abstract/scopus_id/0024254795,SCOPUS_ID:0024254795,2-s2.0-0024254795,A negative maternal effect in springtails,Janssen G.M.,Evolution,00143820,42,4,828-834,1988-01-01,1988,10.1111/j.1558-5646.1988.tb02503.x,"Studied components of fitness (clutch size, age and weight at maturity) in Orchesella cincta (Collembola) collected in pine plantations in the Netherlands. -from Authors",35,Journal,ar,Article,100,4,4,22104,undefined,1,TRUE,5,all,All Open Access
true,https://api.elsevier.com/content/abstract/scopus_id/0024254403,SCOPUS_ID:0024254403,2-s2.0-0024254403,Intrapopulation differentiation in annual plants. III. The contrasting effects of intra- and interspecific competition,Linhart Y.B.,Evolution,00143820,42,5,1047-1064,1988-01-01,1988,10.1111/j.1558-5646.1988.tb02523.x,"In nature, each Veronica peregrina population spans an environmental gradient across the center and sides of a temporary, vernal pool in California. Individuals at the center are subjected to intense intraspecific competition produced by high densities (to 30 seedlings/cm2) generated by quasi-simultaneous germination (90% of seeds germinate in one week). Individuals at the periphery are subjected to interspecific competition with grasses, which shade out the Veronica 4-6 wk after onset of winter growth. Greenhouse experiments confirmed the predictions that 1) when grown under immediate intraspecific competition offspring of plants from the central subpopulation would grow larger and produce more seeds than those from the periphery and that 2) when grown under delayed interspecific competition provided by Agrostis tenuis and Lolium multiflorum, offspring of plants from the periphery would perform better than those from the center. There were 4 additional significant differences between the central and peripheral subpopulations. 1) The faster germination rate in central plants can be advantageous under immediate intraspecific competition. The slower rate in peripheral plants can be advantageous under conditions of erratic and unpredictable soil moisture. 2) Central plants were more sensitive to N-deficiency, peripheral plants more sensitive to P-deficiency. 3) Central plants allocated a greater proportion of biomass to seeds, peripheral plants to leaves under all growing conditions. 4) At the seedling stage, central plants have longer roots; at the adult stage, peripheral plants have longer roots (but not more root mass). -from Author",51,Journal,ar,Article,100,1,1,22104,undefined,1,TRUE,6,all,All Open Access
true,https://api.elsevier.com/content/abstract/scopus_id/0024252575,SCOPUS_ID:0024252575,2-s2.0-0024252575,"Dispersal and population-genetic structure of the cooperative spider, Agelena consociata, in West African rainforest",Roeloffs R.,Evolution,00143820,42,1,173-183,1988-01-01,1988,10.1111/j.1558-5646.1988.tb04117.x,"There was no evidence for active dispersal by reproductives or any age class of this spider. Nest fragmentation by falling tree limbs and storms is the cause of new nest formation within local areas, while passive dispersal by vertebrate carriers that either have some association with the nests (bats) or move through them is indicated as the probable mode of longer-distance dispersal. The population-genetic structure supports the data obtained on dispersal. Kin selection or some type of family-group selection may have been important in the evolution of cooperative behavior in the species. -from Authors",56,Journal,ar,Article,100,2,2,22104,undefined,0,FALSE,7,NA,NA
true,https://api.elsevier.com/content/abstract/scopus_id/0024250681,SCOPUS_ID:0024250681,2-s2.0-0024250681,Physiological and behavioral adaptation to varying environments: a mathematical model,Castillo-Chavez C.,Evolution,00143820,42,5,986-994,1988-01-01,1988,10.1111/j.1558-5646.1988.tb02517.x,"The model, which explores the evolution of habitat selection and physiological adaptation in a heterogeneous environment, assumes 1) a panmictic population of infinite size; 2) prereproductive individuals mobile enough to move between patches; 3) alleles at one locus code for absence or presence of adaptation to detrimental patches; 4) alleles at a 2nd locus code for absence or presence of behavior(s) that cause avoidance of the detrimental patches; 5) additive effects of alleles controlling physiology and behavior; 6) frequency-independent fitness. Results indicate that nontrivial, polymorphic equilibria do not exist. The pattern of genotypic fitnesses and the initial allelic frequencies can influence whether the population adapts by physiological or behavioral mechanisms, or by both. Linkage between the 2 loci can alter the outcome of evolution, given specified genotypic fitness values and initial allelic frequencies. -from Authors",37,Journal,ar,Article,100,3,3,22104,undefined,1,TRUE,8,all,All Open Access
true,https://api.elsevier.com/content/abstract/scopus_id/0024249854,SCOPUS_ID:0024249854,2-s2.0-0024249854,A comparison of genetic and phenotypic correlations,Cheverud J.M.,Evolution,00143820,42,5,958-968,1988-01-01,1988,10.1111/j.1558-5646.1988.tb02514.x,Much of the dissimilarity between phenotypic- and genetic-correlation estimates seems to be due to imprecise estimates of genetic correlations. Phenotypic correlations are likely to be fair estimates of their genetic counterparts in many situations. Genetic and environmental causes of phenotypic variation tend to act on growth and development in a similar manner. -from Author,573,Journal,ar,Article,100,1,1,22104,undefined,1,TRUE,9,all,All Open Access
true,https://api.elsevier.com/content/abstract/scopus_id/0024249833,SCOPUS_ID:0024249833,2-s2.0-0024249833,How mammals produce large-brained offspring,Pagel M.D.,Evolution,00143820,42,5,948-957,1988-01-01,1988,10.1111/j.1558-5646.1988.tb02513.x,Species differences in relative neonatal brain size reflect different life-history tactics rather than constraints imposed by metabolic rate. -from Authors,88,Journal,ar,Article,100,2,2,22104,undefined,1,TRUE,10,all,All Open Access
true,https://api.elsevier.com/content/abstract/scopus_id/0024248532,SCOPUS_ID:0024248532,2-s2.0-0024248532,Genetic differentiation among ancestral and introduced populations of the Eurasian tree sparrow (Passer montanus),St. Louis V.L.,Evolution,00143820,42,2,266-276,1988-01-01,1988,10.1111/j.1558-5646.1988.tb04131.x,"Compared genetic variation in 3 introduced North American populations of Passer montanus with an ancestral German population, a native Swedish population, and an introduced Australian population. The North American P. montanus were less variable genetically than the ancestral German birds, presumably a result of the founding event. The genetic structure of all 6 populations of P. montanus can be explained in terms of interaction among mutation, genetic drift, effective population size, and unknown selective factors. Cluster analyses and an ordination of distance measures derived from electrophoretic data generally showed relationships in phenetic space among populations consistent with the magnitude of their geographic separation. An exception occurred with the Swedish population, which was closer in the ordination to a North American population than to the geographically neighboring German population. This was attributed to the relative abundance of alleles present in the Swedish birds. Populations of P. montanus seem to have diverged in a manner similar to that seen in conspecific disjunct populations, ie at present showing no trenchant indication of genetic speciation. -Authors",30,Journal,ar,Article,100,2,2,22104,undefined,0,FALSE,11,NA,NA
true,https://api.elsevier.com/content/abstract/scopus_id/0024233727,SCOPUS_ID:0024233727,2-s2.0-0024233727,Male mating preferences and assortative mating in the soldier beetle,McLain D.K.,Evolution,00143820,42,4,729-735,1988-01-01,1988,10.1111/j.1558-5646.1988.tb02491.x,"Mating preferences for a color characteristic were examined in 3 N Georgia populations of Chauliognathus pennsylvanicus (Cantharidae) by comparing observed and expected frequencies of matings to the same phenotype. The populations are apparently in a zone of secondary contact between disparate color morphs. In the most N population sampled, preferences were strong and were associated with positive assortative mating with respect to the color characteristic. In the S population, neither assortative mating nor mating preference was strong, while in the middle population, preferences were expressed in the absence of assortative mating. Mating preferences cannot be attributed to host-plant choice, microhabitat choice, or simple conditioning on the phenotype of the last mate, but they may represent part of a specific mate-recognition system which has been maintained in part of the zone of overlap but which has eroded in other areas. -Author",11,Journal,ar,Article,100,1,1,22104,undefined,1,TRUE,12,all,All Open Access
true,https://api.elsevier.com/content/abstract/scopus_id/0024233726,SCOPUS_ID:0024233726,2-s2.0-0024233726,Evolutionary reduction of complex life cycles: loss of host- alternation in Pemphigus (Homoptera: Aphididae),Moran N.A.,Evolution,00143820,42,4,717-728,1988-01-01,1988,10.1111/j.1558-5646.1988.tb02490.x,"In a Utah canyon, Pemphigus betae, exhibits 2 life cycles: a cycle involving host-alternation between cottonwood Populus trees and roots of herbaceous plants and a secondarily reduced cycle, in which the cottonwood generations are eliminated so that wingless forms live year round on roots. Relative frequencies of the life-cycle types vary along a 30km stretch of the canyon, with the reduced cycle predominating at upper sites. Variation in frequency of life-cycle reduction is dependent on adaptive phenotypic plasticity, microgeographically variable cues affecting mechanisms of morph determination, and genetically based variation in tendency to show reduction versus alternation. Genetic variation between sites corresponds to microgeographic variation in success of life-cycle phases. Where cottonwood hosts are absent (lower elevations) or where the cottonwood phase has low survival (upper elevations), clones tend to produce fewer migrating morphs, compared to clones from middle elevations, where the cottonwood phase is relatively favorable. -from Authors",40,Journal,ar,Article,100,2,2,22104,undefined,1,TRUE,13,all,All Open Access
true,https://api.elsevier.com/content/abstract/scopus_id/0024233324,SCOPUS_ID:0024233324,2-s2.0-0024233324,Variation in preference and specificity in monophagous and oligophagous swallowtail butterflies,Thompson J.N.,Evolution,00143820,42,1,118-128,1988-01-01,1988,10.1111/j.1558-5646.1988.tb04112.x,"Analysis of a locally monophagous butterfly species, Papilio oregonius, and a locally oligophagous species, P. zelicaon, showed significant variation in oviposition preference within populations of both species. Females of both species chose primarily their native hosts, but the percentages of eggs laid by individual females among the plant species and the number of plant species on which individual females laid eggs differed significantly among isofemale strains within populations. Moreover, some females within all isofemale strains of both species laid a few eggs on Foeniculum vulgare, an umbelliferous species that does not occur in the native habitats of these populations but is a host for Papilio species in other geographic areas. Local monophagy and oligophagy in these species probably reflect the relative ranking among potential plant species. Both populations harbor variation in oviposition choice that could allow for host shifts if these populations invaded new habitats. -from Author",80,Journal,ar,Article,100,1,1,22104,undefined,1,TRUE,14,all,All Open Access
true,https://api.elsevier.com/content/abstract/scopus_id/0024231461,SCOPUS_ID:0024231461,2-s2.0-0024231461,Evolution of Atlantic and Pacific cod: loss of genetic variation and gene expression in Pacific cod,Grant W.S.,Evolution,00143820,42,1,138-146,1988-01-01,1988,10.1111/j.1558-5646.1988.tb04114.x,"An allozyme investigation of 41 protein-coding loci in the morphologically similar Gadus morhua and G. macrocephalus indicates that the latter experienced a severe population bottleneck that led to the loss of gene diversity and gene expression, most likely associated with founder populations that dispersed into the Pacific Ocean after the Bering Strait opened. Pacific cod probably dispersed into the Pacific Ocean soon after the Bering Strait opened in the mid-Pliocene, 3.0-3.5 Ma BP. -Authors",40,Journal,ar,Article,100,2,2,22104,undefined,1,TRUE,15,all,All Open Access
true,https://api.elsevier.com/content/abstract/scopus_id/0024226445,SCOPUS_ID:0024226445,2-s2.0-0024226445,Reproductive isolation and distinct population structures in two types of the freshwater shrimp Palaemon paucidens,Chow S.,Evolution,00143820,42,4,804-813,1988-01-01,1988,10.1111/j.1558-5646.1988.tb02498.x,"Twenty local populations of Palaemon paucidens were electrophoretically and morphologically surveyed. A and B types had experienced cladogenic separation with pre- or postmating isolation, whereafter the A type, under geographic isolation, underwent genetic and phenotypic differentiation, while the B type, under extensive gene flow, did not undergo differentiation. -from Authors",22,Journal,ar,Article,100,3,3,22104,undefined,1,TRUE,16,all,All Open Access
true,https://api.elsevier.com/content/abstract/scopus_id/0024225989,SCOPUS_ID:0024225989,2-s2.0-0024225989,Geographic variation and heterochrony in two species of cowries (genus Cypraea),Tissot B.N.,Evolution,00143820,42,1,103-117,1988-01-01,1988,10.1111/j.1558-5646.1988.tb04111.x,"Geographic variation in the marine, Indo-Pacific Cypraea caputserpentis involves clinal variations that parallel the ontogenetic development of adult shell characteristics. Cypraea caputdraconis, a closely related species endemic to Easter Island and Sala y Gomez, is morphologically similar to juvenile C. caputserpentis. Paedomorphosis results from the combined effects of neoteny and post-displacement, and may result from the advantages of larger body size relative to shell size under reduced predation intensities and associated increases in fecundity. -from Author",24,Journal,ar,Article,100,1,1,22104,undefined,1,TRUE,17,all,All Open Access
true,https://api.elsevier.com/content/abstract/scopus_id/0024225740,SCOPUS_ID:0024225740,2-s2.0-0024225740,Variation in the coding of species identity in the advertisement calls of Litoria verreauxi (Anura: Hylidae),Gerhardt H.C.,Evolution,00143820,42,3,556-565,1988-01-01,1988,10.1111/j.1558-5646.1988.tb04160.x,Variation within and among males was documented in two properties of the advertisement call of Litoria verreauxi; comparisons were also made between populations of L. verreauxi that were allopatric and sympatric with L. ewingi. -from Authors,28,Journal,ar,Article,100,2,2,22104,undefined,1,TRUE,18,all,All Open Access
true,https://api.elsevier.com/content/abstract/scopus_id/0024225096,SCOPUS_ID:0024225096,2-s2.0-0024225096,Hybridization in western Atlantic stone crabs (genus Menippe): evolutionary history and ecological context influence species interactions,Bert T.M.,Evolution,00143820,42,3,528-544,1988-01-01,1988,10.1111/j.1558-5646.1988.tb04158.x,"Menippe mercenaria and M. adina interbreed extensively in 2 disjunct areas of the coastal SE USA. A narrow hybrid zone in NW Florida is situated at the junction of the present ranges of the 2 parental forms, in an area of strong ecological change and hydrological convergence. Despite extensive hybridization in this area, there is a significant deficiency of heterozygotes for the Alp-2 locus, nonrandom associations of alleles for 2 diagnostic loci, and an absence of certain combinations of phenotypes and genotypes. Along the Atlantic coast (E-central Florida into South Carolina), a broad zone of increased variability exists within the range of M. mercenaria. Allele frequencies throughout this zone are similar to those of M. mercenaria but reflect apparent introgression from M. adina. Color patterns are quite variable, but only in the center of this zone. There is little evidence of a heterozygote deficiency, and the preferred habitat of M. mercenaria is not present. The Atlantic zone of variability is apparently expanding, with alleles at enzyme loci introgressing more rapidly than color characteristics. Despite these differences, certain features are common to both zones. These include 1) asymmetry in terms of the direction of introgression, 2) differential introgression of alleles, and 3) an almost complete absence of M. adina phenotypes that carry high proportions of M. mercenaria alleles. Factors inherent to the organism (intrinsic factors) and factors inherent to the environment (extrinsic factors) both act to structure and maintain the 2 hybrid zones. -from Authors",65,Journal,ar,Article,100,2,2,22104,undefined,0,FALSE,19,NA,NA
true,https://api.elsevier.com/content/abstract/scopus_id/0024221763,SCOPUS_ID:0024221763,2-s2.0-0024221763,Genetic variation for larval anuran (Scaphiopus couchii) development time in an uncertain environment,Newman R.A.,Evolution,00143820,42,4,763-773,1988-01-01,1988,10.1111/j.1558-5646.1988.tb02494.x,"Couch's spadefoot toads breed in ponds of uncertain duration. Larvae exhibit considerable variation in growth, size at metamorphosis and development time. Phenotypic differences in development time may dramatically affect survivorship. Additive genetic variance was detected for development time, but not for any other trait. Some variation in early growth was attributed to maternal effects; maternal effects, however, were not apparent for size at metamorphosis or development time. Nonadditive genetic effects were not statistically significant for any trait, but the nonsignificance of these effects must be interpreted cautiously, as the sample of females was relatively small and the mating design used is not very effective for detecting interactions. Genetic variation in development time in this population is most likely maintained by variability in the direction of selection as a consequence of variation in pond duration. -from Author",89,Journal,ar,Article,100,1,1,22104,undefined,1,TRUE,20,all,All Open Access
