@_fa,prism:url,dc:identifier,eid,dc:title,dc:creator,prism:publicationName,prism:issn,prism:volume,prism:issueIdentifier,prism:pageRange,prism:coverDate,prism:coverDisplayDate,prism:doi,dc:description,citedby-count,prism:aggregationType,subtype,subtypeDescription,author-count.@limit,author-count.@total,author-count.$,source-id,fund-no,openaccess,openaccessFlag,entry_number,freetoread.value.$,freetoreadLabel.value.$
true,https://api.elsevier.com/content/abstract/scopus_id/0024188257,SCOPUS_ID:0024188257,2-s2.0-0024188257,Inbreeding depression doesn't matter: the genetic basis of mating- system evolution,Holsinger K.E.,Evolution,00143820,42,6,1235-1244,1988-01-01,1988,10.1111/j.1558-5646.1988.tb04183.x,"Models of mating-system evolution commonly assume that inbreeding depression is independent of the genotype at loci determining the mate system. Because of the association that develops between genotypes at different loci in inbred populations, an individual that is heterozygous at a mating-type locus is more likely to be heterozygous at a fitness locus that is a randomly chosen individual. A modifier model for the evolution of self-fertilization in plants demonstrates that inbreeding depression is not an adequate descriptor of the relative fitness of inbred and outbred progeny. If inbreeding depression is primarily a result of segregation at overdominant loci, intermediate rates of self-fertilization may be favored, even if the inbreeding depression is <30%. Indeed, in some cases, mutants that cause some outcrossing can be introduced into completely selfing populations when the inbreeding depression is as little as 1%. If inbreeding depression is primarily a result of the expression of recessive lethals in inbred progeny, selfing can evolve in an initially random mating population, even when the inbreeding depression is >70%. -Author",140,Journal,ar,Article,100,1,1,22104,undefined,1,TRUE,42,all,All Open Access
true,https://api.elsevier.com/content/abstract/scopus_id/0024187723,SCOPUS_ID:0024187723,2-s2.0-0024187723,Postpollination effects on seed paternity: mechanisms in addition to microgametophyte competition operate in wild radish,Marshall D.L.,Evolution,00143820,42,6,1256-1266,1988-01-01,1988,10.1111/j.1558-5646.1988.tb04185.x,"In Raphanus raphanistrum, maternal-plant × pollen-donor interaction effects were found for all variables, indicating the genetic complementation or maternal choice occurred. Values of the components of reproduction were generally higher for multiply sired fruits than for singly sired fruits, indicating that either competition among embryos changed under multiple paternity or maternal choice for multiply sired fruits occurred. When maternal plants were stressed, the components of reproduction were more strongly affected by seed and fruit paternity. -from Author",48,Journal,ar,Article,100,1,1,22104,undefined,0,FALSE,43,NA,NA
true,https://api.elsevier.com/content/abstract/scopus_id/0024186997,SCOPUS_ID:0024186997,2-s2.0-0024186997,Sex-ratio manipulation in response to host size by the parasitoid wasp Spalangia cameroni: a laboratory study,King B.H.,Evolution,00143820,42,6,1190-1198,1988-01-01,1988,10.1111/j.1558-5646.1988.tb04179.x,"The prediction of Charnov et al's (1981) host-size model that there should be a negative relationship between host size and wasp sex ratio (proportion sons) was supported for Spalangia cameroni, a solitary parasitoid wasp. The relationship was a result of offspring sex manipulation by females in response to host size rather than a result of differential mortality of the sexes. -from Author",103,Journal,ar,Article,100,1,1,22104,undefined,1,TRUE,44,all,All Open Access
true,https://api.elsevier.com/content/abstract/scopus_id/0024184499,SCOPUS_ID:0024184499,2-s2.0-0024184499,Adaptations to temperate climates and evolution of overwintering strategies in the Drosophila melanogaster species group,Kimura M.T.,Evolution,00143820,42,6,1288-1297,1988-01-01,1988,10.1111/j.1558-5646.1988.tb04188.x,"The Drosophila melanogaster species group is considered to have originated in the tropics and only recently invaded temperate habitats. The temperate species of this group studied here may be subdivided into the warm-temperate species (D. lutescens, D. rufa) and the cool-temperate species (species of the auraria complex). The warm-temperate species were more cold-hardy than were their tropical relatives (D. takahashii or D. melanogaster) at the larval and imaginal stages, and the cool-temperate species were more cold-hardy than the warm-temperate species, although only at the imaginal stage. However, these species showed little or no intraspecific variation in cold-hardiness, despite great variation in winter temperature within the species' ranges. It is assumed that cold-hardiness is one of the main factors restricting their distributions at high latitudes and that it is the key for evolution of the warm- and cool-temperate species from their subtropical or warm-temperate ancestors. Both warm- and cool-temperate species had photoperiodically controlled reproductive diapause. In the cool-temperate species, development of cold-hardiness was affected by diapause, but diapause had little or no effect on cold-hardiness in the warm-temperate species. Critical daylengths and the diapause rates varied from species to species according to variation in their overwintering plans and also varied geographically in consequence of their adapatation to local climates. Species showed different responses to temperature in preimaginal and ovarian development. These differences probably reflect adaptation to different environmental temperatures. -Author",95,Journal,ar,Article,100,1,1,22104,undefined,0,FALSE,45,NA,NA
true,https://api.elsevier.com/content/abstract/scopus_id/0024184139,SCOPUS_ID:0024184139,2-s2.0-0024184139,Adaptive radiation and genetic differentiation in the Hawaiian silversword alliance (Compositae: Madiinae),Witter M.S.,Evolution,00143820,42,6,1278-1287,1988-01-01,1988,10.1111/j.1558-5646.1988.tb04187.x,"The Hawaiian silversword alliance consists of the genera Dubautia, Argyroxiphium and Wilkesia, and is a classic example of adaptive radiation in an insular setting. Genetic variation and interspecific genetic differentiation based on 10 enzyme loci are described for Dubautia and Wilkesia. Genetic identities among species span the range of values expected from interpopulation comparisons within a single species (I = 0.90-1.00) to those typical of interspecific comparisons (I = 0.67). Genetic-identity values correspond to biogeographic distribution and morphological distinctiveness, supporting a correlation of increasing genetic distance associated with the time of separation among lineages. The high genetic identities observed within the Hawaiian Madiinae and other island plant groups are apparently due to limited time spans available for taxa to accumulate new genetic variation through mutation. Species may remain genetically similar (I > 0.90) even after time spans on the order of magnitude of 1 000 000 yr. -Authors",96,Journal,ar,Article,100,2,2,22104,undefined,0,FALSE,46,NA,NA
true,https://api.elsevier.com/content/abstract/scopus_id/0024182830,SCOPUS_ID:0024182830,2-s2.0-0024182830,Variation in pathogenicity among and within populations of the fungus Phomopsis subordinaria infecting Plantago lanceolata,De Nooij M.P.,Evolution,00143820,42,6,1166-1171,1988-01-01,1988,10.1111/j.1558-5646.1988.tb04177.x,"The expression of the pathogen appeared to be quantitative rather than qualitative in character, which suggests polygenic inheritance of host susceptibility. Significant statistical interaction between pathogen and host pointed to some degree of physiological specialization between them. None of the individual host-pathogen combinations contributed significantly to the interaction. Environmental factors (in particular weevils that spread the disease) are important for the development of the disease. The pathogen varied in pathogenicity in the field, even among scapes within an individual host plant. -from Authors",19,Journal,ar,Article,100,2,2,22104,undefined,1,TRUE,47,all,All Open Access
true,https://api.elsevier.com/content/abstract/scopus_id/0024179787,SCOPUS_ID:0024179787,2-s2.0-0024179787,Hybridization as a dispersal mechanism,Potts B.M.,Evolution,00143820,42,6,1245-1255,1988-01-01,1988,10.1111/j.1558-5646.1988.tb04184.x,"An example from the genus Eucalyptus is used to argue that hybridization may be of evolutionary significance as a means of gene dispersal where seed dispersal is limited. Study of regeneration of E. risdonii and E. amygdalina indicated that the current selective regime was favoring E. risdonii, but dispersal of E. risdonii by seeds is shown to be limited. Flow of E. risdonii genes into the range of E. amygdalina by pollen dispersal and F1 hybridization is widespread. While the actual level of hybridization is low, interspecific hybridization effectively doubles the dispersal of E. risdonii genes into the range of E. amygdalina. This pollen flow can have a significant genetic impact, since isolated hybrids or patches of abnormal phenotypes have been found 200-300 m from the species boundary. Results suggest that E. risdonii may invade suitable habitat islands within the E. amygdalina forest, independently of seed migration, by long-distance pollen migration followed by selection for the gene combinations of the pollen parent. -from Authors",107,Journal,ar,Article,100,2,2,22104,undefined,0,FALSE,48,NA,NA
true,https://api.elsevier.com/content/abstract/scopus_id/0024179681,SCOPUS_ID:0024179681,2-s2.0-0024179681,Sexual selection: the evolution of conspicuous characteristics in birds by means of imprinting,Ten Cate C.,Evolution,00143820,42,6,1355-1358,1988-01-01,1988,10.1111/j.1558-5646.1988.tb04196.x,"In many species, mating preferences are acquired by sexual imprinting. This process may lead to a preference for a partner that is slightly novel. An asymmetrical preference for novel partners might provide a mechanism driving evolutionary change in the characteristics used in mate choice. -from Authors",74,Journal,ar,Article,100,2,2,22104,undefined,1,TRUE,49,all,All Open Access
true,https://api.elsevier.com/content/abstract/scopus_id/0024179573,SCOPUS_ID:0024179573,2-s2.0-0024179573,An experimental evaluation of selection on color morphs of the polymorphic spider Enoplognatha ovata (Araneae: Theridiidae),Reillo P.R.,Evolution,00143820,42,6,1172-1189,1988-01-01,1988,10.1111/j.1558-5646.1988.tb04178.x,Selection on E. ovata color morphs is not likely to be detected easily within a single population because of the swamping effect of dispersal. Local patterns of morph-frequency variation may arise more from dispersal and drift than from selection on the color phenotypes. -from Authors,24,Journal,ar,Article,100,2,2,22104,undefined,1,TRUE,50,all,All Open Access
true,https://api.elsevier.com/content/abstract/scopus_id/0023698548,SCOPUS_ID:0023698548,2-s2.0-0023698548,Patterns and processes of diversification: speciation and historical congruence in some neotropical birds.,Cracraft J.,Evolution,00143820,42,3,603-620,1988-01-01,1988,10.1111/j.1558-5646.1988.tb04164.x,"This paper documents congruence in geographical patterns of speciation for four clades of birds having taxa endemic to the same areas within the Neotropics. Two genera one a parrot and one a toucan, corroborate a well known biogeographic disjunction in which taxa endemic to southern Central America and northwestern South America are the sister-group to a radiation within the Amazon basin. These two genera, also document a pattern of historical interrelationships for four well known areas of endemism within Amazonia. These generalized historical patterns are interpreted to have arisen via fragmentation (vicariance) of a widespread ancestral biota. A review of the paleogeographic evidence suggests that these vicariance events could have originated as a result of several different mechanisms operating at various times during the Cenozoic. The inference that diversification of the neotropical biota is primarily the result of the most recent of these possible vicariance events is unwarranted. These patterns of historical congruence are also interpreted as direct evidence against the hypothesis that diversification of the forest biota was a consequence of parapatric differentiation along recently established ecological gradients.-from Authors",229,Journal,ar,Article,100,2,2,22104,undefined,0,FALSE,51,all,All Open Access
