@_fa,prism:url,dc:identifier,eid,dc:title,dc:creator,prism:publicationName,prism:issn,prism:volume,prism:issueIdentifier,prism:pageRange,prism:coverDate,prism:coverDisplayDate,prism:doi,dc:description,citedby-count,pubmed-id,prism:aggregationType,subtype,subtypeDescription,author-count.@limit,author-count.@total,author-count.$,authkeywords,source-id,fund-no,openaccess,openaccessFlag,freetoread.value.$,freetoreadLabel.value.$,entry_number,fund-acr,fund-sponsor
true,https://api.elsevier.com/content/abstract/scopus_id/0036807186,SCOPUS_ID:0036807186,2-s2.0-0036807186,Wolbachia interactions that determine Drosophila melanogaster survival,Fry A.J.,Evolution,00143820,56,10,1976-1981,2002-10-01,1 October 2002,10.1111/j.0014-3820.2002.tb00123.x,"We have recently described a mutualistic symbiosis in which Wolbachia bacteria were shown to improve the fitness of some Drosophila melanogaster stocks. Wolbachia did not extend longevity in all Drosophila genotypes, even though 16s rDNA sequences indicated that our Drosophila stocks were infected with the same Wolbachia strain. Here, we use reciprocal hybrid crosses between two Drosophila strains, one that lived longer with Wolbachia (Z53) and one that did not (Z2), to investigate the inheritance of the survival phenotype and its dependence on the host genotype, sex, and mating conditions. Wolbachia's positive effects were more apparent in hybrid flies than in parental flies, ruling out exclusive maternal inheritance or the dependence of the survival phenotype on Wolbachia strain differences. The Wolbachia survival effects were more apparent in single-sex cages, where courtship and mating were not permitted. In these cages, nearly all flies with Wolbachia lived longer than uninfected flies, even though strain Z2 showed no Wolbachia effect in mixed-sex mating cages. We used comparisons between single- and mixed-sex cages to estimate the cost of reproduction for both sexes. Our data suggest that Wolbachia infection may increase the inferred cost of reproduction, particularly in males. Wotbachia can even produce a positive survival effect almost as large as the negative survival effect associated with reproduction. We discuss the implications of our experiments for the study of insect symbioses.",81,12449484,Journal,ar,Article,100,2,2,Cost of reproduction | Hybrid | Mortality | Survival | Symbiosis,22104,undefined,1,TRUE,all,All Open Access,60,NA,NA
true,https://api.elsevier.com/content/abstract/scopus_id/0036807185,SCOPUS_ID:0036807185,2-s2.0-0036807185,Pathogen resistance and genetic variation at MHC loci,Hedrick P.W.,Evolution,00143820,56,10,1902-1908,2002-10-01,1 October 2002,10.1111/j.0014-3820.2002.tb00116.x,"Balancing selection in the form of heterozygote advantage, frequency-dependent selection, or selection that varies in time and/or space, has been proposed to explain the high variation at major histocompatibility complex (MHC) genes. Here the effect of variation of the presence and absence of pathogens over time on genetic variation at multiallelic loci is examined. In the basic model, resistance to each pathogen is conferred by a given allele, and this allele is assumed to be dominant. Given that s is the selective disadvantage for homozygotes (and heterozygotes) without the resistance allele and the proportion of generations, which a pathogen is present, is e, fitnesses for homozygotes become (1 - s)(n-1)e and the fitnesses for heterozygotes become (1 - s)(n-2)e, where n is the number of alleles. In this situation, the conditions for a stable, multiallelic polymorphism are met even though there is no intrinsic heterozygote advantage. The distribution of allele frequencies and consequently heterozygosity are a function of the autocorrelation of the presence of the pathogen in subsequent generations. When there is a positive autocorrelation over generations, the observed heterozygosity is reduced. In addition, the effects of lower levels of selection and dominance and the influence of genetic drift were examined. These effects were compared to the observed heterozygosity for two MHC genes in several South American Indian samples. Overall, resistance conferred by specific alleles to temporally variable pathogens may contribute to the observed polymorphism at MHC genes and other similar host defense loci.",309,12449477,Journal,ar,Article,100,1,1,Frequency-dependent selection | Heterozygote advantage | HLA loci | Overdominance | Polymorphism,22104,undefined,1,TRUE,all,All Open Access,61,NA,NA
true,https://api.elsevier.com/content/abstract/scopus_id/0036807181,SCOPUS_ID:0036807181,2-s2.0-0036807181,The evolutionary response of predators to dangerous prey: Hotspots and coldspots in the geographic mosaic of coevolution between garter snakes and newts,Brodie E.D.,Evolution,00143820,56,10,2067-2082,2002-10-01,1 October 2002,10.1111/j.0014-3820.2002.tb00132.x,"The ""geographic mosaic"" approach to understanding coevolution is predicated on the existence of variable selection across the landscape of an interaction between species. A range of ecological factors, from differences in resource availability to differences in community composition, can generate such a mosaic of selection among populations, and thereby differences in the strength of coevolution. The result is a mixture of hotspots, where reciprocal selection is strong, and coldspots, where reciprocal selection is weak or absent, throughout the ranges of species. Population subdivision further provides the opportunity for nonadaptive forces, including gene flow, drift, and metapopulation dynamics, to influence the coevolutionary interaction between species. Some predicted results of this geographic mosaic of coevolution include maladapted or mismatched phenotypes, maintenance of high levels of polymorphism, and prevention of stable equilibrium trait combinations. To evaluate the potential for the geographic mosaic to influence predator-prey coevolution, we investigated the geographic pattern of genetically determined TTX resistance in the garter snake Thamnophis sirtalis over much of the range of its ecological interaction with toxic newts of genus Taricha. We assayed TTX resistance in over 2900 garter snakes representing 333 families from 40 populations throughout western North America. Our results provide dramatic evidence that geographic structure is an important component in coevolutionary interactions between predators and prey. Resistance levels vary substantially (over three orders of magnitude) among populations and over short distances. The spatial array of variation is consistent with two areas of intense evolutionary response by predators (""hotspots"") surrounded by clines of decreasing resistance. Some general predictions of the geographic mosaic process are supported, including clinal variation in phenotypes, polymorphism in some populations, and divergent outcomes of the interaction between predator and prey. Conversely, our data provide little support for one of the major predictions, mismatched values of interacting traits. Two lines of evidence suggest selection is paramount in determining population variation in resistance. First, phylogenetic information indicates that two hotspots of TTX resistance have evolved independently. Second, in the one region that TTX levels in prey have been quantified, resistance and toxicity levels match almost perfectly over a wide phenotypic and geographic range. However, these results do not preclude the role the nonadaptive forces in generating the overall geographic mosaic of TTX resistance. Much work remains to fill in the geographic pattern of variation among prey populations and, just as importantly, to explore the variation in the ecology of the interaction that occurs within populations.",282,12449493,Journal,ar,Article,100,3,3,Arms-race | Coevolution | Geographic mosaic | Predator-prey | Taricha | Tetrodotoxin resistance | Thamnophis,22104,undefined,1,TRUE,all,All Open Access,62,NA,NA
true,https://api.elsevier.com/content/abstract/scopus_id/0036807176,SCOPUS_ID:0036807176,2-s2.0-0036807176,"Geographic variation in sexual selection among populations of an iguanid lizard, Sauromalus obesus (=ater)",Kwiatkowski M.A.,Evolution,00143820,56,10,2039-2051,2002-10-01,1 October 2002,10.1111/j.0014-3820.2002.tb00130.x,"Geographic variation in selection pressures may result in population divergence and speciation, especially if sexual selection varies among populations. Yet spatial variation in targets and intensity of sexual selection is well studied in only a few species. Even more rare are simultaneous studies of multiple populations combining observations from natural settings with controlled behavioral experiments. We investigated how sexual selection varies among populations of the chuckwalla, Sauromalus obesus. Chuckwallas are sexually dimorphic in color, and males vary in coloration among populations. Using field observations and multiple regression techniques, we investigated how sexual selection acts on various male traits in three populations in which males differed in coloration. The influence of sexual selection on male coloration was then investigated in more detail using controlled experiments. Results from field observations indicate that phenotypic selection was acting on territory quality in all three populations. In two populations, selection was also acting either directly or indirectly on male coloration. Male color likely functions as an indicator of food resources to females because male color is based partly on carotenoid pigments. In controlled experiments, significantly more females from these two populations chose males with brighter colors over dull males, a result consistent with studies on carotenoid pigments in other taxa. In a third population, no evidence of sexual selection on male coloration was found in either the field study or controlled experiment. Lack of female preferences for male color in this population, in which chuckwalla densities are low and home ranges are large, may result from searching costs to females.",99,12449491,Journal,ar,Article,100,2,2,Chuckwalla | Geographic variation | Mate preferences | Population variation | Sauromalus obesus | Sexual selection,22104,undefined,1,TRUE,all,All Open Access,63,NA,NA
true,https://api.elsevier.com/content/abstract/scopus_id/0036753355,SCOPUS_ID:0036753355,2-s2.0-0036753355,Evolutionary shifts between host oak sections and host-plant organs in Andricus gallwasps,Cook J.M.,Evolution,00143820,56,9,1821-1830,2002-09-01,1 September 2002,10.1111/j.0014-3820.2002.tb00196.x,"Gall-inducing insects have especially intimate interactions with their host plants and generally show great specificity with regard to both the host-plant species and the organ (e.g. flower, leaf) galled. However, the relative roles of shifts between host species and between host-plant organs in the diversification of gall-inducers are uncertain. We employ a novel and general maximum-likelihood approach to show that shifts between host-plant organs occur at a significantly greater rate than shifts between host oak sections in European Andricus gallwasps. This suggests that speciation has more often been associated with gall location shifts than with colonization of new host-plant species, and implies that it may be easier for gall-inducers to colonize new plant organs than new plant species. Andricus gallwasps have complex life cycles, with obligate alternation of sexual and parthenogenetic generations. Our phylogenetic analyses show that a life cycle with both generations galling white oaks (section Quercus) is ancestral, with a single shift of the sexual generation onto black oaks (section Cerris) to generate a clade with a novel host-alternating life cycle. This new life cycle provided the opportunity for further speciation, but may have also increased the risk of extinction of one or both generations by the demographic requirement for co-existence of both host-plant groups. In summary, it appears that Andricus gallwasp radiation may be a two-level process. Speciation events often involve shifts in gall location on the same host species. However, there are only so many ways to gall an oak, and rare shifts to new oak sections may contribute greatly to long-term diversification by opening up whole new adaptive zones.",102,12389727,Journal,ar,Article,100,4,4,Bayesian | Cynipidae | Gall | Host plant | Maximum likelihood | Oak | Phylogeny,22104,undefined,1,TRUE,all,All Open Access,64,NA,NA
true,https://api.elsevier.com/content/abstract/scopus_id/0036753213,SCOPUS_ID:0036753213,2-s2.0-0036753213,Is the partial Mantel test inadequate?,Castellano S.,Evolution,00143820,56,9,1871-1873,2002-09-01,1 September 2002,10.1111/j.0014-3820.2002.tb00203.x,"A publication by Raufaste and Rousset (2001) questioned the effectiveness of the partial Mantel test, a nonparametric statistical test for association among three distance matrices. By repeated simulations, we calculated the cumulative density functions of the null-hypothesis probability of no correlation, within an explicit model of causal relationships. Results do not support the criticism: in conditions of moderate correlation between the independent matrices, the actual error rate is closely associated to the intended type-I error α.",119,12389734,Journal,re,Review,100,2,2,Mantel test | Partial Mantel test | Power curve | Simulation study | Type-I error,22104,undefined,1,TRUE,all,All Open Access,65,NA,NA
true,https://api.elsevier.com/content/abstract/scopus_id/0036753212,SCOPUS_ID:0036753212,2-s2.0-0036753212,"Sex-biased genetic structure in the vector of lyme disease, ixodes ricinus",De Meeüs T.,Evolution,00143820,56,9,1802-1807,2002-09-01,1 September 2002,10.1554/0014-3820(2002)056[1802:sbgsit]2.0.co;2,"We analyzed 725 Ixodes ricinus ticks (the principal vector of Lyme disease in Europe) collected in Switzerland in 1995 and 1996 (three and eight samples, respectively) and in Tunisia in 1996 (one sample) with five microsatellite markers. We found highly significant genetic differentiation between Swiss and Tunisian samples but detected almost no differentiation within Switzerland, even between those samples separated by the Alps. Interestingly, we found that I. ricinus females were more genetically related to one another than were males at a local scale, which would indicate a higher dispersal rate of immature males. Possible explanations for these findings in terms of sex-specific association of ticks with certain hosts (e.g., birds) and their epidemiological consequences are discussed.",69,12389725,Journal,ar,Article,100,5,5,Ixodes ricinus | Lyme disease | Population genetics | Sex-biased dispersal | Ticks,22104,undefined,0,FALSE,NA,NA,66,NA,NA
true,https://api.elsevier.com/content/abstract/scopus_id/0036753075,SCOPUS_ID:0036753075,2-s2.0-0036753075,How well do mating frequency and duration predict paternity success in the polygynandrous water strider Aquarius remigis?,Vermette R.,Evolution,00143820,56,9,1808-1820,2002-09-01,1 September 2002,10.1111/j.0014-3820.2002.tb00195.x,"The relationship between mating success and paternity success is a key component of sexual selection but has seldom been estimated for species in which both sexes mate with many partners (polygynandry). We used a modification of Parker's sterile male technique to measure this relationship for the water strider Aquarius remigis in 47 laboratory populations simulating natural conditions of polygynandry. We also tested the hypothesis that prolonged copulation, a characteristic of this species, enhances paternity success. Mating behavior and paternity success were assayed for four days while males and females freely interacted. Paternity success was also assayed for an additional 7 days when females were isolated from males. Mating success significantly predicted paternity success and accounted for ≤ 36% of the variance. Copulation duration was negatively related to both mating success and paternity success and did not explain any of the residual variance in paternity success. Thus, we found no evidence that prolonged copulation functions as a paternity assurance strategy in this species. Comparisons of sterile and fertile males suggested that paternity success is directly influenced by the quantity of sperm transferred. Our results support previous studies that have used mating success to estimate sexual selection, but also highlight the potential importance of sperm competition and other postinsemination processes.",28,12389726,Journal,ar,Article,100,2,2,Copulation duration | Gerridae | Mating success | Sexual selection | Sperm competition | Sterile male,22104,undefined,1,TRUE,all,All Open Access,67,NA,NA
true,https://api.elsevier.com/content/abstract/scopus_id/0036753060,SCOPUS_ID:0036753060,2-s2.0-0036753060,Differential selection to avoid hybridization in two toad species,Pfennig K.,Evolution,00143820,56,9,1840-1848,2002-09-01,1 September 2002,10.1111/j.0014-3820.2002.tb00198.x,"The fitness consequences of hybridization critically affect the speciation process. When hybridization is costly, selection favors the evolution of prezygotic isolating mechanisms (e.g., mating behaviors) that reduce heterospecific matings and, consequently, enhance reproductive isolation between species (a process termed reinforcement). If, however, selection to avoid hybridization differs between species, reinforcement may be impeded. Here, we examined both the frequency and fitness effects of hybridization between plains spadefoot toads (Spea bombifrons) and New Mexico spadefoot toads (S. multiplicata). Hybridization was most frequent in smaller breeding ponds that tend to be ephemeral, and heterospecific pairs consisted almost entirely of S. bombifrons females and S. multiplicata males. Moreover, in controlled experimental crosses, hybrid offspring from crosses in which S. multiplicata was maternal had significantly lower survival and longer development time than pure S. multiplicata offspring. By contrast, hybrid offspring from crosses in which S. bombifrons was maternal outperformed pure S. bombifrons offspring by reaching metamorphosis faster. These data suggest that, although S. multiplicata females are under selection to avoid hybridization, selection might favor those S. bombifrons females that hybridize with S. multiplicata if their breeding pond is highly ephemeral. Generally, the strength of selection to avoid hybridization may differ for hybridizing species, possibly impeding reinforcement.",66,12389729,Journal,ar,Article,100,2,2,Adaptive hybridization | Female mate choice | Hybrid fitness | Introgression | Reinforcement | Spea | Speciation,22104,undefined,0,FALSE,NA,NA,68,NA,NA
true,https://api.elsevier.com/content/abstract/scopus_id/0036753059,SCOPUS_ID:0036753059,2-s2.0-0036753059,"Perspective: Female remating, operational sex ratio, and the arena of sexual selection in Drosophila species",Markow T.,Evolution,00143820,56,9,1725-1734,2002-09-01,1 September 2002,10.1111/j.0014-3820.2002.tb00186.x,"As commonly observed among closely related species within a variety of taxa, Drosophila species differ considerably in whether they exhibit sexual dimorphism in coloration or morphology. Those Drosophila species in which male external sexual characters are minimal or absent tend, instead, to have exaggerated ejaculate traits such as sperm gigantism or seminal nutrient donations. Underlying explanations for the interspecific differences in the presence of external morphological sexual dimorphism versus exaggerated ejaculate traits are addressed here by examining the opportunity for sexual selection on males to occur before versus after mating in 21 species of Drosophila. Female remating frequency, an important component of the operational sex ratio, differs widely among Drosophila species and appears to dictate whether the arena of sexual selection is prior to, as opposed to after, copulation. Infrequent female mating results in fewer mating opportunities for males and thus stronger competition for receptive females that favors the evolution of male characters that maximize mating success. On the other hand, rapid female remating results in overlapping ejaculates in the female reproductive tract, such that ejaculate traits which enhance fertilization success are favored. The strong association between female remating frequency in a given species and the presence of sexually selected external versus internal male characters indicates that the relationship be examined in other taxa as well.",73,12389717,Journal,ar,Article,100,1,1,Drosophila | Ejaculate | Female remating | Sexual dimorphism | Sexual selection,22104,undefined,0,FALSE,NA,NA,69,NA,NA
true,https://api.elsevier.com/content/abstract/scopus_id/0036752877,SCOPUS_ID:0036752877,2-s2.0-0036752877,Habitat-dependent song divergence in the little greenbul: An analysis of environmental selection pressures on acoustic signals,Slabbekoorn H.,Evolution,00143820,56,9,1849-1858,2002-09-01,1 September 2002,10.1111/j.0014-3820.2002.tb00199.x,"Bird song is a sexual trait important in mate choice and known to be shaped by environmental selection. Here we investigate the ecological factors shaping song variation across a rainforest gradient in central Africa. We show that the little greenbul (Andropadus virens), previously shown to vary morphologically across the gradient in fitness-related characters, also varies with respect to song characteristics. Acoustic features, including minimum and maximum frequency, and delivery rate of song notes showed significant differences between habitats. In contrast, we found dialectal variation independent of habitat in population-typical songtype sequences. This pattern is consistent with ongoing gene flow across habitats and in line with the view that song variation in the order in which songtypes are produced is not dependent on habitat characteristics in the same way physical song characteristics are. Sound transmission characteristics of the two habitats did not vary significantly, but analyses of ambient noise spectra revealed dramatic and consistent habitat-dependent differences. Matching between low ambient noise levels for low frequencies in the rainforest and lower minimal frequencies in greenbul songs in this habitat suggests that part of the song divergence may be driven by habitat-dependent ambient noise patterns. These results suggest that habitat-dependent selection may act simultaneously on traits of ecological importance and those important in prezygotic isolation, leading to an association between morphological and acoustic divergence. Such an association may promote assortative mating and may be a mechanism driving reproductive divergence across ecological gradients.",254,12389730,Journal,ar,Article,100,2,2,Ambient noise | Andropadus virens | Ecotone | Little greenbul | Parapatric speciation | Song divergence | Sound transmission,22104,undefined,1,TRUE,all,All Open Access,70,NA,NA
true,https://api.elsevier.com/content/abstract/scopus_id/0036752876,SCOPUS_ID:0036752876,2-s2.0-0036752876,Response to natural and laboratory selection at the Drosophila hsp70 genes,Bettencourt B.R.,Evolution,00143820,56,9,1796-1801,2002-09-01,1 September 2002,10.1111/j.0014-3820.2002.tb00193.x,"To determine whether and how laboratory and natural selection act on the hsp70 (70-Kd heat-shock protein) genes of Drosophila melanogaster, we examined hsp70 allele frequencies in two sets of populations. First, five populations reared at different temperatures for more than 20 years differentially fixed both a large insertion/deletion (indel) polymorphism at the 87A7 hsp70 cluster (""56H8""/""122"") and a single nucleotide polymorphism at the 87C1 hsp70 cluster. In both cases, the 18°C and 25°C populations fixed one allele and the 28°C populations the other, consistent with previously described evolved differences among these populations in Hsp70 expression and thermotolerance. Second, we examined 56H8 and 122 frequencies in a set of 11 populations founded from flies collected along a latitudinal transect of eastern Australia. The 56H8 allele frequencies are positively associated with latitude, consistent with maintenance of the 56H8/122 polymorphism by natural selection. Thermal extremes and average values are negatively correlated with latitude. These results suggest that natural selection imposed by temperature and thermal variability may affect hsp70 allele frequencies.",84,12389724,Journal,ar,Article,100,4,4,Cline | Heat shock protein | hsp70 | Selection | Transposable element,22104,undefined,0,FALSE,NA,NA,71,NA,NA
