@_fa,prism:url,dc:identifier,eid,dc:title,dc:creator,prism:publicationName,prism:issn,prism:volume,prism:issueIdentifier,prism:pageRange,prism:coverDate,prism:coverDisplayDate,prism:doi,dc:description,citedby-count,pubmed-id,prism:aggregationType,subtype,subtypeDescription,author-count.@limit,author-count.@total,author-count.$,source-id,fund-no,openaccess,openaccessFlag,freetoread.value.$,freetoreadLabel.value.$,entry_number
true,https://api.elsevier.com/content/abstract/scopus_id/0023511093,SCOPUS_ID:0023511093,2-s2.0-0023511093,The evolution of bone.,Ruben J.A.,Evolution,00143820,41,6,1187-1197,1987-01-01,1987,10.1111/j.1558-5646.1987.tb02460.x,"Vertebrates are practically unique among the Metazoa in their possession of a skeleton made from calcium phosphate rather than calcium carbonate. Interpretation of the origin of a phosphatic skeleton in early vertebrates has previously centered primarily on systemic requirements for phosphate and/or calcium storage or excretion. We suggest the calcium phosphate skeleton is distinctly advantageous to vertebrates because of their relatively unusual and ancient pattern of activity metabolism: intense bursts of activity supported primarily by rapid intramuscular formation of lactic acid. This postactive acidosis apparently generates slight skeletal dissolution. A variety of apparently unrelated histological features of the skeleton in a number of vertebrates may minimize postactive hypercalcemia. We present new data that suggest that postactive skeletal dissolution would be significantly exacerbated if bone were composed of calcium carbonate rather than calcium phosphate. The former is far less stable both in vivo and in vitro than in calcium hydroxyapatite, under both resting and postactive physiological conditions.-from Authors",39,NA,Journal,ar,Article,100,2,2,22104,undefined,1,TRUE,all,All Open Access,22
true,https://api.elsevier.com/content/abstract/scopus_id/0023511083,SCOPUS_ID:0023511083,2-s2.0-0023511083,The fitness consequences of multiple-locus heterozygosity: the relationship between heterozygosity and growth rate in pitch pine ( Pinus rigida Mill.).,Bush R.M.,Evolution,00143820,41,4,787-798,1987-01-01,1987,10.1111/j.1558-5646.1987.tb05853.x,The adaptive-distance model accounted for between 15-50% of the variation in growth rate within 8 P. rigida population samples by accounting for genotypic differences at 8 polymorphic loci. -from Authors,68,NA,Journal,ar,Article,100,3,3,22104,undefined,1,TRUE,all,All Open Access,23
true,https://api.elsevier.com/content/abstract/scopus_id/0023511076,SCOPUS_ID:0023511076,2-s2.0-0023511076,Effects of avian seed dispersal on the genetic structure of whitebark pine populations.,Furnier G.R.,Evolution,00143820,41,3,607-612,1987-01-01,1987,10.1111/j.1558-5646.1987.tb05831.x,"Pinus albicaulis is a subalpine conifer that commonly displays a multistem form. The individual stems within clumps are genetically distinct individuals, having arisen from separate seeds. Individuals within a clump are genetically more similar than individuals in different clumps, but individuals in neighboring clumps do not appear to be more similar than individuals in distant clumps. This family structure appears to be a direct result of the seed-caching behavior of Clark's nutcrackers Nucifraga columbiana, the primary dispersal agent for whitebark pine seeds. -from Authors",57,NA,Journal,ar,Article,100,4,4,22104,undefined,0,FALSE,NA,NA,24
true,https://api.elsevier.com/content/abstract/scopus_id/0023511007,SCOPUS_ID:0023511007,2-s2.0-0023511007,A model of kin-structured migration.,Rogers A.R.,Evolution,00143820,41,2,417-426,1987-01-01,1987,10.1111/j.1558-5646.1987.tb05807.x,"When individuals disperse from one local group to another, they often do so in the company of relatives. When migration is thus kin-structured, the ratio of between- and within-group variance is increased by a quantity that can be estimated either from behavioral or genetic data. Theoretical results indicate that kin-structured migration should be most important in populations with high mobility. Analysis of data for humans and lions Panthera leo suggests the kin-structured migration may have a substantial effect on genetic population structure in both species. Its effect seems to be small in a population of pine voles Microtus pinetorum.-from Author",23,NA,Journal,ar,Article,100,1,1,22104,undefined,1,TRUE,all,All Open Access,25
true,https://api.elsevier.com/content/abstract/scopus_id/0023510995,SCOPUS_ID:0023510995,2-s2.0-0023510995,"Geographic variation within an island: univariate and multivariate contouring of scalation, size, and shape of the lizard Gallotia galloti.",Thorpe R.S.,Evolution,00143820,41,2,256-268,1987-01-01,1987,10.1111/j.1558-5646.1987.tb05795.x,"In Gallotia galloti within the island of Tenerife, size varies locally in a mosaic pattern while head shape shows a WNW-ESE cline in the south. -from Authors",72,NA,Journal,ar,Article,100,2,2,22104,undefined,0,FALSE,NA,NA,26
true,https://api.elsevier.com/content/abstract/scopus_id/0023510982,SCOPUS_ID:0023510982,2-s2.0-0023510982,Genetic variation and covariation in responses to host plants by Alsophila pometaria ( Lepidoptera: Geometridae).,Futuyma D.J.,Evolution,00143820,41,2,269-279,1987-01-01,1987,10.1111/j.1558-5646.1987.tb05796.x,"Progeny of uncommon parthenogenetic genotypes of the polyphagous geometrid Alsophila pometaria were reared on 4 host plant species representing the same genus, different confamilial genera, and different families. On the supposition that uncommon asexual genotypes have arisen recently from the sympatric sexual population, they may be viewed as a representation of variation in the sexual population that has been captured by parthenogenesis. Significant effects of genotype, host, and their interaction were found for survival. Live weight displayed significant effects of genotype, host, and genotype X host interaction in the laboratory, and significant main effects in the field. The broad heritability of live weight within hose was significantly greater than zero in all cases, ranging from 0.18-0.33.-from Authors",90,NA,Journal,ar,Article,100,2,2,22104,undefined,1,TRUE,all,All Open Access,27
true,https://api.elsevier.com/content/abstract/scopus_id/0023510644,SCOPUS_ID:0023510644,2-s2.0-0023510644,The stability of the symbiosis between dioecious figs and their pollinators: a study of Ficus carica L. and Blastophaga psenes L.,Kjellberg F.,Evolution,00143820,41,4,693-704,1987-01-01,1987,10.1111/j.1558-5646.1987.tb05846.x,"In 'dioecious' figs, the wasp can only breed in the female flowers of the 'male' trees, so that pollination of a female tree is always lethal. The wasps should therefore be selected to avoid female trees. Data are presented showing that the fruiting phenology of the dioecious fig Ficus carica is such that this selection does not occur: syconia are not receptive at the same time on 'male' and female trees. Most wasps are forced to emerge from the syconia of 'male' trees at a time when they will not be able to reproduce, whether they avoid female trees or not. The fruiting phenology of F. carica which stabilizes the symbiosis, is the result of short-term selective pressures on the male function of the trees. Such selective pressures suggest a possible pathway from monoecy to dioecy in Ficus under seasonal climates. -from Authors",173,NA,Journal,ar,Article,100,5,5,22104,undefined,1,TRUE,all,All Open Access,28
true,https://api.elsevier.com/content/abstract/scopus_id/0023504115,SCOPUS_ID:0023504115,2-s2.0-0023504115,Biochemical phenotypic and genetic studies of two introduced fire ants and their hybrid ( Hymenoptera: Formicidae).,Ross K.G.,Evolution,00143820,41,2,280-293,1987-01-01,1987,10.1111/j.1558-5646.1987.tb05797.x,"Two introduced fire ants, Solenopsis invicta and S. richteri, and their hybrid were studied using phenotypic markers from gas chromatographic analysis of hydrocarbons and venom alkaloids, as well as genetic markers from enzyme electrophoresis. Both methods show that extensive gene introgression is occurring over a distance of at least 120km at the contact zone between the 2 forms in E Mississippi. Recombinant genotypes predominate in the hybrid zone, in dicating that F1 hybrids are viable.-from Authors",100,NA,Journal,ar,Article,100,4,4,22104,undefined,1,TRUE,all,All Open Access,29
true,https://api.elsevier.com/content/abstract/scopus_id/0023499230,SCOPUS_ID:0023499230,2-s2.0-0023499230,Asexual reproduction in cestodes ( Cyclophyllidea: Taeniidae): ecological and phylogenetic influences.,Moore J.,Evolution,00143820,41,4,882-891,1987-01-01,1987,10.1111/j.1558-5646.1987.tb05861.x,"Asexual reproduction, a rare trait among cestodes in general, occurs in the metacestode stage of species of the family Taeniidae. Neither historical constraint nor explanations invoking adaptation based on environmental predictability can account for life-history variation in these cestodes. -from Authors",27,NA,Journal,ar,Article,100,2,2,22104,undefined,0,FALSE,NA,NA,30
true,https://api.elsevier.com/content/abstract/scopus_id/0023499215,SCOPUS_ID:0023499215,2-s2.0-0023499215,"Forager behavior, pollen dispersal, and inbreeding in two species of hummingbird-pollinated plants.",Linhart Y.B.,Evolution,00143820,41,3,679-682,1987-01-01,1987,10.1111/j.1558-5646.1987.tb05841.x,"Razisea spicata and Hansteinia blepharorachis (Acanthaceae) are perennial understory herbs in the cloud forests of Monteverde, Costa Rica. Differences in hummingbird foraging behavior and associated gene flow generate differences in levels of inbreeding of the plant populations. -from Authors",33,NA,Journal,ar,Article,100,4,4,22104,undefined,1,TRUE,all,All Open Access,31
true,https://api.elsevier.com/content/abstract/scopus_id/0023499117,SCOPUS_ID:0023499117,2-s2.0-0023499117,Variation and evolution of breeding systems in the Turnera ulmifolia L. complex (Turneraceae).,Barrett S.C.H.,Evolution,00143820,41,2,340-354,1987-01-01,1987,10.1111/j.1558-5646.1987.tb05802.x,"The evolutionary and functional relationships among breeding systems and flora morphology were investigated in the Turnera ulmifolia complex. Predictions of a model of breeding system evolution among distylous and homostylous varieties were tested. Chromosome counts of 73 accessions revealed an association between breeding system and chromosome number. Diploid and tetraploid populations of 5 taxonomic varieties are distylous and self-incompatible, whereas hexaploid populations of 3 varieties are homostylous and self-compatible. Estimates of outcrossing rate in a distylous population using allozyme markers confirmed that dimorphic incompatibility enforces complete oucrossing. Significant genetic variation for flora traits likely to influence the mating system, such as stigma-anther separation, occurs within and among homostylous populations of var. angustifolia on Jamaica. -from Authors",168,NA,Journal,ar,Article,100,2,2,22104,undefined,1,TRUE,all,All Open Access,32
true,https://api.elsevier.com/content/abstract/scopus_id/0023490687,SCOPUS_ID:0023490687,2-s2.0-0023490687,A multispecies approach to the analysis of gene flow in marine shore fishes.,Waples R.S.,Evolution,00143820,41,2,385-400,1987-01-01,1987,10.1111/j.1558-5646.1987.tb05805.x,"Ten species of marine shore fishes with a wide range of life-history strategies were collected from 4 areas in southern California and Baja California and examined for patterns of genetic differentiation. Findings suggest that populations of these shore fishes are in at least a quasi-equilibrium with respect to migration, mutation, and genetic drift.-from Author",411,NA,Journal,ar,Article,100,1,1,22104,undefined,1,TRUE,all,All Open Access,33
true,https://api.elsevier.com/content/abstract/scopus_id/0023486983,SCOPUS_ID:0023486983,2-s2.0-0023486983,Alternative models of character displacement and niche shift. I. Adaptive shifts in resource use when there is competition for nutritionally nonsubstitutable resources.,Abrams P.A.,Evolution,00143820,41,3,651-661,1987-01-01,1987,10.1111/j.1558-5646.1987.tb05836.x,Analyzes the influence of the nutritional status of resources on the adaptive response to interspecific competition in a consumer of those resources. The two cases compared are that in which the resources are nutritionally perfectly substitutable and that in which the resources are nonsubstitutable. -from Author,83,NA,Journal,ar,Article,100,1,1,22104,undefined,1,TRUE,all,All Open Access,34
true,https://api.elsevier.com/content/abstract/scopus_id/0023486889,SCOPUS_ID:0023486889,2-s2.0-0023486889,Developmental quantitative genetics and the evolution of ontogenies.,Atchley W.R.,Evolution,00143820,41,2,316-330,1987-01-01,1987,10.1111/j.1558-5646.1987.tb05800.x,"A model is presented which permits integration of developmental information into genetic discussions about evolutionary change in morphology. Development of a trait is described in terms of an ontogenetic trajectory whose properties are defined by a small number of parameters. Some evolutionary aspects of development are examined from the perspective of this quantitative genetic model. Particular attention is given to the developmental origin of pleiotropic effects, developmental constraints, heterochrony, and the growth and morphogenesis of complex morphologies. The role of genetic maternal effects in mammalian development is briefly examined, particularly as it relates to selection on developmental traits. -Author",73,NA,Journal,ar,Article,100,1,1,22104,undefined,1,TRUE,all,All Open Access,35
true,https://api.elsevier.com/content/abstract/scopus_id/0023486431,SCOPUS_ID:0023486431,2-s2.0-0023486431,"The effects of body mass, phylogeny, habitat, and trophic level on mammalian age at first reproduction.",Wootton J.T.,Evolution,00143820,41,4,732-749,1987-01-01,1987,10.1111/j.1558-5646.1987.tb05849.x,"Examined age at 1st reproduction of 547 mammalian species. Body mass correlated positively with age at 1st reproduction, explaining 56% of the variance. Habitat and trophic groups deviated significantly from the allometric curve in a pattern generally consistent with predictions from r/K selection theory and its modifications, but mammalian orders also deviated significantly from the allometric curve, and different habitat and diet groups contained different ratios of mammalian orders. When the effects of orders were removed, residual deviations did not differ among ecological groups. Adjusting for ecological differences did not eliminate differences between orders. Results suggest that body mass (or some correlated factor) and phylogeny strongly constrain age at first reproduction.-from Authors",49,NA,Journal,ar,Article,100,1,1,22104,undefined,1,TRUE,all,All Open Access,36
true,https://api.elsevier.com/content/abstract/scopus_id/0023486427,SCOPUS_ID:0023486427,2-s2.0-0023486427,Random mating in the northern flicker hybrid zone: implications for the evolution of bright and contrasting plumage patterns in birds.,Moore W.S.,Evolution,00143820,41,3,539-546,1987-01-01,1987,10.1111/j.1558-5646.1987.tb05824.x,"The red-shafted and yellow-shafted flickers Colaptes auratus hybridize in a narrow zone on the W Great Plains of North America. The 2 subspecies are markedly different in 6 plumage traits. Plumage phenotypes were scored for the male and female of 125 mated pairs from the hybrid zone. Correlation analyses revealed no tendency towards pairing of similar phenotypes. Random mating along with evidence of high reproductive success in hybrids suggests that reinforcement of premating reproductive isolation is not occurring and that speciation will not result from the dynamics of the hybrid zone. At least some of the plumage traits seem to be important in the integrated courtship and territorial behaviors. Since these plumage differences have no significance in mate choice, it is inferred that they evolved in an intrasexual selection context rather than in intersexual or species-recognition contexts. Selection gradients appear to be important in restricting hybridization to a narrow zone. The gradients could result from ecological selection or from sexual selection.-from Author",48,NA,Journal,ar,Article,100,1,1,22104,undefined,1,TRUE,all,All Open Access,37
true,https://api.elsevier.com/content/abstract/scopus_id/0023486414,SCOPUS_ID:0023486414,2-s2.0-0023486414,Dissecting correlated characters: adaptive aspects of phenotypic covariation in melanization pattern of Pieris butterflies.,Kingsolver J.G.,Evolution,00143820,41,3,491-503,1987-01-01,1987,10.1111/j.1558-5646.1987.tb05820.x,"Quantifies and analyses variation in the wing-melanization pattern within species for a series of Pieris populations from relatively cool environments in North America and compares results with predictions based on an adaptive hypothesis. The hypothesis correctly predicts many of the qualitative features of covariation in melanization among major regions of the wings, at the level of biogeographic variation among populations, for both male and female Pieris occidentalis. When within-population variation is considered, agreement with the adaptive predictions varies considerably in different populations for both P. occidentalis and P. napi males and females. In both species, there is a consistent difference in melanization pattern between alpine and arctic sites; this difference is discussed in relation to the differences in the radiative environment between these 2 types of 'cold' habitats.-from Authors",23,NA,Journal,ar,Article,100,2,2,22104,undefined,1,TRUE,all,All Open Access,38
true,https://api.elsevier.com/content/abstract/scopus_id/0023483663,SCOPUS_ID:0023483663,2-s2.0-0023483663,Interspecific competitive interactions and the maintenance of genotypic variation within two perennial grasses.,Kelley S.E.,Evolution,00143820,41,1,92-103,1987-01-01,1987,10.1111/j.1558-5646.1987.tb05773.x,"Naturally co-occurring genotypes of two perennial grasses, Danthonia spicata and Anthoxanthum odoratum, differed in interspecific competitive performance. The competitive performance of a given genotype often depended on the genotypic identity of the competing species, especially in Danthonia. Both overcompensatory and undercompensatory interactions were found, but neither was prevalent for both species. -from Authors",44,NA,Journal,ar,Article,100,2,2,22104,undefined,1,TRUE,all,All Open Access,39
true,https://api.elsevier.com/content/abstract/scopus_id/0023482577,SCOPUS_ID:0023482577,2-s2.0-0023482577,Geographic variation of sexual dimorphism in size of savannah sparrows ( Passerculus sandwichensis): a test of hypotheses.,Rising J.D.,Evolution,00143820,41,3,514-524,1987-01-01,1987,10.1111/j.1558-5646.1987.tb05822.x,"Throughout their range male savannah sparrows are larger, on average, than females. This doubtless reflects Darwinian sexual selection, for territorial fights usually involve males, many of whom fail to obtain mates. In some parts of their range, savannah sparrows are commonly polygynous, in others monogamous. Among species of American sparrows sexual size dimorphism is generally greater in polygynous species. A similar trend was not found among populations of savannah sparrows. Amount of sexual dimorphism, either in overall size or in bill size, does not correlate with species diversity and does not differ between island and mainland populations. Results do not support the niche-variation hypothesis. Size dimorphism is relatively great in populations of savannah sparrows that are resident in SW US salt marshes. -from Author",23,NA,Journal,ar,Article,100,1,1,22104,undefined,1,TRUE,all,All Open Access,40
true,https://api.elsevier.com/content/abstract/scopus_id/0023482462,SCOPUS_ID:0023482462,2-s2.0-0023482462,Macro- and microgeographic structure of a spatially subdivided beetle species in nature.,Smith King P.,Evolution,00143820,41,2,401-416,1987-01-01,1987,10.1111/j.1558-5646.1987.tb05806.x,"Collops georgianus (Coleoptera: Melyridae), a beetle species endemic to the 'island' habitat of granitic rock outcrops, was chosen to see how its spatially subdivided distribution has affected its genetic structure. Microgeographically, in the central part of the range, where outcrops are denser and more continuously distributed in space, there was evidence of isolation by distance. Very little variation in allele frequencies was found, but a low but significant level of substructuring occurred among the populations. Comparison of disjunct and continuous populations microgeographically revealed no effect of disjunct distributions, although a significant effect of distance was detected. Effective population size variation among populations and between years, compounded with the effects of local extinctions, suggest that random processes such as drift and founder effects are important determinants of the population's genetic structure. -from Author",31,NA,Journal,ar,Article,100,1,1,22104,undefined,1,TRUE,all,All Open Access,41
true,https://api.elsevier.com/content/abstract/scopus_id/0023480752,SCOPUS_ID:0023480752,2-s2.0-0023480752,Holding on by their hooks: anchors for worms.,Woodin S.A.,Evolution,00143820,41,2,427-432,1987-01-01,1987,10.1111/j.1558-5646.1987.tb05808.x,"Examined the hooked setae of a dominant group of tube-dwellers, the polychaete annelids, and found a pattern of setation that is predictable by tube type, exclusive of worm taxon or orientation. When tube-dwelling worms belonging to different lineages are pressurized, they resist differentially as a function of the direction in which hooks face. The results are consistent with the hypothesis that hooks are used primarily to resist removal of worms from their tubes, are polyphyletic in origin, and are active agents of resistance.-from Authors",25,NA,Journal,ar,Article,100,2,2,22104,undefined,0,FALSE,NA,NA,42
true,https://api.elsevier.com/content/abstract/scopus_id/0023477554,SCOPUS_ID:0023477554,2-s2.0-0023477554,Differentiation and integration of the genome in populations of the marine copepod Tigriopus californicus.,Burton R.S.,Evolution,00143820,41,3,504-513,1987-01-01,1987,10.1111/j.1558-5646.1987.tb05821.x,Geographically separated populations of Tigriopus californicus are sharply differentiated at several enzyme-encoding gene loci. Two studies were performed to investigate the extent to which the gene pools of local populations are organized into harmoniously interacting (or 'coadapted') gene complexes. -from Author,69,NA,Journal,ar,Article,100,1,1,22104,undefined,0,FALSE,NA,NA,43
true,https://api.elsevier.com/content/abstract/scopus_id/0023470181,SCOPUS_ID:0023470181,2-s2.0-0023470181,Evolution and coadaptation of thermoregulatory behavior and wing pigmentation pattern in pierid butterflies.,Kingsolver J.G.,Evolution,00143820,41,3,472-490,1987-01-01,1987,10.1111/j.1558-5646.1987.tb05819.x,"Increased melanization in different wing regions has positive, negative, or neutral effects in increasing body temperature of Pieris butterflies. The angle of the wings used during basking alters the relative importance of different modes of heat transfer and thereby determines the contribution of different dorsal wing regions to thermoregulation. Dorsal melanization affects basking and flight, while ventral melanization primarily affects overheating. Results are used to generate a functional map relating melanization pattern to thermoregulatory performance in Pieris. Reflectance-basking posture, white background color, and melanization pattern represent coadapted characters in Pieris that interact to determine thermoregulatory performance. Differences in thermoregulatory posture and background color between pierid butterflies in the subfamilies Pierinae and Coliadinae have led to a reorganization and partial reversal of the thermoregulatory effects of melanization pattern.-from Author",86,NA,Journal,ar,Article,100,1,1,22104,undefined,1,TRUE,all,All Open Access,44
true,https://api.elsevier.com/content/abstract/scopus_id/0023470134,SCOPUS_ID:0023470134,2-s2.0-0023470134,Sex-ratio selection with migration: does Fisher's result hold?,Kirkpatrick M.,Evolution,00143820,41,1,218-221,1987-01-01,1987,10.1111/j.1558-5646.1987.tb05784.x,"Presents results from a model which addresses the question of whether migration will select a sex ratio different from 1/2 in a species with 2 subpopulations. The model generalizes the problem to allow for arbitrary migration in both directions and for the possibility of environmental or genetic sex determination. Findings show that Fisher's result still holds, and his result applies equally to genotypic sex determination and environmental sex determination. Under genetic sex determination, the sex ratio of an allele is the same in both subpopulations. -from Authors",9,NA,Journal,ar,Article,100,2,2,22104,undefined,1,TRUE,all,All Open Access,45
