@_fa,prism:url,dc:identifier,eid,dc:title,dc:creator,prism:publicationName,prism:issn,prism:volume,prism:issueIdentifier,prism:pageRange,prism:coverDate,prism:coverDisplayDate,prism:doi,dc:description,citedby-count,pubmed-id,prism:aggregationType,subtype,subtypeDescription,author-count.@limit,author-count.@total,author-count.$,source-id,fund-no,openaccess,openaccessFlag,freetoread.value.$,freetoreadLabel.value.$,entry_number
true,https://api.elsevier.com/content/abstract/scopus_id/0023641357,SCOPUS_ID:0023641357,2-s2.0-0023641357,A comparative study of diversification events: the early Paleozoic versus the Mesozoic.,Erwin D.H.,Evolution,00143820,41,6,1117-1186,1987-01-01,1987,10.1111/j.1558-5646.1987.tb02459.x,"We compare 2 major long-term diversifications of marin animal families that began during periods of low diversity but produced strikingly different numbers of phyla, classes, and orders. The 1st is the early-Paleozoic diversification and the other the Mesozoic phase of the post-Paleozoic diversification. The earlier diversification was associated with a great burst of morphological invention producing many phyla, classes, and orders and displaying high per taxon rates of family origination. The later diversification lacked novel morphologies recognized as phyla and classes, produced fewer orders, and displayed lower per taxon rates of family appearances. The chief difference between the diversifications appears to be that the earlier one proceeded from relatively narrow portions of adaptive space, whereas the latter proceeded from species widely scattered among adaptive zones and representing a variety of body plans. Our data support those models that hold that evolutionary opportunity is a major factor in the outcome of evolutionary processes. -from Authors",158,11542112,Journal,ar,Article,100,3,3,22104,undefined,1,TRUE,all,All Open Access,1
true,https://api.elsevier.com/content/abstract/scopus_id/0023585555,SCOPUS_ID:0023585555,2-s2.0-0023585555,Pattern of phenotypic viability and fecundity selection in a natural population of Impatiens pallida,Stewart S.C.,Evolution,00143820,41,6,1290-1301,1987-01-01,1987,10.1111/j.1558-5646.1987.tb02467.x,"Directional viability selection of cotyledon area, day of initial leaf production, number of leaves, and stem length was detected throughout this population. Directional fecundity selection of cotyledon area, day of initial flower production, number of leaves present on day of initial flower production, stem length on day of initial flower production, number of leaves, and stem length was also detected. Phenotypic selection of these characters was strong in some cases, and strength of selection was significantly heterogeneous among locations. For several of the characters, directional phenotypic selection within the population was significantly positive in some locations and significantly negative in others separated by only a few meters. Soil moisture levels and light intensities played a larger role than soil nutrient levels in determining the patterns of both viability and fecundity selection. -from Authors",53,NA,Journal,ar,Article,100,2,2,22104,undefined,1,TRUE,all,All Open Access,2
true,https://api.elsevier.com/content/abstract/scopus_id/0023585545,SCOPUS_ID:0023585545,2-s2.0-0023585545,Geographic population structure and species differences in mitochondrial DNA of mouthbrooding marine catfishes (Ariidae) and demersal spawning toadfishes (Batrachoididae),Avise J.C.,Evolution,00143820,41,5,991-1002,1987-01-01,1987,10.1111/j.1558-5646.1987.tb05872.x,"Restriction-fragment length polymorphisms in mitochondrial DNA (mtDNA) were used to evaluate population-genetic structure and matriarchal phylogeny in 4 species of marine fishes that lack a pelagic larval stage: the catfishes Arius felis and Bagre marinus, and the toadfishes Opsanus tau and O. beta. Considerable genotypic diversity was observed in each species, but major mtDNA phylogenetic assemblages in catfish and toadfish exhibited contrasting patterns of geographic distribution: in catfish, distinct mtDNA clades were widespread, while such clades in toadfish tended to be geographically localized. By both the criteria of species' ranges and the geographic pattern of intraspecific mtDNA phylogeny, populations of marine catfish in the W Atlantic have had greater historical interconnectedness than have toadfish. -from Authors",102,NA,Journal,ar,Article,100,3,3,22104,undefined,0,FALSE,NA,NA,3
true,https://api.elsevier.com/content/abstract/scopus_id/0023558037,SCOPUS_ID:0023558037,2-s2.0-0023558037,"Aggression, density, and sexual dimorphism in chernetid pseudoscorpions (Arachnida: Pseudoscorpionida)",Zeh D.W.,Evolution,00143820,41,5,1072-1087,1987-01-01,1987,10.1111/j.1558-5646.1987.tb05877.x,"Species vary in the extent to which males and females differ in size of the pedipalps, and, in particular, in size of the pedipalpal chelae. A statistical analysis of dimorphism patterns within the Chernetidae suggests that dimorphism is a highly variable condition, relatively unconstrained by phylogenetic influences. The evolution of species with enlarged male pedipalps appears to be associated with a change from nonpairing to pairing sperm-transfer behavior and with aggressive mate acquisition by males. Experiments with Dinocheirus arizonensis demonstrate a strong correlation between male combat ability and chela size. Superior combat ability of large males results in increased mating success only under high-density conditions. The greater success in spermatophore transfer among large males can be attributed to increased opportunity at high density for large males to interrupt matings and aggressively displace smaller males. -from Author",44,NA,Journal,ar,Article,100,1,1,22104,undefined,1,TRUE,all,All Open Access,4
true,https://api.elsevier.com/content/abstract/scopus_id/0023557817,SCOPUS_ID:0023557817,2-s2.0-0023557817,The heritable basis of variation in larval developmental patterns within populations of the wood frog (Rana sylvatica),Berven K.A.,Evolution,00143820,41,5,1088-1097,1987-01-01,1987,10.1111/j.1558-5646.1987.tb05878.x,"There was a high level of additive-genetic variance and high heritability for body size at metamorphosis in the mountain population, but these were very low in the lowland population. The genetic correlations between developmental rate and larval body size are negative for the mountain population and near zero for the lowland population. Differences in genetic structure between these populations reflect differences in the selective regimes of their respective environments. -from Author",61,NA,Journal,ar,Article,100,1,1,22104,undefined,1,TRUE,all,All Open Access,5
true,https://api.elsevier.com/content/abstract/scopus_id/0023557028,SCOPUS_ID:0023557028,2-s2.0-0023557028,Regression analysis of natural selection: statistical inference and biological interpretation,Mitchell-Olds T.,Evolution,00143820,41,6,1149-1161,1987-01-01,1987,10.1111/j.1558-5646.1987.tb02457.x,"Discusses statistical and biological issues that may arise in applications of Lande and Arnold's (1983) multiple-regression approach to measuring selection. In particular, multicollinearity (extreme intercorrelation of characters) and extrinsic, unmeasured factors affecting fitness may seriously complicate inference regarding selection. Violation of the assumption that residuals are normally distributed vitiates tests of significance. For this situation, applications of recently developed jackknife tests of significance are suggested. -from Authors",633,NA,Journal,ar,Article,100,2,2,22104,undefined,1,TRUE,all,All Open Access,6
true,https://api.elsevier.com/content/abstract/scopus_id/0023556763,SCOPUS_ID:0023556763,2-s2.0-0023556763,Demography and sex ratio in social spiders,Frank S.A.,Evolution,00143820,41,6,1267-1281,1987-01-01,1987,10.1111/j.1558-5646.1987.tb02465.x,"All quasisocial spider species appear to have female-biased sex ratios, while congeneric species with less advanced forms of sociality have 1:1 sex ratios. Two sex-ratio models examine the interaction between the genetic structure of populations and 2 aspects of colony demography - the changes as the colony grows larger in fecundity per female and in colony survivorship. In the 1st model, it is assumed that all members of the population produce the same sex ratio under all conditions (monomorphic strategy), while in the 2nd model the sex ratio can be adjusted according to stage in the colony growth cycle (conditional strategy). Results are consistent with the typically observed effects of within-sex competition among relatives; the sex ratio is biased toward the sex with less intense competition. A number of interesting interactions are also revealed among relatedness, demography, and constraints of the sex-determining mechanism, eg when survivorship or fecundity increases as the colony grows larger, the predicted sex ratio becomes more female-biased. These demographic factors of changing viability and fecundity with changing colony size interact synergistically with relatedness; the effect of this interaction on the sex ratio depends on the constraints of the sex-determining mechanism. -from Author",49,NA,Journal,ar,Article,100,1,1,22104,undefined,1,TRUE,all,All Open Access,7
true,https://api.elsevier.com/content/abstract/scopus_id/0023556169,SCOPUS_ID:0023556169,2-s2.0-0023556169,The effect of investment in attractive structures on allocation to male and female functions in plants,Charlesworth D.,Evolution,00143820,41,5,948-968,1987-01-01,1987,10.1111/j.1558-5646.1987.tb05869.x,"Expressions for male and female fitnesses of partially self-fertilizing cosexual plants are derived, assuming that allocation to pollinator attraction at the time of flowering may decrease resources available for male and female primary structures. -from Authors",143,NA,Journal,ar,Article,100,2,2,22104,undefined,1,TRUE,all,All Open Access,8
true,https://api.elsevier.com/content/abstract/scopus_id/0023529883,SCOPUS_ID:0023529883,2-s2.0-0023529883,Altruism in Mendelian populations derived from sibling groups: the haystack model revisited,Wilson D.S.,Evolution,00143820,41,5,1059-1070,1987-01-01,1987,10.1111/j.1558-5646.1987.tb05876.x,"A group-selection model is presented in which each group is initiated by a single fertilized female and persists for several generations before dispersal. Maynard Smith (1964) concluded that altruism could not plausibly evolve under these circumstances. His conclusion is an artifact of a simplifying assumption that amounts to a worst-case scenario for group selection. When the standard donor-recipient equations for altruistic behavior are used in Maynard Smith's model, Mendelian populations derived from sibling groups are often more favorable for the evolution of altruism than are the sibling groups themselves. In general, long-term and large-scale aspects of population structure may at times be important in the evolution of altruistic and other group-advantageous behaviors -from Author",60,NA,Journal,ar,Article,100,1,1,22104,undefined,1,TRUE,all,All Open Access,9
true,https://api.elsevier.com/content/abstract/scopus_id/0023529408,SCOPUS_ID:0023529408,2-s2.0-0023529408,Inter- and intraspecific variation of mosses in tolerance to copper and zinc,Shaw J.,Evolution,00143820,41,6,1312-1325,1987-01-01,1987,10.1111/j.1558-5646.1987.tb02469.x,"Tolerance of Funaria hygrometrica to Cu and Zn was greater in populations that originated on soil with high concentrations of these metals. Protonemal growth was more inhibited by the metals than was germination; Cu was more toxic than Zn. The pattern of population differentiation for heavy metal tolerance in this species is much like that of flowering plants. Five populations of Physcomitrium pyriforme, which does not occur on metal-contaminated soil, were all highly tolerant of Zn but extremely intolerant of Cu. Significant variation in tolerance to Cu and Zn occurred among populations, but tolerance did not correlate with metal contents in native substrates. This pattern differs from that of flowering plants. from Authors",27,NA,Journal,ar,Article,100,3,3,22104,undefined,1,TRUE,all,All Open Access,10
true,https://api.elsevier.com/content/abstract/scopus_id/0023529406,SCOPUS_ID:0023529406,2-s2.0-0023529406,A test of the Chitty hypothesis: inheritance of life-history traits in meadow voles Microtus pennsylvanicus,Boonstra R.,Evolution,00143820,41,5,929-947,1987-01-01,1987,10.1111/j.1558-5646.1987.tb05868.x,"The Chitty hypothesis proposes that the demographic changes occurring in microtine cycles are mediated by natural selection operating on the genetic composition of the population. Implicit is the assumption that a suite of life-history traits is simultaneously undergoing selection and that these traits are strongly heritable. This was tested 1) by determining whether the year-to-year differences in phenotypes in fluctuating meadow vole populations in the field are maintained in samples of young animals raised in the laboratory, and 2) whether the variation seen in the field has a heritable basis as determined by half-sib analysis. In the field, young from the year when population size was increasing grew more rapidly than those from the peak year; in the laboratory, the opposite occurred. Ages at sexual maturity showed similar differences. Heritability analysis was performed on body weight, growth rate, and age and weight at sexual maturity. Virtually all these traits showed significant dam effects, but small or nonexistant sire effects. Thus, most of the variation was nongenetic in origin; maternal and other environmental effects were of overriding importance. The heritabilities of these traits in nature are thus usually lower than necessary for natural selection to operate in the time frames characteristic of microtine cycles. -from Authors",85,NA,Journal,ar,Article,100,2,2,22104,undefined,0,FALSE,all,All Open Access,11
true,https://api.elsevier.com/content/abstract/scopus_id/0023528999,SCOPUS_ID:0023528999,2-s2.0-0023528999,Random-fragment hybridization analysis of evolution in the genus Neurospora: the status of four-spored strains,Natvig D.O.,Evolution,00143820,41,5,1003-1021,1987-01-01,1987,10.1111/j.1558-5646.1987.tb05873.x,"Variation among randomly selected nuclear fragments can be employed to group related taxa with a higher degree of resolution than has been obtained with other DNA hybridization methods, isozyme electrophoresis, or restriction analysis of repetitive DNA. -from Authors",31,NA,Journal,ar,Article,100,3,3,22104,undefined,0,FALSE,NA,NA,12
true,https://api.elsevier.com/content/abstract/scopus_id/0023528724,SCOPUS_ID:0023528724,2-s2.0-0023528724,Phylogenetic studies of coadaptation: preferred temperatures versus optimal performance temperatures of lizards,Huey R.B.,Evolution,00143820,41,5,1098-1115,1987-01-01,1987,10.1111/j.1558-5646.1987.tb05879.x,"Examined thermal preferences and the thermal dependence of sprinting in some Australian skinks (Lygosominae). Thermal preferences (Tp) differ strikingly among genera (range 24-35oC), but critical thermal maxima (CTMax)(range 38-45oC) and optimal temperatures for sprinting (To, 32-35oC) vary less. Diurnal genera have relatively high Tp, To, and CTMax. In contrast, nocturnal genera have low Tp but have moderate to high To and CTMax. Both nonphylogenetic and phylogenetic (minimum-evolution) approaches suggest that coadaptation is tight only for genera with high Tp. Phylogenetic analyses suggest that low Tp and, thus, partial coadaptation are evolutionarily derived, indicating that low thermal preferences can evolve, even if this results in reduced performance. In one instance, thermal preferences and the thermal dependence of sprinting may have evolved in opposite directions (""antagonistic coadaptation'). -from Authors",420,NA,Journal,ar,Article,100,2,2,22104,undefined,1,TRUE,all,All Open Access,13
true,https://api.elsevier.com/content/abstract/scopus_id/0023528721,SCOPUS_ID:0023528721,2-s2.0-0023528721,Fifty years of interspecific hybridization: genetics and morphometrics of a controlled experiment on the land snail Cerion in the Florida keys,Woodruff D.S.,Evolution,00143820,41,5,1022-1045,1987-01-01,1987,10.1111/j.1558-5646.1987.tb05874.x,"In 1915, 55 Bahamian Cerion casablancae were established on Bahia Honda Key, Florida. The introduced snails thrived, bred true to form, and the colony grey until about 1928 when it began to hybridize with C. incanum, the unrelated Florida species. In 1977, morphological hybrids occupied an area of c3.5 ha. Spatial and temporal aspects of the interaction were characterized morphologically and genetically. Comparison of 1933 with 1977 samples showed that the hybrids are gradually approaching C. incanum in phenotype. Regardless of phenotype, the snails on Bahia Honda Key were panmictic and outbreeding. There was no evidence for strong selection against hybrids, and by 1977 introduced alleles had spread over 5 ha. However, no pure C. casablancae remain; low but persistent gene flow has brought about a 30% diminution of the introduced genome. These observations are useful in interpreting Cerion's remarkable variability as colonization following hurricane dispersal has undoubtedly played a role in the group's complex evolution. -from Authors",47,NA,Journal,ar,Article,100,2,2,22104,undefined,1,TRUE,all,All Open Access,14
true,https://api.elsevier.com/content/abstract/scopus_id/0023528447,SCOPUS_ID:0023528447,2-s2.0-0023528447,The dispersal barrier in the tropical Pacific: implications for molluscan speciation and extinction,Vermeij G.J.,Evolution,00143820,41,5,1046-1058,1987-01-01,1987,10.1111/j.1558-5646.1987.tb05875.x,"The dispersal barrier between continental islands (represented by species from E Indonesia, S Philippines, and the N coast of New Guinea) and the nearby oceanic Palau Islands was studied by evaluating the percentage of each shell architectural and habitat category that is present on the continental islands but missing in Palau. The barrier is significantly more effective against sand-dwelling species than against rock-dwellers; among rock-dwellers it is most effective against aperturally unarmored taxa. Barriers between Palau and Guam, Guam and the Hawaiian Islands, and the Line Islands and the tropical Pacific are generally unselective with respect to substratum type and architecture. That narrow-apertured species are less affected by the barrier between the continental islands and Palau than are other rock-dwelling gastropods is consistent with the interpretation that this group has been unusually resistant to extinction and highly susceptible to founder speciation when oceanic circulation is altered. These patterns of susceptibility and geographical distribution may explain why armored gastropods have increased in numbers relative to unarmored ones in the tropical Pacific during the Cenozoic. -from Author",96,NA,Journal,ar,Article,100,1,1,22104,undefined,1,TRUE,all,All Open Access,15
true,https://api.elsevier.com/content/abstract/scopus_id/0023519328,SCOPUS_ID:0023519328,2-s2.0-0023519328,"Color pattern polymorphism in the Lake Erie water snake, Nerodia sipedon insularum.",King R.B.,Evolution,00143820,41,2,241-255,1987-01-01,1987,10.1111/j.1558-5646.1987.tb05794.x,"Populations of Nerodia sipedon on islands in W Lake Erie are polymorphic for color pattern. These populations include banded, intermediate, and unbanded morphs while surrounding mainland populations consist solely of the banded morph. One scenario for the evolution and maintenance of this polymorphism is that selection was important in establishing unbanded morphs in island populations as they became isolated from the mainland. As populations declined to their present size, the impact of migration from the mainland increased and is now swamping the effect of selection. Further declines in island population size may result in fixation of the banded morph.-from Author",45,NA,Journal,ar,Article,100,1,1,22104,undefined,0,FALSE,NA,NA,16
true,https://api.elsevier.com/content/abstract/scopus_id/0023518251,SCOPUS_ID:0023518251,2-s2.0-0023518251,Analysis of mitochondrial DNA polymorphisms among Channel Island deer mice.,Ashley M.,Evolution,00143820,41,4,854-863,1987-01-01,1987,10.1111/j.1558-5646.1987.tb05858.x,"Mitochondrial DNA from 131 deer mice Peromyscus maniculatus, collected on the eight California Channel Islands and from seven southern California mainland locations, was isolated and analyzed for restriction endonuclease fragment polymorphisms.-Authors",51,NA,Journal,ar,Article,100,2,2,22104,undefined,0,FALSE,NA,NA,17
true,https://api.elsevier.com/content/abstract/scopus_id/0023518130,SCOPUS_ID:0023518130,2-s2.0-0023518130,Safety factors of tropical versus temperate limpet shells: multiple selection pressures on a single structure.,Lowell R.B.,Evolution,00143820,41,3,638-650,1987-01-01,1987,10.1111/j.1558-5646.1987.tb05835.x,"A safety factor was defined as shell strength/maximum tenacity, where maximum tenacity (force required to detach foot) determines the maximum prying force that a crab or bird predator can exert on the shell. On average, shell strength and foot tenacity for tropical E Pacific limpets were twice those for the temperate limpets; average safety factors for the 2 groups were about equal. This comparatively narrow range of safety factors was due to a highly significant association of greater shell strengths with greater foot tenacities. Selection has presumably acted to closely link the mechanical performances of these two rather independent structures, the shell and the foot. Whereas the shells of both tropical and temperate limpets are exposed to predator-induced prying forces, the shells of the tropical group are also exposed to lateral crushing forces generated by fish predators. This appears to have influenced the precision with which the shells of these species have become adapted to a single selection pressure. -from Author",25,NA,Journal,ar,Article,100,1,1,22104,undefined,1,TRUE,all,All Open Access,18
true,https://api.elsevier.com/content/abstract/scopus_id/0023516566,SCOPUS_ID:0023516566,2-s2.0-0023516566,Rapid genetic differentiation and founder effect in colonizing populations of common mynas ( Acridotheres tristis).,Baker A.J.,Evolution,00143820,41,3,525-538,1987-01-01,1987,10.1111/j.1558-5646.1987.tb05823.x,"Populations of common mynas introduced to Australia, New Zealand, Fiji, Hawaii, and South Africa from India during the last century were compared genetically with the extant native population using isozyme electrophoresis of 39 presumptive loci. Average heterozygosity, mean number of alleles/locus, and the percentage of polymorphic loci are lower in the inroduced populations, and the 18% loss of alleles involves only alleles that are rare in the native population. The native population is only weakly subdivided genetically whereas the introduced populations are much more differentiated and the mean genetic distance among them is significantly greater than among native samples. The reduction in mean number of alleles/locus and average heterozygosity is greatest in the South African population, cosistent with a very small effective size in the founder population. In the evolutionarily short period of 100-200yr, bottlenecks and random drift have promoted genetic shifts equal to those between different subspecies of birds.-from Authors",133,NA,Journal,ar,Article,100,2,2,22104,undefined,1,TRUE,all,All Open Access,19
true,https://api.elsevier.com/content/abstract/scopus_id/0023516561,SCOPUS_ID:0023516561,2-s2.0-0023516561,Isolating mechanisms in seabirds.,Pierotti R.,Evolution,00143820,41,3,559-570,1987-01-01,1987,10.1111/j.1558-5646.1987.tb05826.x,Bill and foot coloration apparently act as the primary isolating mechanisms in all surface-nesting seabirds and some burrow nesters. -from Author,38,NA,Journal,ar,Article,100,1,1,22104,undefined,1,TRUE,all,All Open Access,20
true,https://api.elsevier.com/content/abstract/scopus_id/0023511136,SCOPUS_ID:0023511136,2-s2.0-0023511136,Maximum-likelihood approaches applied to quantitative genetics of natural populations.,Shaw R.G.,Evolution,00143820,41,4,812-826,1987-01-01,1987,10.1111/j.1558-5646.1987.tb05855.x,"Growing interest in adaptive evolution in natural populations has spurred efforts to infer genetic components of variance and covariance of quantitative characters. Difficulties inherent in the usual least-squares methods of estimation are reviewed. A useful alternative approach is that of maximum likelihood. Its particular advantage over least squares is that estimation and testing procedures are well defined, regardless of the design of the data. -from Author",229,NA,Journal,ar,Article,100,1,1,22104,undefined,1,TRUE,all,All Open Access,21
