@_fa,prism:url,dc:identifier,eid,dc:title,dc:creator,prism:publicationName,prism:issn,prism:volume,prism:issueIdentifier,prism:pageRange,prism:coverDate,prism:coverDisplayDate,prism:doi,dc:description,citedby-count,pubmed-id,prism:aggregationType,subtype,subtypeDescription,author-count.@limit,author-count.@total,author-count.$,authkeywords,source-id,fund-no,openaccess,openaccessFlag,freetoread.value.$,freetoreadLabel.value.$,entry_number,fund-acr,fund-sponsor
true,https://api.elsevier.com/content/abstract/scopus_id/0036341271,SCOPUS_ID:0036341271,2-s2.0-0036341271,Within- and between-population variation for Wolbachia-induced reproductive incompatibility in a haplodiploid mite,Vala F.,Evolution,00143820,56,7,1331-1339,2002-01-01,2002,10.1111/j.0014-3820.2002.tb01447.x,"Wolbachia pipientis is a bacterium that induces cytoplasmic incompatibility (CI), the phenomenon in which infected males are reproductively incompatible with uninfected females. CI spreads in a population of hosts because it reduces the fitness of uninfected females relative to infected females. CI encompasses two steps: modification (mod) of sperm of infected males and rescuing (resc) of these chromosomes by Wolbachia in the egg. Infections associated with CI have mod+resc+ phenotypes. However, mod-resc+ phenotypes also exist; these do not result in CI. Assuming mod/resc phenotypes are properties of the symbiont, theory predicts that mod-resc+ infections can only spread in a host population where a mod+resc+ infection already occurs. A mod-resc+ infection spreads if the cost it imposes on the infected females is lower than the cost inflicted by the resident (mod+resc+) infection. Furthermore, introduction of a mod- Wolbachia eventually drives infection to extinction. The uninfected population that results can be recolonized by a CI-causing Wolbachia. Here, we investigated whether variability for induction of CI was present in two Tetranychus urticae populations. In one population all isofemale lines tested were mod-. In the other, mod+resc+ and mod-resc+ isofemale lines coexisted. We found no evidence for a cost difference to females expressing either type (mod+/-). Infections in the two populations could not be distinguished based on sequences of two Wolbachia genes. We consider the possibility that mod- is a host effect through a population dynamics model. A mod- host allele leads to infection extinction in the absence of fecundity differences. Furthermore, the uninfected population that results is immune to reestablishment of the (same) CI-causing Wolbachia.",27,12206235,Journal,ar,Article,100,5,5,Cytoplasmic incompatibility | Modification and rescue | Resistance | Spider mite | Theoretical model | Wolbachia,22104,undefined,1,TRUE,all,All Open Access,121,NA,NA
true,https://api.elsevier.com/content/abstract/scopus_id/0036340979,SCOPUS_ID:0036340979,2-s2.0-0036340979,The population genetics of adaptation: The adaptation of DNA sequences,Orr H.,Evolution,00143820,56,7,1317-1330,2002-01-01,2002,10.1111/j.0014-3820.2002.tb01446.x,"I describe several patterns characterizing the genetics of adaptation at the DNA level. Following Gillespie (1983, 1984, 1991), I consider a population presently fixed for the ith best allele at a locus and study the sequential substitution of favorable mutations that results in fixation of the fittest DNA sequence locally available. Given a wild type sequence that is less than optimal, I derive the fitness rank of the next allele typically fixed by natural selection as well as the mean and variance of the jump in fitness that results when natural selection drives a substitution. Looking over the whole series of substitutions required to reach the best allele, I show that the mean fitness jumps occurring throughout an adaptive walk are constrained to a twofold window of values, assuming only that adaptation begins from a reasonably fit allele. I also show that the first substitution and the substitution of largest effect account for a large share of the total fitness increase during adaptation. I further show that the distribution of selection coefficients fixed throughout such an adaptive walk is exponential (ignoring mutations of small effect), a finding reminiscent of that seen in Fisher's geometric model of adaptation. Last, I show that adaptation by natural selection behaves in several respects as the average of two idealized forms of adaptation, perfect and random.",185,12206234,Journal,ar,Article,100,1,1,Adaptive evolution | Adaptive walk | Experimental evolution | Fitness jump | Mutational landscape | Natural selection,22104,undefined,1,TRUE,all,All Open Access,122,NA,NA
true,https://api.elsevier.com/content/abstract/scopus_id/0036221662,SCOPUS_ID:0036221662,2-s2.0-0036221662,The effect of miniaturized body size on skeletal morphology in frogs,Yeh J.,Evolution,00143820,56,3,628-641,2002-01-01,2002,10.1111/j.0014-3820.2002.tb01372.x,"Miniaturization has evolved numerous times and reached impressive extremes in the Anura. I compared the skeletons of miniature frog species to those of closely related larger species to assess patterns of morphological change, sampling 129 species from 12 families. Two types of morphological data were examined: (1) qualitative data on bone presence and absence; and (2) thin-plate spline morphometric descriptions of skull structure and bone shape. Phylogenetic comparative methods were used to address the shared history of species. Miniature anurans were more likely to lose skull bones and phalangeal elements of the limbs. Their skulls also showed consistent differences compared to those of their larger relatives, including relatively larger braincases and sensory capsules, verticalization of lateral elements, rostral displacement of the jaw joint, and reduction of some skull elements. These features are explained by functional constraints and by paedomorphosis. Variation among lineages in the morphological response to miniaturization was also explored. Certain lineages appear to be unusually resistant to the morphological trends that characterize miniature frogs as a whole. This study represents the first large-scale examination of morphology and miniaturization across a major, diverse group of organisms conducted in a phylogenetic framework and with statistical rigor.",115,11989691,Journal,ar,Article,100,1,1,Anurans | Development | Evolution | Miniaturization | Osteology | Vertebrate morphology,22104,undefined,1,TRUE,all,All Open Access,123,NA,NA
true,https://api.elsevier.com/content/abstract/scopus_id/0036221655,SCOPUS_ID:0036221655,2-s2.0-0036221655,Interpretation of the results of common principal components analyses,Houle D.,Evolution,00143820,56,3,433-440,2002-01-01,2002,10.1111/j.0014-3820.2002.tb01356.x,"Common principal components (CPC) analysis is a new tool for the comparison of phenotypic and genetic variance-covariance matrices. CPC was developed as a method of data summarization, but frequently biologists would like to use the method to detect analogous patterns of trait correlation in multiple populations or species. To investigate the properties of CPC, we simulated data that reflect a set of causal factors. The CPC method performs as expected from a statistical point of view, but often gives results that are contrary to biological intuition. In general, CPC tends to underestimate the degree of structure that matrices share. Differences of trait variances and covariances due to a difference in a single causal factor in two otherwise identically structured datasets often cause CPC to declare the two datasets unrelated. Conversely, CPC could identify datasets as having the same structure when causal factors are different. Reordering of vectors before analysis can aid in the detection of patterns. We urge caution in the biological interpretation of CPC analysis results.",83,11989675,Journal,ar,Article,100,3,3,Common principal components analysis | Flury hierarchy | Matrix comparisons | Variance-covariance matrix,22104,undefined,0,FALSE,NA,NA,124,NA,NA
true,https://api.elsevier.com/content/abstract/scopus_id/0036221523,SCOPUS_ID:0036221523,2-s2.0-0036221523,A complexity drain on cells in the evolution of multicellularity,McShea D.,Evolution,00143820,56,3,441-452,2002-01-01,2002,10.1111/j.0014-3820.2002.tb01357.x,"A hypothesis has been advanced recently predicting that, in evolution, as higher-level entities arise from associations of lower-level organisms, and as these entities acquire the ability to feed, reproduce, defend themselves, and so on, the lower-level organisms will tend to lose much of their internal complexity (McShea 2001a). In other words, in hierarchical transitions, there is a drain on numbers of part types at the lower level. One possible rationale is that the transfer of functional demands to the higher level renders many part types at the lower level useless, and thus their loss in evolution is favored by selection for economy. Here, a test is conducted at the cell level, comparing numbers of part types in free-living eukaryotic cells (protists) and the cells of metazoans and land plants. Differences are significant and consistent with the hypothesis, suggesting that tests at other hierarchical levels may be worthwhile.",41,11989676,Journal,ar,Article,100,1,1,Complexity | Evolutionary trends | Hierarchy | Parts,22104,undefined,0,FALSE,NA,NA,125,NA,NA
true,https://api.elsevier.com/content/abstract/scopus_id/0036221190,SCOPUS_ID:0036221190,2-s2.0-0036221190,Why do some social insect queens mate with several males? Testing the sex-ratio manipulation hypothesis in Lasius niger,Fjerdingstad E.,Evolution,00143820,56,3,553-562,2002-01-01,2002,10.1111/j.0014-3820.2002.tb01366.x,"Although multiple mating most likely increases mortality risk for social insect queens and lowers the kin benefits for nonreproductive workers, a significant proportion of hymenopteran queens mate with several males. It has been suggested that queens may mate multiply as a means to manipulate sex ratios to their advantage. Multiple paternity reduces the extreme relatedness value of females for workers, selecting for workers to invest more in males. In populations with female-biased sex ratios, queens heading such male-producing colonies would achieve a higher fitness. We tested this hypothesis in a Swiss and a Swedish population of the ant Lasius niger. There was substantial and consistent variation in queen mating frequency and colony sex allocation within and among populations, but no evidence that workers regulated sex allocation in response to queen mating frequency; the investment in females did not differ among paternity classes. Moreover, population-mean sex ratios were consistently less female biased than expected under worker control and were close to the queen optimum. Queens therefore had no incentive to manipulate sex ratios because their fitness did not depend on the sex ratio of their colony. Thus, we found no evidence that the sex-ratio manipulation theory can explain the evolution and maintenance of multiple mating in L. niger.",37,11989685,Journal,ar,Article,100,3,3,Ants | Kin selection | Multiple mating | Sex-ratio manipulation | Social insects,22104,undefined,1,TRUE,all,All Open Access,126,NA,NA
true,https://api.elsevier.com/content/abstract/scopus_id/0036220428,SCOPUS_ID:0036220428,2-s2.0-0036220428,Geometric estimates of heritability in biological shape,Monteiro L.,Evolution,00143820,56,3,563-572,2002-01-01,2002,10.1111/j.0014-3820.2002.tb01367.x,"The recently developed geometric morphometrics methods represent an important contribution of statistics and geometry to the study of biological shapes. We propose simple protocols using shape distances that incorporate geometric techniques into linear quantitative genetic models that should provide insights into the contribution of genetics to shape variation in organisms. The geometric approaches use Procrustes distances in a curved shape space and distances in tangent spaces within and among families to estimate shape heritability. We illustrate the protocols with an example of wing shape variation in the honeybee, Apis mellifera. The heritability of overall shape variation was small, but some localized components depicting shape changes on distal wing regions showed medium to large heritabilities. The genetic variance-covariance matrix of the geometric shape variables was significantly correlated with the phenotypic shape variance-covariance matrix. A comparison of the results of geometric methods with the traditional multivariate analysis of interlandmark distances indicated that even with a larger dimensionality, the interlandmark distances were not as rich in shape information as the landmark coordinates. Quantitative genetics studies of shape should greatly benefit from the application of geometric methods.",72,11989686,Journal,ar,Article,100,4,4,Apis | Geometric morphometrics | Heritability | Procrustes distances | Quantitative genetics | Wing shape,22104,undefined,0,FALSE,NA,NA,127,NA,NA
true,https://api.elsevier.com/content/abstract/scopus_id/0036219503,SCOPUS_ID:0036219503,2-s2.0-0036219503,The historical biogeography of two Caribbean butterflies (Lepidoptera: Heliconiidae) as inferred from genetic variation at multiple loci,Davies N.,Evolution,00143820,56,3,573-589,2002-01-01,2002,10.1111/j.0014-3820.2002.tb01368.x,"Mitochondrial DNA and allozyme variation was examined in populations of two Neotropical butterflies, Heliconius charithonia and Dryas iulia. On the mainland, both species showed evidence of considerable gene flow over huge distances. The island populations, however, revealed significant genetic divergence across some, but not all, ocean passages. Despite the phylogenetic relatedness and broadly similar ecologies of these two butterflies, their intraspecific biogeography clearly differed. Phylogenetic analyses of mitochondrial DNA sequences revealed that populations of D. iulia north of St. Vincent are monophyletic and were probably derived from South America. By contrast, the Jamaican subspecies of H. charithonia rendered West Indian H. charithonia polyphyletic with respect to the mainland populations; thus, H. charithonia seems to have colonized the Greater Antilles on at least two separate occasions from Central America. Colonization velocity does not correlate with subsequent levels of gene flow in either species. Even where range expansion seems to have been instantaneous on a geological timescale, significant allele frequency differences at allozyme loci demonstrate that gene flow is severely curtailed across narrow ocean passages. Stochastic extinction, rapid (re)colonization. but low gene flow probably explain why, in the same species, some islands support genetically distinct and nonexpanding populations, while nearby a single lineage is distributed across several islands. Despite the differences, some common biogeographic patterns were evident between these butterflies and other West Indian taxa; such congruence suggests that intraspecific evolution in the West Indies has been somewhat constrained by earth history events, such as changes in sea level.",33,11989687,Journal,ar,Article,100,2,2,Allozymes | Island | Mitochondrial DNA | Phylogeography | Population genetics | West Indies,22104,undefined,1,TRUE,all,All Open Access,128,NA,NA
true,https://api.elsevier.com/content/abstract/scopus_id/0036219499,SCOPUS_ID:0036219499,2-s2.0-0036219499,"Divergence of mitochondrial DNA is not corroborated by nuclear DNA, morphology, or behavior in Drosophila simulans",Ballard J.W.O.,Evolution,00143820,56,3,527-545,2002-01-01,2002,10.1111/j.0014-3820.2002.tb01364.x,"We ask whether the observed mitochondrial DNA (mtDNA) population subdivision of Drosophila simulans is indicative of organismal structure or of specific processes acting on the mitochondrial genome. Factors either intrinsic or extrinsic to the host genome may influence the evolutionary dynamics of mtDNA. Potential intrinsic factors include adaptation of the mitochondrial genome and of nucleomitochondrial gene complexes specific to the local environment. An extrinsic force that has been shown to influence mtDNA evolution in invertebrates is the bacterial endosymbiont Wolbachia. Evidence presented in this study suggests that mtDNA is not a good indicator of organismal subdivision in D. simulans. Furthermore, there is no evidence to suggest that Wolbachia causes any reduction in nuclear gene flow in this species. The observed differentiation in mtDNA is not corroborated by data from NADH: ubiquinone reductase 75kD subunit precursor or the Alcohol dehydrogenase-related loci, from the shape or size of the male genital arch, or from assortative premating behavior. We discuss these results in relation to a mitochondrial genetic species concept and the potential for Wolbachia-induced incompatibility to be a mechanism of speciation in insects. We conclude with an iterated appeal to include phylogenetic and statistical tests of neutrality as a supplement to phylogenetic and population genetic analyses when using mtDNA as an evolutionary marker.",106,11989683,Journal,ar,Article,100,3,3,Behavior | Drosophila simulans | Mitochondrial variability | Morphometrics | Species concepts | Wolbachia,22104,undefined,0,FALSE,NA,NA,129,NA,NA
true,https://api.elsevier.com/content/abstract/scopus_id/0036219045,SCOPUS_ID:0036219045,2-s2.0-0036219045,An epistatic genetic basis for fluctuating asymmetry of mandible size in mice,Leamy L.,Evolution,00143820,56,3,642-653,2002-01-01,2002,10.1111/j.0014-3820.2002.tb01373.x,"The genetic basis of fluctuating asymmetry (FA), or nondirectional variation in the subtle differences between left and right sides of bilateral characters, continues to be of considerable theoretical interest. FA generally has been thought to arise from random noise during development and therefore to have a largely or entirely environmental origin. Whereas additive genetic variation for FA generally has been small and often insignificant, a number of investigators have hypothesized that interactions between loci, or epistasis, significantly influence FA. We tested this hypothesis by conducting a whole-genome scan to detect any epistasis in FA of centroid size in the mandibles of more than 400 mice from an F2 intercross population formed from crossing the Large (LG/J) and Small (SM/J) inbred strains. Genotypic deviations were imputed at each site 2 cM apart on all 19 autosomes, and these and centroid size asymmetry values were used in canonical correlation analyses for each of the 171 possible pairs of 19 autosomes to identify the most probable sites for epistasis. Epistasis for centroid size asymmetry was abundant, occurring far more often than was expected by chance alone (there were 30 separate instances of epistasis at the 0.001 significance level, when only two were expected by chance alone). The contributions of epistasis from 30 pairwise combinations of loci tended to suppress the additive and dominance genetic variance, but greatly increased the epistatic genetic variance for FA in centroid size given the intermediate allele frequencies of an F2 intercross population.",69,11989692,Journal,ar,Article,100,3,3,Epistasis | Fluctuating asymmetry | Mandible centroid size | Mice | Quantitative trait loci,22104,R01DK052514,0,FALSE,NA,NA,130,NIDDK,National Institute of Diabetes and Digestive and Kidney Diseases
true,https://api.elsevier.com/content/abstract/scopus_id/0036218930,SCOPUS_ID:0036218930,2-s2.0-0036218930,Hardly a relict: Freezing and the evolution of vesselless wood in Winteraceae,Feild T.,Evolution,00143820,56,3,464-478,2002-01-01,2002,10.1111/j.0014-3820.2002.tb01359.x,"The Winteraceae are traditionally regarded as the least-specialized descendents of the first flowering plants, based largely on their lack of xylem vessels. Since vessels have been viewed as a key innovation for angiosperm diversification, Winteraceae have been portrayed as declining relicts, limited to wet forest habitats where their tracheidbased wood does not impose a significant hydraulic constraints. In contrast, phylogenetic analyses place Winteraceae among angiosperm clades with vessels, indicating that their vesselless wood is derived rather than primitive, whereas extension of the Winteraceae fossil record into the Early Cretaceous suggests a more complex ecological history than has been deduced from their current distribution. However, the selective regime and ecological events underlying the possible loss of vessels in Winteraceae have remained enigmatic. Here we examine the hypothesis that vessels were lost as an adaptation to freezing-prone environments in Winteraceae by measuring the responses of xylem water transport to freezing for a diverse group of Winteraceae taxa as compared to Canella winterana (Canellaceae, a close relative with vessels) and sympatric conifer taxa. We found that mean percent loss of xylem water transport capacity following freeze-thaw varied from 0% to 6% for Winteraceae species from freezing-prone temperate climates and approximately 20% in those taxa from tropical (nonfreezing) climates. Similarly, conifers exhibit almost no decrease in xylem hydraulic conductivity following freezing. In contrast, water transport in Canella stems is nearly 85% blocked after freeze-thaw. Although vessel-bearing wood of Canella possesses considerably greaterhydraulic capacity than Winteraceae, nearly 20% of xylem hydraulic conductance remains, a value that is comparable to the hydraulic capacity of vesselless Winteraceae xylem, if the proportion of hydraulic flow through vessels (modeled as ideal capillaries) is removed. Thus, the evolutionary removal of vessels may not necessarily require a deleterious shift to an ineffective vascular system. By integrating Winteraceae's phylogenetic relationships and fossil history with physiological and ecological observations, we suggest that, as ancestors of modern Winteraceae passed through temperate conditions present in Southern Gondwana during the Early Cretaceous, they were exposed to selective pressures against vesselpossession and returned to a vascular system relying on tracheids. These results suggest that the vesselless condition is advantageous in freezing-prone areas, which is supported by the strong bias in the ecological abundance of Winteraceae to wet temperate and tropical alpine habitats, rather than a retained feature from the first vesselless angiosperms. We believe that vesselless wood plays an important role in the ecological abundance of Winteraceae in Southern Hemisphere temperate environments by enabling the retention of leaves and photosynthesis in the face of frequent freeze-thaw events.",67,11989678,Journal,ar,Article,100,3,3,Angiosperm evolution | Canellaceae | Drimys | Freezing stress | Winteraceae | Xylem evolution,22104,undefined,0,FALSE,NA,NA,131,NA,NA
