@_fa,prism:url,dc:identifier,eid,dc:title,dc:creator,prism:publicationName,prism:issn,prism:volume,prism:issueIdentifier,prism:pageRange,prism:coverDate,prism:coverDisplayDate,prism:doi,dc:description,citedby-count,prism:aggregationType,subtype,subtypeDescription,author-count.@limit,author-count.@total,author-count.$,source-id,fund-no,openaccess,openaccessFlag,entry_number,freetoread.value.$,freetoreadLabel.value.$
true,https://api.elsevier.com/content/abstract/scopus_id/0021626871,SCOPUS_ID:0021626871,2-s2.0-0021626871,Control of fecundity in Pieris rapae. III. Synthesis.,Gilbert N.,Journal of Animal Ecology,00218790,53,2,599-609,1984-01-01,1984,10.2307/4538,"Natural selection for increased pupal weight and fecunidty occurs in a wide range of field conditions but the genetic variation is expressed less strongly than in the laboratory. There is a limit, beyond which no further response to selection for increased fecundity occurs. Genotypes close to the limit experience sharply reduced fecundity irrespective of phenotypic size. So 2 butterflies, of the same weight, lay very different numbers of eggs, according to their genotypes. These mechanisms stabilize average size and fecundity at levels which are roughly optimal for the population in field conditions. The data contradict the current dogma that individual competitive advantages take precedence over the welfare of the population as a whole. The amount of genetic variation in pupal weight is limited by the ecological effects of high and low field temperatures on larval survival. -Author Division of Wildlife and Rangelands Research, C.S.I.R.O., P.O.Box 84, Lyneham, A.C.T. 2602, Australia.",17,Journal,ar,Article,100,1,1,29544,undefined,0,FALSE,1,NA,NA
true,https://api.elsevier.com/content/abstract/scopus_id/0021625010,SCOPUS_ID:0021625010,2-s2.0-0021625010,Foraging in the eastern grey kangaroo and the wallaroo.,Taylor R.,Journal of Animal Ecology,00218790,53,1,65-74,1984-01-01,1984,10.2307/4342,"Amount of foraging undertaken in a habitat by Macropus giganteus and M. r. robustus was positively correlated with the abundance of the most preferred food category, high-protein grass leaf. Other less preferred components of the pasture, although sometimes important in the diet, had no significant influence on the distribution of either species. Within the category high-protein grass leaf, the distribution of kangaroos was influenced by the species of grass as much as their quality. The two species of kangaroo differed in their use of some high quality grasses. For a given biomass of high-protein grass leaf, the density of both species was significantly greater on the study area with the higher quality pasture. -from Author",31,Journal,ar,Article,100,1,1,29544,undefined,0,FALSE,2,NA,NA
true,https://api.elsevier.com/content/abstract/scopus_id/0021625009,SCOPUS_ID:0021625009,2-s2.0-0021625009,Density-dependent seasonal mortality and population fluctuations of the temperate-zone willow tit ( Parus montanus).,Ekman J.,Journal of Animal Ecology,00218790,53,1,119-134,1984-01-01,1984,10.2307/4346,"Six years' estimates of immigration, seasonal survival, numbers and age-structure in an almost completely individually-marked willow tit population revealed positive density-dependent feedback on clutch size, yearling and adult summer survival and on yearling late winter survival. The intensity of the density-dependent feedback on survival related solely to yearling density. A density-linked age-shift towards more low-reproductive hens could explain >1/3 of the clutch size density-dependence. Numbers fluctuated mainly through variations in yearling winter survival which were perpetuated by the impact of ambient temperature and predation risk. -Author",74,Journal,ar,Article,100,1,1,29544,undefined,0,FALSE,3,NA,NA
true,https://api.elsevier.com/content/abstract/scopus_id/0021622573,SCOPUS_ID:0021622573,2-s2.0-0021622573,"Recruitment of young rooks, Corvus frugilegus, into breeding populations.",Patterson I.,Journal of Animal Ecology,00218790,53,2,559-572,1984-01-01,1984,10.2307/4534,"The proportion of juveniles in a rook population in NE Scotland declined in late summer, increased temporarily in autumn and rose again in spring. These seasonal changes were caused by a combination of mortality, dispersal and return of locally-bred young, with a probable influx of migrant young in autumn. The proportion of young among rooks in rookeries changed seasonally in parallel with changes among birds seen in feeding flocks, but the proportion in rookeries was always lower than that in fields. Locally-bred young occurred earlier in their natal rookeries and appeared to stay there longer than did non-local young. Two rookeries apparently differed in their attractiveness to young between years. Young rooks which continued to visit a rookery until the end of the breeding season (May) and (especially) those which roosted there at night, were more likely to return there to breed in their 2nd year than were those which were seen only in March and April. -from Authors",6,Journal,ar,Article,100,2,2,29544,undefined,0,FALSE,4,NA,NA
true,https://api.elsevier.com/content/abstract/scopus_id/0021622311,SCOPUS_ID:0021622311,2-s2.0-0021622311,"Experimental density manipulations of the predator Tenodera sinensis ( Orthoptera: Mantidae) in an old-field community. I. Mortality, development and dispersal of juvenile mantids.",Hurd L.,Journal of Animal Ecology,00218790,53,1,269-281,1984-01-01,1984,10.2307/4356,"With 3-fold differences in initial mantid density, relative mortality was not density-dependent. Mortality was >90% for all treatments. Most mortality occurred among 1st-instar nymphs. Nymphs could survive crowded conditions if provided with sufficient food. Cannibalism was negligible among well-fed nymphs at all densities. Starved nymphs exhibited substantial cannibalism, but this was not related to density. Rate of development (changes in proportion of nymphs among instars over time) was negatively related to density, probably due to food limitation. Relative dispersal increased with increasing density. This contributed to overall convergence in density to similar levels among treatments and may help to regulate natural populations of this species. Most dispersal occurred among 2nd-instar nymphs.-from Authors",54,Journal,ar,Article,100,2,2,29544,undefined,0,FALSE,5,NA,NA
true,https://api.elsevier.com/content/abstract/scopus_id/0021620269,SCOPUS_ID:0021620269,2-s2.0-0021620269,Problems in the analysis of dispersal and a critique on its 'heritability' in the great tit.,Van Noordwijk A.J.,Journal of Animal Ecology,00218790,53,2,533-544,1984-01-01,1984,10.2307/4532,"In an analysis of Parus major data from Wytham Wood, Oxford, Greenwood, Harvey & Perrins (1979) (see 80L/0872) demonstrated that offspring resemble their parents in the distance moved from nestbox of birth to nestbox of first breeding. They interpreted this resemblance as heritable. A similar result may be obtained assuming that movements from one nestbox to another are random. That the dispersal distance of offspring is similar to that of the parents follows from the differences between the sets of all possible observations starting from the nestbox where a bird is born. Had the bird been born in another box, the set of potential observations would have been different. -from Author",64,Journal,ar,Article,100,1,1,29544,undefined,0,FALSE,6,NA,NA
true,https://api.elsevier.com/content/abstract/scopus_id/0021619558,SCOPUS_ID:0021619558,2-s2.0-0021619558,Population dynamics of two carabid beetles at a Dutch heathland. I. Subpopulation fluctuations in relation to weather and dispersal.,Baars M.A.,Journal of Animal Ecology,00218790,53,2,375-388,1984-01-01,1984,10.2307/4522,"Numbers of the spring breeder Pterostichus versicolor (= P. coerulescens) at different sites, fluctuated asynchronously: the autumn breeder Calathus melanocephalus fluctuated more violently and in parallel the average catch demonstrating a cyclic pattern. Low and high net reproductive rates alternated in 3 yr periods. In P. versicolor low rainfall or high temperatures after July (and the reproductive season), coincided with high survival and recruitment. In C. melanocephalus high temperatures during the reproductive (August-September) and spring periods, corresponded with low survival and recruitment. The bimodal frequency distribution of the net reproductive rate probably originated from the weather. Fluctuations in subpopulations, within relatively narrow limits, cannot be understood from the weather and random dispersal alone, however; density dependent processes in both species must be assumed. -from Authors",28,Journal,ar,Article,100,2,2,29544,undefined,0,FALSE,7,NA,NA
true,https://api.elsevier.com/content/abstract/scopus_id/0021619531,SCOPUS_ID:0021619531,2-s2.0-0021619531,Nutritional quality and chemical defence in the ragwort- cinnabar moth interaction.,Van Der Meijden E.,Journal of Animal Ecology,00218790,53,2,443-453,1984-01-01,1984,10.2307/4527,Tyria jacobaeae larvae reared on foodplants with different protein concentrations did not produce heavier pupae at the highest concentrations. Nearest-neighbour analysis demonstrated absence of selection for high alkaloid concentrations. Protein-N and alkaloid concentrations are positively correlated in the foodplant. Ragwort Senecio jacobaea plants low in protein N are nutritionally inadequate whereas plants with high protein are toxic because of the correlation between protein-nitrogen and alkaloid. Nearest- neighbour analysis of oviposition in relation to the quality of foodplant populations and individuals confirmed an optimum response at an intermediate level of N concentration. -from Authors,22,Journal,ar,Article,100,4,4,29544,undefined,0,FALSE,8,NA,NA
true,https://api.elsevier.com/content/abstract/scopus_id/0021618611,SCOPUS_ID:0021618611,2-s2.0-0021618611,Food limitation and competition: a field experiment with two Carabus species.,Lenski R.,Journal of Animal Ecology,00218790,53,1,203-216,1984-01-01,1984,10.2307/4352,"In a southern Appalachian forest, food supplementation significantly increased average body mass of both non-teneral (reproductive) and teneral (prereproductive) Carabus limbatus adults. Food supplementation had no effect on survival of non-teneral C. limbatus adults. Food supplementation may have improved survival of teneral C. limbatus adults. Activity of both teneral and non-teneral C. limbatus adults was significantly lower on food supplementation plots, indicating that much of their normal activity is associated with foraging. C. sylvosus received none of the supplemental food available to C. limbatus, yet C. sylvosus weighed significantly more on food supplementation plots than on control plots. This improved foraging success of C. sylvosus is attributed to reduced competition with C. limbatus for naturally occurring food. -from Author",97,Journal,ar,Article,100,1,1,29544,undefined,0,FALSE,9,NA,NA
true,https://api.elsevier.com/content/abstract/scopus_id/0021617979,SCOPUS_ID:0021617979,2-s2.0-0021617979,Effect of helpers on the feeding rates of nestlings in the chestnut-bellied starling Spreo pulcher.,Wilkinson R.,Journal of Animal Ecology,00218790,53,1,301-310,1984-01-01,1984,10.2307/4358,"The number of individual feeders on any one nest watch was strongly related to the final complement size. In turn, the number of feeders was highly correlated with nestling feeding rates. The relationship between nestling feeding rate and all other relevant variables was investigated by stepwise multiple regression. The number of feeders was again most important, explaining nearly 50% of the total variance in nestling feeding rate.-from Authors",10,Journal,ar,Article,100,2,2,29544,undefined,0,FALSE,10,NA,NA
true,https://api.elsevier.com/content/abstract/scopus_id/0021616584,SCOPUS_ID:0021616584,2-s2.0-0021616584,Arthropod communities in a maritime Antarctic moss-turf habitat: three-dimensional distribution of mites and Collembola.,Usher M.,Journal of Animal Ecology,00218790,53,2,427-441,1984-01-01,1984,10.2307/4526,"The vertical distribution of the 6 frequently occurring taxa indicates that 3 occur near the surface of the moss-turf, 2 in an intermediate position, and 1 deep down. Within a taxon the vertical distribution varies from one developmental stage to another. Aggregation is the norm in this Signy Island community, but its degree varies with the developmental stage (prostigmatid mites). The predator Gamasellus racovitzai is generally randomly distributed. Two separate sub-communities of arthropods can be recognized: the 'green moss community' occurs near the surface of the moss-turf (0-1.5 cm layer), the 'dead moss community' deeper in the turf (<3 cm). The 2 sub-communities are composed of the same 6 species, but the relative proportions of the species differ considerably. The numbers of individuals of a species in one community are generally not correlated with the numbers of the same species in the other community, hence aggregations in the communities are independent of each other. -from Authors",51,Journal,ar,Article,100,2,2,29544,undefined,0,FALSE,11,NA,NA
true,https://api.elsevier.com/content/abstract/scopus_id/0021613469,SCOPUS_ID:0021613469,2-s2.0-0021613469,Stability and persistence of an age-structured avian population in a seasonal environment.,Ekman J.,Journal of Animal Ecology,00218790,53,1,135-146,1984-01-01,1984,10.2307/4347,"Positive density-dependent factors operating on survival and fecundity of a willow tit Parus montanus population were locally stable around an equilibrium level close to the observed mean. Age-structure did not tend to destabilize numbers. The observed population trajectory in time could be mimicked closely by a discrete time-series model with age-structure by including time-dependent survival rates, related to the impact of ambient winter temperature and predation risk, beside the density- dependent effects. With time-dependent survival the model population could not persist for any longer period in 'Monte Carlo' simulations without density-dependent compensations. Density-dependence in yearling late winter and summer survival were the only feedback mechanisms able to absorb perturbations and to keep fluctuations within observed ranges.-Author",1,Journal,ar,Article,100,1,1,29544,undefined,0,FALSE,12,NA,NA
true,https://api.elsevier.com/content/abstract/scopus_id/0021607917,SCOPUS_ID:0021607917,2-s2.0-0021607917,"Inherent changes in the body size, viability and behaviour of a fluctuating red grouse ( Lagopus lagopus scoticus) population.",Moss R.,Journal of Animal Ecology,00218790,53,1,171-189,1984-01-01,1984,10.2307/4350,"Samples of eggs were taken from a population during an 8 yr fluctuation in density. Chicks from these hill eggs were hatched and reared in captivity. The following year, they bred in the aviary and their offspring were reared in the same conditions. Hatch weight of chicks from hill eggs, early survival and their longevity as adults varied from year to year, but bore no relation to population density in the wild. Egg size and body weight at 75 days did change in relation to density, but differences between year classes were not carried over to the next generation, so they were not genetic. Inherent changes in social dominance rank occurred in relation to density. The evidence was consistent with genetic selection against dominant types during the increase and peak phases of the fluctuation, and for such types during the decline. As the main demographic cause of the decline was emigration, subordinate types may have dispersed more readily than dominants. Results refute hypotheses which see either changes in nutrition or genetic changes in the population as the sole cause of the population cycles. Movement is a major component of population limitation. Changes in spacing behaviour between the increase and decline phases of the population fluctuation are probably the main cause of the changes in the rate of emigration and in consequent densities.-from Authors",15,Journal,ar,Article,100,3,3,29544,undefined,0,FALSE,13,NA,NA
true,https://api.elsevier.com/content/abstract/scopus_id/0021607892,SCOPUS_ID:0021607892,2-s2.0-0021607892,The effect of grebe predation on a brine shrimp population.,Cooper S.,Journal of Animal Ecology,00218790,53,1,51-64,1984-01-01,1984,10.2307/4341,"Determined whether at Mono Lake, California, the marked autumnal decline in Artemia monica was related to the annual arrival of hundreds of thousands of eared grebes Podiceps nigricollis. Mean number of Artemia eaten per grebe per day ranged from 8000-70 000. The mean proportion of the Artemia population eaten per day tended to increase throughout the autumn, ranging from 0.5% in August to 22% in late October 1980 and from 0.02% in August to 6.6% in late November 1981. Grebe predation could account for 55-83% of the decline in Artemia density in 1980 and 8-27% of the decline in density in 1981. In both years, grebe predation could account for substantial amounts, but not all, of the observed declines in Artemia levels. Most Artemia mortality was due to other causes in 1981.-from Authors",44,Journal,ar,Article,100,3,3,29544,undefined,0,FALSE,14,NA,NA
true,https://api.elsevier.com/content/abstract/scopus_id/0021607316,SCOPUS_ID:0021607316,2-s2.0-0021607316,Rates of food intake and aggression of oystercatchers Haematopus ostralegus on the most and least preferred mussel Mytilus edulis beds of the Exe Estuary.,Goss-Custard J.,Journal of Animal Ecology,00218790,53,1,233-245,1984-01-01,1984,10.2307/4354,"The least aggressive of the immature birds left the preferred beds first as the adults returned from the breeding grounds from July-October. The immatures that remained had similar aggression scores to adults. Aggressive encounters occurred much more frequently on preferred beds than on least preferred beds. There were highly significant differences in aggressiveness between individuals feeding on the most preferred beds, but not amongst those feeding on the low density bed. Intake rate was significantly correlated with aggressiveness amongst 18 individuals studied on the preferred beds but not amongst 18 individuals studied on the least preferred bed. This difference was probably mainly due to the amount of aggression, and, particularly of robbing, differing between the beds. On the most preferred beds, robbing depressed the intake of the less aggressive birds and enhanced that of the most aggressive ones. This was not the case on the least preferred bed as encounters were so rare.-from Authors",80,Journal,ar,Article,100,3,3,29544,undefined,0,FALSE,15,NA,NA
true,https://api.elsevier.com/content/abstract/scopus_id/0021607315,SCOPUS_ID:0021607315,2-s2.0-0021607315,Population fluctuations in red grouse: analysis of bag records and a simulation model.,Potts G.,Journal of Animal Ecology,00218790,53,1,21-36,1984-01-01,1984,10.2307/4339,"A time-series analysis of numbers of Lagopus lagopus scoticus shot per annum was carried out for 52 moors in N England where data were available for at least 20 consecutive years during 1870-1977. In the most representative sub-sample of moors, 83% of the series had significant negative coefficients at T + 2 or T + 3 years or both. A mathematical model was fitted to the fluctuations to describe their quasi-cyclic nature. Average 'cycle-length' was 4.84+ or -0.086yr. Field observations and data from trials with captive grouse were combined to construct a simulation model of a red grouse population; its main features were: 1) An inverse logistic curve relating mean numbers of the parasitic nematode Trichostrongylus tenuis in adult red grouse to their breeding success. 2) T. tenuis accumulation by young red grouse to steady state levels. Numbers of worms accumulated per bird varied according to a combined effect of the density of grouse prior to the breeding season and the worm burden of these grouse. 3) A logistic curve relating the proportion of grouse shot with the density of grouse available. 4) An annual survival rate of the non-shot population inversely proportional to the density of old grouse. The simulation model successfully captured mean levels and other population parameters, but it only gave a good fit to observed fluctuation patterns when stochastic elements were introduced to to represent known effects of weather. Red grouse cycles could be caused by effects of T. tenuis working together with stochastic elements and a time delay arising from the uptake of worms. -from Authors",87,Journal,ar,Article,100,3,3,29544,undefined,0,FALSE,16,NA,NA
true,https://api.elsevier.com/content/abstract/scopus_id/0021607132,SCOPUS_ID:0021607132,2-s2.0-0021607132,"Nutrition, energy and passage time: experiments with fruit preference in European blackbirds ( Turdus merula).",Sorensen A.E.,Journal of Animal Ecology,00218790,53,2,545-557,1984-01-01,1984,10.2307/4533,"Blackbird preferences among winter and spring-ripening fruits were positively related to the in vitro energy, per cent metabolizable energy, metabolizable energy, per cent apparent digestibility, and seed passage rates of fruits. Preferences of birds for autumn-ripening fruits were related to seed passage rates only. It is proposed that seed passage rates play an important role in determining preference, particularly if nutritional and other properties (eg accessibility) of fruit species are similar. Birds obtain a high rate of energy gain by consuming fruits whose seeds are regurgitated because gut volume may place a constraint on fruit uptake. Seed regurgitation results in a rapid elimination of non-nutritional seed 'ballast' and creates space in the gut for additional food. Fruit species containing seeds which are defecated have lower rates of energy gain because the seeds take up space in the gut for much longer periods of time. -Author",82,Journal,ar,Article,100,1,1,29544,undefined,0,FALSE,17,NA,NA
true,https://api.elsevier.com/content/abstract/scopus_id/0021607122,SCOPUS_ID:0021607122,2-s2.0-0021607122,Factors affecting reproductive output of the goldeneye duck Bucephala clangula.,Dow H.,Journal of Animal Ecology,00218790,53,2,679-692,1984-01-01,1984,10.2307/4543,"In a study area in south-central Sweden, mean size of clutch was 8.7 + or - 0.1 eggs and broods 8.1 + or - 0.1 young. Females breeding for the first time produced smaller clutches, fewer young and bred later in the season. There was some evidence of a decline in clutch sizes and later laying dates among older females (> 6 breeding yr). Females returning to the same nest site in successive years had earlier egg-laying dates than those that changed nest site. Some females, however, consistently produced larger clutches and broods and bred earlier in the season than others. Survival of young to at least 3 months appeared to be independent of size of brood in which they hatched and the previous breeding experience of the female parent. Young hatched later in the season had a lower rate of survival than early-hatched young. Females were first recorded breeding at a mean of 3.2 yr of age. Mean annual survival rate of adult females was 0.77 and average breeding life- expectancy was 3.9 yr. 40% of females had years in which they were not recorded breeding. Females probably have a limited annual reproductive output in order to increase their probability of survival and enhance reproductive success over a lifetime. -from Authors",68,Journal,ar,Article,100,2,2,29544,undefined,0,FALSE,18,NA,NA
true,https://api.elsevier.com/content/abstract/scopus_id/0021607114,SCOPUS_ID:0021607114,2-s2.0-0021607114,Control of fecundity in Pieris rapae. I. The problem.,Gilbert N.,Journal of Animal Ecology,00218790,53,2,581-588,1984-01-01,1984,10.2307/4536,"Pupal weight measures potential lifetime fecundity. Larger individuals lay on average 20% more eggs than small ones. There is constant natural selection for greater size. Larger individuals survive rather better than smaller ones at every stage of the life cycle. The advantage of greater size and fecundity, is not counteracted by reduced survival. There is genetic variation for pupal weight which, in the laboratory, responds immediately and repeatedly to artificial selection for larger pupae. There is no such response to the natural selection in the field. -Author",55,Journal,ar,Article,100,1,1,29544,undefined,0,FALSE,19,NA,NA
true,https://api.elsevier.com/content/abstract/scopus_id/0021607082,SCOPUS_ID:0021607082,2-s2.0-0021607082,Habitat quality and the distribution of algae-grazing catfish in a Panamanian stream.,Power M.,Journal of Animal Ecology,00218790,53,2,357-374,1984-01-01,1984,10.2307/4521,"Armoured catfish (Loricariidae) in a Panamanian stream feed on attached algae or periphyton, and are food-limited for much of the year. Periphyton productivity is higher in open, sunny reaches of the stream than in areas covered by dense forest canopy. Densities of loricariids (both numbers of individuals and biomass) are negatively correlated with the density of forest canopy over streams, and positively correlated with rates of periphyton production on stream substrates. Growth rates of the most common loricariid in pools, Ancistrus spinosus, were similar for pre-reproductive individuals in pools of different canopy covers. Survivorship of pre-reproductive and of all Ancistrus was also similar in different pools. Marked loricariids were most often re-sighted in their home pools over the 28 months of this study. But loricariids did re-distribute themselves in response to changes in the quality or availability of pools. Consequently, densities of residents continued to balance primary productivities of habitats, so that fish in sunny, crowded pools and fish in dark, sparsely-populated pools had similar rates of food intake. -from Author",146,Journal,ar,Article,100,1,1,29544,undefined,0,FALSE,20,NA,NA
