@_fa,prism:url,dc:identifier,eid,dc:title,dc:creator,prism:publicationName,prism:issn,prism:volume,prism:issueIdentifier,prism:pageRange,prism:coverDate,prism:coverDisplayDate,prism:doi,dc:description,citedby-count,prism:aggregationType,subtype,subtypeDescription,author-count.@limit,author-count.@total,author-count.$,source-id,fund-no,openaccess,openaccessFlag,entry_number,freetoread.value.$,freetoreadLabel.value.$
true,https://api.elsevier.com/content/abstract/scopus_id/0020418282,SCOPUS_ID:0020418282,2-s2.0-0020418282,Vacant niches and unsaturated communities: a comparison of bracken herbivores at sites on two continents.,Lawton J.,Journal of Animal Ecology,00218790,51,2,573-595,1982-01-01,1982,10.2307/3985,"Communities of herbivorous insects feeding on the above-ground parts of Pteridium aquilinum were compared at matched open and woodland sites in the north of England (Skipwith Common) and the Sacramento Mountains, New Mexico (Sierra Blanca). General supporting surveys of herbivores were also conducted throughout Britain and the south-western USA (Arizona and New Mexico). Some 27 species of insects feed on the above-ground parts of bracken fronds in Britain, with another 8 possibly or occasionally doing so. Only 5 species were found on bracken in New Mexico, with 2 more in Arizona. This difference in faunal richness consistent with predictions based on standard species-area relationships, given the areas within which bracken grows in the 2 regions. The small pool of species in Arizona and New Mexico means that local communities of bracken herbivores in this region are also species-poor. Compared with communities in Britain, bracken in New Mexico has a large number of apparently vacant niches, ie unutilized or underutilized plant-parts. -from Author",95,Journal,ar,Article,100,1,1,29544,undefined,0,FALSE,20,NA,NA
true,https://api.elsevier.com/content/abstract/scopus_id/0020418280,SCOPUS_ID:0020418280,2-s2.0-0020418280,"The richness, abundance and biomass of the arthropod communities on trees.",Southwood T.,Journal of Animal Ecology,00218790,51,2,635-649,1982-01-01,1982,10.2307/3988,"The invertebrate fauna of 6 tree species in both Britain and South Africa was sampled using pyrethrum knockdown. Two of the tree species in Britain and 3 in South Africa were introduced. Average faunal diversities were similar in South Africa and in Britain. The South African arthropod community consisted of fewer, heavier individuals and tended to have a more uniform, larger biomass overall. Faunal diversity was similar for native and introduced trees for all guilds except the phytophages, which showed a lower diversity on introduced trees. On every native tree, the most abundant species was an hemipteran; on 4 of the five introduced trees other orders provided the most abundant species. Total species richness was correlated with tree abundance for both native and introduced trees in Britain. Arthropod abundance increased with species richness: as communities became richer in species, they became more tightly packed. Biomass and numbers of individual arthropods, classified by guild, was not clearly related to structural and other features of the individual trees sampled. There was a positive correlation between the biomass of chewing phytophages and a measure of defoliation. -Authors",135,Journal,ar,Article,100,3,3,29544,undefined,0,FALSE,21,NA,NA
true,https://api.elsevier.com/content/abstract/scopus_id/0020415677,SCOPUS_ID:0020415677,2-s2.0-0020415677,Habitat quality and the foraging behaviour of coccinellid larvae ( Coccinella septempunctata).,Carter M.,Journal of Animal Ecology,00218790,51,3,865-878,1982-01-01,1982,10.2307/4011,"The effects of hunger, rate of prey encounter and rate of food intake on the foraging behaviour of 4th instar Coccinella septempunctata larvae were investigated. Duration of area- restricted searching behaviour following prey encounter increased with increasing hunger. This increased the probability of encountering a subsequent prey item and ultimately the time spent in a patch and the degree to which each patch was exploited. Handling time increased as hunger increased. Changes in the duration of the area-restricted searching behaviour and handling time were dependent on hunger level, not average encounter rate or average rate of food intake. Hunger-induced changes in foraging behaviour enabled larvae to forage in a manner consistent with optimal foraging theory. - from Authors",108,Journal,ar,Article,100,2,2,29544,undefined,0,FALSE,22,NA,NA
true,https://api.elsevier.com/content/abstract/scopus_id/0020415665,SCOPUS_ID:0020415665,2-s2.0-0020415665,Demographic analysis of arthropod populations using a continuous stage-variable ( Collembola).,Van Straalen N.M.,Journal of Animal Ecology,00218790,51,3,769-783,1982-01-01,1982,10.2307/4004,"A mathematical model is discussed that handles data obtained by sampling an age-structured arthropod field population. It is assumed that the observations come in the form of continuous stage- frequency distributions. A special case with constant mortality rate, constant body growth-rate and a Gaussian birth-wave is worked out. A procedure for estimating parameters is presented, using discrete multivariate analysis. Maximum likelihood estimates are obtained, based on the multiple Poisson distribution. A numerical example with data from a population study on Collembola is given. -from Author",7,Journal,ar,Article,100,1,1,29544,undefined,0,FALSE,23,NA,NA
true,https://api.elsevier.com/content/abstract/scopus_id/0020415423,SCOPUS_ID:0020415423,2-s2.0-0020415423,"Comparative dynamics of a single-host aphid; III, Movement and population structure.",Gilbert N.,Journal of Animal Ecology,00218790,51,2,469-480,1982-01-01,1982,10.2307/3977,"Morph proportions among the progeny fundatrices reflect the length of the previous season, whereas morph proportions in later generations are determined by current plant quality. These 2 mechanisms ensure that, in most locations, morph frequencies are close to optimal throughout the season. The species uses the environmental cues which most accurately predict the appropriate morph proportions. Wingless adults tend to stay on their original host plant, winged adults move to new plants of acceptable quality, generally within a few metres of their original plant. The species avoids extinction by adjusting its distribution to the ever- changing pattern of plant quality. The classical mathematical concepts of stationarity and stability do not apply, but two features - density-dependent control of fecundity and adult movement - confer 'stability' of another kind. The essential complexity can be fitted into 7 dimensions, but no fewer. -Author",7,Journal,ar,Article,100,1,1,29544,undefined,0,FALSE,24,NA,NA
true,https://api.elsevier.com/content/abstract/scopus_id/0020412148,SCOPUS_ID:0020412148,2-s2.0-0020412148,"Predator avoidance as a result of aggregation in the grey pine aphid, Schizolachnus pineti ( Pinus sylvestris).",Kidd N.,Journal of Animal Ecology,00218790,51,2,397-412,1982-01-01,1982,10.2307/3973,"Analysis of field and laboratory distributions of Schizolachnus pineti on Pinus sylvestris reveals that the aphids are aggregated in colonies on pine needles and the colonies are aggregated on shoots. While 'shoot aggregation' is likely to reflect differences in habitat suitability or localized numerical increase, 'needle aggregation' is a result of gregariousness mediated by social responses between aphids. From an analysis of field egg distribution, syrphid larvae are distributed discriminately on those shoots bearing aphid colonies. Aphids in large needle aggregations have a higher probability of escape from a syrphid larva than those in small aggregations. The aphids used touch to communicate the presence of a predator. Models consistently predict an advantage to the aphids if the predator searches systematically between needles. Needle aggregation will only confer an advantage on the aphids when the predator searches preferentially amongst those shoots bearing aphid colonies. -for Author",35,Journal,ar,Article,100,1,1,29544,undefined,0,FALSE,25,NA,NA
true,https://api.elsevier.com/content/abstract/scopus_id/0020412083,SCOPUS_ID:0020412083,2-s2.0-0020412083,"Spatial variation in the predation of cockles by oystercatchers at Traeth Melynog, Anglesey. I. The cockle population ( Cerastoderma edule).",Sutherland W.,Journal of Animal Ecology,00218790,51,2,481-489,1982-01-01,1982,10.2307/3978,"Spat cockles Cerastoderma edule settled at the top of the shore so were abundant there; cockles at the bottom of the shore were old and had been washed down the shore. At the top of the shore cockles were abundant, young and slow growing; at the bottom they were scarce, old and fast growing. Mean size thus increased down the shore and was inversely correlated with cockle density. The flesh content for a given sized cockle increased down the shore and was inversely correlated with cockle density. Such variation in cockle size and flesh content may affect the predator's response to cockle density.-Author",27,Journal,ar,Article,100,1,1,29544,undefined,0,FALSE,26,NA,NA
true,https://api.elsevier.com/content/abstract/scopus_id/0020404365,SCOPUS_ID:0020404365,2-s2.0-0020404365,Survivorship and longevity of a long-lived vertebrate species: how long do turtles live ( Pseudemys scripta)?,Gibbons J.,Journal of Animal Ecology,00218790,51,2,523-527,1982-01-01,1982,10.2307/3981,"A 13-yr mark-release-recapture study on natural populations of freshwater turtles, Pseudemys scripta of known age indicates that c.1% of the individuals can be expected to attain an age of 20 yr. Probable maximum longevity in natural populations is about 30 yr, in contrast to published estimates of up to 75 years. Adults follow a Type II survivorship curve with constant rates of mortality at all ages.-from Authors",35,Journal,ar,Article,100,2,2,29544,undefined,0,FALSE,27,NA,NA
true,https://api.elsevier.com/content/abstract/scopus_id/0020402510,SCOPUS_ID:0020402510,2-s2.0-0020402510,Simulation models for laboratory populations of Callosobruchus chinensis and C. maculatus.,Bellows T.,Journal of Animal Ecology,00218790,51,2,597-623,1982-01-01,1982,10.2307/3986,"A simulation is developed to describe the daily changes which occur in an insect population with reference to its age structure and density. Special attention is given to time distributed events, such as oviposition and development, and to density dependent processes which limit population growth. In the adult stage, the model describes the reproductive process by considering age- specific mortality and fecundity and the effects of density on oviposition. The dynamics of the preimaginal stages in Callosobruchus chinensis and C. maculatus is described by a life-table model in which stage-specific mortality and development rates are used to describe changes occurring in a cohort of insects developing from eggs to adults. Density dependence is included in the model of intrastage and interstage competition. The model is used to simulate the long-term dynamics of these species: C. chinensis simulations showed a monotonic approach to a stable equilibrium; C. maculatus simulations showed as oscillatory approach to a stable equilibrium, the oscillations having a period of approx 10 generations. -from Author",38,Journal,ar,Article,100,1,1,29544,undefined,0,FALSE,28,NA,NA
true,https://api.elsevier.com/content/abstract/scopus_id/0020401856,SCOPUS_ID:0020401856,2-s2.0-0020401856,Structure and diversity of ant communities in successive coastal dune valleys.,Boomsma J.,Journal of Animal Ecology,00218790,51,3,957-974,1982-01-01,1982,10.2307/4016,"On the Dutch Wadden island Schiermonnikoog, the number of ant species increased from 4 in Strandvlakte (pioneer dune) to 11 in Kobbeduinen and 18 in Kooiduinen (advanced stages in primary and secondary succession, respectively). Ant species diversity was positively related to structural diversity of soil and vegetation; a negative relationship was found between ant species diversity and the abundance of the pioneering ant Lasius niger. Microhabitat niche breadth of ant species in the advanced communities Kobbeduinen and Kooiduinen was positively correlated with worker density; this was particularly true in Kobbeduinen, where the highest overall densities of ant workers, root aphids and potential prey (except soil Collembola) were found. In the most diverse but moderately dense Kooiduinen community, only part of the ant species had niche breadths which were in the same degree proportional to worker density as in Kobbeduinen. Mean niche overlap per species was positively related to worker density in Kobbeduinen, but not in Kooiduinen; in Kooiduinen, the degree of realization of the niche breadths found in Kobbeduinen appeared to be a negative power function of the mean niche overlap per species. -from Authors",36,Journal,ar,Article,100,2,2,29544,undefined,0,FALSE,29,NA,NA
true,https://api.elsevier.com/content/abstract/scopus_id/0020401853,SCOPUS_ID:0020401853,2-s2.0-0020401853,"Ecological studies on the butterfly Maniola jurtina in Britain. II. Population dynamics: the present position ( Hightown, Liverpool).",Brakefield P.,Journal of Animal Ecology,00218790,51,3,727-738,1982-01-01,1982,10.2307/4001,"Adult meadow brown butterfly survival at Hightown, near Liverpool, was lowest in the hot and dry summer of 1976. Estimates of expectation of life for males and females in all experiments varied between 5-12 days. Mean number of eggs laid by a female was estimated from fertility and survivorship data as 66. This is 0.37 of the mean total egg production in the laboratory. The emergence of each sex occurred in more than one peak in 1977 and 1978 Total emergence at Hightown estimated declined from 1380-1850 insects ha-1 in 1976 to 235-250 insects ha-1 in 1977, probably due to exceptionally high mortality of hatching larvae in the dry late summer of 1976. A generally lower population density was found in Scotland than in England. -from AuthorDept. of Genetics, Univ. of Liverpool, Brownlow Street, Liverpool, L69 3BX, UK.",41,Journal,ar,Article,100,1,1,29544,undefined,0,FALSE,30,all,All Open Access
true,https://api.elsevier.com/content/abstract/scopus_id/0020401556,SCOPUS_ID:0020401556,2-s2.0-0020401556,The effects of sediment particle diameter upon the meiobenthic copepod community of an intertidal beach: a field and a laboratory experiment ( Harpacticoida).,Hockin D.,Journal of Animal Ecology,00218790,51,2,555-572,1982-01-01,1982,10.2307/3984,"The colonization of a range of artificial monometric sediments by meiobenthic Harpacticoida was studied both in an intertidal estuarine beach and in microcosm culture. No quantitative differences could be established between the copepod communities of different sediment types, with respect to numbers of species and individuals in either experiments. Different species, however, were found in sediment matrices of different particle diameter. Endopsammic species were recorded in greatest population densities from the coarsest sediments, mesopsammic species from the intermediate, and epipsammic species from the finest. Somatically similar, numerically abundant mesopsammic species tended to be found in sediments of differing particle diameter, indicating the segregation of potential competitor species across the resources. However, considerable overlap did occur, so that it is inferred that interspecific interactions appear likely to be important determinants of the community structure.-from Author",18,Journal,ar,Article,100,1,1,29544,undefined,0,FALSE,31,NA,NA
true,https://api.elsevier.com/content/abstract/scopus_id/0020385733,SCOPUS_ID:0020385733,2-s2.0-0020385733,Detection of annual changes in the numbers of cliff-nesting seabirds in Orkney 1976-80.,Wanless S.,Journal of Animal Ecology,00218790,51,3,785-795,1982-01-01,1982,10.2307/4005,"Counts of individual guillemots Uria aalge, razorbills Alca torda, kittiwakes Rissa tridactyla and fulmars Fulmarus glacialis and apparently occupied nests and sites of kittiwakes and fulmars were made in fixed plots at 5 colonies in June from 1976-1980. There were significant differences between annual colony means in all the species and categories counted. Interaction of colonies with years for all categories (except kittiwake nests) indicated unidirectional change but all different rates. For kittiwake nests, interaction indicated opposing trends in the colonies. All colonies showed mean annual increases in numbers of individual guillemots, razorbills and fulmars and fulmar sites (except Costa Head). There were mean annual decreases at all colonies (except Mull Head) in numbers of kittiwake nests and individuals. -from Authors",16,Journal,ar,Article,100,4,4,29544,undefined,0,FALSE,32,NA,NA
true,https://api.elsevier.com/content/abstract/scopus_id/0020385710,SCOPUS_ID:0020385710,2-s2.0-0020385710,Comparative synoptic dynamics. I. Relationships between inter-and intra-specific spatial and temporal variance/mean population parameters.,Taylor L.,Journal of Animal Ecology,00218790,51,3,879-906,1982-01-01,1982,10.2307/4012,"The inter- and intra-specific relationships between spatial and temporal variances and means are examined comparatively within and between 97 aphid, 263 moth and 84 bird species at up to 300 sites for about a decade throughout Great Britain. Only by using samples from such large homogeneous groups of species sampled simultaneously could any confidence by placed in these results. Some of the evidence presented for dynamic theory is suspect because its species' base is narrow and its replication inadequate. -from Authors",123,Journal,ar,Article,100,2,2,29544,undefined,0,FALSE,33,NA,NA
true,https://api.elsevier.com/content/abstract/scopus_id/0020383892,SCOPUS_ID:0020383892,2-s2.0-0020383892,Predators and prey in patchy environment: a freshwater study.,Hildrew A.,Journal of Animal Ecology,00218790,51,3,797-815,1982-01-01,1982,10.2307/4006,"The acid, Fe-rich Broadstone stream is devoid of fish and macrophytes and contains relatively few macroinvertebrate species. Prey species showed strong seasonal fluctuations in abundance and were aggregated on the stream bed. Distribution patterns were probably related to food supply. The distributions of the predators Plectrocnemia conspersa and, less clearly, Sialis fuliginosa, were more closely related to prey density than to the physical conditions on the stream bed. Daily consumption rates by P. conspersa varied between 0.2-2.8% of the prey present, a considerable predation pressure. At certain times, consumption rates were significantly lower in the more structurally complex patches in the stream, presumably because these provided prey refuges. Evidence of seasonal prey switching by P. conspersa is presented.-from Authors",67,Journal,ar,Article,100,2,2,29544,undefined,0,FALSE,34,NA,NA
true,https://api.elsevier.com/content/abstract/scopus_id/0020383749,SCOPUS_ID:0020383749,2-s2.0-0020383749,"Tests of alternative models of prey consumption by predators, using ant-lion larvae ( Macroleon quinquemaculatus).",Griffiths D.,Journal of Animal Ecology,00218790,51,2,363-373,1982-01-01,1982,10.2307/3970,When fed one ant/day the amount of food extracted per prey by larvae of the ant-lion Macroleon quinquemaculatus was independent of predator size or hunger level. Feeding time was constant within an instar but varied between instars. When fed prey at 1 hr intervals extraction efficiency per prey again remained constant but feeding time declined with successive prey. This pattern is consistent with the hypothesis that rate of prey digestion determines feeding time. The rate at which the contents were extracted from the body did not determine feeding time. Differences in the extraction efficiency of larvae feeding on different prey species are due to the presence in some prey of defensive secretions which the larvae do not ingest. Variation in extraction efficiency also results from incomplete consumption. This is little difference in the rates of energy intake predicted by the gut-limitation and optimal foraging hypotheses; factors affecting the level of gut fullness are of greater importance in determining rate of prey consumption. -from Author,27,Journal,ar,Article,100,1,1,29544,undefined,0,FALSE,35,NA,NA
true,https://api.elsevier.com/content/abstract/scopus_id/0020381210,SCOPUS_ID:0020381210,2-s2.0-0020381210,The life cycle and spatial distribution of the aquatic parasitoid Agriotypus armatus ( Hymenoptera: Agriotypidae) and its caddis host Silo pallipes ( Trichoptera: Goeridae).,Elliott J.,Journal of Animal Ecology,00218790,51,3,923-941,1982-01-01,1982,10.2307/4014,"The life cycle of Silo pallipes took 1yr in a small stony stream. Adults were present chiefly in June and July. Oviposition occurred on large stones just below the water surface; eggs hatched within 19-35 days. The 5 larval instars built 11 stony-cases. Growth was rapid in the early instars; most larvae were in instar IV or V by November. Pupation began in spring; emerging adults were taken from May-August. Changes in population density followed a similar pattern in each year-class. Density increased during egg hatching, reached a maximum in July, decreased exponentially at a fairly constant rate from July-May, then decreased rapidly during pupation and emergence from June-August. Only 5% of the initial population in the egg stage reached the pupal stage, 67-68% of the pupal population emerged as adults, 22-23% died and 9-10% were parasitized by Agriotypus armatus. The life cycle of A. armatus also took 1yr. Adults were present in May and June, and laid their eggs in the pupal cases of their host. The 5 larval instars fed externally on their living host and grew rapidly to the pupal stage by August. There was only 1 parasitoid per host. All parasitoids were in the adult stage by October, overwintered as resting adults within the pupal cases and emerged in spring. Only 4-7% of the initial population in the egg stage reached adult stage in spring. Taylor's power law showed that the spatial distribution of both species was density dependent. Relative clumpping remained fairly constant between sites, year-classes and larval instars of Silo, but increased markedly between the larval and pupal stages. Although the aquatic stages of Agriotypus were also clumped, the degree of relative clumping was less than that of their pupal host.-from Author",23,Journal,ar,Article,100,1,1,29544,undefined,0,FALSE,36,NA,NA
true,https://api.elsevier.com/content/abstract/scopus_id/0020380881,SCOPUS_ID:0020380881,2-s2.0-0020380881,Manipulation of female behaviour in field populations of Microtus townsendii.,Taitt M.,Journal of Animal Ecology,00218790,51,2,681-690,1982-01-01,1982,10.2307/3991,"Behaviour of females was manipulated in field populations during a spring decline in numbers. All females were implanted with testosterone to increase aggressiveness in one area, and force-fed the chemosterilant mestranol to reduce aggressiveness in another area. Testosterone treatment resulted in wounding among females, increased size of female home ranges, a reduction in female survival, and increased female immigration. Males in the population with testosterone-treated females had the same population dynamics as males in a control population and a population with no females. Mestranol treatment had no effect on female dynamics. Males with mestranol-treated females survived better than control males. Despite the profound effect of testosterone on social strife, the spring decline in numbers was little affected by experiments. Female spacing behaviour may operate in more subtle ways than overt aggression. -Authors",12,Journal,ar,Article,100,2,2,29544,undefined,0,FALSE,37,NA,NA
true,https://api.elsevier.com/content/abstract/scopus_id/0020378399,SCOPUS_ID:0020378399,2-s2.0-0020378399,"Effects of supplemental feeding on timing of breeding, clutch- size and polygyny in red-winged blackbirds Agelaius phoeniceus.",Ewald P.,Journal of Animal Ecology,00218790,51,2,429-450,1982-01-01,1982,10.2307/3975,"Supplemental feeding advanced onset of nesting. The effect was increased when food was provided earlier in the prebreeding season. Within experimental territories the frequency distribution of nesting activity as a function of season was skewed to the right; in controls the distribution was more symmetrical. Offspring mortality rates increased as the season progressed and were higher in experimental territories than in controls, due to predation rather than starvation. When a single feeder was provided per territory, numbers of females nesting simultaneously in enriched territories were greater than in controls. When density of feeders was increased by an order of magnitude, intrusion rate increased, density of territorial males increased and enriched territories did not have significantly more females nesting simultaneously than did controls.-from Authors",86,Journal,ar,Article,100,2,2,29544,undefined,0,FALSE,38,NA,NA
