@_fa,prism:url,dc:identifier,eid,dc:title,dc:creator,prism:publicationName,prism:issn,prism:volume,prism:issueIdentifier,prism:pageRange,prism:coverDate,prism:coverDisplayDate,prism:doi,dc:description,citedby-count,prism:aggregationType,subtype,subtypeDescription,author-count.@limit,author-count.@total,author-count.$,source-id,fund-no,openaccess,openaccessFlag,entry_number,freetoread.value.$,freetoreadLabel.value.$
true,https://api.elsevier.com/content/abstract/scopus_id/0020377704,SCOPUS_ID:0020377704,2-s2.0-0020377704,"Changes in the breeding biology of the herring gull, ( Larus argentatus) induced by reduction in the size and density of the colony ( Isle of May, Firth of Forth).",Coulson J.,Journal of Animal Ecology,00218790,51,3,739-756,1982-01-01,1982,10.2307/4002,"Herring gulls originally colonized the Isle of May, Firth of Forth in 1907, which was followed by a period of progressive increase in numbers at 13% per annum. By 1970 there were c.13 000 breeding pairs. In 1972 the Nature Conservancy Council commenced annual culls which in 4 yr reduced the colony to a quarter of the previous density, but without radically altering the area of the island which was used for breeding. This paper considers the compensating factors which occur in herring gull which can mitigate against the effects of high natural or man-induced mortality. In particular, age of recruitment, condition of surviving adults, egg size and possibly emigration changed as the density of breeding birds decreased, each factor compensating for the increased adult mortality. -from Authors",111,Journal,ar,Article,100,3,3,29544,undefined,0,FALSE,39,NA,NA
true,https://api.elsevier.com/content/abstract/scopus_id/0020375692,SCOPUS_ID:0020375692,2-s2.0-0020375692,A population study of the ants Myrmica sabuleti and Myrmica scabrinodis living at two sites in the south of England. II. Effect of above-nest vegetation.,Elmes G.,Journal of Animal Ecology,00218790,51,2,665-680,1982-01-01,1982,10.2307/3990,"Canonical variate analysis showed that there were significant differences between the flora above Myrmica nests. Differences between different sizes of colony could also be detected. It is the vegetation that is important to the ants, because of the shading effect of the vegetation. The effect of insolation and shading upon the success of Myrmica colonies is discussed. -from Authors",29,Journal,ar,Article,100,2,2,29544,undefined,0,FALSE,40,NA,NA
true,https://api.elsevier.com/content/abstract/scopus_id/0020374855,SCOPUS_ID:0020374855,2-s2.0-0020374855,Apostatic selection as an optimal foraging strategy.,Hubbard S.F.,Journal of Animal Ecology,00218790,51,2,625-633,1982-01-01,1982,10.2307/3987,"Two simple optimal diet models are shown to be capable of predicting a variety of effects similar to those of frequency-dependent selection, the type depending on whether the predator can search simultaneously for the prey species it attacks, or not. Intensity of detected selection should decline with increasing prey exploitation.-from AuthorsDept. of Biological Sciences, The Univ., Dundee DD1 4HN, & The Marine Lab., Victoria Rd., Aberdeen, Scotland, UK.",38,Journal,ar,Article,100,4,4,29544,undefined,0,FALSE,41,NA,NA
true,https://api.elsevier.com/content/abstract/scopus_id/0020372997,SCOPUS_ID:0020372997,2-s2.0-0020372997,Use of mussel Mytilus edulis beds by oystercatchers Haematopus ostralegus according to age and population size ( Exe estuary).,Goss-Custard J.,Journal of Animal Ecology,00218790,51,2,543-554,1982-01-01,1982,10.2307/3983,"Around 350 immature oystercatchers ate mussels on the Exe estuary in spring and summer. Half of them fed on 2 mussel beds (numbered 30 and 31). Many of the remaining beds had no birds at all. Numbers of birds eating mussels increased 6-fold from July-October as the adults returned from the breeding areas. The population spread out until almost all the beds were occupied and over half had densities in excess of 10 per ha. The proportion of the birds on beds 30 and 31 declined to almost 20%. Immatures were subordinate to adults and 75% of those that fed on the most preferred beds in summer moved to other parts of the estuary as the adults returned. In winter, more immatures occurred on the low ranking mussel beds. They also changed mussel beds during autumn and winter almost twice as frequently as adults and were more likely to change beds from one winter to the next. Many immatures returned to beds 30 and 31 when the adults left in spring, but did not stay for the entire winter until 4 yr-old. As birds matured, the mean rank of the bed on which they fed in winter increased, presumably as their status and competitive ability increased.-from Authors",70,Journal,ar,Article,100,4,4,29544,undefined,0,FALSE,42,NA,NA
true,https://api.elsevier.com/content/abstract/scopus_id/0020360745,SCOPUS_ID:0020360745,2-s2.0-0020360745,Ecology and everyman.,Dunnet G.,Journal of Animal Ecology,00218790,51,1,1-14,1982-01-01,1982,10.2307/4306,"In this presidential address to the British Ecological Society (January 1981), discussion first centres on the misunderstanding and therefore misuse of the word 'ecology' and indeed a range of expressions common in ecological work by the general public. The applied value of ecology is indicated, and the cases of environmental monitoring (environmental impact assessment and seabird monitoring) are used to demonstrate how the ecologist sees problems and can make interpretations and predictions.-P.J.Jarvis",5,Journal,ar,Article,100,1,1,29544,undefined,0,FALSE,43,NA,NA
true,https://api.elsevier.com/content/abstract/scopus_id/0020342322,SCOPUS_ID:0020342322,2-s2.0-0020342322,Prey switching: a case study from New Guinea.,Dwyer P.,Journal of Animal Ecology,00218790,51,2,529-542,1982-01-01,1982,10.2307/3982,A quantitative seasonal switch occurs in the species of mammalian prey taken by Etolo people of Papua New Guinea. The switch in species of prey is largely a result of shifting from trapping mammals at one time of the year to hunting them at another. It is reinforced by the increased vulnerability of certain species during the period when new gardens are prepared; this period coincides with trapping. -from Author,14,Journal,ar,Article,100,1,1,29544,undefined,0,FALSE,44,NA,NA
