@_fa,prism:url,dc:identifier,eid,dc:title,dc:creator,prism:publicationName,prism:issn,prism:volume,prism:issueIdentifier,prism:pageRange,prism:coverDate,prism:coverDisplayDate,prism:doi,dc:description,citedby-count,prism:aggregationType,subtype,subtypeDescription,author-count.@limit,author-count.@total,author-count.$,source-id,fund-no,openaccess,openaccessFlag,entry_number,freetoread.value.$,freetoreadLabel.value.$
true,https://api.elsevier.com/content/abstract/scopus_id/0021604247,SCOPUS_ID:0021604247,2-s2.0-0021604247,"The effect of temperature on intraspecific variation in egg biology and nymphal size in the stonefly, Capnia atra ( Plecoptera) .",Brittain J.,Journal of Animal Ecology,00218790,53,1,161-169,1984-01-01,1984,10.2307/4349,"Adult Capnia atra were collected from a lowland river at the margin of the species' Scandinavian distribution, a subalpine lake in the mountains of southern Norway and an alpine lake in the coastal area of northern Norway. Eggs were incubated in the laboratory under constant water temperatures at 4oC intervals from 4-28oC. For the 3 populations, there was a common relationship, linear on logarithmic scales, between egg incubation period and water temperature in the range 4-24oC. No hatching occurred at 28oC. No diapause was observed. Egg volume and subsequent first instar size differed significantly between populations, those from the more central populations having larger eggs and 1st instar nymphs than the marginal lowland population. All populations retained most of the same degree of variation, but in different proportions. Egg incubation temperature also had a significant, non-linear, effect on first instar size; the largest nymphs hatched from eggs reared at 8oC and the smallest at 20 and 24oC. Certain predictions of the thermal equilibrium hypothesis with regard to optimal temperature regimes are already apparent in the egg stage. Non-optimal temperatures may induce a shift in the allocation of energy between growth and tissue development, resulting in smaller eggs.-from Authors",28,Journal,ar,Article,100,3,3,29544,undefined,0,FALSE,21,NA,NA
true,https://api.elsevier.com/content/abstract/scopus_id/0021600976,SCOPUS_ID:0021600976,2-s2.0-0021600976,The number of species of insects associated with British trees: a re-analysis.,Kennedy C.,Journal of Animal Ecology,00218790,53,2,455-478,1984-01-01,1984,10.2307/4528,"An updated list of numbers of phytophagous insects and mites associated with 28 British tree species or genera is presented, together with revised estimates of the abundance of the trees. Difficulties in assessing species-area relationships for insects on trees are discussed and a new relationship calculated. When a number of variables: Log tree abundance, time present in Britain, whether or not trees were evergreen or coniferous, taxonomic relatedness, tree height and leaf length were included in a stepwise multiple regression analysis of insect species richness, all but 'coniferousness' contributed significant F values. These variables accounted for 82% of the variation in insect species richness between British trees. When the regression analysis was repeated, but halted after the entry of the last significant F value, log abundance, time and evergreenness emerged as the best set of predictor variables for the numbers of insect species on British trees and accounted for 74% of the variation. -from Authors",261,Journal,ar,Article,100,3,3,29544,undefined,0,FALSE,22,NA,NA
true,https://api.elsevier.com/content/abstract/scopus_id/0021600644,SCOPUS_ID:0021600644,2-s2.0-0021600644,"Search strategies of wheatears ( Oenanthe oenanthe) and stonechats ( Saxicola torquata): adaptive variation in perch height, search time, sally distance and inter-perch move length.",Moreno J.,Journal of Animal Ecology,00218790,53,1,147-159,1984-01-01,1984,10.2307/4348,"In a dry thornscrub area of N Spain during the breeding season, wheatears were more diverse in their foraging mode mainly using perch-to-ground sallying and running ground-gleaning. Stonechats were sallying specialists. Wheatears on average used lower perches than stonechats. The distributions of successful and unsuccessful search times for both species resemble log-normal distribution. Departures from both types of perches occurred independently of the time already spent on the perch. Stonechats generally stayed longer on perches, and had lower departure rates from them than wheatears. Capture probabilities were lower for stonechats. Giving-up times and successful search times increased with perch height, and were longer for stonechats at the same perch heights. This suggests that these birds were able to estimate how long it would take to search the area viewed from each perch, and that the height of the perch and probably the complexity of the area determine these giving-up times. The return-to-perch rate of stonechats was twice that of wheatears. The return rate was negatively correlated with search times preceding the previous sally for wheatears, but not for stonechats. Wheatears generally moved longer between perches than stonechats. Size of the detection area from a perch thus determines the subsequent distance moved after giving up. -from Author",38,Journal,ar,Article,100,1,1,29544,undefined,0,FALSE,23,NA,NA
true,https://api.elsevier.com/content/abstract/scopus_id/0021599713,SCOPUS_ID:0021599713,2-s2.0-0021599713,The reproductive strategy of a parasitic wasp. I. Optimal progeny and sex allocation in Trichogramma evanescens.,Waage J.,Journal of Animal Ecology,00218790,53,2,401-415,1984-01-01,1984,10.2307/4524,"The mechanism by which Trichogramma evanescens makes adaptive responses in progeny and sex allocation may be very simple: wasps usually allocate 2 females per host (Mamestra brassicae, Noctuidae) egg, adding a male in the first 1 or 2 hosts attacked during an oviposition bout, and at intervals thereafter. -from Authors",199,Journal,ar,Article,100,2,2,29544,undefined,0,FALSE,24,NA,NA
true,https://api.elsevier.com/content/abstract/scopus_id/0021599131,SCOPUS_ID:0021599131,2-s2.0-0021599131,Control of fecundity in Pieris rapae. II. Differential effects of temperature.,Gilbert N.,Journal of Animal Ecology,00218790,53,2,589-597,1984-01-01,1984,10.2307/4537,"The basic weight-temperature curve for insects is a rectangular hyperbola. It is profoundly affected by quality of diet. Genetic variation in pupal weight is due to variation in the responses of development and growth to temperature. In good conditions, the weight-temperature curves for different genotypes meet at average field temperatures. Insect stocks held at high temperatures or on poor diets, will self-select away from wild-type. -Author",28,Journal,ar,Article,100,1,1,29544,undefined,0,FALSE,25,NA,NA
true,https://api.elsevier.com/content/abstract/scopus_id/0021598197,SCOPUS_ID:0021598197,2-s2.0-0021598197,The effect of conspecifics on juvenile survival and recruitment of snowshoe hares.,Boutin S.,Journal of Animal Ecology,00218790,53,2,623-637,1984-01-01,1984,10.2307/4540,"Removal of adult Lepus americanus from peak populations improved survival of juvenile females in summer and of juvenile males in autumn. Removal of first litter juveniles did not improve survival of second litter animals. Removal of adults and first litter juveniles increased recruitment, particularly through immigration. Although immigration was limited by the presence of conspecifics, 30% of the recruits caught on the control area were immigrants, suggesting that juveniles begin to disperse at an early age and considerable movement between populations occurs. The chances of a disperser becoming resident in a new population decreased from summer to autumn. -from Author",21,Journal,ar,Article,100,1,1,29544,undefined,0,FALSE,26,NA,NA
true,https://api.elsevier.com/content/abstract/scopus_id/0021598177,SCOPUS_ID:0021598177,2-s2.0-0021598177,The reproductive strategy of a parasitic wasp. II. Sex allocation and local mate competition in Trichogramma evanescens.,Waage J.,Journal of Animal Ecology,00218790,53,2,417-426,1984-01-01,1984,10.2307/4525,"The theory of local mate competition predicts that optimal sex ratio in parasitic wasps will change as the number of female parasitoids exploiting a particular patch of host resource varies. Behavioural analysis reveals little evidence that wasps respond to the presence of other wasps on the patch. Rather, adaptive sex ratio changes are generated largely by the sequence in which male and female progeny are deposited in host (Mamestra brassicae, Noctuidae) patches. By this simple pattern of sex allocation, Trichogramma can make adaptive responses to changes in both the size of resource patches and the number of wasps competing for them. The implications for mass production of Trichogramma for biological control are discussed. -from Authors",81,Journal,ar,Article,100,2,2,29544,undefined,0,FALSE,27,NA,NA
true,https://api.elsevier.com/content/abstract/scopus_id/0021596357,SCOPUS_ID:0021596357,2-s2.0-0021596357,"Models for the population dynamics of the yellow fever mosquito, Aedes aegypti.",Dye C.,Journal of Animal Ecology,00218790,53,1,247-268,1984-01-01,1984,10.2307/4355,"The most appropriate analytical model is a generalization of a continuous time model used by Gurney, Blythe & Nisbet (1980) to describe Nicholson's blowfly populations. Despite uncertainty about egg-laying rate, local stability analysis firmly predicts that the population in Wat Samphaya, Bangkok, Thailand, is monotonically stable. Equilibrium analysis predicts that adult populations will be more sensitive to changes in death rate than to changes in either birth rate or number of larval breeding sites. Accurate prediction of equilibrium population size requires good estimates of parameters describing density-dependent mortality. Results of stability analysis with the simulation model accord with those of the analytical model: observed fluctuations in adult population size are unlikely to be driven cycles, but rather due to fluctuations in adult survivorship combined with strong density-dependent larval mortality. Equilibrium analysis reinforces the conclusion that the adult population is more sensitive to changes in adult survivorship than to changes in fecundity.-from Author",110,Journal,ar,Article,100,1,1,29544,undefined,0,FALSE,28,NA,NA
true,https://api.elsevier.com/content/abstract/scopus_id/0021594993,SCOPUS_ID:0021594993,2-s2.0-0021594993,"The consequences of brood size for breeding blue tits I. Adult survival, weight change and the cost of reproduction.",Nur N.,Journal of Animal Ecology,00218790,53,2,479-496,1984-01-01,1984,10.2307/4529,"Brood size was manipulated in a population of Parus caeruleus breeding in Wytham Wood, Oxford. Female weight loss increased linearly as brood size increased. Females rearing large broods lost on average 15-36% more weight than those rearing small broods. In 1978 (but not in 1979 and 1980) male weight decreased as brood size increased: in 1978 males rearing the largest broods were on average 5% lighter than those rearing the smallest broods. For broods manipulated in 1978, an increase in brood size from 3 to 15 was associated with a decrease in female survival of 54% (0.41 v. 0.19) ; the relationship was non-linear (second derivative positive), ie the effect of brood size on apparent female survival was greater at small brood sizes than at large. Female weight loss occurred, for the most part, early in the nestling period; between days 8 and 16, females, but not males, lost additional weight. The negative correlation between female weight and brood size was already well established before nestling feeding frequency reached its peak but while the female was still brooding her young. The energetic stress of feeding nestlings is thus insufficient to account for the observed pattern of weight loss. Differences in weight loss reflect real differences in reproductive costs incurred. Weight loss is presumably regulated to reflect benefits and costs to the breeding individual. -from Author",193,Journal,ar,Article,100,1,1,29544,undefined,0,FALSE,29,NA,NA
true,https://api.elsevier.com/content/abstract/scopus_id/0021583450,SCOPUS_ID:0021583450,2-s2.0-0021583450,Non-linear interactions of populations and the importance of estimating per capita rates of change.,Livdahl T.,Journal of Animal Ecology,00218790,53,2,573-580,1984-01-01,1984,10.2307/4535,"Derives a computational formula for estimating the per capita rate of change in experimental cohorts when detailed schedules for reproduction and survival during the reproductive period are impractical to obtain. For experiments that manipulate densities, this calculation can provide estimates for the unlimited population growth rate (rm), the equilibrium carrying capacity (K), and the intensity of interspecific interactions. These methods are applied to life history data for treehole mosquitoes to underscore the potential shortcomings of analysing separate life-history features in testing the adequacy of simple linear models of population growth. Non-linearities which arise when survivorship and fecundity are treated separately may cancel when gathered into a well-behaved estimate of population growth. -Authors",94,Journal,ar,Article,100,2,2,29544,undefined,0,FALSE,30,NA,NA
true,https://api.elsevier.com/content/abstract/scopus_id/0021581107,SCOPUS_ID:0021581107,2-s2.0-0021581107,Population dynamics of two carabid beetles at a Dutch heathland. II. Egg production and survival in relation to density.,Baars M.A.,Journal of Animal Ecology,00218790,53,2,389-400,1984-01-01,1984,10.2307/4523,"Egg production was estimated by summing the weekly averages of the number of eggs in the ovaries per female during the reproductive period. For both Pterostichus versicolor and Calathus melanocephalus this variable correlates with the number of eggs laid. Egg production is determined largely by food supply, but with shortage of food total numbers of eggs in the ovaries though low, overestimate the numbers laid. In two subpopulations egg production correlated inversely with total catch, representing mean density, suggesting that competition for food results in density-dependent fecundity. Both P. versicolor and C. melanocephalus densities are restricted by scrambling for food. Below the carrying capacity, abiotic factors may determine fluctuations in numbers. -from Authors",40,Journal,ar,Article,100,2,2,29544,undefined,0,FALSE,31,NA,NA
true,https://api.elsevier.com/content/abstract/scopus_id/0021579765,SCOPUS_ID:0021579765,2-s2.0-0021579765,"The consequences of brood size for breeding blue tits II. Nestling weight, offspring survival and optimal brood size.",Nur N.,Journal of Animal Ecology,00218790,53,2,497-517,1984-01-01,1984,10.2307/4530,"Breeding pairs of Parus caeruleus in Wytham Wood, Oxford, were randomly assigned 1 of 5 brood sizes: 3, 6, 9, 12 or 15, and the fate of offspring and parents was determined. Nestling weight significantly and consistently decreased with increasing brood size. Nestlings from the largest broods were 8-12% lighter at day 10 of the nestling period than those from the smallest broods; between days 10-13 the former did not catch up in weight with the latter nor did they fall further behind. Nestling weight at day 10 or 13 of the nestling period was correlated with subsequent survival in 1978 but not in 1979. Survival of individual offspring was independent of brood size except that in 1978 (but not in 1979) nestlings from broods of 15 survived less well than young from smaller broods. Number of surviving offspring per brood was maximized for broods of 12 in 1978 and for broods of 15 in 1979. Results are consistent with the view that investment in offspring reflects the balance of costs and benefits to the breeding individual. Time and energy constraints may act to limit brood size during the laying period, not during the feeding period. If survival probabilities (especially of offspring) are unpredictable from year to year, restrained reproductive effort may be favoured. -from Author",156,Journal,ar,Article,100,1,1,29544,undefined,0,FALSE,32,NA,NA
true,https://api.elsevier.com/content/abstract/scopus_id/0021579719,SCOPUS_ID:0021579719,2-s2.0-0021579719,Effects of temperature and oxygenation on predator-prey overlap and prey choice of Notonecta glauca.,Cockrell B.,Journal of Animal Ecology,00218790,53,2,519-532,1984-01-01,1984,10.2307/4531,"Both Notonecta glauca and one of the prey types, Culex larvae, spent more time submerged with decreasing water temperatures between 5 and 25oC and at higher dissolved oxygen levels. At low temperatures or high oxygenation, a greater proportion of submerged as opposed to surface attacks were levelled at Culex but there was no significant change in the number of attacks made on the benthic prey, Asellus aquaticus. At high dissolved oxygen concentrations N. glauca made fewer attacks on adult Musca domestica that floated on the water's surface, and more attacks on Asellus when presented at a high density. -from AuthorAsellus aquaticus Culex Musca domestica",17,Journal,ar,Article,100,1,1,29544,undefined,0,FALSE,33,NA,NA
true,https://api.elsevier.com/content/abstract/scopus_id/0021579331,SCOPUS_ID:0021579331,2-s2.0-0021579331,Host susceptibility as a component in host- parasitoid systems.,Hassell M.,Journal of Animal Ecology,00218790,53,2,611-621,1984-01-01,1984,10.2307/4539,"Functional responses are generated using a Monte Carlo simulation method, in which the hosts are either all equally susceptible to parasitism or vary randomly in their degree of susceptibility. Irrespective of this difference, the relationships all tend to rise at a decreasing rate towards an upper asymptote, as typical of the many type II responses obtained from experiments with insect parasitoids. While variable host susceptibility has no effect on the general form of the functional response, it does affect the impact that parasitism has on the host populations' dynamics. Like other forms of heterogeneity (eg in space or time), it renders some individuals less prone to parasitism than others which can contribute strongly to the stability of the interaction. -Authors",25,Journal,ar,Article,100,2,2,29544,undefined,0,FALSE,34,NA,NA
true,https://api.elsevier.com/content/abstract/scopus_id/0021579256,SCOPUS_ID:0021579256,2-s2.0-0021579256,Effects of food enrichment on numbers and spacing behaviour of red grouse.,Watson A.,Journal of Animal Ecology,00218790,53,2,663-678,1984-01-01,1984,10.2307/4542,"Heather Calluna vulgaris, the main food of Lagopus lagopus scoticus, was enriched by spreading nitrate fertilizer. The heather's response to fertilizer differed in the three experiments, but its nitrogen content increased by a similar amount in all three. Numbers in Experiment 1 increased while grouse on the rest of the moor were breeding poorly and declining in density from a moderate peak. All grouse were removed from the experimental and control area at the start of this experiment, but not from later ones. Immigrants reared bigger broods on the fertilized area; many of the young from these broods were recruited into the breeding population, which increased and subsequently remained at a higher density than on the control for 4 yr. Experiment 2 was started while grouse on the rest of the moor were breeding well and increasing to a very high density. Fertilizing did not improve breeding, relaive to the control, but it was followed by more immigration and increased recruitment to the breeding population, which again exceeded that on the control for 4 yr. Experiment 3 took place while densities were declining rapidly from the high peak during experiment 2. Numbers on the fertilized area decreased as much as on the control, until both areas held no birds. When food enrichment increased numbers, this followed changes in territory size. The ratio of hens to cocks in spring also increased. -from Authors",23,Journal,ar,Article,100,3,3,29544,undefined,0,FALSE,35,NA,NA
true,https://api.elsevier.com/content/abstract/scopus_id/0021578957,SCOPUS_ID:0021578957,2-s2.0-0021578957,"Seasonal decline in brood sizes of sympatric waterfowl ( Anas and Aythya, Anatidae) and a proposed evolutionary explanation.",Toft C.,Journal of Animal Ecology,00218790,53,1,75-92,1984-01-01,1984,10.2307/4343,"At a single location in the Canadian subarctic, the strongest and most consistent source of variation in anatid brood size was that during the season; for all species (mallard Anas platyrhynchos, American wigeon A. americana, green-winged teal A. crecca carolinensis, lesser scaup Aythya affinis, ring-necked duck A. collaris) newly-hatched broods were smaller as the season progressed in all years. Mortality after hatching somewhat reduced the magnitude of seasonal decline. Much of the variation in brood sizes among species was not due directly to genetic differences between species but was mediated by environmental effects. Hatching date distributions of all species except mallard were unimodal. Taken with the superimposed seasonal decline in brood sizes, ie a majority of broods were of about average size and hatched about the modal date. Minor proportions of brood were, on the one hand, larger and earlier than average and, on the other, smaller and later than average. Mallards exhibited a left-truncated distribution, ie the proportion of broods hatching decreased monotonically as the season progressed. A general, evolutionary explanation is proposed by extending Lack's hypothesis for interspecific and interpopulational differences to include intrapopulational differences in clutch sizes: the optimum clutch size, that resulting in a maximum of young reared in the female's lifetime, changes in robust ways during the breeding season in response to changing costs and benefits of rearing young at different times in the season. -from Authors",18,Journal,ar,Article,100,3,3,29544,undefined,0,FALSE,36,NA,NA
true,https://api.elsevier.com/content/abstract/scopus_id/0021578927,SCOPUS_ID:0021578927,2-s2.0-0021578927,"Numerical changes and population regulation in young migratory trout Salmo trutta in a Lake District stream, 1966-83.",Elliott J.,Journal of Animal Ecology,00218790,53,1,327-350,1984-01-01,1984,10.2307/4360,"In Black Brows Beck, earliest and latest spawning dates were 3 November and 7 December; larger females spawned earlier than smaller females. Eggs per redd and mean egg weight increased with female size and decreased with time from the start of the spawning period. Migratory trout produced more and larger eggs per unit length of fish than did resident trout in a neighbouring stream. In laboratory and stream experiments, 50% of eggs hatched and 50% of alevins emerged after 444o days and 852o days from fertilization, respectively. Population densities of eggs and alevins were very similar within but differed between year-classes (range: 12-133 eggs m-2). The dominant factor affecting population densities of young trout was the population density of eggs, and hence alevins, at the start of each year-class. Maximum recruitment was 7.2 fish m-2 (95% CL = 6.5-8.0) soon after the fry stage ended in May/early June and 2.0 (+ or -0.5) fish m-2 in late August/September. Optimum egg densities for these values were 40.0 m-2 (95% CL = 38.5-41.7) and 62.5 m-2 (55.6-71.4) respectively. Mortality was very low for eggs and alevins but high for young trout trying to establish feeding territories. The instantaneous mortality rate was linearly related to egg density. The mortality rate for June to August was also negatively related to, and appeared to compensate for, the high mortality rate in May/early June. Density-dependent mortality appeared to be the chief mechanism for population regulation of the young trout.-from Author",153,Journal,ar,Article,100,1,1,29544,undefined,0,FALSE,37,NA,NA
true,https://api.elsevier.com/content/abstract/scopus_id/0021578464,SCOPUS_ID:0021578464,2-s2.0-0021578464,The effect of host plant flowering on the distribution and growth of hawthorn psyllids ( Homoptera: Psylloidea).,Sutton R.,Journal of Animal Ecology,00218790,53,1,37-50,1984-01-01,1984,10.2307/4340,"Examined Psylla peregrina and Psylla subferruginea, and their host plant Crataegus monogyna. Hawthorn trees show irregular flowering patterns that tend towards alternate bearing and non-bearing years. After the high levels of soluble N associated with bud-burst have declined, only growing shoots and inflorescences provide suitable feeding sites for P. peregrina nymphs. Nymphs on non-flowering trees are thus aggregated on growing shoots at the apex of branches. Those on flowering trees are less clumped and are found on flowers along the length of branches. P. subferruginea nymphs are concentrated on growing shoots on both flowering and non-flowering trees. Psyllids on flowering trees are larger than those on non-flowering trees. Year-to-year changes in the size of P. peregrina are closely related to the flowering patterns of individual trees. Size differences are probably related to the higher levels of soluble N present in tissues of flowering trees. Feeding by P. peregrina nymphs reduces the extension of hawthorn shoots.-from Author",19,Journal,ar,Article,100,1,1,29544,undefined,0,FALSE,38,NA,NA
