@_fa,prism:url,dc:identifier,eid,dc:title,dc:creator,prism:publicationName,prism:issn,prism:volume,prism:issueIdentifier,prism:pageRange,prism:coverDate,prism:coverDisplayDate,prism:doi,dc:description,citedby-count,prism:aggregationType,subtype,subtypeDescription,author-count.@limit,author-count.@total,author-count.$,authkeywords,source-id,fund-no,openaccess,openaccessFlag,entry_number,freetoread.value.$,freetoreadLabel.value.$
true,https://api.elsevier.com/content/abstract/scopus_id/0034970895,SCOPUS_ID:0034970895,2-s2.0-0034970895,Long-term effects of changes in goose grazing intensity on arrowgrass populations: A spatially explicit model,Mulder C.,Journal of Ecology,00220477,89,3,406-417,2001-06-27,2001,10.1046/j.1365-2745.2001.00559.x,"1. Field studies on effects of geese on arrowgrass (Triglochin palustris) on the Yukon-Kuskokwim Delta (SW Alaska) have demonstrated that Pacific black brant geese (Brant bernicla nigricans) can have both positive and negative effects on arrowgrass populations, but cannot predict unambiguously the effects of increased goose numbers on arrowgrass demography. 2. A cellular automata model was used to predict effects of changes in goose grazing intensity on small-scale (within-patch) arrowgrass dynamics. We examined effects of making some of the plant competitors edible to geese, of goose faeces increasing arrowgrass reproduction but reducing size of ungrazed arrowgrass, and of the presence of other species protecting arrowgrass from grazing. We also compared the effects of a random vs. patchy distribution of geese, and of incorporating threshold numbers of arrowgrass below which grazing ceased. 3. The results indicate that arrowgrass populations are likely to be highest at medium to high levels of grazing. Inclusion of edible competitors and positive effects of faecal deposition resulted in greater changes in arrowgrass population dynamics than did inclusion of associative refuges. 4. For a given grazing intensity, models generally resulted in lower arrowgrass populations with increased aggregation if distributions of geese were patchy, suggesting that decreased colonization may result from lower dispersal. 5. Inclusion of a feedback effect (grazing only above a certain plant population) caused arrowgrass populations to persist for much longer. Temporal variability in whether plots were grazed (unrelated to arrowgrass numbers) could not account for this result. 6. The model results suggest that knowledge of both small-scale and large-scale foraging behaviour is needed to predict the long-term effects of goose grazing on arrowgrass. Small-scale effects on the population may be particularly important where dispersal distances are short. The ability of plant populations to persist locally may be increased if grazing is suspended when herbivory reduces forage plants below a threshold level.",7,Journal,ar,Article,100,2,2,Branta bernicla nigricans | Cellular automata | Foraging behaviour | Subarctic saltmarsh | Triglochin palustris,29602,undefined,1,TRUE,70,all,All Open Access
true,https://api.elsevier.com/content/abstract/scopus_id/0034967503,SCOPUS_ID:0034967503,2-s2.0-0034967503,The effect of plant population size on the interactions between the rare plant Gentiana cruciata and its specialized herbivore Maculinea rebeli,Kéry M.,Journal of Ecology,00220477,89,3,418-427,2001-06-27,2001,10.1046/j.1365-2745.2001.00550.x,"1. Many rare plant species are restricted to small isolated populations in which fitness may be reduced because of inbreeding, environmental and demographic stochasticity, and reduced pollination. However, specialist herbivores are less likely to be present in such populations because of higher probabilities of herbivore extinction and lower rates of colonization, and may therefore affect fitness only in larger plant populations. 2. We studied the relationships between the size of populations of the endangered grassland plant Gentiana cruciata and the probability of occurrence and population size of its specialist herbivore, the endangered butterfly Maculinea rebeli, and their effects on plant size, fruit herbivory and seed production. 3. The 29 G. cruciata populations studied ranged in size from 1 to 337 genets and 18 of them supported a M. rebeli population. M. rebeli populations were both more likely and larger in larger G. cruciata populations. Estimated adult herbivore populations were small, ranging from 1 to 42 individuals, with a median of 11. We conclude that the conservation of M. rebeli requires the conservation of large G. cruciata populations. 4. Although large populations of G. cruciata produced more flowers, a greater proportion of their fruits were attacked by herbivores. Fruit herbivory, which considerably decreased the number of seeds per fruit, appears to have been caused largely by Maculinea. The number of seeds both per fruit and per genet significantly decreased with the number of M. rebeli eggs per genet. The overall independence of G. cruciata seed production from population size may result from the opposing effects on fruit production and herbivory. 5. Our study suggests that complex interactions between different trophic levels may determine the population dynamics of rare species. Furthermore, small population size may have both negative and positive effects on the fitness of endangered species.",80,Journal,ar,Article,100,3,3,Biotic interactions | Conservation biology | Habitat fragmentation | Herbivory | Population size | Reproduction,29602,undefined,0,FALSE,71,NA,NA
true,https://api.elsevier.com/content/abstract/scopus_id/0034967160,SCOPUS_ID:0034967160,2-s2.0-0034967160,Effects of fine-scale disturbances on the demography and population dynamics of the clonal moss Hylocomium splendens,Rydgren K.,Journal of Ecology,00220477,89,3,395-405,2001-06-27,2001,10.1046/j.1365-2745.2001.00552.x,"1. The boreal forest is subject to disturbance but the effects on population dynamics are poorly understood. We investigated how a prominent species of the forest floor, the clonal moss Hylocomium splendens, responded to different types of fine-scale disturbance. 2. Canopy gap formation was simulated in H. splendens populations by removing 50% of the bryophyte layer (Removal treatment) and herbivory by clipping all of its growing points (Clipped treatment). Demographic parameters and population dynamics were compared with an unmanipulated reference population (Ref). 3. Both types of disturbance caused a significant decrease in mean segment size (particularly following clipping) and an increase in branching rates. Branching rates in the Removal population were enhanced at all architectural opportunities for enhanced branching, but only the Clipped segments themselves were affected during the 2 years following disturbance. 4. The population effects of disturbance were analysed by a periodic matrix model, with 3-year as the period, followed by elasticity analysis. The Ref population was approximately stable (growth rate, λ = 1.012), with the survival of mature segments making an overwhelming contribution to its growth rate. The higher λ (1.740) in the Removal population was associated with higher elasticities of branching. Clipping reduced λ to 0.841 by blocking segment survival, although regeneration of new growing points on the remnant main shoot axis after 1 year, and its subsequent maturation in the next year, then made a major contribution. 5. Life table response experiment analyses revealed that almost all demographic processes including branching and the survival of mature segments contributed to the increased λ in Removal treatment. The relatively small decrease in λ following clipping was mainly due to the absence of mature segment survival, being almost balanced by the pulse of regeneration of growing points the year after disturbance. 6. We conclude that H. splendens populations show a good ability to recover from common types of disturbances in their environment. The general mechanisms behind the responses are discussed.",40,Journal,ar,Article,100,4,4,Boreal forest | Bryophytes | Clonal plants | Demography | Elasticity | Fine-scale disturbance | Life table response experiment | Norway | Periodic matrix model | Population growth rate,29602,undefined,1,TRUE,72,all,All Open Access
true,https://api.elsevier.com/content/abstract/scopus_id/0034967045,SCOPUS_ID:0034967045,2-s2.0-0034967045,Demographic variation and population viability in Gentianella campestris: Effects of grassland management and environmental stochasticity,Lennartsson T.,Journal of Ecology,00220477,89,3,451-463,2001-06-27,2001,10.1046/j.1365-2745.2001.00566.x,"1. Transition matrix models were used to evaluate the effects of environmental stochasticity and four different methods of grassland management on dynamics and viability of a population of the biennial Gentianella campestris (Gentianaceae) in species-rich grassland. Data were collected between 1990 and 1995. 2. Continuous summer grazing, the prevailing management strategy in Scandinavian grasslands, resulted in high recruitment of new plants, mainly because litter accumulation was prevented and gaps were created by trampling. Trampling and repeated grazing, however, caused damage which reduced seed production. Lambda for the average matrix was c. 0.77, and a stochastic matrix model yielded an extinction probability for the total population of c. 0.08 within 50 years. 3. Mowing in mid-July (used as a conservation tool) increased seed production, but litter accumulation following re-growth of the vegetation prevented establishment. Lambda and extinction risk were similar to continuous grazing. 4. Mowing in October (another conservation tool) promoted recruitment because of low litter accumulation, but the seed output decreased because plant growth was impaired by tall vegetation. Lambda was 0.64, while the extinction probability was very high (c. 0.98 within 50 years). 5. Mid-July mowing followed by autumn grazing (the historical management regime) yielded high values for both seed production and establishment of rosettes. Lambda was 0.94 and the probability of extinction within 50 years was below detection level. 6. Log-linear analysis showed that the matrices differed significantly both between treatments and between years. The latter indicates environmental stochasticity, here caused by summer drought that increased the extinction risk. Lambda may be slightly underestimated because drought occurred in one out of five summers during the study period, which is high compared with the natural frequency. 7. We conclude that traditional grassland management is more favourable for G. campestris than the methods that prevail in Scandinavia today. This indicates a serious conservation problem, because grazing has replaced traditional management in many of the remaining semi-natural grasslands throughout Europe.",106,Journal,ar,Article,100,2,2,Environmental stochasticity | Gentianella | Grassland management | Population dynamics | Population viability analysis | Recruitment | Seed production | Transition matrix models,29602,undefined,1,TRUE,73,all,All Open Access
true,https://api.elsevier.com/content/abstract/scopus_id/0034966971,SCOPUS_ID:0034966971,2-s2.0-0034966971,Phylogeny and the niche structure of meadow plant communities,Silvertown J.,Journal of Ecology,00220477,89,3,428-435,2001-06-27,2001,10.1046/j.1365-2745.2001.00553.x,"1. Because related species tend to be ecologically similar, it has long been recognized that the phylogenetic relationships between species in a community are likely to influence its structure. Previous investigations of the influence of phylogeny on community structure have generally shown that congeneric species are more frequent than would be expected if communities were randomly assembled. Because, under most theories of coexistence, stable coexistence requires ecological differences between species, the apparent excess of coexisting congeners suggests that trait differences important to coexistence must be recently evolved, arising near the tips of phylogenetic trees. 2. We test this hypothesis in two meadow plant communities for which we have good evidence of niche segregation along axes defined by hydrological conditions. 3. Niche overlaps were calculated and compared against null models for (i) all species in the community, (ii) species within genera, (iii) genera within families, (iv) families within the eudicots and monocots, and (v) eudicots and monocots. 4. Against expectation, we found that community structure was the cumulative result of niche separation arising at a range of phylogenetic levels and therefore that niche differences have been accumulated through the evolutionary history of species.",98,Journal,ar,Article,100,3,3,Angiospermae | Coexistence | Eudicot | Hydrology | Meadows | Monocot | Niche overlap | Phylogeny | Plant community structure,29602,undefined,0,FALSE,74,NA,NA
true,https://api.elsevier.com/content/abstract/scopus_id/0034966721,SCOPUS_ID:0034966721,2-s2.0-0034966721,Water use trade-offs and optimal adaptations to pulse-driven arid ecosystems,Schwinning S.,Journal of Ecology,00220477,89,3,464-480,2001-06-27,2001,10.1046/j.1365-2745.2001.00576.x,"1. We introduce a hydraulic soil-plant model with water uptake from two soil layers; one a pulse-dominated shallow soil layer, the other a deeper soil layer with continuous, but generally less than saturated soil moisture. Water uptake is linked to photosynthetic carbon assimilation through a photosynthesis model for C3 plants. 2. A genetic algorithm is used to identify character suites that maximize photosynthetic carbon gain for plants that experience a particular soil moisture pattern. The character suites include allocation fraction to stem, leaves and shallow root, stem capacitance and stem water storage capacity, maximal leaf conductance and sensitivity of leaf conductance to plant water potential, and a critical soil water potential at which shallow roots cease to transfer water. 3. We find that if pulse water is a more important water source than deeper soil water in the environment, optimal phenotypes lean towards adaptations that maximize pulse water use (small root: shoot ratio, predominantly shallow root system, high leaf conductance with high stomatal sensitivity to plant water status). If deeper soil water is more important, phenotypes lean towards adaptations that maximize deeper soil water use (large root: shoot ratio, predominantly deep root system, lower leaf conductance with low stomatal sensitivity). Stem succulence is adaptive only when deeper soil water is unavailable. 4. From among the continuum of derived phenotypes, four phenotypes are selected that resemble the character suites of winter annuals, drought-deciduous perennials, evergreen perennials and stem succulents. Under common conditions, these phenotypes reproduce many of the responses to drought and water pulse observed in their respective life-form counterparts. The comparison also highlights the differences in plant life-form sensitivity to summer and winter drought conditions. 5. Based on these results, we discuss the possible role of annual precipitation patterns in shaping plant adaptations and determining the plant composition of arid and semi-arid environments.",323,Journal,ar,Article,100,2,2,Desert | Genetic algorithm | Plant functional types | Whole-plant carbon gain,29602,undefined,1,TRUE,75,all,All Open Access
true,https://api.elsevier.com/content/abstract/scopus_id/0034966720,SCOPUS_ID:0034966720,2-s2.0-0034966720,"Population dynamics and stage structure in a haploid-diploid red seaweed, Gracilaria gracilis",Engel C.,Journal of Ecology,00220477,89,3,436-450,2001-06-27,2001,10.1046/j.1365-2745.2001.00567.x,"1. Many red seaweeds are characterized by a haploid-diploid life cycle in which populations consist of dioecious haploid (gametophyte) and diploid (tetrasporophyte) individuals as well as an additional diploid zygote-derived sporangium (carposporophyte) stage. A demographic analysis of Gracilaria gracilis populations was carried out to explore and evaluate the population dynamics and stage structure of a typical haploid-diploid red seaweed. 2. Four G. gracilis populations were studied at two sites on the French coast of the Strait of Dover. Survival, reproduction and recruitment rates were measured in each population for up to 4 years. Eight two-sex stage-based population projection matrices were built to describe their demography. 3. All four populations were characterized by high survival and low recruitment rates. Population growth rates (λ) were similar between populations and between years and ranged from 1.03 to 1.17. In addition, generation times were found to be as long as 42 years. 4. Sex and ploidy ratios were variable across populations and over time. Female frequencies ranged from 0.31 to 0.59 and tetrasporophyte frequencies from 0.44 to 0.63. However, in most cases, the observed population structures were not significantly different from the calculated stage distributions. 5. Eigenvalue elasticity analysis showed that λ was most sensitive to changes in matrix transitions that corresponded to survival of the gametophyte and tetrasporophyte stages. In contrast, the contribution of the fertility elements to λ was small. Eigenvector elasticity analysis also showed that survival elements had the greatest impact on sex and ploidy ratios.",54,Journal,ar,Article,100,5,5,Algal demography | Eigenvector elasticity analysis | Ploidy ratio | Sex ratio | Two-sex projection matrix model,29602,undefined,1,TRUE,76,all,All Open Access
true,https://api.elsevier.com/content/abstract/scopus_id/0343930742,SCOPUS_ID:0343930742,2-s2.0-0343930742,"The effects of light quality, nitrate concentration and presence of bracteoles on germination of different fruit types in the heterocarpous Atriplex sagittata",Mandák B.,Journal of Ecology,00220477,89,2,149-158,2001-04-01,April 2001,10.1046/j.1365-2745.2001.00537.x,"1 We investigated the effect of light quality, nitrogen supply, fruit size and age on germination of the three types of fruit produced by Atriplex sagittata. 2 Regardless of fruit type, seed germination was significantly reduced in the dark. Light quality had no significant effect on germination of seeds from fruit types A and B, both of which are dormant, but seeds from fruit type C, which are non-dormant, germinated better in green light (low photon flux and red: far-red ratio, simulating conditions in the canopy) than in white light. 3 Optimum nitrate concentration differed between seed types but, for all, germination was reduced at the highest concentration used. 4 The effects of cold stratification and its interaction with light and nitrogen effects were also studied. Strong interactions between stratification and light were found in all seed types but other interactions were less frequent. 5 Three size classes of type C fruit showed similar final germination percentages but large seeds germinated more slowly. 6 The effect of seed age was highly significant: over a 3 year period, the germinability of dormant seeds (types A + B) increased while that of non-dormant seeds (type C) fell. 7 The salt concentration in bracteoles of freshly ripened fruits was too low to mediate an inhibitory effect on germination. Moreover, the first autumn rain would be sufficient to remove all the salt from bracteoles. 8 Differences between fruit types in depth of dormancy, and in response to the quality of light and to nitrate concentration in the soil, allows A. sagittata to respond to the spatial and temporal variation in environmental conditions encountered by this annual of disturbed habitats.",54,Journal,ar,Article,100,2,2,Atriplex sagittata | Bracteoles | Chenopodiaceae | Fruit size | Germination | Heterocarpy | Nitrate | Red: far-red ratio,29602,undefined,1,TRUE,77,all,All Open Access
true,https://api.elsevier.com/content/abstract/scopus_id/0343290337,SCOPUS_ID:0343290337,2-s2.0-0343290337,Discordance in spatial patterns of white pine (Pinus strobus) size-classes in a patchy near-boreal forest,Dovčiak M.,Journal of Ecology,00220477,89,2,280-291,2001-04-01,April 2001,10.1046/j.1365-2745.2001.00545.x,"1. White pines (Pinus strobus) in a c. 1 ha near-boreal aspen-red maple stand in the western Great Lakes region, USA, were allocated to five size-classes that were tested for discordance of their spatial patterns (i.e. within-size-class spatial distribution of individuals and spatial associations among different size-classes). The size-classes were 0.5-1 m tall, 1-2 m tall, 2-4 m tall, > 4 m tall but < 20 cm diameter at breast height (d.b.h.), and > 20 cm d.b.h. The size-classes also differed in age. Their spatial patterns were analysed using formulae for spatial autocorrelation with categorical data at neighbourhood (0-14 m) and stand (0-70 m) scales. 2. Size-classes clustered in neighbourhoods that differed in size ranging from 6 m in diameter (size-class 2) to 40 m (size-class 3), suggesting that the pattern of each size-class is due to a different set of environmental factors. Similar size-classes tended to be randomly or positively associated at neighbourhood scales, while the most dissimilar size-classes occupied different neighbourhoods. 3. Size-classes 1 and 2 were located farther away from seed trees than size-class 3, which was farther away than size-class 4. Thus periodic seedling invasion of a deciduous matrix may be followed by the gradual retraction of older size-classes into a refuge near the mature seed source where competition from shrubs and overstorey trees is lower. Although the lack of fine-scale clustering suggests density-dependent mortality within the refuge, few older individuals were found outside this area. 4. Two regeneration bottlenecks may structure white pine populations. First, recruitment into size-class 2 is restricted to small patches (possibly in understorey gaps) within neighbourhoods with abundant size-class 1. Relatively unrestricted recruitment to size-class 3 follows, and after that recruitment to size-class 4 is again limited, this time to refugia with sparse canopy near adult trees.",72,Journal,ar,Article,100,3,3,Neighbourhood effects | Patch dynamics | Plant demography | Point pattern analysis | Spatial pattern | White pine,29602,undefined,1,TRUE,78,all,All Open Access
true,https://api.elsevier.com/content/abstract/scopus_id/0343059016,SCOPUS_ID:0343059016,2-s2.0-0343059016,Fruit dispersal and seed banks in Atriplex sagittata: The role of heterocarpy,Mandák B.,Journal of Ecology,00220477,89,2,159-165,2001-04-01,April 2001,10.1046/j.1365-2745.2001.00536.x,"1 Atriplex sagittata, an arly succesional, annual species of disturbed habitats in Central Europe, produces three types of fruits. We studied the differences in dispersal between the fruit types in order to investigate their ecological roles. 2 The typical positive relationship between dispersal ability and germinability is not found in this species. Type A (ebracteate) fruits produced deeply dormant seeds and had the lowest dispersal potential, but of the two fruits with bracts, type B, with dormant seeds, was better dispersed by both water and wind than type C, which produces non-dormant seeds. 3 Wind, temperature and precipitation have significant effects on fruit release but their effects differ between fruit types. The release of fruit types with bracts was positively correlated with wind whereas all fruit types tended to be negatively correlated with precipitation and temperature range. 4 Type C fruit, which contains non-dormant seed, are absent from the soil in summer and have a Type II transient seed bank. Type A and B fruits, containing dormant seeds, form a persistent seed bank. 5 Heterocarpy, where fruit types show distinct ecological behaviour, enables colonizing species such as A. sagittata to survive both major disturbance (by ensuring that some seeds persist) and unfavourable conditions (by spreading germination over a long period). 6 In A. sagittata, seed dynamics can be explained by the germination behaviour of seeds produced by the three types of fruit. All fruit types mature in autumn, but few of Type A fall from the mother plant until spring, when germination is probably inhibited because of insufficient stratification. Type C fruit, however, show peak dispersal in winter and the majority of these non-dormant seeds are able to germinate as soon as conditions become more suitable.",63,Journal,ar,Article,100,2,2,Atriplex sagittata | Chenopodiaceae | Morphology | Seed bank | Seed rain | Terminal velocity,29602,undefined,1,TRUE,79,all,All Open Access
