@_fa,prism:url,dc:identifier,eid,dc:title,dc:creator,prism:publicationName,prism:issn,prism:volume,prism:issueIdentifier,prism:pageRange,prism:coverDate,prism:coverDisplayDate,prism:doi,dc:description,citedby-count,prism:aggregationType,subtype,subtypeDescription,author-count.@limit,author-count.@total,author-count.$,source-id,fund-no,openaccess,openaccessFlag,entry_number,freetoread.value.$,freetoreadLabel.value.$
true,https://api.elsevier.com/content/abstract/scopus_id/0027802719,SCOPUS_ID:0027802719,2-s2.0-0027802719,Genet dynamics of the clonal plant Rubus saxatilis,Eriksson O.,Journal of Ecology,00220477,81,3,533-542,1993-01-01,1993,10.2307/2261531,"A path analysis suggested a strong effect of fruit-set on total patch fruit production. Fruit-set varied between 6.6-8.3% (yearly averages) and was influenced by distance to nearest flowering conspecific patch. Isolated patches tended to have a low fruit-set. Size of patches was of minor importance for fruit-set and fruit-production, whereas intrapatch ramet density influenced fruit production positively via an effect on the proportion of ramets that flowered. A pollination experiment confirmed that R. saxatilis is self-incompatible. Within-patch pollinations indicated that isolated patches comprised single genets or incompatibility types. Between-patch pollination indicated that fruit-set may be pollen limited, at least some years. Deficiency of compatible pollen (or ""partners') is the most likely mechanism behind the distance-effect on fruit production found in the path analysis. A bagging experiment suggested that c50% of the fruits (drupelets) were removed by animals. The dynamics of the genet population of R. saxatilis in the study area was interpreted by a source-sink concept. Source populations represent local clusters of genets with high fruit production which enhances further local recruitment in source populations and provide the surrounding sink areas with propagules. Sink populations represent low-density populations comprising isolated genets suffering from partner-limited fruit production. These isolated genets may be loci for future colonization. -from Authors",97,Journal,ar,Article,100,2,2,29602,undefined,0,FALSE,17,NA,NA
true,https://api.elsevier.com/content/abstract/scopus_id/0027802216,SCOPUS_ID:0027802216,2-s2.0-0027802216,Plant life-history and disease susceptibility - the occurrence of Ustilago violacea on different species within the Caryophyllaceae,Thrall P.,Journal of Ecology,00220477,81,3,489-498,1993-01-01,1993,10.2307/2261527,"Data from the empirical literature on the relationship between the presence of anther smut diseases and host life span in the Caryophyllaceae shows that the distribution of Ustilago violacea among host species within the Caryophyllaceae is closely related to the life span of its host species (the proportion of perennial species on which anther-smuts have been reported is five times higher than the proportion of annuals). The distribution of anther-smuts is also related to host flower morphology and breeding system. There are no reports of anther-smuts from the subfamily Paronychioideae whose members lack petals and are mostly selfing and/or produced cleistogamous flowers. In the two subfamilies for which anther smuts are reported, the parentage of species on which anther-smuts have been recorded is higher in the Silenoideae (where pollinators are primarily Lepidopterans and large bees) than the Alsinoideae (pollinated by flies or other small insects. -from Authors",113,Journal,ar,Article,100,3,3,29602,undefined,0,FALSE,18,NA,NA
true,https://api.elsevier.com/content/abstract/scopus_id/0027799577,SCOPUS_ID:0027799577,2-s2.0-0027799577,Biological Flora of the British Isles: Armeria maritima (Mill.) Willd. (Statice armeria L.; S. maritima Mill.),Woodell S.R.J.,Journal of Ecology,00220477,81,3,573-588,1993-01-01,1993,10.2307/2261536,"No. 178 in the series is the perennial herb thrift, usually being divided into the two distinct subspecies of A. maritima ssp. maritima and A. maritima spp. elongata. The former is widespread around the coast and in suitable inland localities, while the latter is confined to a few calcareous pastures. After describing the plants's morphological characteristics and distinguishing features of the subspecies, information is summarized for: geographical and altitudinal distribution, with a 10-km map; habitat; communities from saltmarshes, maritime cliffs, uplands, old lead and zinc mine spoil heaps, and serpentine outcrops; response to biotic factors; response to environment; structure and physiology; phenology; floral and seed characters; herbivory and disease; and history of occurrence. -J.W.Cooper",21,Journal,ar,Article,100,2,2,29602,undefined,0,FALSE,19,NA,NA
true,https://api.elsevier.com/content/abstract/scopus_id/0027528063,SCOPUS_ID:0027528063,2-s2.0-0027528063,A new biogeographical classification of the Scottish Uplands. I. Descriptions of vegetation blocks and their spatial variation,Brown A.,Journal of Ecology,00220477,81,2,207-230,1993-01-01,1993,10.2307/2261493,"A vegetation survey of 88 Scottish upland sites (mainly designated as Sites of Special Scientific Interest) was carried out between 1981-1988. Vegetation stands were classified in the field into 90 previously defined types, equivalent to 65 communities in the UK National Vegetation Classification. Two-way indicator-species analysis, used to classify the sites and communities, gave nine geographical groups of sites, each defined by blocks of indicator communities. These nine grops remained stable when the analysis placed varying degrees of emphasis on communities which are rare and restricted (in area) or on extensive communities which make up the major components of the upland landscape. The geographical groups summarize the range of ecological variation across upland Scotland and can be regarded as a biogeographical classification. Two major biogeographical contrasts were between: 1) the highest and marginally lower sites, and 2) E and W Scotland, with particularly low diversity in the Southern Uplands. Low-altitude Calluna vulgaris-dominated sites were similar in all Scottish geographical groups. The groups concur with many of the regions of interest that have been previously described as being related to climate and geology. -from Authors",23,Journal,ar,Article,100,3,3,29602,undefined,0,FALSE,20,NA,NA
true,https://api.elsevier.com/content/abstract/scopus_id/0027525717,SCOPUS_ID:0027525717,2-s2.0-0027525717,The response of heather (Calluna vulgaris) to shade and nutrients - predictions of the carbon-nutrient balance hypothesis,Iason G.,Journal of Ecology,00220477,81,1,75-80,1993-01-01,1993,10.2307/2261225,"Shading resulted in etiolation of shoots, lower shoot densities and almost complete cessation of flowering. Overall lower shoot weights were due solely to reduced flowering. The concentration of total N increased whereas lignin, total phenolics and condensed tannins, all carbon-based constituents, decreased in the green shoot material with application of shade. Application of fertilizer led to increased flowering per shoot and a greater proportion of flowering shoots. The concentration of total N in the non-flowering component of the shoots increased whereas that of lignin decreased. There was no significant decrease with addition of fertilizer, in total phenolics and condensed tannins. Results are hence not wholly consistent with the decrease in carbon-based secondary metabolites which is predicted by the carbon-nutrient balance hypothesis. -from Authors",108,Journal,ar,Article,100,2,2,29602,undefined,0,FALSE,21,NA,NA
true,https://api.elsevier.com/content/abstract/scopus_id/0027498825,SCOPUS_ID:0027498825,2-s2.0-0027498825,Factors that control monsoon-rainforest seedling establishment and growth in north Australian Eucalyptus savanna,Bowman D.,Journal of Ecology,00220477,81,2,297-304,1993-01-01,1993,10.2307/2261499,"The seasonally deciduous tree species Bombax ceiba and Sterculia quadrifida formed 9.1% and 2.3%, respectively, of the total basal area in a coastal dry monsoon rainforest in the Australian seasonally dry tropics. Neither species occurred in a nearby Eucalyptus savanna. Both communities occurred on deep, iron-rich, sandy loam soils. The savanna had lower concentrations of nutrients in the surface soil than the rainforest but experienced greater maximum ground surface air temperatures than the monsoon rainforest when averaged over a year. Annual mean surface soil moisture content was similar in savanna and rainforest, but savanna soils were drier in the dry season. During this time both communities had soil matrix pressure potentials below 1.3 MPa. S. quadrifida established more successfully in the rainforest than in the savanna but B. ceiba establishment was <2% in both communities. The long-term development of a monsoon rainforest-savanna ecotone is critical for creating microclimatic and soil conditions favourable for monsoon-rainforest seedling establishment and growth. Experiments point toward the importance of mycorrhizas, soil fertility and soil moisture in controlling monsoon-rainforest seedling establishment. This study helps explain why so few monsoon-rainforest seedlings have been observed to establish in fire-protected Eucalyptus savannas. -from Authors",61,Journal,ar,Article,100,2,2,29602,undefined,0,FALSE,22,NA,NA
true,https://api.elsevier.com/content/abstract/scopus_id/0027493699,SCOPUS_ID:0027493699,2-s2.0-0027493699,Flooding regimes and life-history characteristics of short-lived species in river forelands,Van Der Sman A.J.M.,Journal of Ecology,00220477,81,1,121-130,1993-01-01,1993,10.2307/2261229,"Cohorts of Chenopodium rubrum, Rumex maritimus and R. palustris were raised in accordance with a flooding regime which was based on the average flooding conditions of their natural habitats in river forelands. Survival of submergence in the pre-reproductive phase was high in both species of Rumex, but relatively low in C. rubrum. Biomass reduction following flooding depended on plant size before flooding and on mean temperature of the flood-water. Both Rumex spp. were less reduced in size during flooding, and better capable of regeneration afterwards, than C. rubrum. Later-raised cohorts of the short-day species C. rubrum started to flower after a shorter time and at an earlier developmental stage than earlier cohorts. Flooding had little effect on probability of flowering and caused only a slight delay in flowering in this species. In both long-day species of Rumex, flowering stems were not initiated until a minimal leaf number was formed. As a result later cohorts remained vegetative, while flooding delayed flowering until later in the season or even until the following year. All flooded plants of C. rubrum and most flooded plants in early cohorts of R. maritimus attempted to reproduce in the first growing season. Seed number was severely reduced in C. rubrum due to both reduction of plant biomass and destruction of flowers during flooding. In flooded plants of R. maritimus, seed output was correlated with plant size at the time of bolting. Seed number was maximized at the expense of seed size in R. maritimus. -from Authors",53,Journal,ar,Article,100,3,3,29602,undefined,0,FALSE,23,all,All Open Access
true,https://api.elsevier.com/content/abstract/scopus_id/0027487717,SCOPUS_ID:0027487717,2-s2.0-0027487717,Primary colonization by microalgae in relation to spatial variation in edaphic factors on Antarctic fellfield soils,Davey M.,Journal of Ecology,00220477,81,2,335-343,1993-01-01,1993,10.2307/2261503,"Investigated the causes of variations in the composition of microalgal communities on frost-sorted soil polygons in Signy Island. Interpolygon variations in all environmental factors measured were small and not much greater than the intrapolygon variations. Microalgal diversity was low. Only seven taxa occurred in sufficient numbers to be included in statistical analyses, two of which, Nostoc spp., were found on only one polygon. The filamentous cyanobacterium Phormidium autumnale occurred on all polygons and usually provided the largest component of the total biovolume. Microalgal communities were qualitatively constant within polygons, but varied markedly between polygons. Each taxon varied independently of the others; hence it was not possible to correlate community structure with any specific environmental factor. Correlations between numbers of individual taxa and edaphic factors were low and accounted for a maximum of 18% of the observed interpolygon variation or 12% of the total variation. Differences in the microalgal communities were due to the vagaries of the colonization process and reflect the probability of successful colonization of these ecosystems by microalgae. -from Authors",36,Journal,ar,Article,100,2,2,29602,undefined,0,FALSE,24,NA,NA
true,https://api.elsevier.com/content/abstract/scopus_id/0027487716,SCOPUS_ID:0027487716,2-s2.0-0027487716,Light or pollen - seasonal limitations on female reproductive success in the understory shrub Lindera benzoin,Niesenbaum R.,Journal of Ecology,00220477,81,2,315-323,1993-01-01,1993,10.2307/2261501,"Fruit set was significantly greater in sun than in shade, and was reduced in both habitats by shading branches. Supplemental pollination added significantly more viable pollen to stigmas, but plants never responded with increased fruit set, even under conditions of high light availability. Treatments had no effect on fruit and seed mass, but there was a significant maternal effect on these variables. Treatments did result in a significant reduction in per branch flower production in the following year, especially on fruit-bearing branches in shaded sites and on artificially shaded branches. Defoliations at the level of the branch significantly reduced fruit maturation. Branches within plants are somewhat physiologically autonomous: and, because light can affect fruit/seed set and flower production in this understory plant, gap dynamics may play an important role in its reproductive ecology. -from Author",62,Journal,ar,Article,100,1,1,29602,undefined,0,FALSE,25,NA,NA
true,https://api.elsevier.com/content/abstract/scopus_id/0027487526,SCOPUS_ID:0027487526,2-s2.0-0027487526,Factors limiting climber distribution and abundance in a southern African forest,Balfour D.,Journal of Ecology,00220477,81,1,93-100,1993-01-01,1993,10.2307/2261227,"Climber abundance was positively correlated with the altitudinal gradient in the Knysna Forest as well as with the level of base nutrients in the soil but not with the nitrogen concentration. However, these factors together with rainfall may covary and thus confound any power to explain the distribution of climbers. The hypothesis that climber abundance is limited by trellis availability (presence of small-diameter branches, and thus host-tree architecture and crown characteristics) was tested. Where the forest canopy is high, and small-diameter branches (trellises) are scarce, significantly more climbers enter their host trees horizontally from neighbouring trees than vertically; when the forest is low more climbers enter their host trees vertically via the available trellises. Density of climbers per host tree is correlated with the height of the lowest branches of the tree canopy. The trunk of trees is seldom used as an access route for climbers to the canopy of their host trees. -from Authors",107,Journal,ar,Article,100,2,2,29602,undefined,0,FALSE,26,NA,NA
true,https://api.elsevier.com/content/abstract/scopus_id/0027461015,SCOPUS_ID:0027461015,2-s2.0-0027461015,Herbivore population crashes and woodland structure in East Africa,Prins H.,Journal of Ecology,00220477,81,2,305-314,1993-01-01,1993,10.2307/2261500,"Between 1985-1991, bush encroachment was serious in Lake Manyara National Park, N Tanzania. Shrub cover increased by c20%. Since 1987 there has been a steep decline in the number of African elephant Loxodonta africana in the Park due to poaching. Elephant density decreased from 6km-2 to 1km-2. However, shrub establishment preceded poaching. Shrub establishment in two areas of the Park coincided with anthrax epidemics that drastically reduced the impala Aepyceros melampus population. In the northern section of the Park this was in 1984, in the southern section in 1977. The diameter increment of Acacia tortilis was 5.24 mm yr-1, irrespective of size of the trees. Size measurements indicated an even-aged stand of Acacia established in 1961, which coincided with another anthrax outbreak among impala. Size measurements of old A. tortilis trees indicated another even-aged stand established at the end of the 1880s. The size of trees of this stand was not significantly different from two other stands. All three stands are likely to have originated from bush establishment caused by the rinderpest pandemic at the end of the 1880s. It is suggested that seedling establishment of Acacia is a rare event under the prevailing conditions of high browsing pressures by ungulates such as impala. Punctuated disturbances by epidemics among these ungulates create narrow windows for seedling establishment, which may explain the occurrence of even-aged stands. -from Authors",235,Journal,ar,Article,100,2,2,29602,undefined,0,FALSE,27,NA,NA
true,https://api.elsevier.com/content/abstract/scopus_id/0027458223,SCOPUS_ID:0027458223,2-s2.0-0027458223,Impact of carpets of the invasive moss Campylopus introflexus on Calluna vulgaris regeneration,Equihua M.,Journal of Ecology,00220477,81,2,359-365,1993-01-01,1993,10.2307/2261506,"Campylopus introflexus is a Southern Hemisphere species in the process of expanding its distributional range. It was first found in Europe in 1941. A significant depressive effect (60% reduction) of the moss carpet on the amount of Calluna germination was observed, irrespective of the form of water supply, but seedlings grew higher and produced more flowers when growing on moss carpets. Experiments indicate no allelopathic effects. Results of experiments suggested that there was no definite evidence that C. introflexus can suppress Calluna re-establishment following fire, but under field conditions, the germination rate of heather on moss carpets can be expected to be much lower and its growth rate will be reduced by grazing. These conditions will make it more difficult for the heather to compensate for the loss in recruitment. The dynamics of the moss carpet itself may play an important part in the competitive success of C. introflexus. -from Authors",61,Journal,ar,Article,100,2,2,29602,undefined,0,FALSE,28,NA,NA
true,https://api.elsevier.com/content/abstract/scopus_id/0027451236,SCOPUS_ID:0027451236,2-s2.0-0027451236,Factors affecting intraplant variation in flowering and fruiting in the gynodioecious species Hebe subalpina,Delph L.,Journal of Ecology,00220477,81,2,287-296,1993-01-01,1993,10.2307/2261498,"Flower number varied within plants on both morphs, but while fruit production was just as variable as flower number within female plants, fruit production was more variable than flower number within the ""male' (or perfect-flowered) morph, which produced fewer fruits on average. Flower production within a shoot was correlated with shoot characteristics in both morphs, but fruit production was correlated with these variables only within male plants. Fruit set and growth were reduced by leaf removal and fruit set was increased by inflorescence removal, confirming that shoot status affects fruit set and also that most of the resources available for reproduction come directly from within the shoot. However, an increase in both fruit set and growth in response to an increase in a shoot's hierarchical rank showed that some of these resources come from beyond the shoot. Results suggest that the stage at which investment is adjusted differs from the two morphs and support the idea that the two morphs have evolved different resource allocation strategies. -from Author",20,Journal,ar,Article,100,1,1,29602,undefined,0,FALSE,29,NA,NA
true,https://api.elsevier.com/content/abstract/scopus_id/0027451164,SCOPUS_ID:0027451164,2-s2.0-0027451164,"Hydrochory, population dynamics and distribution of the clonal aquatic plant Ranunculus lingua",Johansson M.A.,Journal of Ecology,00220477,81,1,81-91,1993-01-01,1993,10.2307/2261226,"Dispersal and dynamics of Ranunculus lingua were studied in a marginal river population in N Sweden, where this species is dispersed exclusively by vegetative diaspores (floating rhizome fragments). Between 0.8-2.9% of the total population of ramets dispersed each year. Most rhizomes were dispersed within 1.5 km in a leptokurtic pattern. A river lake functioned as a dispersal barrier, preventing dispersal distances >3 km. Vegetative diaspores were mainly dispersed to river curves and obstacles; distribution of established stands was highly correlated with these features. Establishment was low and probably strongly influenced by water-level fluctuation and winter conditions. Relative changes in ramet numbers varied between years and were correlated with water-level fluctuations during the present and previous growing seasons, with winter low-water, and with duration of spring-flood. The predictability of change was high within but low between stands. -from Authors",141,Journal,ar,Article,100,2,2,29602,undefined,0,FALSE,30,NA,NA
true,https://api.elsevier.com/content/abstract/scopus_id/0027435831,SCOPUS_ID:0027435831,2-s2.0-0027435831,Genotypic variation in plant disease resistance - physiological resistance in relation to field disease transmission,Alexander H.,Journal of Ecology,00220477,81,2,325-333,1993-01-01,1993,10.2307/2261502,"Cloned genotypes of Silene alba differed in the percentage of plants that became diseased following floral and bud inoculation with six isolates of the smut fungus Ustilago violacea. No differences in virulence were found among the six fungal isolates. The percentage of diseased plants following inoculation was an important predictor of disease levels of the same genotypes in a field experiment with natural disease transmission. Floral phenology, a plant trait that affects the likelihood of spore deposition in the field, also accounted for a significant portion of the genotypic variation in field disease levels. Thus, both physiological resistance and factors affecting transmission should be considered when interpreting patterns of disease incidence in nature. -from Authors",62,Journal,ar,Article,100,3,3,29602,undefined,0,FALSE,31,NA,NA
true,https://api.elsevier.com/content/abstract/scopus_id/0027435830,SCOPUS_ID:0027435830,2-s2.0-0027435830,The effect of a vector-borne disease on the dynamics of natural plant populations: a model for Ustilago violacea infection of Lychnis viscaria,Ingvarsson P.,Journal of Ecology,00220477,81,2,263-270,1993-01-01,1993,10.2307/2261496,"A mathematical model was used to study how a parasitic castrating fungus affects the population dynamics of its host plant, based on the interactions between the smut fungus Ustilago violacea and its host plant Lychnis viscaria. Analysis of the model, with the disease absent, revealed that the pollinators have a limiting effect on the growth rate of the population. The disease must possess a minimum transmission potential to be able to invade the host population. The condition was entirely dependent on the demographic processes of the host plant. The higher the recruitment rate of the host, the easier it is for the pathogen successfully to invade the host population. When the disease was able to invade the host population, disease incidence varied with the transmission potential of the fungal spores. If the disease incidence rose >50%, the host population was driven to local extinction, mainly because, at high disease incidence levels, the fraction of pollinators that carried pollen was almost non-existent. This led to the transmission of the disease to all plants in the population and thus to the extinction of the entire host population. -from Authors",6,Journal,ar,Article,100,2,2,29602,undefined,0,FALSE,32,NA,NA
true,https://api.elsevier.com/content/abstract/scopus_id/0027435824,SCOPUS_ID:0027435824,2-s2.0-0027435824,Biological Flora of the British Isles: Impatiens glandulifera Royle (Impatiens roylei Walp.),Beerling D.J.,Journal of Ecology,00220477,81,2,367-382,1993-01-01,1993,10.2307/2261507,"Describes the distribution, history, habitat, communities, autecology, reproduction and associated organisms of Indian balsam. Impatiens glandulifera is an alien, but completely naturalized in Britain on the banks of many types of waterways, waste ground, thin woodlands and occasionally mires. -from Authors",162,Journal,ar,Article,100,2,2,29602,undefined,0,FALSE,33,NA,NA
