@_fa,prism:url,dc:identifier,eid,dc:title,dc:creator,prism:publicationName,prism:issn,prism:volume,prism:issueIdentifier,prism:pageRange,prism:coverDate,prism:coverDisplayDate,prism:doi,dc:description,citedby-count,prism:aggregationType,subtype,subtypeDescription,author-count.@limit,author-count.@total,author-count.$,authkeywords,source-id,fund-no,openaccess,openaccessFlag,entry_number,freetoread.value.$,freetoreadLabel.value.$
true,https://api.elsevier.com/content/abstract/scopus_id/0034880757,SCOPUS_ID:0034880757,2-s2.0-0034880757,Growth strategies of a shade-tolerant tropical tree: The interactive effects of canopy gaps and simulated herbivory,Blundell A.,Journal of Ecology,00220477,89,4,608-615,2001-09-04,2001,10.1046/j.0022-0477.2001.00581.x,"1. We hypothesized that the survival of shade-tolerant juvenile trees in the understorey depends on allocation strategies that slow their growth but enhance recovery from herbivore damage. In contrast, allocation patterns should maximize height growth in gaps where competitors grow rapidly. We tested the interactive effects of canopy gaps and simulated herbivory (by removing the apical meristem, or 10%, 50% or 90% of tissue from all leaves) on juvenile (< 1 cm diameter at breast height) Shorea quadrinervis Sloot (Dipterocarpaceae), a dominant canopy tree in Borneo. 2. Damage did not diminish survival over 8 months, except for 90% foliage removal from understorey plants. Height growth in the understorey was negligible in both control and damaged plants. In gaps, height growth was stimulated by removal of either the apical meristem or 10% of leaf tissue; growth was reduced only after 90% foliage removal. 3. Higher damage levels increased subsequent net leaf loss. Leaf production was much greater, but leaf retention much lower, in gaps than in the understorey. Ninety per cent foliage removal drastically reduced production in gaps and retention in the understorey. After 10% defoliation, height growth was enhanced in gaps despite approximately 30% net leaf loss. 4. In a separate experiment, juveniles were moved from a shade house to gaps. After 8 months, gap plants had more leaves and more total biomass, but only half the root : shoot ratio of plants left in the shade. 5. Allocation patterns, together with the survival of understorey plants after all but the highest levels of damage, indicate that root : shoot allocation there tends to reduce the risk of mortality following herbivore or mechanical damage at the expense of growth. In contrast, in gaps, where interference competition for light is high, resource allocation apparently maximizes height growth. The interaction between resource availability and herbivore damage provides the basis for a more synthetic theory of resource allocation and growth strategies than one based on resource availability alone.",62,Journal,ar,Article,100,2,2,Artificial defoliation | Gunung Palung National Park | Indonesia | Kalimantan Barat | Meristem damage | Overcompensation | Plant-herbivore interactions | Seedlings | South-east Asia | Tropics,29602,undefined,1,TRUE,45,all,All Open Access
true,https://api.elsevier.com/content/abstract/scopus_id/0034880710,SCOPUS_ID:0034880710,2-s2.0-0034880710,Aapa mires as a carbon sink and source during the Holocene,Mäkilä M.,Journal of Ecology,00220477,89,4,589-599,2001-09-04,2001,10.1046/j.0022-0477.2001.00586.x,"1. The vertical and horizontal dynamics of peat carbon accumulation in Ruosuo aapa mire, north-central Finland, were investigated in an attempt to understand variations in carbon accumulation over time. 2. Paludification began around 8700 BP (9600 cal BP). The long-term net carbon accumulation rate, based on vertical and lateral growth, was 8.0 g C m2 year-1. Variations in carbon accumulation rates can be explained to a great extent by natural succession and variations in local conditions, but the role of climate cannot be ignored. 3. The marked decline in carbon accumulation rates after 6100 BP (7000 cal BP) may indicate a relatively dry and warm climate. The levelling out and subsequent increase in carbon accumulation rates after 4000 BP (4500 cal BP) indicates the development of a cooler and moister climate. 4. The low long-term net carbon accumulation rate and the high carbon content per unit volume in the layer underlying the surficial peat is typical for a wet aapa mire. The continuous penetration of roots, mostly sedge, results in carbon input into the underlying peat layer and contributes to the intensive decay of the surficial peat due to high biological activity. 5. Although one-third of the apparent carbon has accumulated during the last 2000 years, most of Ruosuo is approaching the stage where primary production does not adequately compensate for overall carbon loss. The declining net carbon accumulation rates from the base up to the depth of 80 cm may indicate a real delayed trend in net carbon accumulation rates. 6. We suggest that under the present climatic conditions the northern circumpolar wet mires are significant sources of greenhouse gases. In addition to high methane production, northern aapa mires also have lower carbon accumulation rates than more southern raised bogs. 7. Our results, which are based on horizontal and vertical carbon accumulation rates, suggest that the earlier published carbon accumulation rates in Finnish aapa mires are overestimated.",43,Journal,ar,Article,100,3,3,Carbon accumulation | Carbon balance | Finland | Holocene | Peatlands,29602,undefined,1,TRUE,46,all,All Open Access
true,https://api.elsevier.com/content/abstract/scopus_id/0034880411,SCOPUS_ID:0034880411,2-s2.0-0034880411,"Salicornia L. (Salicornia pusilla J. Woods, S. ramosissima J. Woods, S. europaea L., S. obscura P.W. Ball &amp; Tutin, S. nitens P.W. Ball &amp; Tutin, S. fragilis P.W. Ball &amp; Tutin and S. dolichostachya Moss)",Davy A.,Journal of Ecology,00220477,89,4,681-707,2001-09-04,2001,10.1046/j.0022-0477.2001.00607.x,NA,156,Journal,ar,Article,100,3,3,NA,29602,undefined,0,FALSE,47,all,All Open Access
true,https://api.elsevier.com/content/abstract/scopus_id/0034928208,SCOPUS_ID:0034928208,2-s2.0-0034928208,Crown development in tropical rain forest trees: Patterns with tree height and light availability,Sterck F.,Journal of Ecology,00220477,89,1,1-13,2001-07-31,2001,10.1046/j.1365-2745.2001.00525.x,"1 Monitoring of two canopy species Dicorynia guianensis and Vouacapoua americana (Caesalpiniaceae) in a tropical rain forest in French Guiana was used to investigate vegetative crown development at five organizational levels: leaf, metamer, extension unit, sympodial unit and whole crown. The effects of light availability and tree height on different traits were evaluated in trees < 25 m in height and compared with taller individuals (25-37 m). Path-analysis is used to illustrate the consequences of trait changes at multiple levels of organization for the whole crown level. 2 Tree height and canopy openness influenced crown development at each organizational level. Crowns in higher light levels had lower specific leaf area, greater leaf spacing, greater extension of all branches, and greater extension of the leader shoot. With increasing tree height, crowns had a lower specific leaf area, greater leaf area index and greater relative crown depth. 3 Vouacapoua showed some responses to light not seen in Dicorynia. In particular, Vouacapoua increased meristem activity with light, but the lack of response in Dicorynia may be due to moderate light levels rather than inability to respond. 4 Low leaf-display costs at low light availability may enable trees to survive light suppression. 5 Light availability cannot explain trait changes with tree height. Alternative explanations for trait changes with tree height are discussed. 6 Several of the relationships between plant traits and tree height or canopy openness became non-linear when taller trees (25-37 m) were included. In these taller trees, vegetative growth was reduced at all organizational levels, particularly in Vouacapoua, which does not grow as tall as Dicorynia. 7 Qualitatively, plant responses to light did not differ between trees of different height, and were similar to seedling and sapling data in the literature. Responses were, however, quantitatively different, suggesting that small saplings cannot serve as model organisms for crown development in taller trees.",104,Journal,ar,Article,100,2,2,Canopy | Crown structure | Dicorynia guianensis | French Guiana | Ontogeny | Rain forest trees | Tree architecture | Vouacapoua americana,29602,undefined,1,TRUE,48,all,All Open Access
true,https://api.elsevier.com/content/abstract/scopus_id/0034926192,SCOPUS_ID:0034926192,2-s2.0-0034926192,Molinia caerulea (L.) Moench,Taylor K.,Journal of Ecology,00220477,89,1,126-144,2001-07-31,2001,10.1046/j.1365-2745.2001.00534.x,NA,99,Journal,ar,Article,100,3,3,NA,29602,undefined,0,FALSE,49,NA,NA
true,https://api.elsevier.com/content/abstract/scopus_id/0034926113,SCOPUS_ID:0034926113,2-s2.0-0034926113,Persistent soil seed banks in Phacelia secunda (Hydrophyllaceae): Experimental detection of variation along an altitudinal gradient in the Andes of central Chile (33° S),Cavieres L.,Journal of Ecology,00220477,89,1,31-39,2001-07-31,2001,10.1046/j.1365-2745.2001.00514.x,"1 It is unclear whether soil seed banks in alpine environments are a result of selection for extended seed dormancy, of ideal conditions for seed preservation in the soil, or a combination of both. 2 The nature of the soil seed bank was investigated in the perennial herb Phacelia secunda (Hydrophyllaceae) through reciprocal burial experiments using seeds obtained from populations growing at 1600, 2200, 2900 and 3400 m a.s.1. in the mediterranean Andes of central Chile. At the four elevations, six replicates of 50 seeds each, from each of the four elevational sources, were buried at 5 cm depth in mesh envelopes, placed in wire cages to protect against predation. Seeds were retrieved 1,2 and 3 years after burial, and numbers of ungerminated seeds, and of those that remained viable, were determined. 3 At all elevations of seed burial, increasing proportions of seeds remained ungerminated, and proportionately more of the ungerminated seeds remained viable, as elevation of source of seed increased. For seed from low elevation, more seeds remained viable in the soil at the higher burial sites. However, for the seeds from higher elevation sources, seeds remaining viable were similar in number at all sites for seed burial. Half-lives of seed buried at the source elevation, calculated from the log-logistic distribution, increased with elevation, and ranged from 188 days at 1600 m to 354 days at 3400 m. 4 The results suggest that the propensity to form a persistent seed bank in P. secunda increases with elevation. Seeds from the highest elevations had the longest persistence, and this was largely unaffected by soil preservation conditions. Seeds from lower elevations survived for less time, and this was modifiable by preservation conditions. These results suggest that both selective effects and soil conditions may be involved in soil seed bank expression in the alpine environment.",57,Journal,ar,Article,100,2,2,Alpine environments | Elevational gradient | Persistent seed bank | Phacelia,29602,undefined,0,FALSE,50,NA,NA
true,https://api.elsevier.com/content/abstract/scopus_id/0034925924,SCOPUS_ID:0034925924,2-s2.0-0034925924,Effects of pollution-induced habitat disturbance on the response of willows to simulated herbivory,Zvereva E.L.,Journal of Ecology,00220477,89,1,21-30,2001-07-31,2001,10.1046/j.1365-2745.2001.00509.x,"1 Stress may affect compensatory plant growth and plant responses to herbivory may therefore be modified by pollution. We compared the effects of leaf clipping on growth, reproduction and developmental stability of two willow species (Salix borealis and S. caprea) growing at different distances from two copper-nickel smelters (Monchegorsk, NW Russia and Harjavalta, SE Finland). 2 In unpolluted sites, the defoliation of both willow species adversely affected sexual reproduction and increased the formation of epicormic shoots, but did not change either shoot growth or leaf size. Timing and extent of clipping had little effect on the responses. 3 Compensatory responses to leaf clipping in polluted habitats were reduced, especially in S. borealis, as reflected by decrease in shoot growth and fruit production and an increase in leaf fluctuating asymmetry, a non-specific indicator of stress. 4 Activation of dormant buds was a common compensatory response to herbivory in unpolluted sites. The lack of an increase in epicormic shoots in polluted sites may be due to already weakened apical dominance. 5 Compensatory abilities may be affected both by direct damage caused by pollutants and pollution-induced increases in environmental stress. Although S. borealis shows no visible sign of stress in polluted sites, regrowth from dormant buds and enhanced shoot growth were seen under these conditions. Resources were not therefore available for further compensation of damage caused by defoliation. Our results fit the hypothesis that fast growing plants have low compensative abilities. 6 Salix caprea shows more pollution-induced stress than S. borealis, expressed as increased developmental instability near the weaker and shorter shoots near the stronger pollution source. This may explain the differences in their compensatory responses in polluted sites.",53,Journal,ar,Article,100,2,2,Apical dominance | Compensatory responses | Defoliation | Growth | Reproduction,29602,undefined,0,FALSE,51,NA,NA
true,https://api.elsevier.com/content/abstract/scopus_id/0034924302,SCOPUS_ID:0034924302,2-s2.0-0034924302,Male and female Silene latifolia plants differ in per-contact risk of infection by a sexually transmitted disease,Kaltz O.,Journal of Ecology,00220477,89,1,99-109,2001-07-31,2001,10.1046/j.1365-2745.2001.00527.x,"1 Behavioural, physiological or immunological constraints often render one sex more susceptible to parasites, thereby potentially generating sex-specific trade-offs between traits associated with infection risk and other life-history characters. 2 The fungal pathogen Microbotryum violaceum systemically infects the dioecious plant Silene latifolia when pollinators deposit fungal spores on the flowers of healthy plants. Male plants produce many short-lived flowers, whereas females produce few flowers that remain connected with the plant after fertilization. We investigated how variation in flower production and flower longevity affects the infection risk for males and females. 3 In glasshouse experiments, we varied the number of flowers inoculated (4 vs. 16 per plant) with spores and the time until these flowers were removed (1 or 2 days for both sexes, 14 days for females only). We also measured the longevity of male flowers receiving simulated visits, with or without spores, to test for an abscission response to visitation and/or contamination. In a field survey, we measured male and female disease prevalence in 17 natural populations. 4 Varying the number of inoculated flowers did not affect infection probability, but females retaining inoculated flowers for 14 days became diseased more often (20.0%) than did plants with flowers removed within 2 days (7.3%). 5 Males that had dropped more inoculated flowers prematurely were more likely to remain uninfected. Spore-bearing visits shortened male flower longevity (38.4±2.8 h) relative to non-spore visits (47.9 ± 5.2 h). 6 Female field disease prevalence (19.7±3.5%) was higher than that of males (14.3 ± 2.6%), especially in populations with a high disease incidence. 7 Continuing physical connection during fruit ripening appears to increase invasion time and thus the per-contact infection risk in females. This is consistent with higher female field prevalences, although other explanations, unrelated to disease transmission, are possible. These results illustrate how interactions between plant reproductive behaviour and pollinator activity may affect disease spread. Female mating behaviour may evolve towards lower attractiveness to pollinators to minimize infectious contacts, while males can afford to be more promiscuous with an attractive, but disposable, floral display.",47,Journal,ar,Article,100,2,2,Flower life span | Mating behaviour | Microbotryum violaceum | Sexual selection | Sexually transmitted disease,29602,undefined,0,FALSE,52,NA,NA
true,https://api.elsevier.com/content/abstract/scopus_id/0034923272,SCOPUS_ID:0034923272,2-s2.0-0034923272,Species richness-standing crop relationship in stream bryophyte communities: Patterns across multiple scales,Virtanen R.,Journal of Ecology,00220477,89,1,14-20,2001-07-31,2001,10.1046/j.1365-2745.2001.00513.x,"1 We tested for a unimodal ('hump-backed') relationship between species richness and standing crop at various spatial scales in stream bryophyte communities. Bryophyte species and their biomasses were determined from 20 to 25 quadrats in eight river and six stream sites in northern Finland. 2 Regression analyses revealed a quadratic relationship between richness and biomass in only two of the river sites and a positive correlation in one other. A quadratic relationship was detected in three stream sites and richness increased linearly with biomass in another. 3 We also tested for the hump-shaped pattern across individual stream boulders, representing an elevational gradient from continuously submerged to permanently dry conditions, with an intermediate zone with fluctuating water level. 4 Species richness-standing crop relationship conformed to the hump-backed model only when samples from all three microhabitats were included in the analysis. A significant positive correlation occurred in the exposed low biomass end of the gradient which is characterized by semi-aquatic species, whereas the relationship tended to be negative in permanently submerged areas with high biomass of large canopy-forming species. Quadrats close to the water level had intermediate standing crop and highest species richness. 5 Species dominant at either end of the gradient appeared unable to monopolize space in the intermediate zone where disturbances (e.g. scouring by ice) detach mosses from the substratum, creating vacant gaps for colonization. The unimodal relationship between richness and biomass is likely to occur only in streams that contain large boulders protruding above the water line, thus providing scope for community diversification along very short vertical distances.",27,Journal,ar,Article,100,3,3,Dominance | Hump-backed model | Lotic | Mosses | Spatial scale,29602,undefined,0,FALSE,53,NA,NA
true,https://api.elsevier.com/content/abstract/scopus_id/0034918339,SCOPUS_ID:0034918339,2-s2.0-0034918339,The relationship of total and per-gram rankings in competitive effect to the natural abundance of herbaceous perennials,Howard T.G.,Journal of Ecology,00220477,89,1,110-117,2001-07-31,2001,10.1046/j.1365-2745.2001.00533.x,"1 Using a field experiment and a garden experiment, I estimated the rankings in total and per-gram competitive effect of non-woody perennial old-field species. 2 Total competitive effects were defined as the relative reduction in growth of a target from no-neighbour to with-neighbour conditions. Per-gram competitive effects were defined as the per-unit relative reduction in target growth among increasing neighbour densities, and were determined from the shape of a nonlinear curve fit through a distribution of normalized target performance against neighbour mass. 3 In both experiments, mean total competitive effect differed significantly among species, indicating a strong competitive hierarchy. In the garden experiment only species at opposite ends of the ranking differed significantly in per-gram competitive effect, resulting in a weaker competitive hierarchy based on this measure. 4 Nonetheless, rankings of per-gram competitive effect were more strongly correlated with rank in abundance than were rankings of total competitive effect. 5 Per-gram competitive effect may be more predictive of natural abundance than total competitive effect for at least two reasons. The effects of neighbour abundance on targets are nonlinear, and unlike total effects, per-gram estimates of competitive effect may therefore indicate how competition changes over time with changing neighbour densities. Also, if higher per-gram competitive effect reflects higher per-unit nutrient uptake rates, it would probably be advantageous to a species throughout the individual's life span, rather than only when the individual is larger than its surrounding neighbours.",21,Journal,ar,Article,100,1,1,Additive experiments | Boundary analysis | Competitive hierarchies | Competitive suppression | Field experiment,29602,undefined,1,TRUE,54,all,All Open Access
true,https://api.elsevier.com/content/abstract/scopus_id/0034918338,SCOPUS_ID:0034918338,2-s2.0-0034918338,"The expansion history of a sexual and asexual species of Cortaderia in California, USA",Lambrinos J.,Journal of Ecology,00220477,89,1,88-98,2001-07-31,2001,10.1046/j.1365-2745.2001.00524.x,"1 The expansion histories of two South American species of Cortaderia, similar in morphology but differing profoundly in their breeding systems, were compared in California, USA. 2 Both species were introduced to California in the mid-1800s, but herbarium records indicate that the sexual C. selloana has expanded spatially at twice the rate of the asexual C. jubata. 3 The invasiveness of C. selloana has increased over time, whereas that of C. jubata has remained relatively constant. Populations of C. selloana now occupy more vegetation types and more non-ruderal habitats than C. jubata. 4 Populations of C. selloana have experienced directional morphological change, whereas the morphology of C. jubata has been constant over the 90 years for which preserved specimens are available. 5 The invasion of an alien species appears to be a malleable process, rather than a singular event. Species traits, such as inbreeding, can be advantageous at some stages but disadvantageous at others. Alien species also adjust over time to the novel and diverse selective regimes that they encounter as they expand spatially. Sexual species may have a greater ability to adjust to diverse selective landscapes relative to asexual species.",60,Journal,ar,Article,100,1,1,Evolution | History | Inbreeding | Invasion | Invasive plants | Pampas grass,29602,undefined,0,FALSE,55,NA,NA
true,https://api.elsevier.com/content/abstract/scopus_id/0034914962,SCOPUS_ID:0034914962,2-s2.0-0034914962,Effects of migratory geese on plant communities of an Alaskan salt marsh,Zacheis A.,Journal of Ecology,00220477,89,1,57-71,2001-07-31,2001,10.1046/j.1365-2745.2001.00515.x,"1. We studied the effects of lesser snow geese (Anser caerulescens caerulescens) and Canada geese (Branta canadensis) on two salt marsh plant communities in Cook Inlet, Alaska, a stopover area used during spring migration. From 1995 to 1997 we compared plant species composition and biomass on plots where geese were excluded from feeding with paired plots where foraging could occur. 2. Foraging intensity was low (650-1930 goose-days km-2) compared to other goose-grazing systems. 3. Canada geese fed mainly on above-ground shoots of Triglochin maritimum, Puccinellia spp. and Carex ramenskii, whereas the majority of the snow goose diet consisted of below-ground tissues of Plantago maritima and Triglochin maritimum. 4. Plant communities responded differently to goose herbivory. In the sedge meadow community, where feeding was primarily on above-ground shoots, there was no effect of grazing on the dominant species Carex ramenskii and Triglochin maritimum. In the herb meadow community, where snow geese fed on Plantago maritima roots and other below-ground tissues, there was a difference in the relative abundance of plant species between treatments. Biomass of Plantago maritima and Potentilla egedii was lower on grazed plots compared with exclosed, whereas biomass of Carex ramenskii was greater on grazed plots. There was no effect of herbivory on total standing crop biomass in either community. The variable effect of herbivory on Carex ramenskii between communities suggests that plant neighbours and competitive interactions are important factors in a species' response to herbivory. In addition, the type of herbivory (above- or below-ground) was important in determining plant community response to herbivory. 5. Litter accumulation was reduced in grazed areas compared with exclosed in both communities. Trampling of the previous year's litter into the soil surface by geese incorporated more litter into soils in grazed areas. 6. This study illustrates that even light herbivore pressure can alter plant communities and affect forage availability.",28,Journal,ar,Article,100,3,3,Canada goose | Carex ramenskii | Herbivory | Plantago maritima | Potentilla egedii | Snow goose | Triglochin maritimum,29602,undefined,1,TRUE,56,all,All Open Access
