@_fa,prism:url,dc:identifier,eid,dc:title,dc:creator,prism:publicationName,prism:issn,prism:eIssn,prism:volume,prism:issueIdentifier,prism:pageRange,prism:coverDate,prism:coverDisplayDate,prism:doi,dc:description,citedby-count,prism:aggregationType,subtype,subtypeDescription,author-count.@limit,author-count.@total,author-count.$,authkeywords,source-id,fund-acr,fund-no,fund-sponsor,openaccess,openaccessFlag,freetoread.value.$,freetoreadLabel.value.$,entry_number
true,https://api.elsevier.com/content/abstract/scopus_id/0026277253,SCOPUS_ID:0026277253,2-s2.0-0026277253,Some aspects of the ecology of bagrid catfishes in a southern Nigerian river,Idodo-Umeh G.,Journal of Tropical Ecology,02664674,14697831,7,2,221-232,1991-01-01,May 1991,10.1017/S0266467400005381,"Some aspects of the ecology of bagrid catfishes in River Ase, southern Nigeria were studied for a period of two years. Nine species of Bagridae were recorded and these accounted for 15.0% of the number and 24.4% of the weight of all fish captured. Chrysichthys nigrodigitatus and Chrysichthys auratus longifilis were the principal species. C. nigrodigitatus was a rainy season species, while C. auratus longifilis was abundant in both dry and rainy seasons. Both species showed a major peak in catches between 0600 and 0900 h. C. nigrodigitatus exhibited a minor peak in catches between 1500 and 2100h, while C. auratus longifilis showed a minor peak between 1500 and 1800h. The spatial distribution of C. nigrodigitatus and C. auratus longifilis populations was heterogeneous. Bagrid fishes were an important component in the fish yield of the study river and its species composition has been compared with those of other Nigerian waters. The distribution and abundance of C. nigrodigitatus and C. auratus longifilis are discussed in detail. © 1991, Cambridge University Press. All rights reserved.",6,Journal,ar,Article,100,1,1,Bagridae | ecology | fish | Nigeria | river | tropics,23435,NA,undefined,NA,0,FALSE,NA,NA,31
true,https://api.elsevier.com/content/abstract/scopus_id/0026276981,SCOPUS_ID:0026276981,2-s2.0-0026276981,"The carnivore community in a dry tropical forest mosaic in Huai Kha Khaeng Wildlife Sanctuary, Thailand",Rabinowitz A.,Journal of Tropical Ecology,02664674,14697831,7,1,37-47,1991-01-01,February 1991,10.1017/S0266467400005034,"An assessment of carnivore Species richness and food habits was carried out in a 100 km2area of dry tropical forest in Huai Kha Khaeng Wildlife Sanctuary, Thailand. Twenty-one carnivore species of five families were found to be feeding on at least 34 mammal species, as well as birds, lizards, snakes, crabs, fish, insects, and fruits. Forty-four percent of the prey identified in faeces of larger carnivores, primarily leopards, consisted of barking deer, Muntiacus muntjak. Sambar deer, macaques, wild boar, porcupine, and hog badger were important secondary prey items. In faeces from small carnivores (< 10 kg), murid rodents accounted for 33% of identified food items. The two most frequently encountered mammalian prey species were the yellow rajah rat, Maxomys surifer, and the bay bamboo rat, Cannomys badius. Non-mammal prey accounted for 21.3%, and fruit seeds for 12.4%, of all food items found in small carnivore faeces. © 1991, Cambridge University Press. All rights reserved.",31,Journal,ar,Article,100,1,1,carnivore | community ecology | dry tropical forest | Thailand,23435,MU,undefined,Mahidol University,0,FALSE,NA,NA,32
true,https://api.elsevier.com/content/abstract/scopus_id/0026276917,SCOPUS_ID:0026276917,2-s2.0-0026276917,Seed selection and removal by ants in a tropical savanna woodland in northern australia,Gross C.L.,Journal of Tropical Ecology,02664674,14697831,7,1,99-112,1991-01-01,February 1991,10.1017/S0266467400005150,"Ant species in the genera Chelaner, Meranoplus and Pheidole were found to be seed harvesters in a tropical savanna woodland in northern Australia. Despite the availability of other seed types (legume seeds in particular were abundant), all five seed-harvesting species studied are specialists in that they store only grass seeds. Depot experiments, in which seeds were placed along foraging trails, also indicate a preference for grass seeds over legume seeds. At least for some ant species the handling efficiency of legume seeds may be less than that of grass seeds. Marked differences in seed composition of granaries were observed among different seed-harvesting ant species and among colonies of the same species at different sites. All ant species studied, except Pheidole sp. 1, stored only one type of grass seed in granaries at any site despite the availability of other seed types. This contrasts with studies conducted elsewhere in Australia in which generalist foraging by seed-harvesters was found to be common. With the possible exception of Pheidole, dietary specialization does not appear to arise from a low diversity or abundance of seed supplies. In addition to differences in seed preferences, species of seed-harvesting ants also exhibited some differences in temporal foraging behaviour and some partitioning of resources may be occurring among these co-occurring species. Temporal overlap in foraging, however, was much greater than dietary overlap. The viability of granary seeds was very low for three ant species suggesting that seeds stored by these ants were largely predated rather than dispersed. © 1991, Cambridge University Press. All rights reserved.",24,Journal,ar,Article,100,1,1,Australia | savanna woodland | seed predation | seed viability | seed-harvesting ants | specialist foraging,23435,NA,undefined,NA,0,FALSE,NA,NA,33
true,https://api.elsevier.com/content/abstract/scopus_id/0026269709,SCOPUS_ID:0026269709,2-s2.0-0026269709,Leaf litter production by lianes and trees in a sub-tropical Australian rain forest,Hegarty E.E.,Journal of Tropical Ecology,02664674,14697831,7,2,201-214,1991-01-01,May 1991,10.1017/S0266467400005356,"Leaf litter production by lianes (= lianas) and trees was compared in an evergreen rain forest in subtropical Australia. Several successional stages were represented at the main site. Lianes contributed 2.2% of total basal area (69.6 m2ha-1) of this site, but 24% of leaf litterfall (5.9-6.5 t ha-ly-1over two years. Minor year-to-yeFar variation in litterfall was attributed to incidence of severe storms, and drought. Lianes were responsible for about 17% of leaf litterfall in spring, 21% in the summerpeak, and 40% in autumn, more lianes than trees being deciduous. Leaf litter production by 23 individual species of liane, in relation to their basal area within the main site, was, on average, 15 times as great as that by 34 tree species, but declined more steeply between the species-groups of early and later succession. Tendrillar lianes, unlike twiners and scramblers, were confined to the ‘early’ successional group, and their foliage was spread across canopy surfaces, maximizing light interception. It was concluded that this contributed to greater production of leaf litter, per unit basal area, by tendrillar than by other climbers, and to the successional decline in leaf litterfall from lianes. © 1991, Cambridge University Press. All rights reserved.",40,Journal,ar,Article,100,1,1,Australia | leaf | lianes | litterfall | production | rain forest | sub-tropical | succession | trees | vines,23435,NA,undefined,NA,0,FALSE,NA,NA,34
true,https://api.elsevier.com/content/abstract/scopus_id/0026269195,SCOPUS_ID:0026269195,2-s2.0-0026269195,Diversity of soil fauna in the canopy and forest floor of a Venezuelan cloud forest,Taylor J.,Journal of Tropical Ecology,02664674,14697831,7,3,373-383,1991-01-01,August 1991,10.1017/S0266467400005654,"Arboreal and terresterial soil and litter were sampled for macro- and microinvertebrates at two locations in a Venezuelan cloud forest. Fauna were most abundant in forest floor soil and associated litter. However, media suspended in the canopy and particularly those trapped in bromeliad shoots were most densely populated, while the diversities of the arboreal and terrestrial soil fauna were indistinguishable. Rates of leaf litter decomposition in the arboreal and terrestrial soils were similar, but the arboreal soils contained higher concentrations of mineral nutrients and carbon. Implications of these findings for the definition of soil in humid tropical forests, and related differences between temperate and tropical forests are discussed. The similarities in diversity and differences in species composition between arboreal and terrestrial soil fauna raise questions concerning the evolution of tropical soil fauna, as well as the estimate of global biotic diversity. © 1991, Cambridge University Press. All rights reserved.",96,Journal,ar,Article,100,2,2,cloud forest | density | diversity | epiphytic bromeliads | soil fauna | Venezeula,23435,NA,undefined,NA,0,FALSE,NA,NA,35
true,https://api.elsevier.com/content/abstract/scopus_id/0026269181,SCOPUS_ID:0026269181,2-s2.0-0026269181,Herbivory as an ecological process in a Kandelia candel (Rhizophoraceae) mangal in Hong Kong,Lee S.Y.,Journal of Tropical Ecology,02664674,14697831,7,3,337-348,1991-01-01,August 1991,10.1017/S0266467400005605,"Natural levels and consequences of insect herbivory were studied for a Kandelia candel (Rhizophoraceae) dominated mangal at the Mai Po Marshes, Hong Kong. Grazing insects (mainly lepidopteran larvae) consumed, on average, 10.3% of the leaf area on K. candel, with >90% of the leaves suffering <30% loss. Natural median leaf longevity was significantly different between winter and summer-exposed leaves, being, respectively, 423.2 and 269.6 days. Observations showed that herbivore damage caused a reduction of leaf longevity, as severely damaged leaves were abscissed before intact, older leaves on the same branch. Experimental leaf area removal suggested that leaf life span reduction was significantly influenced by leaf age and degree of damage. However, the reduction was only significant (>40 days) when area loss was >40%. Leaves produced in summer were also more sensitive to damage than those produced in winter. As <5% of the leaves suffered >40% of area removal by insect grazing in nature, insect herbivory is considered an unimportant regulator of leaf litter dynamics for K. candel. At this intensity level, herbivory consumes 2.8-3.5% of the net above-ground primary production of the mangrove. There was also no significant difference in the final number of leaves and twigs produced by the branches with various degrees of leaf area removal. Other observed impacts of insects on the structure and function of the K. candel mangal arc discussed. © 1991, Cambridge University Press. All rights reserved.",32,Journal,ar,Article,100,1,1,herbivory | Hong Kong Kandelia candel | leaf longevity | mangroves,23435,NA,undefined,NA,0,FALSE,NA,NA,36
true,https://api.elsevier.com/content/abstract/scopus_id/0026268830,SCOPUS_ID:0026268830,2-s2.0-0026268830,"Nitrogen mineralization and nitrification in terra firme forest and savanna soils on Ilha de Maracä, Roraima, Brazil",Marrs R.H.,Journal of Tropical Ecology,02664674,14697831,7,1,123-137,1991-01-01,February 1991,10.1017/S0266467400005186,"Soil mineralization and nitrification rates were measured in (1) undisturbed and felled gaps of varying size in terra firme forest, and (2) along a forest savanna transect, on Ilha de Maraca in northern Brazil. Both rates were similar to those found in studies of other forests with a marked seasonal rainfall pattern. However, rates were much lower than those of tropical forests where there is little seasonality in rainfall, A major finding was that the highest rates were during the transition between dry and wet seasons, implying that wetting and drying may be an important initiator of soil nitrogen flux. Felling had little effect on either process up to a gap size of 2500 m2. In the forest-savanna study, nitrogen mineralization was lower in the savanna in all seasons, but in the wet season when the savanna soils were water-logged NH4+-N was immobilized. Experimental additions of nutrients identified two important results; first that added NH4+-N was quickly immobilized rather than nitrified this may be an important nutrient conservation mechanism, and second that soil calcium appeared to be a limiting factor, either directly or through a pH effect. © 1991, Cambridge University Press. All rights reserved.",30,Journal,ar,Article,100,2,2,Brazil | felled forest | gap-size | nitrification | nitrogen-mineralization | nutrient addition | savanna | seasonality | terra firme | undisturbed forest,23435,NERC,undefined,Natural Environment Research Council,0,FALSE,NA,NA,37
true,https://api.elsevier.com/content/abstract/scopus_id/0026268656,SCOPUS_ID:0026268656,2-s2.0-0026268656,The composition of the arthropod fauna of Bornean lowland rain forest trees,Stork N.E.,Journal of Tropical Ecology,02664674,14697831,7,2,161-180,1991-01-01,May 1991,10.1017/S0266467400005319,"Data on the taxonomic composition of the arboreal arthropod fauna of 10 Bornean lowland rain forest trees are presented, based on samples obtained using insecticide fogging. Combined samples from all trees comprised 23,874 individuals of at least 3000 species. The mean number of species on each tree was 616.7 with one tree sample containing more than 1007 species. The relative rank of the major orders of arthropods in terms of both species and individuals was remarkably constant across the trees. Hymenoptera Coleoptera Diptera and Hemiptera were the orders with the most species and individuals. Formicidae, though not particularly species rich, was the most abundant family in terms of individuals and the commonest species in six of the 10 trees was an ant. Refogging of one of the trees 10 days after initial sampling showed that the arthropod fauna had not completely recovered. What many arthropods are doing in the canopy is discussed. © 1991, Cambridge University Press. All rights reserved.",159,Journal,ar,Article,100,1,1,arboreal insects | arthropods | Borneo | insect diversity | insecticide fogging,23435,NA,undefined,NA,0,FALSE,NA,NA,38
true,https://api.elsevier.com/content/abstract/scopus_id/0010238789,SCOPUS_ID:0010238789,2-s2.0-0010238789,Litterfall and productivity of eucalyptus camaldulensis in thailand,Thoranisorn S.,Journal of Tropical Ecology,02664674,14697831,7,2,275-279,1991-01-01,May 1991,10.1017/S0266467400005447,NA,5,Journal,ar,Article,100,2,2,Eucalyptus | litterfall | productivity | Thailand,23435,NA,undefined,NA,0,FALSE,NA,NA,39
true,https://api.elsevier.com/content/abstract/scopus_id/0006212853,SCOPUS_ID:0006212853,2-s2.0-0006212853,Seasonal activity patterns of julid millipedes in zimbabwe,Dangerfield J.,Journal of Tropical Ecology,02664674,14697831,7,2,281-285,1991-01-01,May 1991,10.1017/S0266467400005472,NA,32,Journal,ar,Article,100,2,2,Diplopoda | Julida | millipedes | seasonal activity patterns | Zimbabwe,23435,NA,undefined,NA,0,FALSE,NA,NA,40
true,https://api.elsevier.com/content/abstract/scopus_id/0002547509,SCOPUS_ID:0002547509,2-s2.0-0002547509,Levels of allozyme diversity in populations of uncommon neotropical tree species,Hamrick J.,Journal of Tropical Ecology,02664674,14697831,7,3,395-399,1991-01-01,August 1991,10.1017/S0266467400005691,NA,56,Journal,ar,Article,100,2,2,allozymes | effective population size | gene flow | genetic diversity | isozymes | Neotropical tree species | Panama | uncommon species,23435,NSF,86-0063,National Science Foundation,0,FALSE,NA,NA,41
true,https://api.elsevier.com/content/abstract/scopus_id/0001933971,SCOPUS_ID:0001933971,2-s2.0-0001933971,Comparison Of Seed Dispersal By Guenons In Kenya And Capuchins In Panama,Rowell T.,Journal of Tropical Ecology,02664674,14697831,7,2,269-274,1991-01-01,May 1991,10.1017/S0266467400005435,NA,45,Journal,ar,Article,100,2,2,Barro Colorado Island | Cebus | Cercopithecus | frugivory | Kakamega | Kenya | Panama | primate | seed dispersal,23435,NA,undefined,NA,0,FALSE,NA,NA,42
true,https://api.elsevier.com/content/abstract/scopus_id/0001632182,SCOPUS_ID:0001632182,2-s2.0-0001632182,Nitrogen Fixation In Association With Ecuadorean Bromeliads,Bermudes D.,Journal of Tropical Ecology,02664674,14697831,7,4,531-536,1991-01-01,November 1991,10.1017/S0266467400005927,NA,18,Journal,ar,Article,100,2,2,Bromeliaceae bromeliads | cyanobacteria | diazotrophy | Ecuador | green algae | Ncotropics phytotelmata | symbiosis,23435,BU,07043,Boston University,0,FALSE,NA,NA,43
true,https://api.elsevier.com/content/abstract/scopus_id/0001506347,SCOPUS_ID:0001506347,2-s2.0-0001506347,The effect of birds upon germination of banyan (ficus bengalensis) seeds,Midya S.,Journal of Tropical Ecology,02664674,14697831,7,4,537-538,1991-01-01,November 1991,10.1017/S0266467400005940,NA,22,Journal,ar,Article,100,2,2,Acridotheres | birds | Ficus bengalensis | India | seed dispersal | seed germination,23435,NA,undefined,NA,0,FALSE,NA,NA,44
true,https://api.elsevier.com/content/abstract/scopus_id/0000459864,SCOPUS_ID:0000459864,2-s2.0-0000459864,Dead logs as a substrate for rain forest trees in dominica,Lack A.,Journal of Tropical Ecology,02664674,14697831,7,3,401-405,1991-01-01,August 1991,10.1017/S026646740000571X,NA,11,Journal,ar,Article,100,1,1,Dominica | Miconia | nurse logs | rain forest | regeneration,23435,NA,undefined,NA,0,FALSE,NA,NA,45
