@_fa,prism:url,dc:identifier,eid,dc:title,prism:publicationName,prism:issn,prism:eIssn,prism:volume,prism:issueIdentifier,prism:pageRange,prism:coverDate,prism:coverDisplayDate,prism:doi,citedby-count,prism:aggregationType,subtype,subtypeDescription,author-count.@limit,author-count.@total,source-id,fund-no,openaccess,openaccessFlag,entry_number,dc:creator,author-count.$,fund-acr,fund-sponsor,dc:description,authkeywords
true,https://api.elsevier.com/content/abstract/scopus_id/84972416670,SCOPUS_ID:84972416670,2-s2.0-84972416670,Instructions to authors,Journal of Tropical Ecology,02664674,14697831,4,1,95-97,1988-01-01,February 1988,10.1017/S0266467400002595,0,Journal,ar,Article,100,0,23435,undefined,0,FALSE,1,NA,NA,NA,NA,NA,NA
true,https://api.elsevier.com/content/abstract/scopus_id/84972217781,SCOPUS_ID:84972217781,2-s2.0-84972217781,Burrowing parrots—all credit to the world bank,Journal of Tropical Ecology,02664674,14697831,4,3,270,1988-01-01,August 1988,10.1017/S0266467400002820,0,Journal,no,Note,100,1,23435,undefined,0,FALSE,2,Goodland R.,1,NA,NA,NA,NA
true,https://api.elsevier.com/content/abstract/scopus_id/84959604504,SCOPUS_ID:84959604504,2-s2.0-84959604504,Age structure of male Euglossa imperialis (Hymenoptera: Apidae: Euglossini) at nectar and chemical sources in Panama,Journal of Tropical Ecology,02664674,14697831,4,3,303-306,1988-01-01,August 1988,10.1017/S0266467400002868,11,Journal,ar,Article,100,1,23435,BSR-8501246,0,FALSE,3,Santiago M.,1,SI,Smithsonian Institution,NA,NA
true,https://api.elsevier.com/content/abstract/scopus_id/0024257246,SCOPUS_ID:0024257246,2-s2.0-0024257246,Internal heterogeneity of gaps and species richness in costa rican tropical wet forest,Journal of Tropical Ecology,02664674,14697831,4,2,99-119,1988-01-01,May 1988,10.1017/S0266467400002625,120,Journal,ar,Article,100,2,23435,undefined,0,FALSE,4,Hartshorn G.S.,2,NA,NA,"In Costa Rican tropical wet forest the distribution of seedlings of most tree species colonizing 51 tree-fall gaps is clumped, probably because of differences in the proximity of gaps to fruiting trees. Different gap zones (root, bole and crown) are more similar to one another, in terms of their species composition, than they are to other zones in the same gap. This nonrandom pattern is established soon after gap formation, indicating that mortality of young seedlings is both high and related to gap zones. Some tree species are strongly positively associated with one of the gap zones, whereas others are associated with the age of the gap at the time the census was taken or the species of tree whose fall caused the gap. Root zones are dominated by fewer species than are bole or crown zones. Results are consistent with the assumption that an initial random distribution of seedlings is quickly changed to a strongly non-random pattern by selective mortality of seedlings of different tree species in the different gap zones. The internal heterogeneity of gaps is probably one of the factors helping to maintain the high tree species richness characteristic of tropical wet forests. © 1988, Cambridge University Press. All rights reserved.",Costa Rica | disturbance | diversity | gaps | La Selva | patchy environments | species richness | tree-falls | tropical forests
true,https://api.elsevier.com/content/abstract/scopus_id/0024254519,SCOPUS_ID:0024254519,2-s2.0-0024254519,Water potential gradients for gaps and slopes in a panamanian tropical moist forest's dry season,Journal of Tropical Ecology,02664674,14697831,4,2,173-184,1988-01-01,May 1988,10.1017/S0266467400002674,151,Journal,ar,Article,100,3,23435,undefined,0,FALSE,5,Rabenold P.E.,3,NSF,National Science Foundation,"Soil water potentials were measured weekly by psychrometers at 20 cm depth during the dry season in a tropical moist forest on Barro Colorado Island, Panama. There was a persistent gradient of decreasing soil moisture from gap centre to gap edge to adjacent understorey at both a large and a small gap. On both a north-south and an east-west transect, the soil was drier (water potentials were more negative) on an upland surface than on moderate slopes. This trend was reflected in the predawn, total water potentials of shallow-rooted Psychotria horizontalis and deep-rooted Trichilia tuberculata measured in the understorey during the last two months of the dry season. P. horizontalis from the wettest sites on the transects had higher osmotic potentials at full hydration and at zero turgor, indicating less drought resistance than for conspecifics from the driest sites. © 1988, Cambridge University Press. All rights reserved.",Barro Colorado Island | dry season | gap | gradient | osmotic potential | Panama | plant water potential | slope | soil water potential | tropical moist forest
true,https://api.elsevier.com/content/abstract/scopus_id/0024248232,SCOPUS_ID:0024248232,2-s2.0-0024248232,"Relict mangrove stand on last interglacial terrace, christmas island, indian ocean",Journal of Tropical Ecology,02664674,14697831,4,1,1-17,1988-01-01,February 1988,10.1017/S0266467400002431,16,Journal,ar,Article,100,1,23435,undefined,0,FALSE,6,Woodroffe C.,1,ANU,Australian National University,"A unique stand of mangroves of the genus Bruguiera occurs on the shore terrace at Hosnies Spring, Christmas Island, Indian Ocean. The mangrove stand, of about 0.33 ha, occurs 120 m inland and over an elevational range of 13 m, from 24 to 37 m above sea level. It is flooded by freshwater from a spring which trickles over a partially-cemented calcsinter concretion gravel with mud. Trees reach 30–40 m high, and 80 cm diameter breast height. The size structure is bimodal with few trees in the 10–25 cm dbh size classes, but abundant propagules, seedlings and saplings. The shore terrace contains corals, some in their position of growth, and has been shown by Uranium-series dating to be Last Interglacial in age. Several alternative explanations of how the mangroves reached this site are examined. One explanation is that this stand of mangroves has persisted at the site for approximately 120,000 years since the Last Interglacial. While this cannot be proved it does appear that the stand is relict and is actively regenerating in this unusual location. © 1988, Cambridge University Press. All rights reserved.",Bruguiera | Christmas Island | Indian Ocean | Last Interglacial | mangrove | paleoecology | relict forest
true,https://api.elsevier.com/content/abstract/scopus_id/0024229586,SCOPUS_ID:0024229586,2-s2.0-0024229586,"Litterfall and productivity in a tropical rain forest, southern bakundu forest reserve, cameroon",Journal of Tropical Ecology,02664674,14697831,4,1,25-37,1988-01-01,February 1988,10.1017/S0266467400002467,43,Journal,ar,Article,100,2,23435,undefined,0,FALSE,7,Songwe N.,2,NA,NA,"Litterfall was measured monthly in ten 1 m2 traps in each of two 0.25 ha plots in the rain forest of Southern Bakundu Forest Reserve, Cameroon for 18 months from 1 July 1982 to 31 December 1983. Particular emphasis was placed on measuring species contributions and in relating litterfall to climatic factors; the litterfall data were also used in estimating leaf production. Annual litterfall ranged between 12.9 and 14.1 t ha-1and was partitioned to leaves (61-66%), branches (23-38%), fruits and flowers (8—12%) and ephiphytes (0.8%). Emergents and top canopy species like Desbordesia glaucescens (evergreen) and Ceiba pentandra (deciduous) contributed more litter than the numerically dominant lower storey species like Cola leptdota and Diospyros spp. Litter fell throughout the year but was greatest during the dry season (November to March); litterfall was thus strongly negatively correlated with environmental moisture variables and could be predicted from its linear regression on time of year, throughfall and relative humidity. By correcting the leaf fall data for leaf weight losses due to grazing and re-translocation, leaf production rates of 10.2 to 11.2 t ha-1yr-1were estimated for the forest. © 1988, Cambridge University Press. All rights reserved.",Cameroon | litterfall | productivity | rain forest
true,https://api.elsevier.com/content/abstract/scopus_id/0024229246,SCOPUS_ID:0024229246,2-s2.0-0024229246,The use of tubificids for weeding and aquaculture in paddy fields in Japan,Journal of Tropical Ecology,02664674,14697831,4,4,393-401,1988-01-01,November 1988,10.1017/S0266467400003059,8,Journal,ar,Article,100,2,23435,undefined,0,FALSE,8,Kurihara Y.,2,OCW,"Ministerie van Onderwijs, Cultuur en Wetenschap","Tubificid worms that live in the paddy mud increase in numbers when an organic fertilizer is applied. They mix the soil by passing it through their gut as well as by their burrowing and respiratory movements, thereby checking the sprouting of paddy weeds. Tubificids inhabiting the pond’s mud also serve as fish food. It is suggested that such a pond might be appropriate for aquaculture. This study considers a method to control paddy field ecosystems based on the above to produce rice and freshwater fish, with organic fertilizers but without the use of herbicides and insecticides. © 1988, Cambridge University Press. All rights reserved.",agricultural chemicals | aquaculture | Japan | paddy field | tubificids
true,https://api.elsevier.com/content/abstract/scopus_id/0024228797,SCOPUS_ID:0024228797,2-s2.0-0024228797,"Invertebrates in the litter and soil on Volcàn Barva, Costa Rica",Journal of Tropical Ecology,02664674,14697831,4,3,307-310,1988-01-01,August 1988,10.1017/S026646740000287X,33,Journal,ar,Article,100,2,23435,undefined,0,FALSE,9,Atkin L.,2,NA,NA,NA,altitudinal zonation | Costa Rica soil invertebrates
true,https://api.elsevier.com/content/abstract/scopus_id/0024228525,SCOPUS_ID:0024228525,2-s2.0-0024228525,"Dormancy, germination and seedling growth of two kalaharian perennials of the genus harpagophytum (pedaliaceae)",Journal of Tropical Ecology,02664674,14697831,4,2,185-198,1988-01-01,May 1988,10.1017/S0266467400002686,10,Journal,ar,Article,100,4,23435,undefined,0,FALSE,10,Ernst W.,4,NA,NA,"Dormancy and germination ecology of two Harpagophytum species (Pedaliaceae) from an open Acacia savanna in Botswana were investigated. The maintenance of dormancy is governed partly by the seed coat but mainly by the endosperm and the embryo itself, as demonstrated by removal of the endosperm. Dissemination of the seed from the fruit can be delayed for several years without affecting the viability of the embryo, due to very low respiration rates. Germination can be enhanced slightly by high temperatures under natural conditions, and by gibberellic acid or removal of the endosperm under laboratory conditions. Relative growth rates for both Harpagophytum species are lower than for subtropical grasses and legumes, due to a strong investment in root and tuber biomass. Germination and seedling growth is discussed in relation to the drought avoidance syndrome and the animal disperser syndrome. © 1988, Cambridge University Press. All rights reserved.",Botswana | dormancy | Harpagophytum | Kalaharian plants | photosynthesis | seed germination | seed weight | seedling survival | water uptake
true,https://api.elsevier.com/content/abstract/scopus_id/0024228524,SCOPUS_ID:0024228524,2-s2.0-0024228524,"Growth and photosynthesis of aechmea magdalenae, a terrestrial cam plant in a tropical moist forest, panama",Journal of Tropical Ecology,02664674,14697831,4,2,199-207,1988-01-01,May 1988,10.1017/S0266467400002704,22,Journal,ar,Article,100,1,23435,undefined,0,FALSE,11,Smith A.P.,1,NA,Whitehall Foundation,"Aechmea magdalenae is a terrestrial bromeliad that dominates areas of forest understorey on Barro Colorado Island, Panama. Nocturnal CO2uptake via crassulacean acid metabolism was the primary means of carbon gain under well-watered conditions and all light regimes. The ability to maintain a positive carbon balance under conditions of very low light was demonstrated by laboratory measurements of photosynthesis and forest measurements of growth. Low-light-grown juvenile rosettes had the same daily net assimilation whether tested at photon flux densities of 15 or 300 ymol m“2 s-1. Growth rates of rosettes in treefall gaps were similar to those of plants in closed canopy forest. Growth rates of forest plants were increasingly correlated with canopy openness as the wet season progressed due to increased growth by gap plants, suggesting that water availability rather than light may limit growth during the annual dry season. © 1988, Cambridge University Press. All rights reserved.",Aechmea | Barro Colorado Island | Bromeliaceae | CAM | growth | Panama | photosynthesis | shade | tropical forest | understorey
true,https://api.elsevier.com/content/abstract/scopus_id/0024226303,SCOPUS_ID:0024226303,2-s2.0-0024226303,"Studies on acacia mangium in kemasul forest, malaysia. i. biomass and productivity",Journal of Tropical Ecology,02664674,14697831,4,3,293-302,1988-01-01,August 1988,10.1017/S0266467400002856,40,Journal,ar,Article,100,1,23435,undefined,0,FALSE,12,Tsai L.M.,1,NA,NA,"Malaysia is establishing large-scale plantations for reforestation and the production of wood for pulp and paper as well as for light construction. The main species used currently is the exotic legume Acacia mangium. The above-ground biomass, litter production and litter accumulation in a four-year-old stand m Peninsular Malaysia were studied. The mean diameter at breast height (dbh) was 12 cm. The mean annual increment (MAI) m dbh of individual trees ranged from 0.9 to 5.1 cm while MAI in height of sample trees ranged from 2.9 to 5.5 m. The total above-ground biomass of the stand was 90.4 t ha-1 consisting of 57.6 t stem, 14.1 t branch and 5.4 t leaf. Litter production averaged 10.23 t ha-1 yr1with leaf litter making up 87.4% of the totaL Leaf litter accumulation amounted to 6.64 t ha1and the turnover constant of leaf litter was estimated at 1.35. The high productivity is discussed in relation to the high turnover of foliage and the low turnover of litter. © 1988, Cambridge University Press. All rights reserved.",Acacia mangium | biomass | litter accumulation | litter production | Malaysia | plantation | productivity
true,https://api.elsevier.com/content/abstract/scopus_id/0024225735,SCOPUS_ID:0024225735,2-s2.0-0024225735,"Crepuscular biting activity of mosquitoes at peradeniya, sri lanka",Journal of Tropical Ecology,02664674,14697831,4,3,271-280,1988-01-01,August 1988,10.1017/S0266467400002832,2,Journal,ar,Article,100,1,23435,undefined,0,FALSE,13,Amerasinghe F.,1,NA,NA,"Thirty-four spedes of mosquitoes (Diptera: Culicidae) were collected at a senes of human-bait catches designed to study evening crepuscular biting activity using the Nielsen crep unit, at a site at Peradeniya, Sri Lanka. Crepuscular biting profiles of seven spedes (Armigeres subalbatus, Aedes albopictus, Culex pseudovtshnui, Cx. gelidus, Cx. fuscocephala, Cx. tntaeniorhynchus and Mansonia uniformis) were obtained. Modal periods for the onset of biting were analysed in six species: Cx. pseudovishnui, Cx. fuscocephala, Cx. gelidus, Cx. tritaeniorhynchus, Cx. qumquefasciatus and Ma. uniformis. Successions in the biting peaks and in modal onset of biting were seen in these species. Analysis of biting in Ar. subalbatus and Cx. pseudovishnui under high (dear sky) and low (cloud-overcast sky) light intensities showed earlier biting in both species under the latter conditions. The value of the Nielsen crep unit in making latitudinal comparisons is illustrated in Ma. uniformis, for which parallel data are available from Africa. © 1988, Cambridge University Press. All rights reserved.",Aedes | Armigeres | crepuscular biting activity | Culex | Mansonia | mosquitoes | Nielsen crep units | Sri Lanka
true,https://api.elsevier.com/content/abstract/scopus_id/0024221797,SCOPUS_ID:0024221797,2-s2.0-0024221797,The post-nuptial moult of quelea quelea in relation to breeding in kenya,Journal of Tropical Ecology,02664674,14697831,4,4,373-380,1988-01-01,November 1988,10.1017/S0266467400003023,10,Journal,ar,Article,100,1,23435,undefined,0,FALSE,14,Thompson J.,1,NA,NA,"During the unusually extended breeding season of 1984/85 in Tsavo-East National Park, Kenya, Quelea quelea were sampled and moult patterns recorded. Particular attention was paid to individuals with an interrupted moult pattern. These were further classified as either having their moult arrested or suspended. Apparently, post-nuptial moult begins earlier in males than in females. Although the majority of quelea bred and moulted sequentially, these activities overlapped in many individuals and moulting suspended after the replacement of a few feathers. The initiation of post-nuptial moult before the cessation of breeding, followed by moult interruption, is evidence for the physio-ecological drive in quelea to complete their moult as soon as possible to prepare for the next breeding opportunity. © 1988, Cambridge University Press. All rights reserved.",Kenya | moult | Quelea quelea
true,https://api.elsevier.com/content/abstract/scopus_id/0024221758,SCOPUS_ID:0024221758,2-s2.0-0024221758,"The distribution and ecology of the freshwater prawn caridina singhalensis (decapoda, atyidae) endemic to sri lanka",Journal of Tropical Ecology,02664674,14697831,4,4,347-359,1988-01-01,November 1988,10.1017/S0266467400002996,8,Journal,ar,Article,100,1,23435,undefined,0,FALSE,15,Benzie J.A.H.,1,NA,NA,"The distribution and rnicrohabitat preference of the freshwater prawn, Caridina singhalensis, endemic to Sri Lanka, was determined. The species is now restricted to a 10–15 km stretch of the Behihul Oya headwaters, its distribution being determined by physiography and agricultural development. Beds of Isolepis fluitans support some 76% of the adult population, at mean monthly densities of around 210 individuals m-2. Aponogeton jacobsenii beds and roots of marginal vegetation beneath overhanging banks support about 12% each, at mean monthly densities of 41 individuals m-2. The prawn produces young all year round but a peak in the number of ovigerous females occurs from September to January. Only juveniles produced after the rains appear to survive in great numbers. The submerged roots of marginal vegetation form a nursery area for about 45% of the annual output of young. Conservation plans for this endangered species need to take account of the particular importance of L fluitans and root habitats to C. singhalensis. © 1988, Cambridge University Press. All rights reserved.",Atyidae | Caridina | freshwater ecology | prawn ecology | Sri Lanka | tropical rivers
true,https://api.elsevier.com/content/abstract/scopus_id/0024221002,SCOPUS_ID:0024221002,2-s2.0-0024221002,Simulating forest shade to study the developmental ecology of tropical plants: Juvenile growth in three vines in india,Journal of Tropical Ecology,02664674,14697831,4,3,281-292,1988-01-01,August 1988,10.1017/S0266467400002844,46,Journal,ar,Article,100,1,23435,undefined,0,FALSE,16,Lee D.,1,NA,Whitehall Foundation,"Both light quantity and quality affect the development and autoecology of plants under shade conditions, as in the understorey of tropical forests. However, little research has been directed towards the relative contributions of lowered photosynthetic photon flux density (PPFD) versus altered spectral distributions (as indicated by quantum ratios of 660 to 750 nra, or R:FR) of radiation underneath vegetation canopies. A method for constructing shade enclosures to study the contribution of these two variables is described. Three tropical leguminous vine species (Abrus precatonus L., Caesalpinta bondicela Fleming and Mucuna prunens (L.) DC.) were grown in two shade enclosures with 3-4% of solar PPFD with either the R:FR of sunlight (1.10) or foliage shade (0.33), and compared to plants grown in sunlight. Most species treated with low R:FR differed from those treated with high R:FRin (1) percent allocation to dry leaf weight, (2) intemode length, (3) dry stem weight/length, (4) specific leaf weight, (5) leaf size, and (6) chlorophyll a/b ratios. However, these plants did not differ in chlorophyll content per leaf dry weight or area. In most cases the effects of low R:FR and PPFD were additional to those of high R:FR and low PPFD. Growth patterns varied among the three species, but both low PPFD and diminished R:FR were important cues in their developmental responses to light environments. This shadehouse system should be useful in studymg the effects of light on the developmental ecology of other tropical forest plants. © 1988, Cambridge University Press. All rights reserved.",developmental ecology | forest shade | India | photosynthetic photon flux density (PPFD) | red/far red | shadehouse | vine
true,https://api.elsevier.com/content/abstract/scopus_id/0024219697,SCOPUS_ID:0024219697,2-s2.0-0024219697,On the abundance and density of terrestrial arthropods in Central Amazonian dryland forests,Journal of Tropical Ecology,02664674,14697831,4,1,19-24,1988-01-01,February 1988,10.1017/S0266467400002455,30,Journal,ar,Article,100,1,23435,undefined,0,FALSE,17,Adis J.,1,NA,NA,NA,NA
true,https://api.elsevier.com/content/abstract/scopus_id/0024219298,SCOPUS_ID:0024219298,2-s2.0-0024219298,"Frugivory and seed dispersal in cymhopetalum baillonii (annonaceae) at los tuxtlas, mexico",Journal of Tropical Ecology,02664674,14697831,4,2,157-172,1988-01-01,May 1988,10.1017/S0266467400002650,52,Journal,ar,Article,100,2,23435,undefined,0,FALSE,18,Coates-Estrada R.,2,NA,NA,"Fruit production, frugivore foraging activity and seed dispersal was studied at 10 Cymhopetalum baillonii (Annonaceae) trees during an entire fruiting season. Fruits dehisced during the first six months of the year offer to potential dispersal agents a package of 8–24 arillate seeds. Insects and fungi, however, killed up to 14% of the seeds potentially available for dispersal before fruit dehiscence. Visitation by 24 species of birds and one mammal to the trees closely followed the availability of arillate seeds. The foraging activity of Peromyscus and Heteromys rodents accounted for 80% mortality of the seeds deposited under the crown of the parent tree. Among those seedlings that became established under the crown mortality was 90% after 12 months. Seeds dispersed under conspecific fruiting trees experienced intense predation by vertebrates. Field experiments showed that seeds and seedlings planted 30 m away from adult trees survived significantly longer than those planted under the crown and at distances 30 m. An unequivocal advantage to dispersal away from the tree and under allospecific trees was evident from the data. A very narrow range of frugivores (N “8 species) accounted for the quality component of dispersal services to the trees. The tree with the lowest animal visitation and fruit crop was the most efficient in the dispersal of its seeds. © 1988, Cambridge University Press. All rights reserved.",Cymhopetalum baillonii | frugivory | Mexico | seed dispersal | seed predation | tropical rain forest
true,https://api.elsevier.com/content/abstract/scopus_id/0024198958,SCOPUS_ID:0024198958,2-s2.0-0024198958,Phenological studies of shrub and treelet species in tropical cloud forests of costa rica,Journal of Tropical Ecology,02664674,14697831,4,4,323-346,1988-01-01,November 1988,10.1017/S0266467400002984,65,Journal,ar,Article,100,1,23435,DEB 78-11728,0,FALSE,19,Koptur S.,1,NSF,National Science Foundation,"(1) During 1978–1981, marked individuals of 107 species of treelets and shrubs in three forest types between 1300–1650 m elevation at Monteverde, Costa Rica, were monitored at monthly intervals for behaviour of leafing, flowering, and fruiting. (2) Although there was not a pronounced seasonal pattern of leafing activity, more species produced new leaves in the dry season. Species that flush large quantities of new leaves do so more commonly in the drier months. Leaf loss was gradual and unobtrusive in species observed. (3) Flowering activity was greatest in the late dry season and early wet season. Most species exhibited extended flowering; only 15% of the species were massively flowering. Massive flowerers showed less seasonality than extended flowerers. (4) Of the species studied, the majority had relatively unspecialized flowers which were visited by a variety of insects; small bee-pollination was the next most common, followed by hummingbird, beetle, settling moth, sphingid, butterfly, large bee and fly pollination (the pollination system of 18 species was unknown). Hummingbird pollinated species showed little seasonality of flowering when compared with species exhibiting small moth, and beetle pollination syndromes, as well as those with unspecialized flowers. (5) The vast majority of species studied have fleshy fruits (sarcochores). Fruiting activity was less markedly seasonal than flowering. Species with fruit are more numerous in the second half of the year (the wet season and early dry season). The second year of the study saw substantially fewer species in fruit than the first year; this is attributed to the greater than usual rainfall and inclement weather during the peak flowering season. (6) Cloud forest shrub and treelet phenology is compared with patterns of other forests that have been studied. In general, the greater the rainfall, the less seasonality of flowering and fruiting is seen. Although Monteverde is very wet, rainfall is intermediate between that of lowland dry and lowland wet forest in Costa Rica. Seasonality of flowering and fruiting at Monteverde is more pronounced than at La Selva (wet) and less obvious than in Guanacaste (dry). © 1988, Cambridge University Press. All rights reserved.",Costa Rica | flowering | fruiting | leafing | phenology | pollination | shrubs | treelets | tropical
