@_fa,prism:url,dc:identifier,eid,dc:title,prism:publicationName,prism:issn,prism:eIssn,prism:volume,prism:issueIdentifier,prism:pageRange,prism:coverDate,prism:coverDisplayDate,prism:doi,citedby-count,prism:aggregationType,subtype,subtypeDescription,author-count.@limit,author-count.@total,source-id,fund-no,openaccess,openaccessFlag,freetoread.value.$,freetoreadLabel.value.$,entry_number,dc:creator,author-count.$,authkeywords,dc:description,fund-acr,fund-sponsor
true,https://api.elsevier.com/content/abstract/scopus_id/0024884968,SCOPUS_ID:0024884968,2-s2.0-0024884968,"Avian attendance and foraging at army-ant swarms in the tropical rain forest of Los Tuxtlas, Veracruz, Mexico",Journal of Tropical Ecology,02664674,14697831,5,3,281-292,1989-01-01,August 1989,10.1017/S0266467400003655,22,Journal,ar,Article,100,2,23435,undefined,0,FALSE,NA,NA,23,Coates-Estrada R.,2,army-ants | birds | foraging | Mexico | tropical rain forest,"Foraging and attendance of birds at army-ant swarm raids were studied in the tropical rain forest of Los Tuxtlas, Mexico. Sixty-eight raiding swarms were intercepted over a four-year period of which 57% were Eciton burchelli and 43% Labidus praedator. A total of 461 birds (37 species/12 families) were recorded at swarms of E. burchelli and 208 birds (34 species/10 families) were recorded at L praedator swarms. The mean number of bird species detected per swarm was 7.2 at E. burchelli raids and 5.6 at L. praedator raids. Red-throated ant-tanagers (Habia fuscicauda) were most frequently seen at the swarms of both army-ant species. Other important species were the golden-crowned warbler (Basileuterus culicivorus), the white-breasted wood wren (Henicorhina leucosticta) and the Kentucky warbler (Oporornis formosus). Swarms of both army-ant species were active year-round. Birds weighing between 20 and 40 g dominated perches closest to the ground and the central zone of the swarms, richest in animal prey. Birds weighing less than 20 g occupied higher perches and tended to forage in more peripheral zones. At Los Tuxtlas raiding swarms of army ants are important in the foraging ecology of 44 bird species, including 12 North American migrants. © 1989, Cambridge University Press. All rights reserved.",NA,NA
true,https://api.elsevier.com/content/abstract/scopus_id/0024884932,SCOPUS_ID:0024884932,2-s2.0-0024884932,"Red crabs in rain forest, christmas island: Removal and relocation of leaf-fall",Journal of Tropical Ecology,02664674,14697831,5,3,337-348,1989-01-01,August 1989,10.1017/S0266467400003746,38,Journal,ar,Article,100,2,23435,undefined,0,FALSE,NA,NA,24,O'Dowd D.J.,2,Christmas Island | Gecarcoidea natalis | Indian Ocean | island | land crabs | leaf-fall | litter | nutrients | rain forest,"Field experiments comparing leaf-fall in the presence and absence of the red land crab, Gecarcoidea natalis, in rain forest on Christmas Island, Indian Ocean showed that, by eating and returning leaves to their burrows, they significantly reduced accumulation of leaf-fail on the forest floor. Red crabs removed 30-50% of the leaf-fall at the experimental sites during the study. Differences in leaf-fall mass between crab-access and exclusion quadrats were positively correlated with the density of foraging red crabs. Red crabs also generated spatial heterogeneity in the distribution of litter on the forest floor by returning litter to their burrows. Leaves lined chambers of 64% of excavated burrows and litter biomass around the entrances was significantly greater than that on off-burrow locations. This was reflected in the significantly higher concentrations of organic matter and nutrients (N, P, K, Ca, Na, and Mg) associated with soils near burrow entrances. These results suggest that a single species, G. natalis, is the major processor of leaf-fall in rain forest on Christmas Island and may affect (1) the temporal and spatial patterns of nutrient availability and (2) the diversity and biomass of the litter fauna. © 1989, Cambridge University Press. All rights reserved.",NA,NA
true,https://api.elsevier.com/content/abstract/scopus_id/0024883059,SCOPUS_ID:0024883059,2-s2.0-0024883059,Elevational zonation of mammals in the central philippines,Journal of Tropical Ecology,02664674,14697831,5,3,259-280,1989-01-01,August 1989,10.1017/S0266467400003643,69,Journal,ar,Article,100,5,23435,BSR-8514223,0,FALSE,NA,NA,25,Heaney L.R.,5,conservation | ecology | endemism | island biogeography | mammals | Muridae | Philippines | Pteropodidae | Soricidae,"Trapping and netting of small mammals on a land-bridge island (Leyte) and on an oceanic island (Negros) revealed similar patterns of elevational change in abundance and species richness. Fruit bats (Pteropodidae) reached their greatest local densities in agricultural areas, and were least abundant in montane mossy forest. The fruit bats found to be common in agricultural areas are widespread in Southeast Asia: In contrast, species that were most common in forested areas are Philippine endemics. Fruit bat abundance was greater on the oceanic island than on the land-bridge island. Trappable small mammals (families Soricidae and Muridae) showed no change in species richness with increasing elevation, but did show a gradual increase in overall abundance. Even though the oceanic island was depauperate of non-volant mammal species, it had the higher abundance of non-volant mammal individuals; however, this may have been due primarily to differences associated with the elevation of sampling sites. Murid rodents at the higher elevations on Leyte tend to be those that are members of the old endemic group of Philippine murids, and those at lower elevations tend to be members of more recently arrived groups. Most non-volant small mammals at all elevations on the oceanic Negros, and in agricultural areas on Leyte, are non-native species. © 1989, Cambridge University Press. All rights reserved.",NA,NA
true,https://api.elsevier.com/content/abstract/scopus_id/0024879228,SCOPUS_ID:0024879228,2-s2.0-0024879228,"Short term nitrogen dynamics in a small brazilian wetland (lago infernao, sao paulo)",Journal of Tropical Ecology,02664674,14697831,5,3,323-335,1989-01-01,August 1989,10.1017/S0266467400003710,9,Journal,ar,Article,100,4,23435,undefined,0,FALSE,NA,NA,26,Howard-Williams C.,4,aquatic macrophyte. Brazil | denitrification | fixation | littoral zone | nitrification | nitrogen | wetland,"We have studied a number of related processes of the nitrogen cycle in a Brazilian floodplain lake to identify the major pools and pathways over a short time period. The study was centred on the littoral zone dominated by the floating plant Eichhornia azurea, which has a large epiphyte algal community of which heterocystous cyanobacteria were the major components. The water column was continuously undersaturated with oxygen although some elevated values (to 60% saturation) were recorded in the macrophyte beds in the afternoon. Marked diel temperature changes were documented. NH4-N dominated the dissolved N component in the water with maximal values (60 mg m-8) at lowest O2 concentrations early in the morning. Nitrogen fixation (acetylene reduction) of the epiphyte community showed marked diel changes with daily values of 5 mg N fixed m-2 day-1(based on 3:1 C2 H4:N2 ratio). Macrophyte NH4-N uptake rates (in situ incubations) were 93 mg N m-2 day-1. The activities of nitrifying bacteria could not be detected with the nitrapyrin block on dark CO2 fixation but denitrification (acetylene block technique) was recorded in the sediments when enhanced with NO3-. The major pathways of aquatic nitrogen involved macrophyte uptake and sediment release of NH4-N. © 1989, Cambridge University Press. All rights reserved.",DSIR,"Department of Scientific and Industrial Research, Ministry of Science and Technology, India"
true,https://api.elsevier.com/content/abstract/scopus_id/0024875646,SCOPUS_ID:0024875646,2-s2.0-0024875646,The influence of elephants and fire on a Brachystegia-Julbernardia woodland in Zimbabwe,Journal of Tropical Ecology,02664674,14697831,5,2,215-226,1989-01-01,May 1989,10.1017/S0266467400003503,46,Journal,ar,Article,100,1,23435,undefined,0,FALSE,NA,NA,27,Guy P.R.,1,elephants | fire | woodland | Zimbabwe,"Wildlife Research Area, Zimbabwe, show major differences in structure, biomass and species composition. The woodlands inside the research area have a lower stem area, tree density and biomass than those outside it. The shrubs inside the research area occur at a higher density than they do outside it, but the biomasses of shrubs in the two woodlands are similar. The woodlands inside the research area are affected by elephants and fire, whereas those outside it are affected mainly by fire. It is postulated that the policy of maintaining the elephant population at 250 in the research area is having a beneficial effect and, provided elephants and fire are kept in check, the woodlands inside the research area will eventually recover. Brachystegia-Julbernardia (miombo) woodlands inside and outside the Sengwa. © 1989, Cambridge University Press. All rights reserved.",NA,Earthwatch Institute
true,https://api.elsevier.com/content/abstract/scopus_id/0024874214,SCOPUS_ID:0024874214,2-s2.0-0024874214,Tent-Roosting By Scotophilus Kuhlii (Chiroptera: Vespertilionidae) In The Philippines,Journal of Tropical Ecology,02664674,14697831,5,4,433-436,1989-01-01,November 1989,10.1017/S0266467400003886,17,Journal,ar,Article,100,3,23435,BSR-8514223,0,FALSE,NA,NA,28,Rickart E.A.,3,NA,NA,NSF,National Science Foundation
true,https://api.elsevier.com/content/abstract/scopus_id/0024873352,SCOPUS_ID:0024873352,2-s2.0-0024873352,A survey of small mammals within a sabah tree plantation in Malaysia,Journal of Tropical Ecology,02664674,14697831,5,2,203-214,1989-01-01,May 1989,10.1017/S0266467400003485,22,Journal,ar,Article,100,2,23435,undefined,0,FALSE,NA,NA,29,Stuebing R.,2,logged forest | Malaysia | murids | plantations | rodents | tree shrews,"A survey of small mammals was made in a tree plantation in Sabah, East Malaysia. Transects within pure plantings of Eucalyptus deglupta, Gmelina arborea, Albizia falcataria and A. falcataria/Theobroma cacao were compared with a similar transect laid through seven-year-old logged forest near the plantation. A total of 16 small mammal species were trapped, with 11 found in the logged forest area, and 15 in the plantation. Values for the Shannon-Wiener Diversity Index (H') and for biomass were highest in logged forest, which also showed a low (>45%) Percent Similarity when compared with any of the plantation areas. Highest diversity and biomass values within the plantation were found in Albizia falcataria plantings, while the lowest were found in A. falcataria underplanted with Theobroma cacao. All plantation areas were dominated by Maxomys whiteheadi, whereas A. falcataria plantings had the highest numbers of Tupaia glis and Tupaia tana. The study shows that although tropical plantations of exotic tree species can support a large number of species of scansorial small mammals, overall diversity and species biomass per hectare is much lower than that found in logged forest. © 1989, Cambridge University Press. All rights reserved.",NA,NA
true,https://api.elsevier.com/content/abstract/scopus_id/0024797507,SCOPUS_ID:0024797507,2-s2.0-0024797507,Mist and fog interception in elfin cloud forests in Colombia and Venezuela,Journal of Tropical Ecology,02664674,14697831,5,3,309-322,1989-01-01,August 1989,10.1017/S0266467400003709,105,Journal,ar,Article,100,2,23435,undefined,0,FALSE,NA,NA,30,Cavelier J.,2,cloud forest | Colombia | fog interception | leaf angle | mist | mountain forests | Neotropics | tropical mountains | Venezuela | water sources,"forests on small mountains along the Caribbean coast of South America and one in the Venezuelan Andes. (1) While rainfall increases from west to east in the small mountains along the coast, fog interception decreases. In 1985, the total annual rainfall and fog interception were 853 mm and 796 mm in the cloud forest of Serrania de Macuira, 1630 mm and 518 mm in Cerro Santa Ana and, 4461 mm and 480 mm in Cerro Copey. In the Andean forest of El Zumbador, the 1985 rainfall was 1983 mm and the annual fog interception was only 72 mm. (2) Fog interception seems to be an important source of water to the elfin cloud forests of the small mountains which are surrounded by dry vegetation types and where the rainfall regime is highly seasonal. (3) Fog interception increases with altitude (in the same mountain), exposure (wind-ward slopes) and leaf inclination. These variations of fog interception could partially explain the observed distribution of epiphytic flora in some of these cloud forests. Fog interception and rainfall were measured during one year in three elfin cloud. © 1989, Cambridge University Press. All rights reserved.",ULA,Universidad de Los Andes Venezuela
true,https://api.elsevier.com/content/abstract/scopus_id/0024572125,SCOPUS_ID:0024572125,2-s2.0-0024572125,"Analysis of the niche of two sympatric species of bombus (Hymenoptera, Apidae) in southeastern Brazil",Journal of Tropical Ecology,02664674,14697831,5,1,81-92,1989-01-01,February 1989,10.1017/S0266467400003242,30,Journal,ar,Article,100,2,23435,40.2476/82,0,FALSE,NA,NA,31,Camillo E.,2,Bombus | Brazil | bumble-bees | competition | evenness | flowering | food sources | niche width | overlap,"The sources of food and the width and overlap of the food niches of Bombus atratus and Bombus mono were determined by field observations and analysis of the pollen loads carried to the colonies by worker bees. The two species together utilized 50 flower species of which 26 were used by both. Solanum paniculatum (Solanaceae) and Psidium guajava (Myrta-ceae) were the most frequently visited plants. The food niche width and niche evenness for both species were similar. The correlation between niche width and niche evenness was non-significant showing that evenness does not depend on niche width. In addition, there was no correlation between niche width and overlap, i.e. overlap varied independently of niche width. A high overlap of food sources utilized by the two species was observed in September, October and November. This may be explained in one of two ways: (a) if B. atratus and B. mono compete for resources, competition would be more intense during those three months; (b) the convergency of both species to the same plant species (Solanum paniculatum and Psidium guajava) would only result in more intensive competition if resources were limiting. However, at that period of the year resources are abundant, therefore although the values of overlap were high, competition need not have occurred. © 1989, Cambridge University Press. All rights reserved.",FAPESP,Fundação de Amparo à Pesquisa do Estado de São Paulo
true,https://api.elsevier.com/content/abstract/scopus_id/0024571931,SCOPUS_ID:0024571931,2-s2.0-0024571931,Canopy dynamics and light climates in a tropical moist deciduous forest in India,Journal of Tropical Ecology,02664674,14697831,5,1,65-79,1989-01-01,February 1989,10.1017/S0266467400003229,27,Journal,ar,Article,100,1,23435,undefined,0,FALSE,NA,NA,32,Lee D.W.,1,India | monsoon | phenology | photosynthetic photon flux density | quality | spectral | tropical deciduous forest,"The canopy dynamics and light climates within a 20 by 60 m quadrat were studied in a disturbed moist deciduous forest near Bombay, India. A map was drawn of individual trees within the quadrat, the taxa were identified, and their phenology was followed from November 1984 to July 1985. The quadrat contained 14 species, the most common being Tectona grandis, Terminalia tomentosa, Butea monosperma, Mitragyne parviflora and Albizia procera. Some individuals were in leaf at all times, more so at the moister east end of the quadrat. In November at the end of the rainy season, light measurements documented percentages of total daily photosynthetic photon fluence (PPF) at 10.0% of full sunlight; 44% of this flux was due to sun-flecks whose duration was approximately 17% of the daytime hours. Values for six sites were similar to mid-day measurements along a 40 m transect, and consistent with the 94% canopy cover of the sites, photographed with a fish-eye lens. The March dry season measurements revealed a more intense radiation environment (54% of solar PPF), and 59% of the photosynthetic photon flux density at mid-day along the transect. Canopy openings were increased to a mean of 59.4%. Light in the understorey in November was spectrally altered, with typical R:fr ratios of 0.30, compared to March values identical to those of sunlight, at 1.10. © 1989, Cambridge University Press. All rights reserved.",NA,Whitehall Foundation
true,https://api.elsevier.com/content/abstract/scopus_id/0024531096,SCOPUS_ID:0024531096,2-s2.0-0024531096,Ant-Mealybug Interaction Decreases Reproductive Fitness Of Schomburgkia Tibicinis (Orchidaceae) In Mexico,Journal of Tropical Ecology,02664674,14697831,5,1,109-112,1989-01-01,February 1989,10.1017/S0266467400003266,16,Journal,ar,Article,100,2,23435,undefined,0,FALSE,NA,NA,33,Rico-Gray V.,2,NA,NA,NA,NA
true,https://api.elsevier.com/content/abstract/scopus_id/0024530438,SCOPUS_ID:0024530438,2-s2.0-0024530438,Moth diversity of a tropical forest in Peninsular Malaysia,Journal of Tropical Ecology,02664674,14697831,5,1,37-50,1989-01-01,February 1989,10.1017/S0266467400003205,54,Journal,ar,Article,100,2,23435,undefined,0,FALSE,NA,NA,34,Barlow H.,2,biomass | diversity | light trapping | log-normal | log-series | macrolepidoptera | moths | Peninsular Malaysia | Q-statistic | seasonality,"A standard Rothamsted light trap was operated for slightly over 12 months from the end of September 1979 to October 1980 at Genting Sempah, Pahang in Malaysia. All specimens of macrolepidoptera families together with the Pyralidae were identified, counted and recorded. The numbers of species caught were compared with those obtained by a different method at a nearby site for over 10 years. Diversity, biomass and seasonality of the catch were compared with identically sampled populations in Great Britain and New Zealand. The Genting Sempah trap had very high diversity and biomass compared with the temperate samples and exhibited much less seasonality. The Pyralidae and other families (excluding Noctuidae and Geometridae) formed a much higher component of diversity in Genting than in Britain. The log-normal distribution fits the data better than the log-series. So the inter-quartile slope, Q, is the correct parameter for interfaunal comparisons. © 1989, Cambridge University Press. All rights reserved.",NA,NA
true,https://api.elsevier.com/content/abstract/scopus_id/0024525962,SCOPUS_ID:0024525962,2-s2.0-0024525962,An Association Between Marmosets And Army Ants In Brazil,Journal of Tropical Ecology,02664674,14697831,5,1,113-116,1989-01-01,February 1989,10.1017/S0266467400003278,14,Journal,ar,Article,100,3,23435,undefined,0,FALSE,NA,NA,35,Rylands A.B.,3,army ants | Brazil | marmosets,NA,NA,NA
true,https://api.elsevier.com/content/abstract/scopus_id/0024525954,SCOPUS_ID:0024525954,2-s2.0-0024525954,Litterfall and litter nutrient content in primary and secondary amazonian ‘terra firme’ rain forest,Journal of Tropical Ecology,02664674,14697831,5,1,27-36,1989-01-01,February 1989,10.1017/S0266467400003199,53,Journal,ar,Article,100,2,23435,undefined,0,FALSE,NA,NA,36,Dantas M.,2,Amazonia Brazil | capoeira | litter litter nutrient content primary forest tropical rain forest,"Litterfall in primary and secondary forests (‘capoeira’) in eastern Brazilian Amazonia was measured fortnightly from August 1979 to October 1980. The nutrient contents of the litter (N, P, K, Ca and Mg) were determined. Litterfall differed between the two forest types (primary forest - 8.04 t ha-1 yr-1; secondary forest - 5.04 t ha-1 yr-1). The value obtained for primary forest was similar to those reported elsewhere in Brazil (mean = 8 t ha-1 yr-1) and from other regions of S. America (mean = 7.20 t ha-1 yr-1). Prediction of net primary production from litterfall at the primary forest site gave rise to values of 14.47 and 26.58 t ha-1 yr-1. Estimates of net primary production in ‘capoeira’ ranged from 9.07 to 16.63 t ha-1 yr-1. Seasonality of litterfall was more marked in ‘capoeira’ than primary forest but in both cases was less pronounced than elsewhere in Brazil. Nutrient concentrations were highest in ‘capoeira’ litter, a finding which accords with results from other tropical sites; nevertheless input of nutrients per unit area of forest floor was greatest in the primary forest. © 1989, Cambridge University Press. All rights reserved.",NA,NA
true,https://api.elsevier.com/content/abstract/scopus_id/0024525666,SCOPUS_ID:0024525666,2-s2.0-0024525666,Microhabitat variation in an african savanna: Effects of woody cover and herbivores in kenya,Journal of Tropical Ecology,02664674,14697831,5,1,93-108,1989-01-01,February 1989,10.1017/S0266467400003254,46,Journal,ar,Article,100,1,23435,BSR 8505862,0,FALSE,NA,NA,37,Georgiadis N.,1,Africa | grass production | herbivory | Kenya | savanna | shade | soil | trees,"Effects of extreme livestock pressure on the abundance and distribution of a drought-deciduous shrub Sericocomopsis pallida, and effects of the shrub canopy on microclimate, soil fertility and grass production, were studied in savanna grasslands of southern Kenya. Canopy volume declined with increasing herbivore pressure, but shrub density was not systematically affected, suggesting strong resilience against destruction by herbivores. However, shrubs became more aggregated with increasing herbivory, suggesting that clumps of individuals are more resilient to destruction than are isolated individuals. Grass production was three times greater under the canopy of S. pallida than in the open. Comparisons of physical-chemical properties among soils derived from four microsites revealed far higher nutrient levels in sub-canopy soil than in soil derived from open ground between canopies, and radically different properties compared to soil heavily enriched with livestock dung and urine. Higher nutrient levels beneath the canopy most likely resulted from litter decomposition. A pot experiment, designed to simulate shading and soil conditions in the field, showed that grass growth promotion was largely due to a substantial increase in soil fertility beneath the canopy of S. pallida, comparable to grass productivity in soil enriched with livestock excreta. However, this increase in sub-canopy grass production did not significantly increase regional grass layer production. © 1989, Cambridge University Press. All rights reserved.",NSF,National Science Foundation
true,https://api.elsevier.com/content/abstract/scopus_id/0024484809,SCOPUS_ID:0024484809,2-s2.0-0024484809,"The ecology of small mammals in Ogba Forest Reserve, Nigeria",Journal of Tropical Ecology,02664674,14697831,5,1,51-64,1989-01-01,February 1989,10.1017/S0266467400003217,8,Journal,ar,Article,100,1,23435,undefined,0,FALSE,NA,NA,38,Iyawe J.,1,lowland rain forest | Nigeria | rodents | shrews,"A total of 392 small mammals belonging to five species of small rodents and four species of shrews were caught. The small mammals and their percentage composition were Crocidura nigeriae (20.9%), Crocidura grandiceps (11.7%), Crocidura crossei (9.7%), Crocidura flavescens manni (20.4%), Mus musculoides (89.0%), Praomys tullbergi (11.5%), Lophuromys sikapusi (3.6%), Lemniscomys striatus (1.3%), and Arvicanthis niloticus (0.3%). There were monthly variations in the number of Mus musculoides and Crocidura nigeriae. In Mus musculoides breeding was at a maximum at the beginning and towards the end of the wet season and early dry season. In Crocidura nigeriae breeding was maximal during the wet season and low in the dry season. The seasonal changes in the age structure of the two most common species: Mus musculoides and Crocidura nigeriae, are described. © 1989, Cambridge University Press. All rights reserved.",NA,NA
true,https://api.elsevier.com/content/abstract/scopus_id/0024484478,SCOPUS_ID:0024484478,2-s2.0-0024484478,Body Size And Nesting Behaviour Of The Sand Wasp Stictia Heros (Hymenoptera: Sphecidae) In Costa Rica,Journal of Tropical Ecology,02664674,14697831,5,1,117-120,1989-01-01,February 1989,10.1017/S026646740000328X,4,Journal,ar,Article,100,2,23435,undefined,0,FALSE,NA,NA,39,Larsson F.,2,aggregations | body size | Costa Rica | nearest neighbour | nesting | sphecidae | Stictia heros,NA,NA,NA
