@_fa,prism:url,dc:identifier,eid,dc:title,dc:creator,prism:publicationName,prism:issn,prism:eIssn,prism:volume,prism:issueIdentifier,prism:pageRange,prism:coverDate,prism:coverDisplayDate,prism:doi,dc:description,citedby-count,prism:aggregationType,subtype,subtypeDescription,author-count.@limit,author-count.@total,author-count.$,authkeywords,source-id,fund-acr,fund-no,fund-sponsor,openaccess,openaccessFlag,freetoread.value.$,freetoreadLabel.value.$,entry_number
true,https://api.elsevier.com/content/abstract/scopus_id/0026306471,SCOPUS_ID:0026306471,2-s2.0-0026306471,"The effect of water supply on tree seed germination and seedling survival in a tropical seasonal forest in Veracruz, Mexico",Blain D.,Journal of Tropical Ecology,02664674,14697831,7,1,69-83,1991-01-01,February 1991,10.1017/S0266467400005101,"In tropical seasonal forests, mass seedling death may incidentally occur early in the rainy season following untimely germination provoked by an isolated heavy rainfall. We hypothesized that, in a soil with little moisture retention capacity, irregular rainfall patterns would result in large fluctuations of water supply and, in the early wet season, drought episodes could cause seedling death. This hypothesis was tested in a seasonal tropical forest in Mexico where seedling density is low and the soil consists of almost pure sand with a low water retention capacity. Various patterns of simulated rainfall were applied in the forest to seeds and seedlings of three common tree species. Overall very little difference in germination and seedling survival was observed between the various rainfall treatments. The results showed that rainfall patterns and the soil texture may interact in a much more complex way than was initially hypothesized, and that water availability to seeds and seedlings is not necessarily predictable. The absence of seedlings of the three tree species might be better explained by high seed predation and low light level in the understorey. © 1991, Cambridge University Press. All rights reserved.",39,Journal,ar,Article,100,1,1,Brosimum alicastrum | Cedrela odorata | Enterolobium cyclocarpum | germination | Mexico | seasonal | seedling | tropical forest | water supply,23435,NSERC,undefined,Natural Sciences and Engineering Research Council of Canada,0,FALSE,NA,NA,17
true,https://api.elsevier.com/content/abstract/scopus_id/0026306460,SCOPUS_ID:0026306460,2-s2.0-0026306460,Interspecific flowering patterns in the Dipterocarpaceae in West Malaysia: Implications for predator satiation,Toy' R.,Journal of Tropical Ecology,02664674,14697831,7,1,49-57,1991-01-01,February 1991,10.1017/S0266467400005058,"Nanophyes shoreae is a pre-dispersal fruit-predator of several species of Diptero-carpaceae. The timing of oviposition of this weevil was monitored in six trees in Pasoh Forest Reserve, West Malaysia from September 1986 to February 1987. A flowering event occurred during this period. Oviposition started within 12 days after peak anthesis, and continued within any one tree for 11–39 days. Host trees of N. shoreae flowered over a 75 day period. Intraspecific flowering synchrony was high but different species flowered sequentially. The behaviour of N. shoreae and the period of the oviposition ‘window’ strongly suggest that this pre-dispersal fruit-predator ‘tracks’ the sequence of flowering shown by its host species. The implications for predator satiation through mass-flowering of the Dipterocarpaceae are discussed. © 1991, Cambridge University Press. All rights reserved.",23,Journal,ar,Article,100,1,1,Dipterocarpaceae | flowering | fruit-predators | Malaysia | Nanophyes | predator satiation | West,23435,NERC,GT4/84/TLS/4,National Eye Research Centre,0,FALSE,NA,NA,18
true,https://api.elsevier.com/content/abstract/scopus_id/0026304703,SCOPUS_ID:0026304703,2-s2.0-0026304703,Feeding strategy and activity budget of the frugivorous bat Carollia perspicillata (Chiroptera: Phyllostomidae) in French Guiana,Charles-Dominique P.,Journal of Tropical Ecology,02664674,14697831,7,2,243-256,1991-01-01,May 1991,10.1017/S026646740000540X,". The frugivorous phyllostomid bat Carollia perspicillata is closely associated with specific fruits which are found and picked in flight, then eaten at a feeding roost. Each fruit eaten corresponds to a single flight. An apparatus designed for this study permits the simultaneous tracking of 10 bats equipped with double rhythm transmitters (slow rate corresponding to resting position and rapid rate to flying bouts). (1) The number of flights, (2) the percentage time spent flying and (3) the range of activity were recorded for different categories of animals during two periods of fruit production. Heavier males displayed high activity, while other males, non-breeding females and females in early pregnancy displayed a similar pattern of flying behaviour. Full-term pregnant females and lactating females performed almost as many flying bouts as non-reproductive females, but these flights were much shorter. This unexpected feeding strategy can be interpreted as a means of shifting energy to reproductive effort from exploratory behaviour (non-breeding females performed longer flights which combine the survey of environment and the fruit collection). This strategy, based upon the optimization of flying bouts, is in contrast to those of non-flying mammals and probably is only compatible with periods of high food production. © 1991, Cambridge University Press. All rights reserved.",104,Journal,ar,Article,100,1,1,Carollia perspicillata Chiroptera feeding strategy French Guiana frugivory | Phyllostomidae radiotelemetry reproduction time budget,23435,CNRS,URA 1183,Centre National de la Recherche Scientifique,0,FALSE,NA,NA,19
true,https://api.elsevier.com/content/abstract/scopus_id/0026304206,SCOPUS_ID:0026304206,2-s2.0-0026304206,An elephant (Loxodonta africana) survey using dung counts in the forests of the Central African Republic,Fay J.,Journal of Tropical Ecology,02664674,14697831,7,1,25-36,1991-01-01,February 1991,10.1017/S0266467400005022,"In May and June of 1989 data on elephant [Loxodonta africana) dung density were collected in the main forested areas of the Central African Republic. A total of 147.0 km of line transects (N = 14 transects, x = 10.50 km, SD = 3.79) was completed. Dung was recorded in 37.4% of the 294 sectors of 0.5 km each. The overall dung density was estimated to be 266 piles km-2(x = 382, SD = 383.7). The highest dung density was found in the proposed Dzanga-Sangha Reserve in the extreme south-west with 1166 piles km-2(N = 12 sectors of 0.5 km). The south-eastern forests were found to have an intermediate dung density of 336 piles km-2(N = 215 sectors of 0.5 km, x = 419, SD = 308). In the eastern section of the south-western forests no dung was recorded along survey transects (N = 67 sectors of 0.5 km). These data indicate that elephant populations are still relatively high in the forests of south-western and south-eastern Central African Republic, while the population in the eastern section of the south-western forests has diminished to a very low level. © 1991, Cambridge University Press. All rights reserved.",34,Journal,ar,Article,100,1,1,Central African Republic | dung counts | elephants | forest | Loxodonta africana | survey,23435,NA,undefined,NA,0,FALSE,NA,NA,20
true,https://api.elsevier.com/content/abstract/scopus_id/0026302745,SCOPUS_ID:0026302745,2-s2.0-0026302745,"Litterfall and nutrient fluxes in two montane tropical rain forests, Colombia",Veneklaas E.J.,Journal of Tropical Ecology,02664674,14697831,7,3,319-336,1991-01-01,August 1991,10.1017/S0266467400005587,"Litterfall was sampled during one year in two undisturbed Andean forests at altitudes of 2550 and 3370m in the Colombian Cordillera Central. Total small litterfall at 2550 and 3370m was 7.03 and 4.31 tha-1y-1respectively, of which 4.61 and 2.82 were leaves, 1.06 and 0.76 woody parts, 0.66 and 0.27 reproductive parts, 0.22 and 0.23 epiphytes, 0.47 and 0.23 unclassified. Clear differences were also found in nutrient concentrations, both between different litter fractions from one site and between equivalent litter fractions from different sites. Weighted mean concentrations for total small litterfall were (mgg-1, at 2550 and 3370m respectively): 11.7 and 7.3 for nitrogen; 0.86 and 0.44 for phosphorus; 8.4 and 3.1 for potassium. Comparison of nutrient concentrations in crown leaves and shed leaves indicated important reallocation of nitrogen (39% at both sites) and phosphorus (45% at 2550 m, 65% at 3370 m) before leaf shedding. The results for litterfall amounts, litter nutrient concentrations and reallocation of nutrients in the two forests are consistent with such data obtained in other montane forests in the wet tropics. © 1991, Cambridge University Press. All rights reserved.",79,Journal,ar,Article,100,1,1,Colombia | litterfall | montane tropical rain forest | nutrients | reallocation,23435,NA,undefined,NA,0,FALSE,NA,NA,21
true,https://api.elsevier.com/content/abstract/scopus_id/0026302734,SCOPUS_ID:0026302734,2-s2.0-0026302734,Comparative Effects Of Acacia Albida And Kigelia Africana Trees On Soil Characteristics In Zambezi Riverine Woodlands,Dunham K.,Journal of Tropical Ecology,02664674,14697831,7,2,215-220,1991-01-01,May 1991,10.1017/S026646740000537X,"Soil nutrient concentrations under Acacia albida and Kigelia africana trees growing in Zambezi riverine woodlands were compared with soils in the open, beyond tree canopies. Concentrations of N, C, P and K were higher under tree canopies. Concentrations of Ca and Mg were unchanged. Soils were slightly more acid under A. albida trees relative to open soil, but were less acid under K. africana. Soil P concentration was higher under K. africana than under A. albida. Otherwise, the two species had similar effects on soil fertility. Despite previous claims, A. albida is probably no more efficient at increasing soil fertility than other savanna trees. © 1991, Cambridge University Press. All rights reserved.",26,Journal,ar,Article,100,1,1,Acacia albida | Kigelia africana | soil fertility | Zambezi,23435,NA,undefined,NA,0,FALSE,NA,NA,22
true,https://api.elsevier.com/content/abstract/scopus_id/0026296062,SCOPUS_ID:0026296062,2-s2.0-0026296062,"Germination ecology of the woody herb Uraria picta, from southern Nigeria",Okusanya O.,Journal of Tropical Ecology,02664674,14697831,7,1,139-146,1991-01-01,February 1991,10.1017/S0266467400005204,"The germination response of Uraria picta to five environmental factors was investigated. It germinated both in light and dark but germination in the light was significantly better than in the dark; there was further germination when seeds first placed in the dark were later brought into the light. It germinated well in the three soil types used but germination in humus and sand was significantly better than in red earth. There was an increase in germination with an increase in burial up to 1.5 cm, thereafter germination levelled off. There was no germination in water-logged conditions and there was an increase in germination as soil moisture decreased. Alternating temperatures of 31/21 °C and 31/15°C favoured germination while 21/15°G inhibited germination. The results are discussed in relation to the phenology and distribution of the species. © 1991, Cambridge University Press. All rights reserved.",7,Journal,ar,Article,100,3,3,ecology | germination | Nigeria | Uraria picta,23435,NA,undefined,NA,0,FALSE,NA,NA,23
true,https://api.elsevier.com/content/abstract/scopus_id/0026295881,SCOPUS_ID:0026295881,2-s2.0-0026295881,Solar energy conversion efficiencies during succession of a tropical rain forest in Amazonia,Saldarriaga J.,Journal of Tropical Ecology,02664674,14697831,7,2,233-242,1991-01-01,May 1991,10.1017/S0266467400005393,"Mean annual quantities of solar radiation absorbed during various stages of regeneration of a tropical rain forest in the upper Rio Negro valley of Colombia and Venezuela were estimated for the consecutive intervals between clear-cut and 1, 3, 10, 20, 35, 60, 80 and 200 years of growth. Forest phytomass and litter fall data from each of these stages were used to calculate the mean annual net dry matter production per unit of absorbed photosynthetically active radiation (PAR), the PAR conversion efficiency. The quantities of PAR absorbed by the forest stands were calculated from the leaf area index values with an extinction coefficient for PAR of 0.74, a PAR albedo of 0.04, and an annual mean incoming PAR of 2.86GJ m-2y-1. Efficiency decreased with increase in successional stage. During the first 10 years of rcgrowth, the efficiency of conversion of PAR into above-ground phytomass averaged 0.23 g MJ ldecreasing to 0.07 g MJ-1over the following 50 years. Inclusion of annual root production in the calculations resulted in a small increase in PAR conversion efficiency; however, efficiency was more than doubled for some periods when the annual leaf and twig litterfall were included. Efficiency values for above-ground production were much lower than PAR conversion efficiency values estimated for above-ground production of temperate forests. © 1991, Cambridge University Press. All rights reserved.",31,Journal,ar,Article,100,1,1,Amazonia | leaf area index | litterfall | photosynthetically active radiation | phytomass | root growth,23435,USDOE,DE-AC05-84OR21400,U.S. Department of Energy,0,FALSE,NA,NA,24
true,https://api.elsevier.com/content/abstract/scopus_id/0026292692,SCOPUS_ID:0026292692,2-s2.0-0026292692,"Microbial biomass and relative contributions of bacteria and fungi in soil beneath tropical rain forest, Hainan Island, China",Yang J.C.,Journal of Tropical Ecology,02664674,14697831,7,3,385-393,1991-01-01,August 1991,10.1017/S0266467400005678,"Soil microbial biomass (Cmit) and its relation with soil carbon and nutrient contents in a tropical rain forest (Bawangling Nature Reserve, Hainan Island, P.R. China) were studied. Cmicwas determined by the substrate induced respiration (SIR) method; bacterial and fungal fractions were measured using a selective inhibition technique. For the A horizon, Cmicranged between 350 and 700μgg-1soil in April (beginning of the rainy season) and 250-600μgg-1in October (end of the rainy season). Cmk. contents of the AB and B horizons were lower, ranging from 80 to 350μg Cmicg-lsoil. On average, 75% of the biomass was bacterial, in the AB and B horizon this was slightly higher than in the A horizon. Cmicwas closely correlated with Corgand N content. N and P contents as well as the respiratory response upon glucose addition indicated that towards the end of the rainy season compared with the start the soils were depleted in nutrients. These observations stress the importance of microbial biomass as a factor for nutrient retention in tropical forest ecosystems. © 1991, Cambridge University Press. All rights reserved.",35,Journal,ar,Article,100,1,1,bacterial biomass | fungal biomass | microbial biomass | selective inhibition | soil | tropical rain forest,23435,NA,undefined,NA,0,FALSE,NA,NA,25
true,https://api.elsevier.com/content/abstract/scopus_id/0026283595,SCOPUS_ID:0026283595,2-s2.0-0026283595,Acclimation of seedlings of three mexican tropical rain forest tree species to a change in light availability,Popma J.,Journal of Tropical Ecology,02664674,14697831,7,1,85-97,1991-01-01,February 1991,10.1017/S0266467400005137,"A comparison is made of the light acclimation potential of seedlings of three canopy species of the tropical rain forest of Los Tuxlias, Mexico: Cordia megalantha, Lonchocarpus guatemalensis, and Omphalea oleifera. These species showed similar growth rates in a range of microhabitats. Gap dynamics were simulated by transferring plants between three environments: beneath a closed canopy, a small gap, and a large gap. Plants of all three species were able to adjust their morphology and growth rates in response to changes in light availability. Growth rates increased when plants were moved to a (larger) gap, and decreased when plants were moved to a more shaded environment. Shade-grown plants were able to acclimate faster to increasing light availability than sun-grown plants to decreasing light availability. Also, plants moved from shady to sunny conditions showed higher relative growth rates than sun control plants, whereas sun-grown plants when moved to the shade showed lower relative growth rates than shade control plants. Species differed in their response to gap dynamics. Omphalea could not acclimate morphologically to shading, but reacted faster than the other species in response to the occurrence of a large gap. Acclimation potential seemed to be related to plasticity in physiological rather than in morphological traits. Suppressed seedlings of all three species performed well in the shade, and were able to acclimate rapidly to gap-conditions. © 1991, Cambridge University Press. All rights reserved.",67,Journal,ar,Article,100,1,1,acclimation | biomass allocation | Cordia megalantha | growth | Lonchocarpus guatemalensis | Los Tuxtlas | Mexico | morphology | Omphalea oleifera | tree seedlings | treefall gaps | tropical rain forest,23435,NA,undefined,NA,0,FALSE,all,All Open Access,26
true,https://api.elsevier.com/content/abstract/scopus_id/0026278828,SCOPUS_ID:0026278828,2-s2.0-0026278828,Population dynamics of earthworms and their activity in forest ecosystems of north-east India,Bhadauria T.,Journal of Tropical Ecology,02664674,14697831,7,3,305-318,1991-01-01,August 1991,10.1017/S0266467400005575,". A comparative analysis of earth worm populations in seral Khasi pine forest represented by Pinus kesiya 5- and 35-year old stands, and a climax broad-leaved mixed forest represented by a sacred grove was done at altitudes of 1500m in Meghalaya in north-east India. Tonoscolax horaii occurred under all forest types whereas Amynthas diffringens and Eutyphoeus festivus were confined to pine forest stands only. Perionyx sp. and Drawida assamensis were restricted to the sacred grove. T. horaii had larger numbers in all three different forest types. This species offers possibilities of vermiculturc for biologically improving soil fertility in manmade ecosystems because of its wide range of tolerance. Generally earthworm populations were more active during the monsoon season; A. diffringens was however, more active during the winter, thereby conferring an advantage on this species as it was enabled to avoid competition during the monsoon season when other species dominate. Earthworm activity was generally higher in the sacred grove than in the pine forest stands. Population size was significantly correlated with soil moisture, temperature and pH. Wormcasts had a higher pH and nutrient status than the soil. In the highly leached soils of the humid tropics where there is a large concentration of fine root biomass in the surface soil layers, earthworm activity is beneficial because it helps incorporate detritus into the mineral soil rapidly and locally concentrates nutrients in the surface layers. © 1991, Cambridge University Press. All rights reserved.",26,Journal,ar,Article,100,2,2,Annelida | earthworms | forest ecosystems | groves | India | nutrient cycling | Pinus | sacred,23435,NA,undefined,"Department of Science and Technology, Government of Kerala",0,FALSE,NA,NA,27
true,https://api.elsevier.com/content/abstract/scopus_id/0026278803,SCOPUS_ID:0026278803,2-s2.0-0026278803,Population dynamics and production of the rocky stream-dwelling fish Garra ceylonensis (Cyprinidae) in Sri Lanka,De Silva K.,Journal of Tropical Ecology,02664674,14697831,7,3,289-303,1991-01-01,August 1991,10.1017/S0266467400005551,"A population of Garra ceylonensis in a rocky, hill stream was studied by monthly sampling over a period of two years. The monthly population density, which varied from 1.28 to 4.16 m-2with a mean of 2.37 m-2, was negatively correlated with the water speed. Asymptotic length (L∞) and the growth constant (K) were found to be 180.5 mm total length and 0.62. Maximum size observed was 174 mm, which is attained in about five years, but 99% of the population had a life expectancy of less than 3.4 years. The overall male to female ratio of the population was 0.58. The sex ratio was 1.0 in smaller size classes but decreased steadily with increasing size. There was a major spawning season following the main rainy period in contrast to the trend of most tropical freshwater fish species, which show enhanced breeding during the rainy season. The mean length and age at sexual maturity in females appear to be 109 mm and eighteen months. Fecundity varied between 740 and 4390. Average longevity and natural mortality were 4.8 years and 1.86. The mean biomass, average annual production and turnover ratio of the population were about 23.7 gm-2wet weight, 41.2gm-2and 1.7, respectively. © 1991, Cambridge University Press. All rights reserved.",12,Journal,ar,Article,100,1,1,biology | biomass | Cyprinidae | fish | Garra | population ecology | production | reproductive | Sri Lanka,23435,NA,undefined,NA,0,FALSE,NA,NA,28
true,https://api.elsevier.com/content/abstract/scopus_id/0026278063,SCOPUS_ID:0026278063,2-s2.0-0026278063,Comparative biology of Neotropical epiphytic and saxicolous Tillandsia species: Population structure,Bennett B.,Journal of Tropical Ecology,02664674,14697831,7,3,361-371,1991-01-01,August 1991,10.1017/S0266467400005630,"In comparing the population structure of epiphytic and saxicolous Tillandsia species I found no significant differences between polycarpic species. Epiphytic T. ionochroma populations had a higher seedling:adult ratio than saxicolous T. ionochroma populations, but the difference was not statistically significant. Tillandsia ultriculata, a monocarpic epiphyte, had a significantly higher seedling:adult ratio than the polycarpic species. T. utriculata‘s higher ratio may result from its greater seed production and lack of vegetative propagation. Unlike the polycarpic species, all adult-size rosettes grow from seeds in T. utriculata. Tillandsia sphaerocephala, an obligate saxicole, occurred in larger clusters (i.e. more rosettes per genet) than T. ionochroma. The increased tendency for vegetative reproduction in T. sphaerocephala suggests that spatial patchiness is less of a constraint than with epiphytes. © 1991, Cambridge University Press. All rights reserved.",15,Journal,ar,Article,100,1,1,Bromeliaceae demography epiphytes Peru population structure southern Florida | Tillandsia,23435,NSF,BNS 8313190,National Science Foundation,0,FALSE,NA,NA,29
true,https://api.elsevier.com/content/abstract/scopus_id/0026277258,SCOPUS_ID:0026277258,2-s2.0-0026277258,Interactive ecology of two cohabiting characin fishes (Astyanax fasciatus and Astyanax bimaculatus) in an eutrophic Brazilian reservoir,Arcifa M.,Journal of Tropical Ecology,02664674,14697831,7,2,257-268,1991-01-01,May 1991,10.1017/S0266467400005423,"The competitive interactions between two species of characins (Astyanax fasciatus and Astyanax bimaculatus) were investigated by studying their horizontal distribution, relative abundance and feeding habits in littoral and limnetic zones of Americana Reservoir, southern Brazil. Differences in horizontal distribution of the species mainly as adults led to their partial habitat segregation. Most adult A. bimaculatus were littoral dwellers, whereas A. fasciatus adults were distributed from inshore to offshore waters, but with most in the latter region. Both are facultative zooplanktivores in the reservoir, feeding mostly on planktonic crustaceans, insects (chiefly chironomids), some higher plant material, detritus and even fish scales (A. bimaculatus). Food overlap coefficients, considering adult and juvenile stages of both species are large in dry as well as wet seasons, although in the dry season the overlaps are significantly reduced for juveniles of both species and for juveniles of A. bimaculatus versus adults of A. fasciatus. Both species prey more on cladocerans than on cyclopoid copepods, and the adults selectively take larger forms (Daphnia gessneri and Moina micrura) in the reservoir (as in previously reported enclosure experiments). Juveniles prey heavily on Bosmina longirostris. These two formerly riverine species may reduce competition, in the reservoir, by partial habitat segregation in older stages, a mechanism to avoid competition, which may have existed in their previous interactive history in rivers. © 1991, Cambridge University Press. All rights reserved.",41,Journal,ar,Article,100,2,2,Astyanax Brazil Characidae tropical fish interaction food overlap competition | reservoir selective predation,23435,NSERC,undefined,Natural Sciences and Engineering Research Council of Canada,0,FALSE,NA,NA,30
