@_fa,prism:url,dc:identifier,eid,dc:title,prism:publicationName,prism:issn,prism:eIssn,prism:volume,prism:issueIdentifier,prism:pageRange,prism:coverDate,prism:coverDisplayDate,prism:doi,citedby-count,prism:aggregationType,subtype,subtypeDescription,author-count.@limit,author-count.@total,source-id,fund-no,openaccess,openaccessFlag,entry_number,dc:creator,author-count.$,fund-acr,fund-sponsor,dc:description,authkeywords
true,https://api.elsevier.com/content/abstract/scopus_id/0024197478,SCOPUS_ID:0024197478,2-s2.0-0024197478,Herpetofauna of a northern australian monsoon rain forest: Seasonal changes and relationships to adjacent habitats,Journal of Tropical Ecology,02664674,14697831,4,3,227-238,1988-01-01,August 1988,10.1017/S0266467400002790,5,Journal,ar,Article,100,2,23435,undefined,0,FALSE,20,Martin K.,2,NA,NA,"The herpetofauna of a floodplain monsoon rain forest in northern Australia is composed primarily of species from non rain forest habitats. The majority of frog species use rain forest as a seasonal refuge, and there is a marked increase m numbers during the dry season. Faunal richness lies within limits expected on the basis of the length of the dry season and species ricluiesses of non-Australian faunas. There are few lizard species and an abundance of frog species (none of which is a rain forest specialist) in comparison to rain forest herpetofaunas in other tropical regions. The impoverished lizard fauna, and the paucity of rain forest specialists may be because (a) seasonal invasion of rain forest by frogs prevents evolution of, or colonization by, specialists or (b) rain forest specialists may not have been able to cross semi-and habitats separating the Northern Territory from eastern Australian rain forests. The her-pc to faunas of monsoon forests in Cape York Peninsula may provide a means of distinguishing between these hypotheses. © 1988, Cambridge University Press. All rights reserved.",Australia | dry season | frogs | herpetofauna | lizards | rain forest | refugia | species nchness
true,https://api.elsevier.com/content/abstract/scopus_id/0024196628,SCOPUS_ID:0024196628,2-s2.0-0024196628,Input of wind-dispersed seeds into light-gaps and forest sites in a neotropical forest,Journal of Tropical Ecology,02664674,14697831,4,3,239-252,1988-01-01,August 1988,10.1017/S0266467400002807,53,Journal,ar,Article,100,1,23435,BSR 8219856,0,FALSE,21,Augspurger C.K.,1,NSF,National Science Foundation,"A total of 52, 467 wind-dispersed seeds from 14 tree and 32 liana species fell into 1720 seed traps in 43 paired light-gap and adjacent forest sites on Barro Colorado Island, Panama. Summed at the community level, many more wind-dispersed seeds were collected from light-gaps (61%) than from forest sites (39%). They accumulated from March through May, 1984 to a density of 328 m~ain gaps and 207 m2 in forest sites. In contrast, only 33% of the total of 2782 non-wind-dispersed seeds were collected m gaps. Due to the extreme heterogeneity of the seed rain, these differences between gap and forest sites were not statistically significant at the community-leveL Gap sites received more wind-dispersed seeds than adjacent forest sites in only 20 of 43 locations and in 13 of 20 species, especially those with individuals of high fecundity near gap sites. Of the estimated 105 million wind-dispersed seeds contributing to the seed rain of the 50 ha study plot, only 4.1% were dispersed to the rare gap sites that enhance the establishment and growth of seedlings for many of these species. © 1988, Cambridge University Press. All rights reserved.",lianas | light-gaps | Neotropics | non-wind-dispersed seeds | Panama | seed density | seed ram | trees | tropical forest | wind-dispersed seeds
true,https://api.elsevier.com/content/abstract/scopus_id/0024195795,SCOPUS_ID:0024195795,2-s2.0-0024195795,A re-assessment of effects of fire on miombo regeneration in the zambian copperbelt,Journal of Tropical Ecology,02664674,14697831,4,4,361-372,1988-01-01,November 1988,10.1017/S0266467400003011,51,Journal,ar,Article,100,1,23435,undefined,0,FALSE,22,Chidumayo E.,1,NA,NA,"In 1933/34 eight coppice plots were established in Brachystegia-Julbernardia (miombo) woodland at Ndola in the Copperbelt area of Zambia by the Forestry Department. These plots have been maintained under fire protection, annual early or late dry season burning since 1934/35. Before establishment stems over 20.3 cm girth at breast height were enumerated. Three of the eight plots (one fire protected and two annually early burnt) were enumerated in 1982, 48–49 years after establishment. In addition, a coppice plot at Chitwi, 16 km southwest of the Ndola plots, cleared in 1972 and left to regenerate naturally was enumerated in May 1982 and August 1986 to assess woody plant growth. The density of stems over 20.0 cm girth in the 13-year-old coppice at Chitwi was 2.5 times that in an adjacent shelterbelt woodland. The stem density in the fire protected plot at Ndola in 1982 was 86% of the pre-felling density while in one of the early burnt plots it was 95% of the pre-felling density. The protected plot had the lowest species diversity after 49 years, largely because of the loss of 11 understorey species that were present before felling. There were no significant differences in stem mean girth at breast height (gbh) of canopy species in the Ndola plots under fire protection and early burning regimes. Mean annual gbh increments of abundant species were estimated at 1.17–2.21 cm yr_1 and 0.59–1.42 cm yr_1 during 0–9 and 0–49 year age-periods, respectively. Estimated mean annual basal area increments for stems over 30 cm gbh were 0.35 m2 ha–1 for the 13-year-old coppice and 0.24–0.27 m2 ha–1 for the 49-year-old coppice. These results indicate a decrease in both gbh and basal area increment with increasing age of miombo coppice. © 1988, Cambridge University Press. All rights reserved.",basal area | burning | girth increment | miombo | species diversity | Zambia
true,https://api.elsevier.com/content/abstract/scopus_id/0024195790,SCOPUS_ID:0024195790,2-s2.0-0024195790,"Litterfall in an Australian population of Mimosa pigra, an invasive tropical shrub",Journal of Tropical Ecology,02664674,14697831,4,4,381-392,1988-01-01,November 1988,10.1017/S0266467400003035,26,Journal,ar,Article,100,1,23435,undefined,0,FALSE,23,Lonsdale W.M.,1,NA,NA,"An investigation of seasonal changes in litterfall in a dense stand of the invasive tropical shrub Mimosa pigra was carried out in northern Australia between October 1984 and December 1986. Total annual litterfall averaged 758 g m-2, close to the value predicted for the latitude and altitude of the site. Leaf litter formed 56.6% of this total, woody material 22.7%, and reproductive material 20.7%. Total litterfall was strongly seasonal, at a maximum in the late wet season or early dry season, and at a minimum late in the dry season. A broadly similar pattern was shown by the various components of the litter, except for woody litterfall, which followed no strong seasonal trend. Variation in the amount of available soil moisture, as calculated from a simple water balance model, accounted for much of the variation in the components of litterfall. The proportion of all initiated flower heads which produce seeds was estimated to be between 2.1 and 4.5%. The mean annual seed fall was 9103 m-2, nearly two orders of magnitude higher than most native shrub populations, and it is argued that this is partly a result of the absence of natural enemies in the introduced range. © 1988, Cambridge University Press. All rights reserved.",alien weed | Australia | flower production | litterfall | Mimosa pigra | reproductive allocation | seed production
true,https://api.elsevier.com/content/abstract/scopus_id/0024195630,SCOPUS_ID:0024195630,2-s2.0-0024195630,The mosaic theory of forest regeneration and the determination of forest composition in Ghana,Journal of Tropical Ecology,02664674,14697831,4,3,253-269,1988-01-01,August 1988,10.1017/S0266467400002819,81,Journal,ar,Article,100,2,23435,undefined,0,FALSE,24,Swaine M.D.,2,NA,Carnegie Trust for the Universities of Scotland,"Early studies comparing adult and juvenile tree populations in West Africa described a contrast in flonstic composition between the two age classes. These studies have been mis-represented in more recent literature, and confusion has arisen over their interpretation. Similar comparisons are reported here for six forest sites in Ghana. At any one site, clear differences in composition were recognized between adult and juvenile samples, but in terms of the variation in flonstic composition over the whole of the forest zone, they are slight and forest types appear to ‘breed true’. At one site, Kade, compositional differences between size classes are fully described for all canopy species on a 0.25 ha plot. There was an abrupt change in composition at about 30 cm gbh. At this site, mortality rates for trees >30 cm gbh were greater amongst species with a high proportion of juveniles in the population. At other sites, changes in composition were sometimes abrupt, occurring at various size classes, or were more gradual. The populations of some species included a large number of juveniles at all sample sites, but the converse, where species always have low densities of juveniles, were not seen. The possible implications of these results for future canopy composition are discussed in relation to temporal equilibrium, or lack of it, in tropical forest composition. © 1988, Cambridge University Press. All rights reserved.",equilibrium | forest composition | forest dynamics | forest types | Ghana | mortality | mosaic theory | regeneration | tropical forest
true,https://api.elsevier.com/content/abstract/scopus_id/0024193373,SCOPUS_ID:0024193373,2-s2.0-0024193373,Pioneer species distribution in treefall gaps in neotropical rain forest; a gap definition and its consequences,Journal of Tropical Ecology,02664674,14697831,4,1,77-88,1988-01-01,February 1988,10.1017/S0266467400002534,77,Journal,ar,Article,100,4,23435,undefined,0,FALSE,25,Popma J.,4,NA,NA,"An attempt was made to evaluate the consequences of applying a strict definition (Brokaw 1982a) to the delimitation of forest gaps in the field. The northernmost Neotropical rain forest, at Los Tuxtlas, Mexico, was searched for young (1-2 years old) single-event gaps that would meet the criteria of the definition. In 60 ha of rain forest, only 12 such gaps containing pioneer species could be found. Thirty-three pioneer species (shrubs and trees) were used as indicator species for gap conditions. Gap size, measured as projected canopy opening (sensu Brokaw 1982a), underestimated from 44 to 515% the size of the area colonized by pioneer species. On average the size of the colonized area was 3.4 times larger than the size of the projected canopy opening. The majority of the pioneer species showed a relative preference for gap borders, an area generally not included in the projected canopy opening. Pioneer plant abundance and density, and species richness and density, did not differ significantly between gap centres and gap borders. Floristical variation was not related to gap size or location in the gap. These findings can be explained if gap environment (to which pioneer plants respond) is seen as the result of many interacting factors, of which size of the canopy opening is only one. It is concluded that the definition for delimiting gaps in the field as proposed by Brokaw (1982a) cannot be regarded a generally applicable definition, and that its value as a comparative standard is doubtful. © 1988, Cambridge University Press. All rights reserved.",gap definition | Neotropics | pioneer community | pioneer species distribution | treefall gaps | tropical rain forest
true,https://api.elsevier.com/content/abstract/scopus_id/0024192899,SCOPUS_ID:0024192899,2-s2.0-0024192899,Vegetation damage in an oil field in the niger delta of nigeria,Journal of Tropical Ecology,02664674,14697831,4,1,61-75,1988-01-01,February 1988,10.1017/S0266467400002510,18,Journal,ar,Article,100,2,23435,undefined,0,FALSE,26,Fagbami A.A.,2,NA,NA,"An investigation into the causes of massive destruction of the vegetation around Tsekelewu Oil Field in the Niger Delta was carried out. The 200 km2 area suffering varying degrees of damage was mapped and the damage quantified by photo interpretation of black and white aerial photographs. Soil, surface and ground water samples were taken from the various zones for chemical analyses which included the determination of pH, electrical conductivity and soluble salt analysis. The results showed that salt accumulation decreased from the sea inland-wards, with some upsurge in the saline-fresh water transitional zone where the greatest damage occurred. The electrical conductivity of the ground water varied from 45 dS m-1 in the area of greatest damage to less than 4 dS m-1 in the fresh water zone where there was no apparent damage. The salt-tolerant species along the coast were not affected, but in the transitional saline-fresh water zone in which the electrical conductivity of ground water was greater than 30 dS m-1, all the vegetation including the relatively salt-tolerant white mangrove (Avicennia africana) were killed. This destruction is attributed to high salinity caused by salt water incursion from the sea. © 1988, Cambridge University Press. All rights reserved.",electrical conductivity | fresh water vegetation | mangrove vegetation | Nigeria | salt accumulation | salt tolerance
true,https://api.elsevier.com/content/abstract/scopus_id/0024192838,SCOPUS_ID:0024192838,2-s2.0-0024192838,Fish communities of a perturbed stream in Southern Nigeria,Journal of Tropical Ecology,02664674,14697831,4,1,49-59,1988-01-01,February 1988,10.1017/S0266467400002492,19,Journal,ar,Article,100,2,23435,undefined,0,FALSE,27,Victor R.,2,NA,Royal Canadian Geographical Society,"Fish communities of a fourth order stream impounded by a weir were studied in Southern Nigeria. Fifty-eight species were recorded of which 90% occurred upstream while reservoir and downstream accounted for 48% and 43% respectively. The distribution of some fish families indicated the effects of habitat alterations caused by reservoir and downstream conditions. The fauna upstream was different from that of reservoir and downstream. Relative abundance of non-cichlids common to reservoir and downstream showed 42% similarity. The longitudinal distribution of three non-cichlid populations was different in reservoir and downstream. Non-cichlid species richness was almost similar in reservoir and downstream, but its general diversity and evenness were higher in reservoir than its downstream. Fish community changes in this stream are discussed. © 1988, Cambridge University Press. All rights reserved.",Africa | communities | fish Nigeria | perturbations | reservoir | stream | tropics
true,https://api.elsevier.com/content/abstract/scopus_id/0024191361,SCOPUS_ID:0024191361,2-s2.0-0024191361,"Jamaican limestone forests: Floristics, structure and environment of three examples along a rainfall gradient",Journal of Tropical Ecology,02664674,14697831,4,2,121-156,1988-01-01,May 1988,10.1017/S0266467400002649,57,Journal,ar,Article,100,1,23435,undefined,0,FALSE,28,Kelly D.L.,1,MBG,Missouri Botanical Garden,"We describe forests from three areas of Jamaica, all on White Limestone but with markedly different rainfall regimes. The areas are Hog House Hill in the north-east with lower montane rain forest at c. 450 m altitude with a rainfall of c. 4000 mm yr-1; Broom Hall in the centre of the island with evergreen seasonal forest at c. 670 m altitude and with a rainfall of c. 1600 mm yr-1 and a marked dry season; and Round Hill near the south coast with dry semi-evergreen forest at c. 300 m altitude with an irregularly distributed rainfall of c. 1000 mm yr1. Species lists were made from c. 180 ha at Hog House Hill, c. 5 ha at Broom Hall and c. 50 ha at Round Hill, and detailed inventories made of five sample sites of c. 1000 m2, two at Hog House Hill, one at Broom Hall and two at Round Hill. At Hog House Hill we listed 280 vascular plant species, including 118 species of trees and larger shrubs; at Broom Hall 247 and 135; at Round Hill 129 and 81. Species-area and species-individuals curves confirm that Broom Hall was richer in tree species than Hog House Hill. The wetter forests contain high proportions of species endemic to Jamaica: 40% of the total flora at Hog House Hill and 36% at Broom Hall. Canopy height decreased from c. 26–28 m at Hog House Hill to c. 13–24 m at Broom Hall to c. 8–15 m at Round Hill. Predominant leaf size decreased from mesophyll at Hog House Hill to notophyll at Broom Hall to microphyll at Round Hill. Compared with forests on other Caribbean islands, the Jamaican forests appear to be as species-rich as any, but lower in stature than natural forest in Trinidad and Dominica. Continental Neotropical forests are both more species-rich and taller. © 1988, Cambridge University Press. All rights reserved.",Caribbean region | diversity | island floras | Jamaica | leaf size | life form | Neo-tropics | rain forest | species-richness | xeric forest
true,https://api.elsevier.com/content/abstract/scopus_id/0024190654,SCOPUS_ID:0024190654,2-s2.0-0024190654,Oligochaetes in fire climax grassland and conifer plantations in papua new guinea,Journal of Tropical Ecology,02664674,14697831,4,1,39-48,1988-01-01,February 1988,10.1017/S0266467400002480,9,Journal,ar,Article,100,1,23435,undefined,0,FALSE,29,Standen V.,1,BES,Royal Society,"Earthworm populations in grassland and plantations in the area of Bulolo, Papua New Guinea were compared with populations in nearby undisturbed rain forest. The grasslands had been maintained by burning for many years. The Pinus plantation had been developed on a burned grassland site and the Araucaria plantation on a site which had been cleared of secondary forest. The grasslands and the Pinus plantation supported moderate populations of exotic earthworms including Pontoscolex corethrurus, but no indigenous species. The Araucaria site supported a native species, Amynthas zebrus only, which was also found together with two other native species at very low density in rain forest. Exotic earthworm species widespread throughout the tropics, were present in disturbed soils and formed moderately high density populations in burned grasslands. There was no evidence that they displaced native Megascolecidae in rain forest. KEY WORDS: earthworms, fire climax, Glossoscolecidae, Megascolecidae, oligochaetes, Papua New Guinea. © 1988, Cambridge University Press. All rights reserved.",earthworms | fire climax | Glossoscolecidae | Megascolecidae | oligochaetes | Papua New Guinea
true,https://api.elsevier.com/content/abstract/scopus_id/0024186462,SCOPUS_ID:0024186462,2-s2.0-0024186462,Light gaps and long-term seedling performance of a Neotropical canopy tree,Journal of Tropical Ecology,02664674,14697831,4,4,407-411,1988-01-01,November 1988,10.1017/S0266467400003084,16,Journal,ar,Article,100,1,23435,undefined,0,FALSE,30,De Steven D.,1,"NAS",National Academy of Sciences,NA,canopy-gap dynamics | Dipteryx panamensis | Leguminosae | Neotropics | Panama | seedling demography
true,https://api.elsevier.com/content/abstract/scopus_id/0024182718,SCOPUS_ID:0024182718,2-s2.0-0024182718,Dietary observations on some tetrigids (Orthoptera: Caelifera) from Sulawesi (Indonesia),Journal of Tropical Ecology,02664674,14697831,4,4,403-406,1988-01-01,November 1988,10.1017/S0266467400003072,9,Journal,ar,Article,100,3,23435,48,0,FALSE,31,Reynolds J.,3,RES,Royal Entomological Society,NA,decomposers | feeding studies | Indonesia | leaf litter Orthoptera | streambank habitat | Tetrigidae | xylophagys
true,https://api.elsevier.com/content/abstract/scopus_id/0024159156,SCOPUS_ID:0024159156,2-s2.0-0024159156,Tropical forests: Much more than stocks of wood,Journal of Tropical Ecology,02664674,14697831,4,2,209-221,1988-01-01,May 1988,10.1017/S0266467400002728,68,Journal,ar,Article,100,1,23435,undefined,0,FALSE,32,Myers N.,1,NA,NA,"Tropical forests offer many more products than the category for which they are best known, viz. wood products. They can supply a host of raw materials, such as resins, oils, fibres and fruits, which collectively represent a commercial value far higher than is generally recognized. In addition they provide an exceptional abundance and variety of genetic resources, which make substantial contributions to modern agriculture, medicine, industry and energy. On top of these materials, tropical forests supply significant environmental benefits, such as protection of the soil and safeguards for watershed systems. While it is sometimes difficult to quantify the economic values of these diverse goods and services, they are often to be reckoned as equal to, if not higher than, the marketplace values represented by the commercial hardwood timber. Yet when the forests are exploited for their hardwood timber, the process is usually so disruptive to forest ecosystems that the other outputs are severely reduced. By contrast, one may exploit the forests for their other outputs with virtually no disruption to forest ecosystems. The paper describes the main categories of non-wood products available from tropical forests, analyses their relative worth, and offers summarized proposals for an expanded approach to forest development in order to take integrative account of the full range of forest benefits. © 1988, Cambridge University Press. All rights reserved.",economic externalities | environmental services | genetic resources | inter-sectoral linkages | minor forest products | tropical forests
true,https://api.elsevier.com/content/abstract/scopus_id/0000061736,SCOPUS_ID:0000061736,2-s2.0-0000061736,Mangrove understorey absence: A consequence of evolution?,Journal of Tropical Ecology,02664674,14697831,4,3,311-314,1988-01-01,August 1988,10.1017/S0266467400002881,38,Journal,ar,Article,100,2,23435,undefined,0,FALSE,33,Snedaker S.,2,NA,NA,NA,NA
