@_fa,prism:url,dc:identifier,eid,dc:title,prism:publicationName,prism:issn,prism:eIssn,prism:volume,prism:issueIdentifier,prism:pageRange,prism:coverDate,prism:coverDisplayDate,prism:doi,citedby-count,prism:aggregationType,subtype,subtypeDescription,author-count.@limit,author-count.@total,source-id,fund-no,openaccess,openaccessFlag,freetoread.value.$,freetoreadLabel.value.$,entry_number,dc:creator,author-count.$,authkeywords,dc:description,fund-acr,fund-sponsor
true,https://api.elsevier.com/content/abstract/scopus_id/84974489716,SCOPUS_ID:84974489716,2-s2.0-84974489716,Erratum,Journal of Tropical Ecology,02664674,14697831,5,3,354,1989-01-01,August 1989,10.1017/S0266467400003795,0,Journal,er,Erratum,100,0,23435,undefined,1,TRUE,all,All Open Access,1,NA,NA,NA,NA,NA,NA
true,https://api.elsevier.com/content/abstract/scopus_id/84974296128,SCOPUS_ID:84974296128,2-s2.0-84974296128,The Relationship Between Treefall Gap Size And Light Flux In A Neotropical Rain Forest In Costa Rica,Journal of Tropical Ecology,02664674,14697831,5,4,437-439,1989-01-01,November 1989,10.1017/S0266467400003898,39,Journal,ar,Article,100,3,23435,undefined,0,FALSE,NA,NA,2,Barton A.M.,3,canopy openings | Costa Rica | gaps | light flux | treefalls | tropical forest,NA,NA,NA
true,https://api.elsevier.com/content/abstract/scopus_id/84972130834,SCOPUS_ID:84972130834,2-s2.0-84972130834,Instructions To Authors,Journal of Tropical Ecology,02664674,14697831,5,1,127-129,1989-01-01,February 1989,10.1017/S0266467400003370,0,Journal,ar,Article,100,0,23435,undefined,0,FALSE,NA,NA,3,NA,NA,NA,NA,NA,NA
true,https://api.elsevier.com/content/abstract/scopus_id/0024945057,SCOPUS_ID:0024945057,2-s2.0-0024945057,Red coloration of tropical young leaves: A possible antifungal defence?,Journal of Tropical Ecology,02664674,14697831,5,3,293-300,1989-01-01,August 1989,10.1017/S0266467400003667,77,Journal,ar,Article,100,2,23435,BSR 8407712,0,FALSE,NA,NA,4,Coley P.D.,2,anthocyanin | antifungal defence | Atta columbica | herbivory | leaf-cutting ants | Panama | tropics | young leaves,"Many woody species in humid tropical forests synchronously flush entire canopies of young red leaves. Numerous unsuccessful attempts have been made to explain the adaptive value of this visually striking phenomenon. In the humid tropics, fungal attack is a potentially important source of mortality for expanding young leaves. We propose that the anthocyanins responsible for the red coloration of young leaves may play a protective role against invasions by leaf-attacking fungal pathogens. Fungus-growing leaf cutting ants (Atta columbica Guerin) were used in choice tests because they are known to select against leaves or chemicals containing fungicidal properties. In feeding trials with leaf discs from 20 common species, ant preference decreased significantly with increasing anthocyanin content. In feeding trials with pure anthocyanin (3,3',4',5,7-pentahydroxyflavylium chloride) presented on oat flakes, ants again showed a significant dosage dependent preference. This suggests that even low concentrations of anthocyanins may be harmful to the fungal colonies of ants. Additional work on the effects of anthocyanin on leaf-attacking fungi is encouraged. © 1989, Entomological Society of Canada. All rights reserved.",NSF,National Science Foundation
true,https://api.elsevier.com/content/abstract/scopus_id/0024944411,SCOPUS_ID:0024944411,2-s2.0-0024944411,Behaviour And Nest Structure Of The Amazonian Bombus Transversalis In Ecuador,Journal of Tropical Ecology,02664674,14697831,5,2,243-246,1989-01-01,May 1989,10.1017/S0266467400003540,12,Journal,ar,Article,100,1,23435,undefined,0,FALSE,NA,NA,5,Olesen J.,1,Amazonas | bee nest | Bombus transversalis | Ecuador | Neotropics | rain forest,NA,NA,NA
true,https://api.elsevier.com/content/abstract/scopus_id/0024944391,SCOPUS_ID:0024944391,2-s2.0-0024944391,Distribution and ecology of epiphytic bryophytes and lichens in dry evergreen forest of guyana,Journal of Tropical Ecology,02664674,14697831,5,2,131-150,1989-01-01,May 1989,10.1017/S0266467400003400,144,Journal,ar,Article,100,2,23435,undefined,0,FALSE,NA,NA,6,Cornelissen J.,2,community composition | cryptogamic epiphytes | Guyana | host preference | life | rain forest | strategy | vertical zonation,"A floristic and ecological study of epiphytic bryophytes and lichens on standing mature Eperua trees was carried out in dry evergreen (walaba) forest in Guyana, South America. The trees were sampled from their base up to the highest canopy twigs, using mountaineering techniques. Clear vertical distribution patterns of epiphytic species and life-forms were found. Many species, particularly foliose lichens, appear to be preferential or exclusive to either Eperua grandiflora or E. falcata (Leguminosae), which are the dominant trees in the walaba forest. Special attention is given to the species-rich epiphyte vegetation on the upper canopy twigs, which include two categories of species: The sun epiphytes and the pioneers (facultative epi-phylls). © 1989, Cambridge University Press. All rights reserved.",NA,NA
true,https://api.elsevier.com/content/abstract/scopus_id/0024939136,SCOPUS_ID:0024939136,2-s2.0-0024939136,Population demography and sex ratio in a neotropical damselfly (odonata: Coenagrionidae) in costa rica,Journal of Tropical Ecology,02664674,14697831,5,2,159-171,1989-01-01,May 1989,10.1017/S0266467400003424,29,Journal,ar,Article,100,2,23435,undefined,0,FALSE,NA,NA,7,Hamilton L.D.,2,Costa Rica | damselfly | demography | mate guarding | sex ratio | territoriality,"Throughout the latter part of the dry season (January-April) of 1985 and 1986, we studied the demography of mature adults in a small population of Argia chelata along a stream at Monteverde, Costa Rica. Males defended sunlit spots along the stream between 1030 h and 1400 h central standard time each day and females visiting these sunlit spots were soon mated. By individually marking all mature adults in the population we found that there was no significant difference between the sexes in daily survival rates (0.85 for males and 0.86 for females). Lifetime mating success was positively correlated with longevitiy in both males and females but the ability of males to obtain a mate appeared to be independent of age. Although the sex ratio at emergence was 1:1, that of mature adults at the stream was strongly male-biased (87% male), perhaps as a result of a longer or more risky prereproductive period in females related to the costs of egg formation. We argue that the strongly male-biased sex ratio has important effects on the mating system of this species in that the male contact-guards the female for the entire oviposition period each day. Although this limits each male to mating with one female per day, it probably ensures that the male will fertilize most of the eggs laid by the female that day. © 1989, Cambridge University Press. All rights reserved.",NSERC,Natural Sciences and Engineering Research Council of Canada
true,https://api.elsevier.com/content/abstract/scopus_id/0024937597,SCOPUS_ID:0024937597,2-s2.0-0024937597,Fig-eating by birds in a malaysian lowland rain forest,Journal of Tropical Ecology,02664674,14697831,5,4,401-412,1989-01-01,November 1989,10.1017/S0266467400003850,71,Journal,ar,Article,100,1,23435,undefined,0,FALSE,NA,NA,8,Lambert F.,1,birds | Ficus | figs | frugivory | Malaysia | Megalaima | rain forest | resource partitioning | seed-dispersal | Treron,"Sixty bird species ate the figs of 29 Ficus taxa at a lowland forest site in Peninsular Malaysia. Although most bird-eaten figs were brightly coloured, four Ficus species produced dull-coloured ripe fruits. Whilst there was tremendous overlap in the sizes of figs eaten by different bird species, data presented show that the fig resource was partitioned by birds. Large birds were commoner visitors to large-fruited Ficus, but small birds tended to eat small figs. Within two avian genera, the Treron pigeons and Megalaima barbets, there was distinct partitioning of figs consumed according to fig size. © 1989, Cambridge University Press. All rights reserved.",NA,NA
true,https://api.elsevier.com/content/abstract/scopus_id/0024936204,SCOPUS_ID:0024936204,2-s2.0-0024936204,Estimation of arboreal arthropod density in a dry evergreen forest in Northeastern Thailand,Journal of Tropical Ecology,02664674,14697831,5,2,151-158,1989-01-01,May 1989,10.1017/S0266467400003412,15,Journal,ar,Article,100,2,23435,undefined,0,FALSE,NA,NA,9,Watanabe H.,2,arboreal arthropods | dry evergreen forest | insecticide fogging | shifting cultiva- | Thailand | tion,"The density of arboreal arthropods in a dry evergreen forest in Northeastern Thailand was investigated by the insecticide fogging (knockdown) method. Arthropod densities of 256.4 and 140.4 m-2were recorded in the dry season and 195.2 and 123.1 m-2 in the rainy season. The main orders were Collembola, Thysanoptera, Hymenoptera (mainly Formicidae) and Hemiptera. Distinct differences were not found in the arthropod faunal structure and density between the dry and rainy seasons. However, this fauna is completely eliminated by the clearing and burning of forest for shifting cultivation. The results of an experiment investigating the rate of arthropod fall after application of insecticide are presented and problems concerning the efficiency of the estimation methods used in this study are discussed. © 1989, Entomological Society of Canada. All rights reserved.",KAKEN,Japan Society for the Promotion of Science
true,https://api.elsevier.com/content/abstract/scopus_id/0024932637,SCOPUS_ID:0024932637,2-s2.0-0024932637,Effects of isolation on the water status of forest patches in the brazilian amazon,Journal of Tropical Ecology,02664674,14697831,5,2,173-185,1989-01-01,May 1989,10.1017/S0266467400003448,438,Journal,ar,Article,100,1,23435,undefined,0,FALSE,NA,NA,10,Kapos V.,1,Brazil | evapotranspiration | forest edge | forest islands | management | microclimate | rain forest | reserve size | tropical rain forest | water relations,"Patterns of edge-related environmental changes and plant water relations were investigated in the isolated forest reserves of the INPA-WWF Minimum Critical Size of Ecosystems project near Manaus, Brazil early in the wet season. Patterns of edge-related environmental changes and plant water relations were Air temperature was elevated and humidity reduced in the understorey within 40 m of the reserve margins, and air temperature and vapour pressure deficit (VPD) were higher in the interiors of 1 ha reserves than in 100 ha reserves. There was increased photosynthetically active radiation penetration to understorey level up to 40 m into a 100 ha reserve. Soil moisture was depleted in the outer 20 m of both small and large reserves, and surface soil water potentials fell below — 1.5 MPa at the margin of a 1 ha reserve. Studies of leaf relative water contents (RWCs) in understorey shrubs revealed no appreciable saturation deficits, though RWCs were sometimes lower at the reserve margins. Studies of leaf conductances revealed no evidence of restriction of water loss in these plants, and conductances of plants near the edges were significantly higher and higher for longer. The implications of these results for reserve design and for local and regional water budgets, as well as the possible role of water stress in increased tree mortality in isolated reserves are discussed. © 1989, Cambridge University Press. All rights reserved.",NA,NA
true,https://api.elsevier.com/content/abstract/scopus_id/0024928779,SCOPUS_ID:0024928779,2-s2.0-0024928779,"Dung beetles of the Kibale Forest, Uganda; comparison between virgin and managed forests",Journal of Tropical Ecology,02664674,14697831,5,3,349-352,1989-01-01,August 1989,10.1017/S0266467400003758,70,Journal,ar,Article,100,2,23435,undefined,0,FALSE,NA,NA,11,Nummelin M.,2,Africa | Coleoptera | dung beetle | Kibale Forest | mammal | ment | tropical forest manage- | Uganda,NA,NA,NA
true,https://api.elsevier.com/content/abstract/scopus_id/0024924117,SCOPUS_ID:0024924117,2-s2.0-0024924117,Pollen Harvest By Eusocial Bees In A Non-Natural Community In Brazil,Journal of Tropical Ecology,02664674,14697831,5,2,239-242,1989-01-01,May 1989,10.1017/S0266467400003539,42,Journal,ar,Article,100,3,23435,undefined,0,FALSE,NA,NA,12,Imperatriz-Fonseca V.L.,3,Apis mellifera | Brazil | flower visiting | pollen harvest | stingless bees,NA,NA,NA
true,https://api.elsevier.com/content/abstract/scopus_id/0024923863,SCOPUS_ID:0024923863,2-s2.0-0024923863,The breeding season and diet of arvicanthis in northern nigeria,Journal of Tropical Ecology,02664674,14697831,5,4,375-386,1989-01-01,November 1989,10.1017/S0266467400003837,12,Journal,ar,Article,100,2,23435,undefined,0,FALSE,NA,NA,13,Rabiu S.,2,Arvicanthis | breeding season | diet | feeding ecology | Muridae | Nigeria | Nile rat | reproductive ecology | Rodentia | savanna,"The breeding season and diet of the rat Arvicanthis was monitored from December 1983 to November 1985 in the semi-arid Sudan savanna at Kano, Nigeria, West Africa. Breeding began 1–2 months before the start of the rainy season and ceased at the beginning of the dry season. The diet of Arvicanthis was omnivorous, but with seasonal differences. Monocotyledons and dicotyledons predominated in the diet in the dry season, with seeds and insects increasing in the diet in the rainy season. The major differences between the ecology of Arvicanthis at Kano and on the East African savanna were that in East Africa the breeding season is longer and begins after the start of the rainy season. These and other dissimilarities between the biology of Arvicanthis in the two areas could be due to the effect of climatic differences on food supply and to the possible existence of different taxonomic groupings of Arvicanthis in the two regions. © 1989, Cambridge University Press. All rights reserved.",NA,NA
true,https://api.elsevier.com/content/abstract/scopus_id/0024923840,SCOPUS_ID:0024923840,2-s2.0-0024923840,"Fire, growth and survivorship in a Neotropical savanna grass Andropogon semiberbis in Venezuela",Journal of Tropical Ecology,02664674,14697831,5,4,387-400,1989-01-01,November 1989,10.1017/S0266467400003849,26,Journal,ar,Article,100,2,23435,undefined,0,FALSE,NA,NA,14,Silva J.,2,density | fire | grasses | Neotropics | plant demography | savanna | size | Venezuela,"This study was conducted in a woodland savanna in western Venezuela exclosed from grazing and burnt once a year towards the end of the dry season. Mean annual rainfall is 1500 mm, with a strong seasonality. Two cohorts of seedlings of Andropogon semiberbis were tagged and monitored for up to three years. Several variables such as survivorship, plant size, seedling density, fire damage and distance to the nearest adult were measured or estimated. Two burning experiments to measure survivorship before and after fire, and two seedling-growth experiments to assess competitive interference from adult plants of three grass species were performed. The highest mortality takes place during the dry season and is due to fire. This decreases as the plants get bigger due to increasing structural complexity of the clump by growth which gives added protection to the meristems. Other mortality factors such as desiccation, uprooting and shading seem to be important during the wet season, when mortality rate is relatively constant. Survivorship during the first year and after three years is strongly correlated to the size attained by the end of the first growing season. Seedling densities are rather low and do not seem to play any role in survivorship in this population. Adult interference with seedling growth decreases with distance and seems to be due to root competition, although there is a tendency toward increased foliage interference related to the canopy structure of adult plants. © 1989, Cambridge University Press. All rights reserved.",CONICIT,Consejo Nacional para Investigaciones Científicas y Tecnológicas
true,https://api.elsevier.com/content/abstract/scopus_id/0024915143,SCOPUS_ID:0024915143,2-s2.0-0024915143,"Litterfall, nutrient-fall and production in an Acacia albida woodland in Zimbabwe",Journal of Tropical Ecology,02664674,14697831,5,2,227-238,1989-01-01,May 1989,10.1017/S0266467400003515,18,Journal,ar,Article,100,1,23435,undefined,0,FALSE,NA,NA,15,Dunham K.,1,Acacia albida | litterfall | nutrient cycling | production | Zambezi | Zimbabwe,"Litterfall was recorded for one year in Acacia albida woodland in Mana Pools National Park, Zimbabwe. Leaves fell throughout the year, but leaf-fall rate peaked in the wet season. Litterfall was 1.5 t ha-1 year-1, comprising 50% leaves, 20% fruits, 17% ‘fine’ material (mainly frass), 4% flowers and 9% wood and bark. Net above ground production by A. albida trees was 1.7 t ha-1 year-1, including leaf production of 1.0 t ha-1 year-1, twig production of 0.3 t ha-1 year-1 and fruit production of 0.3 t ha-1 year-1. Insects consumed about 26% of leaf production. Net above ground herbaceous production was estimated from rainfall data using regression equations: It was 6.8 t ha-1 year-1 for annual grasses and 2.8 t ha-1 year-1 for forbs. Net above ground primary production in A. albida woodland was 11.3 t ha-1 year-1. The seasonal variations in the nitrogen, phosphorus, potassium, magnesium and calcium concentrations of different A. albida litter components were recorded. The estimated falls of N, P, K, Ca and Mg were 31.1, 2.1, 9.8, 15.0 and 3.4 kg ha-1 year-1 respectively. © 1989, Cambridge University Press. All rights reserved.",NA,NA
true,https://api.elsevier.com/content/abstract/scopus_id/0024907791,SCOPUS_ID:0024907791,2-s2.0-0024907791,Establishment Of Clethra Occidentalis On Stems Of The Tree-Fern Cyathea Pubescens In A Jamaican Montane Rain Forest,Journal of Tropical Ecology,02664674,14697831,5,4,441-445,1989-01-01,November 1989,10.1017/S0266467400003916,27,Journal,ar,Article,100,2,23435,undefined,0,FALSE,NA,NA,16,Newton A.C.,2,Clethra | disturbance | Jamaica | regeneration | seedling bank | seedling establishment | tree-fern | tropical rain forest,NA,CPS,Cambridge Philosophical Society
true,https://api.elsevier.com/content/abstract/scopus_id/0024901892,SCOPUS_ID:0024901892,2-s2.0-0024901892,"A study of the ecological history, vegetation and conservation management of ile aux aigrettes, mauritius",Journal of Tropical Ecology,02664674,14697831,5,4,355-374,1989-01-01,November 1989,10.1017/S0266467400003825,12,Journal,ar,Article,100,4,23435,undefined,0,FALSE,NA,NA,17,Parnell J.,4,conservation | description | lowland tropical forest | Mauritius | tropical ecology | vegetation,"Much of the unique native vegeration of Mauritius has been destroyed. Coastal ebony (Diospyros egrettarum I.B.K. Richardson) forest forms an extreme type of Mauritian lowland forest which no longer exists on mainland Mauritius and only survives on one offshore islet, He aux Aigrettes. Undisturbed D. egrettarum forest is resistant to invasion by exotic plants, which have now invaded most relict patches of native lowland vegetation in Mauritius. Human disturbance however, has allowed many exotics (particularly Flacourtia indica (Burm. fiL) Merrill) to invade and form new vegetation types. Much of the disturbance was caused by illegal woodcutting up to 1985, prompted by an acute fuelwood shortage in Mauritius. On the basis of 132 4 X 4 m quadrats, we recognize 10 types of natural, semi-natural and exotic vegetation. The conservation of the remaining natural ebony woodland vegetation requires the total cessation of woodcutting and the eradication of Tabebuia pallida (Lindl.) Miers (potentially the most damaging exotic species). © 1989, Cambridge University Press. All rights reserved.",NA,NA
true,https://api.elsevier.com/content/abstract/scopus_id/0024899916,SCOPUS_ID:0024899916,2-s2.0-0024899916,Fine root biomass under a tropical forest light gap opening in Costa Rica,Journal of Tropical Ecology,02664674,14697831,5,2,251-256,1989-01-01,May 1989,10.1017/S0266467400003576,44,Journal,ar,Article,100,1,23435,undefined,0,FALSE,NA,NA,18,Sanford R.L.,1,Costa Rica | fine root biomass | light gap | tropical forest,NA,UCB,University of California Berkeley
true,https://api.elsevier.com/content/abstract/scopus_id/0024898791,SCOPUS_ID:0024898791,2-s2.0-0024898791,"Nutrient content of bulk precipitation in south-central Java, Indonesia",Journal of Tropical Ecology,02664674,14697831,5,2,187-202,1989-01-01,May 1989,10.1017/S0266467400003461,22,Journal,ar,Article,100,1,23435,undefined,0,FALSE,NA,NA,19,Bruijnzeel L.,1,Indonesia | nutrient cycling | tropical tree plantations,"The chemical composition of bulk precipitation was studied for a period totalling 18 months between 1975 and 1978 at a high rainfall site in central Java. The following elements were determined: Calcium, magnesium, sodium, potassium, nitrate-nitrogen, chlorine, phosphate-phosphorus, silicon, aluminium, iron, manganese and pH. Ammoniacal nitrogen, total nitrogen and sulphate-sulphur were determined during four weeks in May 1983. Concentrations of all elements rose dramatically during the exceptionally severe dry season of 1977 which may have caused accession rates for some nutrients to be overestimated (i.e. compared to a year with ‘normal’ rainfall) by about 10%. Results are explained in terms of prevailing wind directions and proximity to, or absence of, particular solute sources, such as the ocean, volcanoes or eroding lands. Most elements exhibited intermediate concentrations when compared with data for other humid tropical locations; sodium and perhaps nitrogen were on the low side and pH on the high side of the spectrum. Annual accession rates at the study site were considerable by pan-tropical standards, mainly as a result of high rainfall totals. Comparing accession rates with 25-year-average nutrient immobilization rates in stemwood of local plantations of Pinus merkusii Jungh. et de Vr. and Agathis dammara Warb. showed atmospheric inputs of magnesium and potassium to be high enough (theoretically) to account for losses of these elements in stemwood removal. Corresponding figures for nitrogen were 90% (Pinus) and 50% (Agathis), and for calcium and phosphorus 60 and 40% respectively (both species). © 1989, Cambridge University Press. All rights reserved.",NA,NA
true,https://api.elsevier.com/content/abstract/scopus_id/0024897947,SCOPUS_ID:0024897947,2-s2.0-0024897947,Antlion Life Cycles In Nigeria,Journal of Tropical Ecology,02664674,14697831,5,2,247-250,1989-01-01,May 1989,10.1017/S0266467400003552,5,Journal,ar,Article,100,1,23435,undefined,0,FALSE,NA,NA,20,Fisher M.,1,antlions | Cueta pallens | Cueta species | life cycles | Morter obscurus | Neuroptera | Nigeria,NA,NA,NA
true,https://api.elsevier.com/content/abstract/scopus_id/0024896981,SCOPUS_ID:0024896981,2-s2.0-0024896981,Environmental factors affecting physiognomic and floristic variation in an area of cerrado in central brazil,Journal of Tropical Ecology,02664674,14697831,5,4,413-431,1989-01-01,November 1989,10.1017/S0266467400003862,93,Journal,ar,Article,100,4,23435,undefined,0,FALSE,NA,NA,21,De Oliveira-Filho A.T.,4,Brazil | cerrado vegetation | ground water | Neotropics | savanna | soil | topography,"Cerrado is a species-rich savanna-like vegetation that covers a large area in central Brazil. Soil, and particularly soil fertility, is considered to be the major factor determining the wide and diverse physiognomic-floristic gradients encountered within cerrado vegetation. To describe the vegetational variations within a cerrado in southern Mato Grosso state (15° 21' S, 55° 49' W), a 1 ha transect was located to pass through an interfluvial cerrado and climb a steep talus slope. The vegetational and environmental variations are described by means of field classification, direct gradient analysis and reciprocal averaging ordination. The effects of differences in ground water regime in the interfluvial cerrado and differences in inclination with associated rockiness in the talus cerrado are related to the vegetational variations. As the soils are very similar in texture and in the majority of chemical properties, the role of the above environmental factors was more easily distinguished. In the interfluvial cerrado, the vegetation variations are probably related to the seasonal fluctuation in water table level. © 1989, Cambridge University Press. All rights reserved.",CAPES,Coordenação de Aperfeiçoamento de Pessoal de Nível Superior
true,https://api.elsevier.com/content/abstract/scopus_id/0024889295,SCOPUS_ID:0024889295,2-s2.0-0024889295,Patterns of seed rain at the edge of a tropical Queensland rain forest,Journal of Tropical Ecology,02664674,14697831,5,3,301-308,1989-01-01,August 1989,10.1017/S0266467400003680,99,Journal,ar,Article,100,2,23435,undefined,0,FALSE,NA,NA,22,Willson M.,2,Australia | habitat structure | Queensland rain forest | seed dispersal | seed rain | vertebrate-dispersed seeds | wind-dispersed seeds,"Both vertebrate- and wind-dispersed seeds moved farther from rain forest into old field than from old field into forest. Vertebrate-dispersed seeds from the rain forest moved farther into the field than wind-dispersed seeds, but seeds of both types moved similar distances from field into forest. Habitat structure affected seed deposition patterns in the field, where shrubs provided perches for flying vertebrates. Vertebrate-dispersed seed deposition was significantly greater, and deposition of plumed, wind-dispersed seeds was significantly less, under shrubs than in the open. Deposition of vertebrate-dispersed seeds under fruiting shrubs was significantly less than under non-fruiting shrubs. © 1989, Entomological Society of Canada. All rights reserved.",NA,NA
