@_fa,prism:url,dc:identifier,eid,dc:title,dc:creator,prism:publicationName,prism:issn,prism:eIssn,prism:volume,prism:pageRange,prism:coverDate,prism:coverDisplayDate,prism:doi,dc:description,citedby-count,prism:aggregationType,subtype,subtypeDescription,author-count.@limit,author-count.@total,author-count.$,authkeywords,source-id,fund-no,openaccess,openaccessFlag,freetoread.value.$,freetoreadLabel.value.$,entry_number,fund-acr,fund-sponsor,prism:issueIdentifier,pubmed-id,article-number
true,https://api.elsevier.com/content/abstract/scopus_id/84901054303,SCOPUS_ID:84901054303,2-s2.0-84901054303,Ecogeography of the genus Sticta (lichenized Ascomycota: Lobariaceae) in Colombia,Moncada B.,Revista de Biologia Tropical,00347744,22152075,62,257-272,2014-01-01,2014,10.15517/rbt.v62i1.3564,"Colombia is a megadiverse country, but with a substantial gap in the taxonomic and ecological knowledge of fungi and lichens. Thus, the objective of the present study was an ecogeographical analysis of the Sticta species in Colombia. The data included macrodistribution (with respect to mountain ranges and life zones) and microhabitat preferences (light, substrate) and were obtained from field work and herbarium collection labels (completed by comparison with modern geographic and vegetation maps), for 103 species of Sticta currently recognized in Colombia (plus seven additional biotypes with different photobionts or reproductive mode). Using non-metric multidimensional scaling (NMS), correlations between ecogeographical variables and species were established, and ecotypes were delimited. Colombian species of Sticta showed distinct distribution patterns relative to altitude, mountain ranges, life zones, as well as light exposure and substrate, forming several distinct groups. Cyanobacterial species tend to have wider distribution ranges than green algal species. We concluded that the orogeny of the Northern Andes substantially affected speciation of the genus Sticta and its ecogeographical differentiation.",7,Journal,ar,Article,100,3,3,Andine | Life zones | Patterns of distribution | Páramo | Sticta | Subandine | Superpáramo,13567,undefined,1,TRUE,all,All Open Access,168,NA,NA,1,24912357,NA
true,https://api.elsevier.com/content/abstract/scopus_id/84901054287,SCOPUS_ID:84901054287,2-s2.0-84901054287,Larval development of Evermannia zosterura (Perciformes: Gobiidae),González-Navarro E.,Revista de Biologia Tropical,00347744,22152075,62,603-610,2014-01-01,2014,10.15517/rbt.v62i2.10810,"Gobiidae is the most specious fish family in the world with almost 2 000 species, however only 11% of them have been described for their larval stages. The entire life cycle information is essential to understand the biology and ecology of this important fish group. Previous studies on zooplankton samples from Ensenada de La Paz, México, have shown the presence of several Gobiidae larvae and juveniles which were identified as Evermania zosterura. The main objective of this work was to describe the larval stages of this species, widely distributed in the Eastern tropical Pacific. The development of E. zosterura larvae was described based on 66 specimens. A total of 53 specimens were used to describe morphometrics and pigmentation patterns, while 13 specimens were cleared and stained, to obtain meristic characteristics. Cleared specimens had 30 to 31 total vertebrae; dorsal-fin elements: IV; I, 13-14, anal-fin elements: I, 13-14, and most had pterygiophore formula 4-111100. The combination of these characteristics confirmed these specimens as E. zosterura. The pigment pattern is similar throughout ontogeny. Larvae are characterized by having three to five dendritic melanophores along the post-anal ventral margin, four to nine smaller melanophores along the ventral margin between the isthmus and anus, and one on the midpoint of the dorsal margin of the tail. There is one small pigment spot on the angle of the jaw, and other on the tip of lower lip. There is an elongated internal pigment under the notochord, between the head and gas bladder. Notochord flexion starts near 3.5mm BL and ends at 4.6mm BL; transformation to the juvenile stage is at about 13.6mm BL. Our conclusion is that the most useful characters to distinguish this species early-larval stages from those of similar species in the area, are the number of myomeres, the large melanophores (approximately uniformly in size) on the post anal ventral margin, and the elongate internal pigment under the notochord, anterior to the gas bladder.",1,Journal,ar,Article,100,3,3,Early development | Gobiidae | Gulf of California | Larvae | Ontogeny | Pigmentation pattern,13567,undefined,1,TRUE,all,All Open Access,169,NA,NA,2,25102643,NA
true,https://api.elsevier.com/content/abstract/scopus_id/84901050691,SCOPUS_ID:84901050691,2-s2.0-84901050691,"Logging impacts on forest structure and seedling dynamics in a Prioria copaifera (Fabaceae) dominated tropical rain forest (Talamanca, Costa Rica)",Valverde-Barrantes O.J.,Revista de Biologia Tropical,00347744,22152075,62,347-357,2014-01-01,2014,10.15517/rbt.v62i1.8504,"The factors that determine the existence of tropical forests dominated by a single species (monodominated forests) have been the subject of debate for a long time. It has been hypothesized that the low frequency of disturbances in monodominated forests and the tolerance to shade of the monodominant species are two important factors explaining the prolonged dominance of a single species. We determined the role of these two factors by examining the effects of logging activities on the floristic composition and seedling dynamics in a Prioria copaifera dominated forest in Southeastern Costa Rica. We determined the floristic composition for trees ≥2.5cm DBH and the associated recruitment, survival and mortality of tree canopy seedlings in two sites logged two (L-02) and 12 years (L-12) prior to sampling and an unlogged forest (ULF). Our results showed that L-02 stands had lower species richness (25 species) than the L-12 and ULF stands (49 and 46 species, respectively). As expected, we found significant logging effects on the canopy structure of the altered forests, particularly when comparing the L-02 and the ULF stands. Seedling density was higher in ULF (0.96 seedlings/ m2) than in the L-02and L-12 stands (0.322 and 0.466 seedlings/m2, respectively). However, seedling mortality was higher in the ULF stands (54%) than in the L-02 (26%) and L-12 (15%) stands. P. macroloba in L-02 was the only species with abundant regeneration under P. copaifera in L-02 stand, where it accounted for 35% of the seedlings. Despite the reduction in seedling abundance observed after logging, P. copaifera seems to maintain large seedling populations in these forests, suggesting that this species maintains its dominance after logging disturbances. Our findings challenge the hypothesis that the regeneration of monodominant species is not likely to occur under heavily disturbed canopy conditions.",8,Journal,ar,Article,100,2,2,Carapa guianensis | Floristic composition | Forest structure | Logging impact | Pentaclethra macroloba | Prioria copaifera | Tree regeneration | Tropical monodominance,13567,undefined,1,TRUE,all,All Open Access,170,NA,NA,1,24912364,NA
true,https://api.elsevier.com/content/abstract/scopus_id/84901049589,SCOPUS_ID:84901049589,2-s2.0-84901049589,"Variability in the relative abundance, size structure and sex ratio of the dolphinfish Coryphaena hippurus (Pisces: Coryphaenidae) in the Gulf of Tehuantepec, México",Alejo-Plata C.,Revista de Biologia Tropical,00347744,22152075,62,611-626,2014-01-01,2014,10.15517/rbt.v62i2.10849,"The dolphinfish (Coryphaena hippurus), is an oceanic epipelagic fish found worldwide in tropical and subtropical waters, with a high dispersal capability via large-scale migrations. This fast-swimming top-level predator is abundant in the Gulf of Tehuantepec, where it is caught incidentally by artisanal fisheries, and represents a target species for both recreational and commercial fisheries in Mexico, Ecuador, Peru and Central America. Nowadays, local fishery information on this species is scarce, thus our objective was to analyze the size structure by sex and the catchper- unit-effort (CPUE) tendency of dolphinfish caught in the Gulf of Tehuantepec, from 2000 to 2007. For this, fishery catches information was obtained from the artisanal fleet, at six landing sites in the Gulf, and the sex ratio, fork length (FL) and the catch per unit effort (CPUE) were estimated. From all sampling sites, a total of 3 494 females, and 3 877 males were obtained, and dolphinfish size as fork length (FL) ranged from 20.5 to 152cm. Fish size ranged from 25.5 to 148cm furcal length (FL) in males, and 20.5 to 129cm FLin females. The sex ratio (males:Females) was 1:1, except in April-May (1:1.5, p<0.05) and November (1:0.5, p<0.05). The sex ratio at different size classes showed a significant bias towards females at smaller sizes (<75cm FL), whereas the males were predominant in larger size classes (>100cm FL). The size structure was bimodal, with a variation in the size average; the modes were defined as the small group (FL=50-55cm) and the large size group (FL=100-110cm). The CPUE showed seasonal changes: Values were high for the November-December period, and values were lower for July-August. The seasonal and inter annual variation in the abundance of dolphinfish is probably related to a pre-spawning migration in close relation to the rain-drought regime characteristic of the region, and the associated wind upwelling season of ""Tehuanos"" in the Gulf of Tehuantepec.",4,Journal,ar,Article,100,3,3,Artisanal fishing | CPUE | Dolphinfish | Eastern tropical pacific | Mahi mahi | Size structure,13567,undefined,1,TRUE,all,All Open Access,171,NA,NA,2,25102644,NA
true,https://api.elsevier.com/content/abstract/scopus_id/84901049146,SCOPUS_ID:84901049146,2-s2.0-84901049146,"Phytoplankton variability in Lake Fraijanes, Costa Rica, in response to local weather variation",Umaña-Villalobos G.,Revista de Biologia Tropical,00347744,22152075,62,483-494,2014-01-01,2014,10.15517/rbt.v62i2.11689,"Phytoplankton species show a variety in morphology which is the result of adaptations to pelagic life including responses to fluctuations in water column dynamics driven by weather conditions. This has been reported in the oceans and in Northern temperate lakes. In order to observe whether tropical freshwater phytoplankton responds to seasonal variation in weather, the weekly variation in temperature of the water column and phytoplankton composition was studied in Lake Fraijanes, Costa Rica, a shallow (6.2m) lake at 1 640m above sea level. A chain of data loggers for temperature was placed in the deepest point in the lake to register temperature every hour at four different depths, and phytoplankton samples were retrieved every week for a year. Additional monthly samples for nutrients were taken at two depths. Notwithstanding its shallowness, the lake developed a thermal gradient which kept the water column stratified for several months during dry season. Whole lake overturns occurred during cold spells with intense precipitation. Phytoplankton changed throughout the year mainly through a shift in dominant taxa. From September to February the lake was frequently mixed by rain storms and windy weather. At this time, phytoplankton was dominated by Chlorococcal green algae. From March to June, the lake was stratified and warmer. Phytoplankton became dominated by Cyanobateria, mainly colonial Chroococcales. The rainy season started again in May 2009. During June and July the lake started to mix intermittently during rain events and phytoplankton showed a brief increase in the contribution of Chlorococcales. These changes fitted well to a general model of phytoplankton succession based on functional groups identified according to their morphology and adaptations.",5,Journal,ar,Article,100,1,1,Ecology | Lakes | Phytoplankton | Stratification | Tropical limnology | Weather variation,13567,undefined,1,TRUE,all,All Open Access,172,NA,NA,2,25102633,NA
true,https://api.elsevier.com/content/abstract/scopus_id/84901048583,SCOPUS_ID:84901048583,2-s2.0-84901048583,Geographic data for Neotropical bats (Chiroptera),Noguera-Urbano E.A.,Revista de Biologia Tropical,00347744,22152075,62,201-215,2014-01-01,2014,10.15517/rbt.v62i1.8379,"The global effort to digitize biodiversity occurrence data from collections, museums and other institutions has stimulated the development of important tools to improve the knowledge and conservation of biodiversity. The Global Biodiversity Information Facility (GBIF) enables and opens access to biodiversity data of 321 million of records, from 379 host institutions. Neotropical bats are a highly diverse and specialized group, and the geographic information about them is increasing since few years ago, but there are a few reports about this topic. The aim of this study was to analyze the number of digital records in GBIF of Neotropical bats with distribution in 21 American countries, evaluating their nomenclatural and geographical consistence at scale of country. Moreover, we evaluated the gaps of information on 1° latitude × 1° longitude grids cells. There were over 1/2 million records, but 58% of them have no latitude and longitude data; and 52% full fit nomenclatural and geographic evaluation. We estimated that there are no records in 54% of the analyzed area; the principal gaps are in biodiversity hotspots like the Colombian and Brazilian Amazonia and Southern Venezuela. In conclusion, our study suggests that available data on GBIF have nomenclatural and geographic biases. GBIF data represent partially the bat species richness and the main gaps in information are in South America.",2,Journal,ar,Article,100,2,2,Bats | Database | Latin America | Records | Richness | Species number,13567,undefined,1,TRUE,all,All Open Access,173,NA,NA,1,24912354,NA
true,https://api.elsevier.com/content/abstract/scopus_id/84901047713,SCOPUS_ID:84901047713,2-s2.0-84901047713,"Community structure of bivalves and gastropods in roots of red mangrove Rhizophora mangle (Rhizophoraceae) in isla Larga, Mochima Bay, Venezuela",Acosta Balbas V.,Revista de Biologia Tropical,00347744,22152075,62,551-565,2014-01-01,2014,10.15517/rbt.v62i2.9803,"The Rhizophora mangle roots form a complex ecosystem where a wide range of organisms are permanently established, reproduce, and find refuge. In this study, we assessed the diversity of bivalves and gastropods that inhabit red mangrove roots, in isla Larga, Mochima, Venezuela Sucre state. Bimonthly collections were made from January 2007 to May 2008, in four study areas denominated: South, North, East and West. In each area, five mangrove roots were sampled, and the specimens were obtained. We analyzed a total of 180 roots and a total of 35 bivalve species and 25 gastropod species were found. The most abundant bivalves were: Isognomon alatus, Isognomon bicolor, Ostrea equestris, Crassostrea rhizophorae and Brachidontes exustus; among gastropods, the most common where: Littorina angulifera, Cymatium pileare and Diodora cayenensis. The months with the highest abundances and number of individuals for both groups were January and July 2007, and March 2008. The mangrove ecosystem in isla Larga, presented a number of individuals and species higher than those reported for other regions in Venezuela and the Caribbean.",6,Journal,ar,Article,100,3,3,Molluscs | Parque nacional mochima | Red mangrove | Roots | Venezuela,13567,undefined,1,TRUE,all,All Open Access,174,NA,NA,2,25102639,NA
true,https://api.elsevier.com/content/abstract/scopus_id/84901047403,SCOPUS_ID:84901047403,2-s2.0-84901047403,"Effects of landscape and vegetation structure on the diversity of phyllostomid bats (Chiroptera: Phyllostomidae) in Oaxaca, Mexico",García-García J.L.,Revista de Biologia Tropical,00347744,22152075,62,217-239,2014-01-01,2014,10.15517/rbt.v62i1.12094,"The tropical forest fragmentation is known to affect the spatial structure of the landscape and habitat. These alterations can modify the attributes of bat assemblages, however, this phenomenon has been little studied and understood. In this work we evaluated the structure of landscape (i.e. composition and configuration) and vegetation, and its relationship with assemblage- and population-level characteristics of phyllostomid bats in a tropical rainforest of Southeastern Mexico. For this, we previously selected 12 sites located in continuous and fragmented forests, where bats were captured using mist nets during a two years sampling effort (144 nights). Bats relative abundance, species richness (diversity of order 0, 0D), Shannon diversity index (1D) and Simpson index (2D) were evaluated in all sites, and their relationship with seven measures of landscape structure and seven measures of vegetation structure was described using a Hierarchical Partitioning Analysis. A total of 1 840 individuals of 29 species of phyllostomid bats were captured in this period. Differences in the assemblages were manifested only in the relative abundance and not in the richness of the species. The assemblages of fragmented forest exhibited greater variation in species composition and a greater abundance of frugivorous and nectarivorous bats in comparison with the assemblages of continuous forest. The landscape configuration was related to the assemblage- and population-level attributes, contrasting with previous studies where the composition was a key element. At habitat level, tree density and canopy cover determined the abundance of bats. Nectarivorous and frugivorous bats were mostly found in disturbed vegetation landscapes, primarily due to landscape configuration (e.g. edge density). This phenomenon could be a response to the availability of food in primary and intermediate successional stages, which are characterized by an abundance of food value.",14,Journal,ar,Article,100,2,2,Landscape configuration | Los Chimalapas | Mexico | Neotropical bats | Spatial scale,13567,undefined,1,TRUE,all,All Open Access,175,NA,NA,1,24912355,NA
true,https://api.elsevier.com/content/abstract/scopus_id/84901046733,SCOPUS_ID:84901046733,2-s2.0-84901046733,Nupela species (Naviculales: Bacillariophyceae) from Colombian lowland waters including N. acaciensis nov. sp. and N. catatumbensis nov. sp,Sala S.,Revista de Biologia Tropical,00347744,22152075,62,241-255,2014-01-01,2014,10.15517/rbt.v62i1.8363,"The genus Nupela comprises ca. 50 species that generally have a distribution restricted by bioclimatic frontiers. As part of an integrated analysis of the diatom flora of Colombia, in this study we focused our interest on the genus Nupela from lowland waters. Periphyton samples were collected from 150 sites of lotic water bodies in Colombia, taking into account hidrogeomorfological variability. In each sampling station, periphyton samples were obtained by scraping, and temperature, pH, dissolved oxygen and conductivity variables were measured. Samples were processed by both light microscopy (LM; Carl Zeiss Axio Scope.A1) and scanning electron microscopy (SEM; FEI-Quanta 450 and a Jeol JSM-6360 LV). The genus Nupela was found in 28 sites. Five taxa were identified, described and illustrated from tropical or subtropical environments: N. lesothensis, N. praecipua y N. subpallavicinii; these were new records for Colombia, and N. acaciensis and N. catatumbensis two new species for science. N. acaciensis is characterized by raphe branches of both valves equally long combined with cymbelloid symmetry, striae built by 2 transapically elongated areolae that delimit a longitudinal line at each hemivalve. N. catatumbensis is characterized by the presence of a well developed raphe in both valves; valves lanceolate with subcapitated to capitated ends and cymbelloid symmetry, striae built by 3-4 transapically elongated areolae, interestriae elevated as transapical ribs and internal proximal raphe ends hook-shaped. The genus Nupela was widely distributed in the studied basins but showed different distribution patterns: N. acaciensis and N. subpallavicini had a restricted distribution, while N. catatumbensis, N. lesothensis and N. praecipua had a wider distribution, and were collected in sites with significant variations in their ecomorphology, altitude, temperature, pH and electrolyte content.",13,Journal,ar,Article,100,5,5,Bacillariophyceae | Colombia | Diatoms | Neotropics | Nupela | Nupela acaciensis | Nupela catatumbensis,13567,undefined,1,TRUE,all,All Open Access,176,NA,NA,1,24912356,NA
true,https://api.elsevier.com/content/abstract/scopus_id/84901046609,SCOPUS_ID:84901046609,2-s2.0-84901046609,"Soil-vegetation relationships in a toposequence of the Guayana Shield, Venezuela",Lozada J.R.,Revista de Biologia Tropical,00347744,22152075,62,385-401,2014-01-01,2014,10.15517/rbt.v62i1.11388,"The Guayana Shield is one of the oldest territories in the planet and has millions of years subjected to leaching and erosion processes that produce oligotrophic soils. This scarcity of nutrients has not avoided the development of high, diverse and magnificent forests, where plants have adaptations to survive these difficult conditions. The aim of this work was to characterize the physical and chemical parameters of the soils in different forest communities of the Imataca Forest Reserve (IFR), to establish some interpretations on their origin, and some relationships between the edaphic components and the inhabitant species. Terrestrial journeys were carried out and two pathways were traced for the interpretation of forest communities. In each community, three plots (100m x 100m) for the ecological survey were established. In each plot, all trees, palms, and lianas were measured (dbh≥10cm; dbh: Diameter at breast height); four 10m x 10m understory sub-plots were evaluated, and a census of all the spermatophyta species (dbh<10cm) was made. Soils were evaluated by means of a trial pit in each community, and a bore in each one understory sub-plot. The obtained data were analyzed by both a detrended and a canonical correspondence analysis. Results from a total of 15 plots allowed us to identify three communities: A forest dominated by Mora excelsa located in a narrow valley with high content of silt; a swamp forest dominated by Catostemma commune in a sandy broad valley, and a forest in clay hills dominated by Alexa imperatricis. Most of the soils had a pH between 3.1 and 4.5. Nutrients were in very low concentrations (N: 0-0.2%; P: 0-14ppm; K: 0-0.3Cmol/kg) and Al in toxicity quantities. We observed that Ca/Al relationship greater than 1 meant a neutralization of the toxic effect of Al. Besides, basal area ranged from 20.4 to 32.3m2/ha; the highest level (top local forest development) corresponded with the C. commune community with a Ca/Al value of 2.5. This research found an adequate relationship between soil and vegetation, as it was able to identify three communities into three distinct soil conditions. Nevertheless, edaphic constraints indicated that high forest cover must be maintained as an essential element for the conservation of these communities.",5,Journal,ar,Article,100,3,3,Ecosystem susceptibility | Imataca | Oligotrophic soils | Soil toxicity | Tropical forests,13567,undefined,1,TRUE,all,All Open Access,177,NA,NA,1,24912367,NA
true,https://api.elsevier.com/content/abstract/scopus_id/84901046413,SCOPUS_ID:84901046413,2-s2.0-84901046413,Reproduction of the pink shrimp Farfantepenaeus notialis (Decapoda: Penaeidae) in the Colombian Caribbean,Paramo J.,Revista de Biologia Tropical,00347744,22152075,62,513-521,2014-01-01,2014,10.15517/rbt.v62i2.11650,"The shallow water pink shrimp (Farfantepenaeus notialis) is among the socioeconomically most important resources of the Caribbean. The lack of biological and fishery information is of great concern for the fisheries management authorities. The presented study therefore aimed at the investigation of the reproductive cycle, the size composition and the size at first maturity of this species as a basis for the ordination and management of this resource. The study was conducted from June 2012 to May 2013 off the coast of the Caribbean Sea of Colombia. A total of 5 356 individuals were collected, identified, classified and preserved for their subsequent analysis in the laboratory. Size, weight, sex and gonad stage were recorded for each specimen. Significant differences were found in sex ratio in all months sampled with a clear predominance of females. Mature females were found year-around, but two reproductive peaks were identified during the periods October- December and April-June. The mean catch total length size (MCS) for females and males was 148.00mm and 122.54mm, respectively. The mean size at maturity (LT50%) was 129.34mm for females and 97.77mm for males. MCS was always above LT50% for both sexes. Considering the large reduction in fishing effort in the Colombian Caribbean Sea over the last years, we could expect that the shrimp population is in a rebuilding process or perhaps it may be already restored.",10,Journal,ar,Article,100,3,3,Colombian Caribbean | Farfantepenaeus notialis | Maturity | Reproduction | Shrimps,13567,undefined,1,TRUE,all,All Open Access,178,NA,NA,2,25102635,NA
