@_fa,prism:url,dc:identifier,eid,dc:title,dc:creator,prism:publicationName,prism:issn,prism:eIssn,prism:volume,prism:pageRange,prism:coverDate,prism:coverDisplayDate,prism:doi,dc:description,citedby-count,prism:aggregationType,subtype,subtypeDescription,author-count.@limit,author-count.@total,author-count.$,authkeywords,source-id,fund-no,openaccess,openaccessFlag,freetoread.value.$,freetoreadLabel.value.$,entry_number,fund-acr,fund-sponsor,prism:issueIdentifier,pubmed-id,article-number
true,https://api.elsevier.com/content/abstract/scopus_id/84921927407,SCOPUS_ID:84921927407,2-s2.0-84921927407,Wildlife damage mitigation in agricultural crops in a Bolivian montane forest,Pérez L. E.,Revista de Biologia Tropical,00347744,22152075,62,1495-1508,2014-01-01,2014,10.15517/rbt.v62i4.12983,"Wildlife is often blamed for causing damage to human activities, including agricultural practices and the result may be a conflict between human interests and species conservation. A formal assessment of the magnitude of damage is necessary to adequately conduct management practices and an assessment of the efficiency of different management practices is necessary to enable managers to mitigate the conflict with rural people. This study was carried out to evaluate the effectiveness of agricultural management practices and controlled hunting in reducing damage to subsistence annual crops at the Cotapata National Park and Natural Area of Integrated Management. The design included seven fields with modified agricultural practices, four fields subjected to control hunting, and five fields held as controls. We registered cultivar type, density, frequency of visiting species to the field, crops lost to wildlife, species responsible for damage, and crop biomass. Most frequent species in the fields were Dasyprocta punctata and Dasypus novemcinctus. Hunted plots were visited 1.6 times more frequently than agriculturally managed plots. Crop lost to wildlife averaged 7.28% at agriculturally managed plots, 4.59% in plots subjected to hunting, and 27.61% in control plots. Species mainly responsible for damage were Pecari tajacu, D. punctata, and Sapajus apella. We concluded that both management strategies were effective to reduce damage by >50% as compared to unmanaged crop plots.",6,Journal,ar,Article,100,2,2,Agricultural practices | Conflict mitigation | Crop damage | Dasyprocta | Local communities | Pecari | Track stations,13567,undefined,1,TRUE,all,All Open Access,114,NA,NA,4,25720183,NA
true,https://api.elsevier.com/content/abstract/scopus_id/84921926255,SCOPUS_ID:84921926255,2-s2.0-84921926255,"Spatial-temporal variation of the macroinvertebrate epibiont community on red mangrove prop roots Rhizophora mangle (Rhizophoraceae) at La Mancha coastal lagoon, Veracruz, Mexico",Ruiz M.,Revista de Biologia Tropical,00347744,22152075,62,1309-1330,2014-01-01,2014,10.15517/rbt.v62i4.12582,"La Mancha lagoon is connected to the Gulf of Mexico through an estuarine ephemeral inlet, a sand bar, which opens during the rainy season and closes during the late fall and the winter storm season. As the lagoon fills up with the permanent stream flow into its Southern part, the water level increases and the sand bar opens up, releasing huge volumes of water into the ocean and leaving the previously flooded intertidal zone exposed to drying. In this study, we described the spatial and temporal variations of structure and composition of the community living on the surface of red mangrove prop roots, related to the hydrodynamic of the estuarine inlet. Four red mangrove prop roots were collected every three months, over an annual period, at ten sampling stations. Water temperature, salinity, dissolved oxygen, water depth and transparency were also measured at each sampling event. To describe the identity, abundance, biomass, and specific richness of epibiont coverage on the prop roots, measurements were taken at 10cm intervals (herein called “horizons”). A total of 59 632 specimens and a total biomass of 172g/cm2 were registered, and a maximum of eleven horizons presented at least one species of epibionts. Two species of polychaetes, 12 of mollusks and 14 of crustaceans were identified, with Mytilopsis leucophaeata as the most abundant, Ficopomatus miamiensis as the most common and Crassostrea rhizophorae with the highest contribution in biomass. Sampling effort was assessed using species accumulation curves, resulting that the efficiency was, in general, greater than 90% of the richness predicted by asymptotic models. The hydrodynamics of the estuarine inlet had a great influence on the environmental conditions of the lagoon and on the spatial and temporal variation of the epibiont community: (a) when the inlet is open, there is a North-South gradient in environmental parameters (b) when the inlet is closed and the water level increases, the epibionts especially the pioneer species F. miamiensis, occupied the highest horizons of prop roots, and (c) the abundance, biomass and richness of epibionts increased towards the deeper and less saline Southern part of the lagoon, as well as on permanently submerged horizons, and during the seasonal closure of the inlet. Variations in depth are determined by the hydrodynamic behavior of the estuarine inlet, suggesting that these factors are major biodiversity drivers of the epibiont community at La Mancha.",14,Journal,ar,Article,100,2,2,Abundance | Biomass | Crustaceans | Ephemeral estuarine inlet | Mollusks | Polychaetes | Species accumulation curves | Specific richness | Water depth,13567,undefined,1,TRUE,all,All Open Access,115,NA,NA,4,25720169,NA
true,https://api.elsevier.com/content/abstract/scopus_id/84921925827,SCOPUS_ID:84921925827,2-s2.0-84921925827,"Colonization and structure of arbuscular mycorrhizal fungi community in Alsophila firma (Cyatheales: Cyatheaceae) from a tropical montane cloud forest in Veracruz, México",Lara-Pérez L.A.,Revista de Biologia Tropical,00347744,22152075,62,1609-1623,2014-01-01,2014,10.15517/rbt.v62i4.13324,"Alsophila firma is a tree fern that is distributed mainly in tropical montane cloud forest (TMCF) and is considered as a threatened species. Arbuscular mycorrrhizal fungi (AMF) have been proposed as an alternative in rescue programs of endangered species. However, our knowledge about diversity of AMF and mycorrhizal status of the species of TMCF is limited. In Mexico TMCF shows different degrees of conservation because of fragmentation and land use change. In this study, we evaluated the level of colonization, richness and abundances of spores of AMF in three fragments with different conservation status: conserved (100 years), secondary vegetation (17 years) and disturbed. For this, soil samples and roots were collected from five individuals of A. firma per site, with at least 100m away from each other; a total of 100cm of roots were analysed per site. Root samples showed AMF and occasionally dark septate fungi (DSF) colonizations. For the overall study, 19 species of AMF were recorded: Gigaspora (7), Acaulospora (4), Glomus (4), Funneliformis (2), Sclerocystis (1) and Scutellospora (1). The dominant species in the three sites were Funneliformis geosporum and Acaulospora scrobiculata. The highest diversity (H’) and evenness (J’) (p<0.05) were found in the conserved site (H’=1.7, J’=0.66), when compared to the secondary vegetation (H’=1.5, J’=0.61), and the disturbed site (H’=0.74, J’=0.41). Statistical analysis showed that the AMF degree of colonization was significantly higher (p<0.05) in the conserved site; although, the disturbed site showed low richness and abundances of AMF, the degree of root colonization did not differ statistically (p<0.05) with the secondary vegetation site. Chao2 (Richness estimation model) showed that the number of analysed samples were sufficient to represent the structure of the AMF communities with values >90%. The present study confirmed that A. firma is a mycorrhizal species that exhibits high levels of colonization even in disturbed sites. We suggest that F. geosporum and A. scrobiculata may have the potential to inoculate the gametophyte and young sporophyte of A. firma, to support restoration programs, because of their abundances and high tolerance to disturbed sites.",7,Journal,ar,Article,100,6,6,Disturbed | Diversity index | Glomeromycota | Mycorrhizal colonization | Number of spores | Secondary and conserved vegetation | Tree fern,13567,undefined,1,TRUE,all,All Open Access,116,NA,NA,4,25720191,NA
true,https://api.elsevier.com/content/abstract/scopus_id/84921924047,SCOPUS_ID:84921924047,2-s2.0-84921924047,The community structure of macroscopic basidiomycetes (Fungi) in Brazilian mangroves influenced by temporal and spatial variations,Nogueira-Melo G.S.,Revista de Biologia Tropical,00347744,22152075,62,1587-1595,2014-01-01,2014,10.15517/rbt.v62i4.12598,"Mangroves are transitional ecosystems between terrestrial and marine environments, and are distinguished by a high abundance of animals, plants, and fungi. Although macrofungi occur in different types of habitat, including mangroves, little is known about their community structure and dynamic. Therefore the aim of this study was to analyze the diversity of macrofungi in a number of Brazilian mangroves, and the relationship between such diversity, precipitation and area of collection. A total of 32 field trips were undertaken from 2009 to 2010, and macrofungi were studied in four 250×40m transects: Timbó and Santa Cruz Channel on the Northern coast, and Maracaípe and Ariquindá on the Southern coast. All basidiomata found along the transects were placed in paper bags, air-dried and identified using existing literature. It was found that Northern areas predominantly featured Avicennia schaueriana mangroves, while Rhizophora mangle dominated in Southern transects. A total of 275 specimens were collected, and 33 species, 28 genera, 14 families and six orders were represented. Overall abundance and species richness did not vary significantly among areas, but varied according to time, being higher during the rainy season. Subtle differences in composition were observed over time and between areas, probably due to variations in plant species occurrence. Further studies with collections during months of greater precipitation in transects dominated by different mangrove species of the same ecosystem are suggested to assess the overall diversity of mycobiota in these ecosystems.",7,Journal,ar,Article,100,3,3,Agaricomycetes | Diversity | Ecological interactions | Estuaries | Fungi,13567,undefined,1,TRUE,all,All Open Access,117,NA,NA,4,25720189,NA
true,https://api.elsevier.com/content/abstract/scopus_id/84921923175,SCOPUS_ID:84921923175,2-s2.0-84921923175,Key to chironomid pupal exuviae (Diptera: Chironomidae) of tropical high Andean streams,Prat N.,Revista de Biologia Tropical,00347744,22152075,62,1385-1406,2014-01-01,2014,10.15517/rbt.v62i4.9844,"The Chironomidae is a cosmopolitan family of Nematoceran flies with more than 20 000 species described. However the diversity of genera and species of the family in the Andean region beyond the 2 000m.a.s.l are scarcely known. We conducted faunal surveys and biomonitoring research in different streams of Colombia, Ecuador and Peru from May 2005 to October 2011. Based on specimens collections, a taxonomic key was developed to identify pupae and pupal exuviae of 46 genera of midges (Diptera, Chironomidae) collected from streams at high altitude areas on the Andean tropical mountains. We included illustrations and brief taxonomic descriptions for all genera, of which several ones have not yet been formally described; in this latter case we used the nomenclature of Roback & Coffman (1983). For two genera, Cricotopus and Genus 1, keys to the most common morphospecies were provided. Results showed that in this area the chironomid assemblages are dominated by the members of the subfamily Orthocladiinae (22 genera) followed by the Chironominae (13). Six genera of Tanypodinae were identified, while only three and two genera were present from subfamilies Podonominae and Diamesinae. This key may be very useful for both studies about drift in streams, and for biomonitoring purposes.",15,Journal,ar,Article,100,3,3,Chironomidae | Drift | High andean streams | Pupae | Pupal exuviae,13567,undefined,1,TRUE,all,All Open Access,118,NA,NA,4,25720175,NA
true,https://api.elsevier.com/content/abstract/scopus_id/84921920221,SCOPUS_ID:84921920221,2-s2.0-84921920221,"Causes and consequences of change rates in the habitat of the threatened tropical porcupine, Sphiggurus mexicanus (Rodentia: Erethizontidae) in Oaxaca, Mexico: Implications for its conservation",Lorenzo C.,Revista de Biologia Tropical,00347744,22152075,62,1481-1494,2014-01-01,2014,10.15517/rbt.v62i4.13587,"Land use changes by human activities have been the main causes of habitats and wildlife population degradation. In the Tehuantepec Isthmus in Oaxaca, the tropical habitat of the porcupine Sphiggurus mexicanus has been subject to vegetation and land use changes, causing its reduction and fragmentation. In this study, we estimated vegetation cover and land use (δn) change rates and assessed habitat availability and potential corridors for possible porcupine movements to avoid its isolation. In the study area, the type of vegetation with the most change rate value was the savanna (δn=−2.9), transformed into induced grasslands. Additionally, we have observed the porcupine (since 2011) in semi-deciduous (δn=−0.87) and tropical dry (δn=−0.89) forests that have been transformed in temporal agriculture and mesquite and induced grasslands. The vegetation inhabited by the porcupine resulted in recording a total of 64 plant species (44 trees, nine vines, seven herbs, four shrubs), of which the vine Bunchosia lanceolata showed the highest importance value (41.85) followed by the trees Guazuma ulmifolia (22.71), Dalbergia glabra (18.05), and Enterolobium cyclocarpum (17.02). The habitat evaluation and potential corridor analysis showed that only 1 501.93ha could be considered as suitable habitats with optimum structural conditions (coverage, surface, and distances to transformed areas) to maintain viable populations of S. mexicanus, and 293.6ha as corridors. An increasing destruction of the porcupines’ habitat has been observed in the study area due to excessive logging, and actions for this species and its habitat conservation and management have to be taken urgently.",1,Journal,ar,Article,100,4,4,Corridors | Habitat availability | Plant associations | Selection | Sphiggurus mexicanus | Tehuantepec isthmus | Tropical porcupines | Use,13567,undefined,1,TRUE,all,All Open Access,119,NA,NA,4,25720182,NA
true,https://api.elsevier.com/content/abstract/scopus_id/84921919864,SCOPUS_ID:84921919864,2-s2.0-84921919864,Identification of gene fragments related to nitrogen deficiency in Eichhornia crassipes (Pontederiaceae),Fu M.,Revista de Biologia Tropical,00347744,22152075,62,1637-1648,2014-01-01,2014,10.15517/rbt.v62i4.12892,"Eichhornia crassipes is an aquatic plant native to the Amazon River Basin. It has become a serious weed in freshwater habitats in rivers, lakes and reservoirs both in tropical and warm temperate areas worldwide. Some research has stated that it can be used for water phytoremediation, due to its strong assimilation of nitro- gen and phosphorus, and the accumulation of heavy metals, and its growth and spread may play an important role in environmental ecology. In order to explore the molecular mechanism of E. crassipes to responses to nitrogen deficiency, we constructed forward and reversed subtracted cDNA libraries for E. crassipes roots under nitrogen deficient condition using a suppressive subtractive hybridization (SSH) method. The forward subtraction included 2 100 clones, and the reversed included 2 650 clones. One thousand clones were randomly selected from each library for sequencing. About 737 (527 unigenes) clones from the forward library and 757 (483 unigenes) clones from the reversed library were informative. Sequence BlastX analysis showed that there were more transporters and adenosylhomocysteinase-like proteins in E. crassipes cultured in nitrogen deficient medium; while, those cultured in nitrogen replete medium had more proteins such as UBR4-like e3 ubiquitin- protein ligase and fasciclin-like arabinogalactan protein 8-like, as well as more cytoskeletal proteins, including actin and tubulin. Cluster of Orthologous Group (COG) analysis also demonstrated that in the forward library, the most ESTs were involved in coenzyme transportation and metabolism. In the reversed library, cytoskeletal ESTs were the most abundant. Gene Ontology (GO) analysis categories demonstrated that unigenes involved in binding, cellular process and electron carrier were the most differentially expressed unigenes between the forward and reversed libraries. All these results suggest that E. crassipes can respond to different nitrogen status by efficiently regulating and controlling some transporter gene expressions, certain metabolism processes, specific signal transduction pathways and cytoskeletal construction.",3,Journal,ar,Article,100,6,6,BlastX analysis | COG analysis | Deficient nitrogen | Eichhornia crassipes | GO analysis | SSH,13567,undefined,1,TRUE,all,All Open Access,120,NA,NA,4,25720193,NA
true,https://api.elsevier.com/content/abstract/scopus_id/84921919421,SCOPUS_ID:84921919421,2-s2.0-84921919421,"New leafhopper species of Jikradia from Mesoamerica with new records, revised key to species, distribution, origin, and checklist (Hemiptera: Cicadellidae: Coelidiinae: Teruliini)",Nielson M.,Revista de Biologia Tropical,00347744,22152075,62,1375-1384,2014-01-01,2014,10.15517/rbt.v62i4.12943,"The following four new species of leafhoppers are described and illustrated: Jikradia dentata n. sp. and J. trispinata n. sp. from Guatemala, J. variabilis n. sp. from Belize, and J. exilis n. sp. from Costa Rica. Jikradia basipendula Nielson and J. krameri Nielson are new records for Guatemala. Belize is a new record for the genus. A record of the first introduction of the genus in the Old World is reviewed. A revised key to the known species is provided with a review of its possible origin. A checklist of all known species is also given.",7,Journal,ar,Article,100,4,4,Belize | Checklist | Costa Rica | Guatemala | Italy | Leafhoppers | New records | New species | Taxonomy,13567,undefined,1,TRUE,all,All Open Access,121,NA,NA,4,25720174,NA
true,https://api.elsevier.com/content/abstract/scopus_id/84921919403,SCOPUS_ID:84921919403,2-s2.0-84921919403,"Diversity, relative abundance and activity patterns of medium and large mammals in a tropical deciduous forest in the Isthmus of Tehuantepec, Oaxaca, Mexico",Cortés-Marcial M.,Revista de Biologia Tropical,00347744,22152075,62,1433-1448,2014-01-01,2014,10.15517/rbt.v62i4.13285,"The use of camera traps and mammal track search are complementary methods to monitoring species of which is not well documented their natural history, as in the case of medium and large mammals. To ensure its conservation and good management, it is necessary to generate information about the structure of the community and their populations. The objective of the present study was to estimate the diversity, relative abundance and activity patterns of medium and large mammals in a tropical deciduous forest located in the Isthmus of Tehuantepec, Oaxaca, Mexico. Samplings were conducted in three month intervals, from September 2011 to May 2013. We used photographic-sampling and track search, two complementary sampling methods. For photographic-sampling, 12 camera traps were placed covering an area of 60km2, while for the tracks search a monthly tour of four line-transect surveys of three kilometers length each was undertaken. We obtained a total of 344 pictures with 5 292 trap-days total sampling effort; in addition, 187 track records in a total of 144km. With both methods we registered 21 species of mammals, in 13 families and seven orders, and five species resulted in new records to the area. The diversity index of Shannon-Wiener obtained with the method of tracks was H'=2.41, while the most abundant species were Urocyon cinereoargenteus (IAR=0.23) and Pecari tajacu (IAR=0.20). By the method of trap the most abundant species were P. tajacu (IAR=2.62) and Nasua narica (IAR=1.28). In terms of patterns of activity P. tajacu, N. narica and Odocoileus virginianus were primarily diurnal species; Canis latrans and Leopardus pardalis did not show preference for any schedule in particular, and Didelphis virginiana and Dasypus novemcinctus preferred to have nocturnal activity. This information can be of help to the creation of programs of management and conservation of mammals of medium and large in the Isthmus of Tehuantepec, Oaxaca, México.",17,Journal,ar,Article,100,2,2,Camera traps | Diversity | Mammals | Patterns of activity | Tracks,13567,undefined,1,TRUE,all,All Open Access,122,NA,NA,4,25720178,NA
true,https://api.elsevier.com/content/abstract/scopus_id/84921918595,SCOPUS_ID:84921918595,2-s2.0-84921918595,"Effect of temporal lakes on avifaunal composition at the Southeast of Isthmus of Tehuantepec, Oaxaca, Mexico",Rioja-Paradela T.,Revista de Biologia Tropical,00347744,22152075,62,1523-1534,2014-01-01,2014,10.15517/rbt.v62i4.12994,"Oaxaca hosts one of the greatest biodiversity in México, occupying first place in avian diversity compared to other regions of the country. However, the area is undergoing serious problems such as high deforestation rates, soil erosion and over exploitation and extinction of species. These factors have all contributed to the current loss of biodiversity. Also, biological inventories are still incomplete. One of the least explored sites is the semiarid zone of Tehuantepec isthmus, around the locality of Santa Maria del Mar, Oaxaca, México. The area includes floodable grasslands, mangrove areas and dry forest, providing a range of potential habitats for different species. Our objective was to evaluate the effect of temporal lakes on spatial and temporal composition of the avifauna in Santa Maria del Mar, in order to generate information regarding this group within the region and the state, and to understand the importance of flood areas for resident and transitory birds. We conducted 12 avifauna surveys between July 2006 and June 2008, and established two transects of 2km length in each of four habitat types (beach, grassland, dry forest, and mangrove). We found a total of 75 species, corresponding to 16 orders and 30 families. Within an area of 26km2, we significantly found 10.1% of the total number of bird species recorded for the entire state, and 6.6% of the total reported in Mexico. The families most represented were: Ardeidae, Laridae and Scolopacidae. Over the entire study period, dry forest was the most diverse habitat; followed by mangrove, grassland and the beach. Of all the species recorded, 38.6% were found at the edge or in the temporal lakes. We found a significant difference in species composition between seasons in the grassland, but no difference in the other habitats. Our results showed a significant effect of temporary lakes on avian diversity during the wet season; it also demonstrated the importance of grassland conservation given its relevance for presence of waterbirds. We suggested a continued and more intense monitoring; and proposed the designation of the area as an Important Conservation Bird Area (AICA).",3,Journal,ar,Article,100,3,3,AICA | Bird diversity | Important conservation bird area | Season effect | Water bodies | Waterbirds,13567,undefined,1,TRUE,all,All Open Access,123,NA,NA,4,25720185,NA
