@_fa,prism:url,dc:identifier,eid,dc:title,dc:creator,prism:publicationName,prism:issn,prism:eIssn,prism:volume,prism:pageRange,prism:coverDate,prism:coverDisplayDate,prism:doi,dc:description,citedby-count,prism:aggregationType,subtype,subtypeDescription,author-count.@limit,author-count.@total,author-count.$,authkeywords,source-id,fund-no,openaccess,openaccessFlag,freetoread.value.$,freetoreadLabel.value.$,entry_number,fund-acr,fund-sponsor,prism:issueIdentifier,pubmed-id,article-number
true,https://api.elsevier.com/content/abstract/scopus_id/84918784978,SCOPUS_ID:84918784978,2-s2.0-84918784978,Macroperipatus ohausi: Redescription and taxonomic notes on its status (Onychophora: Peripatidae),Chagas-Júnior A.,Revista de Biologia Tropical,00347744,22152075,62,977-985,2014-07-01,1 July 2014,10.15517/rbt.v62i3.11643,"Onychophora have undergone a new wave of taxonomic revisions in the last three years. After a recent revision, only two species of Macroperipatus are registered from Brazil: Macroperipatus ohausi and Macroperipatus geayi. The former was only the second species of Onychophora to be described from Brazil, and is herein redescribed, illustrated, and its taxonomic status revised. Macroperipatus ohausi had only been collected at the type locality, Petrópolis, state of Rio de Janeiro, but has not been found there since its discovery. In 2009 we collected two specimens of this species in an Atlantic rain forest fragment in Nova Iguaçu in RPPN dos Petroleiros (also state of Rio de Janeiro). The color of the new specimens was interpreted and described based on the NBS/ISCC System of Color Designation, and corresponds only weakly to that described in earlier publications on M. ohausi. The identification of M. ohausi was based solely on its morphology and compared with its original description. In addition, a female syntype of M. ohausi deposited in the Zoologisches Museum (Hamburg) was examined. We reinvestigated its external morphology and concluded that the dorsal papillae have been misinterpreted in M. ohausi in previous studies of its integument. The new specimens examined are conspecific with M. ohausi mainly by having conical primary papillae, different sized accessory papillae, and by the number of legs. Our material resembles the original description of M. ohausi, for example, in spinous pad and nephridial tubercles, even though these features are not represented in the original description and redescription of M. ohausi; these features are further detailed here. We concluded that the dorsal papillae morphology of M. ohausi, shares diagnostic characters, for example, with representatives of the genera Peripatus and Epiperipatus. The dorsal papillae are rounded and not square as in the original description and redescription. Another argument that supports our conclusion is that the RPPN dos Petroleiros, the locality where the new samples were collected, belongs to the same mountain chain and Atlantic mosaic as the original material of M. ohausi. Furthermore, a male of M. ohausi is described here for the first time. Based on our morphological data, we transfered this species to the genus Epiperipatus, proposing a new combination, E. ohausi.",8,Journal,ar,Article,100,2,2,Brazil | Geographical distribution | Peripatidae | Taxonomy | Velvet worms,13567,undefined,1,TRUE,all,All Open Access,57,NA,NA,3,25412530,NA
true,https://api.elsevier.com/content/abstract/scopus_id/84918783608,SCOPUS_ID:84918783608,2-s2.0-84918783608,"Knowledge, perceptions, and practices with respect to the prevention of dengue in a mid-Pacific coastal village of Costa Rica",Egedus V.L.,Revista de Biologia Tropical,00347744,22152075,62,859-867,2014-07-01,1 July 2014,10.15517/rbt.v62i3.14065,"Dengue fever is the fastest spreading, most prevalent and deadly arthropod-borne viral disease worldwide, present in over 125 countries. In 2013, Costa Rica is experiencing the highest number of Dengue infections since the virus’s reintroduction to the country in 1993. This study evaluated the Dengue-related knowledge of 320 community members, and polled opinions on how to better educate and mobilize the community on Dengue prevention in Quebrada Ganado, Costa Rica during March-May, 2013. In addition, property inspections were used to find relationships between knowledge or opinions and presence of Aedes breeding sites. Results showed that while citizens knew the virus is transmitted by mosquitoes that reproduce near water, they lacked knowledge on Aedes habits and confused it with other mosquitoes. Eighty-one percent of respondents assumed some responsibility for dengue prevention. Suggestions for improved education included consistent and continual information on the risks and dangers dengue poses to an individual. Characteristics relating to households with more positive breeding sites were: lower education level, higher prevalence of dengue infections in the household, lesser knowledge of dengue symptoms, a lower rating on the dangers of dengue and a lower rating on the importance of preventative actions. While a range of prevention methods are implemented, active community involvement is highly important for successful Dengue prevention. Continual evaluation is necessary to make more immediate, long-term behavioral societal changes, and to maximize the economic resources spent on Dengue prevention.",9,Journal,ar,Article,100,3,3,Aedes aegypti | Arbovirus | Costa Rica | Dengue fever | KAP | Social communication,13567,undefined,1,TRUE,all,All Open Access,58,NA,NA,3,25412518,NA
true,https://api.elsevier.com/content/abstract/scopus_id/84918777609,SCOPUS_ID:84918777609,2-s2.0-84918777609,"Knowledge of cervical cancer pathology of high school students in San Carlos, Costa Rica",Carlson L.M.,Revista de Biologia Tropical,00347744,22152075,62,877-886,2014-07-01,1 July 2014,10.15517/rbt.v62i3.14063,"In Costa Rica, cervical cancer is the second most common female cancer, despite accessibility of screening through the universal health care system. There is little understanding of knowledge levels of the adolescent population on cervical cancer, although this population is the most exposed to risk factors. This study sought to learn about male and female adolescent knowledge of preventative methods, infection acquisition, clinical manifestations and medical services. A total of 533 students from grades 7-12 from five public high schools in the rural San Carlos region participated in the study from March through April 2012. Students were found to lack knowledge, as only 30.8% of students stated that they knew what cervical cancer is. Additionally, a connection was lacking between cervical cancer concepts, as for example 75.2% of students had heard of Human Papiloma Virus, but only 33.9% of those students knew that HPV is related to cervical cancer. Age had a positive relationship with knowledge of main concepts (p≤0.001). More women than men had heard of cervical cancer and the Papanicolaou (p=0.025, p≤0.0001), but otherwise no significant difference in mean response between genders was found. Students were found to have a limited awareness of the educational cervical cancer campaign (7.7% of the student population) and the ability to go alone to the doctor to receive medical attention (30.6% of students). Additionally, the public education system does not require cervical cancer to be included in the present curriculum. Hence, as students lack education on prevention and risk factors, the majority of prevention responsibility falls only on the universal health care system to regularly perform Papanicolaou exams to detect pre-cancerous or cancerous changes. The findings indicated the importance of including cervical cancer in the sexual education curriculum of the public education system in Costa Rica to educate the at-risk population of preventative methods, infection development, clinical manifestations and medical services in order to lower the presence of cervical cancer.",6,Journal,ar,Article,100,2,2,Adolescents | Cervical cancer | Costa Rica | Papanicolaou | Sex education,13567,undefined,1,TRUE,all,All Open Access,59,NA,NA,3,25412520,NA
true,https://api.elsevier.com/content/abstract/scopus_id/84918770917,SCOPUS_ID:84918770917,2-s2.0-84918770917,"Impact of traditionally managed forest units on the landscape connectivity of Sierra de Los Tuxtlas, Mexico",Vásquez Y.A.,Revista de Biologia Tropical,00347744,22152075,62,1099-1109,2014-07-01,1 July 2014,10.15517/rbt.v62i3.12821,"The ever-increasing establishment of landscape mosaics is expressed as a surrounding matrix of agricultural activities, which frames patches or remnants of the original vegetation cover. Conservation actions should be aimed to establish or to increase those interactive systems, which help to maintain the landscape flow through linkages. Spaces occupied by traditional management systems retain and support this function. In this paper, we used Geographic Information Systems to evaluate the importance of traditionally managed forest units (‘acahuales’-coffee plantations) and to assess landscape connectivity in the indigenous Popoluca area of Sierra de los Tuxtlas, Mexico. The cartographic material used to establish the types of vegetation and their coverture included the period 1991-2008. At landscape level, four indices were used to assess the general situation of the habitat network, and to identify the patches of high priority. Individually, indices evaluated if patches were important for their area, their potential flow or their connecting function. Results showed that the landscape is functioning as a single system, but having low connectivity. Values improved when traditionally managed forest patches were considered as viable habitat. We detected 367 patches of very high priority, 80% belonging to forests managed traditionally. Patches were important for their potential flow (size and topological relationships). Only 70 patches were significant for their function as biological corridors between largest forests located at the top of the volcanoes, and are mostly managed forest (75%). We concluded that the units of traditionally managed forest play a significant role in landscape connectivity maintenance.",3,Journal,ar,Article,100,6,6,Acahuales | Landscape connectivity | Los Tuxtlas | Popoluca traditional management | Tropical forest,13567,undefined,1,TRUE,all,All Open Access,60,NA,NA,3,25412538,NA
true,https://api.elsevier.com/content/abstract/scopus_id/84946194702,SCOPUS_ID:84946194702,2-s2.0-84946194702,"Short-term assessment of the sediment deposition rate and water conditions during a rainy season on La Azufrada coral reef, Gorgona Island, Colombia",Lozano-Cortés D.F.,Revista de Biologia Tropical,00347744,22152075,62,107-116,2014-02-01,1 February 2014,10.15517/rbt.v62i0.15981,"One of the major stresses on corals is the settlement of suspended sediment on their surfaces. This leads to the blocking of light, the covering of the coral mucus surface and an increased risk of disease. For this reason sediment deposition on a reef is considered a highly important variable in coral reef studies. With the use of sediment traps and oceanographic sensors, the sediment deposition rate and water conditions during a rainy season (April-May 2009) on a Tropical Eastern Pacific coral reef (La Azufrada) at Gorgona Island in Colombia were investigated. To quantify sediment deposition, sediment traps were established in nine stations along the coral reef (three stations per reef zone: backreef, flat and slope). To minimize disturbance by aquatic organisms in the sediment traps these were filled with hypersaline borax-buffered 10% formaline solution before their deployment; animals found in the filter contents were fixed and stored in a 4% formalin solution, frozen and identified in the laboratory. To determine the water conditions, discrete samples of water from 1 m and 10 m depths were collected using a Niskin bottle. Oceanographic variables (temperature, salinity and dissolved oxygen) as well as turbidity, chlorophyll and nutrient concentration (nitrite, nitrate and phosphorus) were measured in the samples from both depths. Vertical records of temperature and salinity were carried out with a Seabird-19 CTD nearest to La Azufrada and water transparency was measured using a Secchi disk. We found a mean trap collection rate of 23.30±4.34gm-2d-1 and did not detect a significant difference in the trap collection rate among reef zones. The mean temperature and salinity in the coral reef depth zone (0-10m layer) were 26.98±0.19°C and 32.60±0.52, respectively. Fourteen taxonomic groups of invertebrates were detected inside the sediment traps with bivalves and copepods being the most abundant and frequen. The findings presented here constitute the first report of both the potential sediment deposition rates and the water conditions of La Azufrada coral reef.",3,Journal,ar,Article,100,3,3,Colombia | Coral reefs | Gorgona Island | Invertebrates | Oceanographic conditions | Sediment deposition | Tropical Eastern Pacific,13567,undefined,1,TRUE,all,All Open Access,61,NA,NA,NA,NA,NA
true,https://api.elsevier.com/content/abstract/scopus_id/84946193042,SCOPUS_ID:84946193042,2-s2.0-84946193042,Short-tailed bats (Carollia: Phyllostomidae) from Gorgona National Natural Park (Colombia) and its biogeographical implications,Murillo-García O.E.,Revista de Biologia Tropical,00347744,22152075,62,435-445,2014-02-01,1 February 2014,10.15517/rbt.v62i0.16370,"Taxonomy of short-tailed bats (Phyllostomidae: Carollia) has been unclear due to the extreme morphological similarity among species and the significant morphological variation within species. The identity of the Carollia species in Gorgona National Natural Park (Colombian Pacific) has been controversial due to the high morphological similarity between Carollia perspicillata and C. brevicauda. C. perspicillata is common in lowlands, and more likely to be the Gorgona species than C. brevicauda, while geological evidence suggests that common between 1 500 and 3 000m. We recorded eight measurements from jaws and skulls of confirmed C. perspicillata (24 individuals) and C. brevicauda (23) and 35 individuals captured in Gorgona. Discriminant analyses showed that, contrary to expectations based on current altitudinal distributions, the Gorgona population is morphologically closer to C. brevicauda. Biological evidence suggests that Gorgona was connected in the past to mainland South America. Gorgona may be the highest part of a now submerged mountain range (“Cordillera de la Costa”) that was part of the continent during the Pleistocene glaciations. Consequently, I hypothesize that C. brevicauda colonized Gorgona overland during last Pleistocene glaciations.",4,Journal,ar,Article,100,1,1,Bat dispersal | Bat taxonomy | Biogeography | Cranial morphology | Island colonization,13567,undefined,1,TRUE,all,All Open Access,62,NA,NA,NA,NA,NA
true,https://api.elsevier.com/content/abstract/scopus_id/84946186962,SCOPUS_ID:84946186962,2-s2.0-84946186962,"Wasps from the arboreal vegetation in Gorgona national natural park, Colombian Pacific",Lopez L.,Revista de Biologia Tropical,00347744,22152075,62,307-315,2014-02-01,1 February 2014,10.15517/rbt.v62i0.16348,"Studies of Colombian Hymenoptera are incipient, fragmented and there is no comprehensive study about its size and composition. We know that the guild of hymenopteran parasitoids is the richest in species and that they are common and abundant in all terrestrial ecosystems, acting as regulators of populations of other insects. Studies in Gorgona National Natural Park have mostly focused on the natural history and identification of Formicidae and Apidae. This work was directed toward the identification of other hymenopteran species associated with its tropical rain forest. In November 2007, 16 trees were sampled by fogging with a biodegradable pyrethroid insecticide applied from 1m above the ground to the canopy. We found 641 individuals (45% identified to subfamily and 28% to genera) from seven superfamilies, 20 families and 118 morphospecies. Chalcidoidea was the most representative superfamily, Eulophidae the most diverse family and Braconidae the numerically dominant family. The sampling efficiency was 71% and 166 species are estimated to exist in the island. Approximately 71% of the estimated species were captured during this study. We report 12 genera new for the island.",0,Journal,ar,Article,100,3,3,Chalcidoidea | Fogging technique | Insular ecosystem | Tropical rainforest | Waps,13567,undefined,1,TRUE,all,All Open Access,63,NA,NA,NA,NA,NA
true,https://api.elsevier.com/content/abstract/scopus_id/84946186246,SCOPUS_ID:84946186246,2-s2.0-84946186246,"Community structure and vertical distribution of the soft bottom Macrofauna on Isla Gorgona, Colombian Pacific",Valencia B.,Revista de Biologia Tropical,00347744,22152075,62,169-188,2014-02-01,1 February 2014,10.15517/rbt.v62i0.16274,"Soft bottoms are important in marine ecosystems but their ecology have been less studied in the tropics than in temperate areas. This article describes the temporal, spatial, and vertical distribution of the community structure of subtidal soft bottom macrofauna on Isla Gorgona, Colombian Pacific. Samples were collected in March and June 2011 by corers at 10m depth at five points around the island. Seventy-three species were recorded; polychaetes (55%) and crustaceans (30%) were the dominant groups in number of individuals. The community structure assessed by classification and ordination analysis did not change temporarily, but it shows differences between sampling points, due to the structure of the substrate. The highest abundances of macrofauna were recorded at points with dominance of fine particles (Farallones). However, another point with a similar substrate (Planchón) showed low abundance, apparently due to bioturbation exerted by the fish Heteroconger sp. The presence of Heteroconger sp. in El Planchón could also affect the vertical distribution of the macrofauna, where their relative abundance was homogeneous across the analyzed layers (1-2-3-4-5-10cm). In the other four sites, the abundance of the macrofauna was mainly limited to the first two centimeters of the sediment. Playa Blanca and Remanso showed substrates composed mainly of gravel, recording at the last sampling point the lowest richness, diversity and abundance.",5,Journal,ar,Article,100,3,3,Colombia | Community structure | Eastern tropical Pacific | Isla Gorgona | Macrofauna | Soft bottom,13567,undefined,1,TRUE,all,All Open Access,64,NA,NA,NA,NA,NA
true,https://api.elsevier.com/content/abstract/scopus_id/84946185104,SCOPUS_ID:84946185104,2-s2.0-84946185104,Arboreal ants of Gorgona national park (Pacific of Colombia),De Ulloa P.C.,Revista de Biologia Tropical,00347744,22152075,62,277-287,2014-02-01,1 February 2014,10.15517/rbt.v62i0.16341,"Despite the strong microclimatic fluctuations, scarcity of nesting sites and unpredictable prey availability in open environments, ants are the dominant invertebrates in the tropical forest canopy. This study focused on the arboreal ants in Gorgona National Park, Colombia, a rainforest ecosystem (27ºC, 6 000mm average annual rainfall). In November 2007, 16 trees were sampled by fogging them with a biodegradable pyrethroid insecticide in four levels between 1 and 15 m above the understory vegetation. We found 53 species of Formicidae (24 genera and six subfamilies): two subfamilies had the most species: Formicinae (20 species) and Myrmicinae (17). The most abundant were arboreal species of Azteca, Dolichoderus (D. bispinosus and D. lutosus), Camponotus (C. atriceps, C. claviscapus, C. championi, C. excisus) and Crematogaster (C. brasiliensis, C. carinata, C. curvispinosa). Some species that are common at ground level (Wasmannia auropunctata and Camponotus sericeiventris) were collected up to a height of 15 m. We remark the capture of Nesomyrmex pittieri, Crematogaster stolli, Cephalotes basalis, Anochetus bispinosus and Stigmatomma mystriops, species rarely found using conventional methods.",0,Journal,ar,Article,100,4,4,Ants composition | Fogging technique | Foraging | Tropical rain forest | Vertical stratification,13567,undefined,1,TRUE,all,All Open Access,65,NA,NA,NA,NA,NA
true,https://api.elsevier.com/content/abstract/scopus_id/84946182285,SCOPUS_ID:84946182285,2-s2.0-84946182285,A comparison of visual and collection-based methods for assessing community structure of coral reef fishes in the Tropical Eastern Pacific,Alzate A.,Revista de Biologia Tropical,00347744,22152075,62,359-371,2014-02-01,1 February 2014,10.15517/rbt.v62i0.16361,"Gorgona Island, the major insular area in the Colombian Pacific Ocean, is characterized by a remarkably high biological and ecosystem diversity for this area of the world. Coral reefs are well developed and their fish communities have been described using conventional visual surveys. These methods, however, are known to be biased towards detecting larger and more mobile species, tending to ignore small and cryptobenthic species. The two main objectives of this study were to describe the assemblage structure of the cryptobenthic fish fauna and estimate the extent to which this fauna is underestimated by visual surveys.At the beginning and the end of the warm season, we compared the cryptobenthic fish assemblage recorded using visual surveys against the one recorded using “enclosed anesthetic/rotenone samples” on isolated coral colonies (N=54 beginning of warm season; N=17 end of warm season). The crypthobenthic fish fauna associated to coral colonies was characterized by small body sizes and was composed mainly by species of the families Antennaridae, Blennidae, Gobiidae, Labrisomidae, Muraenidae, Serranidae, Scorpaenidae and Syngnathidae. Conventional visual surveys underestimated overall species richness by 28-36% and number of individuals by 16-35%. Noteworthy, four species recorded during this study using “enclosed anesthetic/rotenone samples” were new records for Gorgona Island. Although both sampling methods can detect a largely overlapping group of species, the “enclosed anesthetic/ rotenone samples” method was able to detect more individuals and species, including several species that visual surveys fail to detect. Although this study is the first effort to describe the cryptobenthic fish assemblage associated to coral reefs in the Tropical Eastern Pacific, our results suggest that these assemblages are an important component of the reef fish community in the region in terms of biodiversity and functional roles.",15,Journal,ar,Article,100,3,3,Coral reefs | Cryptobenthic fishes | Enclosed anesthetic/rotenone samples | Sampling methods | Visual surveys,13567,undefined,1,TRUE,all,All Open Access,66,NA,NA,NA,NA,NA
true,https://api.elsevier.com/content/abstract/scopus_id/84946181615,SCOPUS_ID:84946181615,2-s2.0-84946181615,"Isla Gorgona, strategic enclave for conservation efforts in the Eastern Tropical Pacific",Giraldo A.,Revista de Biologia Tropical,00347744,22152075,62,1-12,2014-02-01,1 February 2014,10.15517/rbt.v62i0.15975,"Gorgona, located in the southern zone of the Pacific Ocean of Colombia, is an insular territory at 35km in a straight line from the continental margin. Although historically this island was used in different forms, since 1984 it has been among the most important protected marine areas of the Colombian Pacific Ocean. Here we review the historical development of scientific research in Gorgona island and its importance for marine and coastal conservation in the Colombian Pacific region. The island is an strategic location for the Eastern Tropical Pacific Conservation Corridor. Its ecological status is acceptable but the populations of Bradypus variegatus and Proechymis simispinosus are too small and monitoring and scientific programs need to continue.",11,Journal,ar,Article,100,3,3,Biodiversity | Colombia | Conservation | Ecological integrity | Island systems | Marine protected areas,13567,undefined,1,TRUE,all,All Open Access,67,NA,NA,NA,NA,NA
